,Unnamed: 0.1,Unnamed: 0,User,Date Created,Number of Likes,Number of Retweets,Number of Replies,Number of Quotes,Number of Views,Tweet,class
8721,8721,83,RWPUSA,2022-08-21 23:48:34+00:00,227,58,6,0,,"As reported here by @AP in 2005 I gave a series of lectures to White House staff on classified information (after somebody stupidly leaked it for political purposes). The rule is simple: If you take it home with you, expect a visit from the F.B.I. 
Duh...
https://t.co/9luPW0Y4Ye",2
8728,8728,90,gtlem,2022-08-21 23:19:11+00:00,55,9,4,0,,"@ItsDeanBlundell Only white people tweet these pictures to you - not visible minorities

But the irony is - the more White Conservatives talk about the picture

The more they alienate Ethnic Voters

as they side with JT on this and find this offensive by Conservatives @ItsDeanBlundell",2
8731,8731,0,onebadnoodle_,2022-08-18 19:43:38+00:00,8448,964,23,6,,i woke up from this weird dream where i was in this alien looking jungle and i saw these large flowers that resembled bugs bunny. just felt like i had to draw them https://t.co/Cp6FcmBESu,2
8748,8748,17,_bunnysworld,2022-08-16 14:25:47+00:00,77,67,84,0,,"Bunny's World x Clans of Jungle

We're invited to join @clansofjungle. They have provided us with following to be given away!

Award 🏆: 𝟓 𝐖𝐋 𝐱 𝟓 𝐎𝐆 

To Enter:

▶️ Follow @clansofjungle
▶️ Like &amp; RT
▶️ Tag 4 people

#CNFT #CNFTCommunity #Cardano #ADA #NFTs #CNFTGiveaway https://t.co/KpSUxFEzty",2
8780,8780,0,penners827,2022-08-21 20:16:34+00:00,122,17,3,0,,"if you want to kill Uncle Grandpa, you have to kill all of their series. https://t.co/YjTU4fPTDr",0
8781,8781,1,HEARTS4KELSEY,2022-08-21 21:49:06+00:00,237,41,1,3,,he left that booth knowing he was about to kill us all with those pictures https://t.co/OzsV8UBhST,2
8784,8784,4,maria_drutska,2022-08-21 20:07:49+00:00,458,50,14,3,,"Man russian media kind of going bananas

...""It was Ukraine!""
...""Kill all Ukrainians!""
...""This means war!""
...""Destroy the Kyiv control centres!""
...""Kill their government officials!""

And by bananas I mean it hasn't changed at all in the last 6 months.",2
8787,8787,7,turkeyram,2022-08-21 20:41:25+00:00,328,59,12,3,,"One 18 spoilers 

If Liam manages to send everyone back . He’s still stuck there . Forever. Even if he kills himself we KNOW he has nothing in the waiting room and he lost ALL of the notes AND TEXTY. He’s the most fucked out of all of them.",1
8788,8788,8,gangfr__otf,2022-08-21 19:50:02+00:00,165,19,8,6,,And I wish y’all stop calling Von a “Serial Killer” because he’s not. A serial killer is someone who kill for fun and etc. Von was just getting revenge for his homies that got killed!! It’s definitely a difference between them! But anyways #LLKV REST UP KING ❤️‍🔥🫶🏽,2
8789,8789,9,Petrit,2022-08-21 21:45:40+00:00,141,33,12,25,,"So, I kid you not: all gov-controlled media front pages in Serbia leading with the conspiracy launched by President: Circassians (don’t ask me) &amp; anti-Putin Chechens are in Kosovo, with blessing of Western intel services, planning to kill Serbs. And recruit Albanians for Ukraine. https://t.co/XAA7aALwPe",2
8791,8791,11,HornitoDog,2022-08-21 22:25:19+00:00,2933,283,78,12,,"@NaomiRHelm @cryborg WTF? This is going on all over the country. Law enforcement has been hiring predominately war -fighting veterans trained to beat &amp; kill, not mediate social problems and maintain peace. These officers must be arrested, charged, and sentenced heavily.",0
8792,8792,12,sabri44220662,2022-08-21 22:39:15+00:00,65,13,3,1,,"“Time is a great teacher, but unfortunately it kills all its pupils.”

Hector Berlioz",2
8796,8796,16,J_Alexander_HS,2022-08-21 23:21:23+00:00,67,5,7,0,,"Not all decks make screen shots like Miracle Rogue; I think only Priest does. However a closer look at card stats could help one appreciate what a blow out turns like this can be. The death doesn't come as quick, and it's not the card that kills you, but it does a lot of winning https://t.co/R23tHOsOn7",2
8797,8797,17,Naturepilled_,2022-08-21 19:43:51+00:00,100,35,2,4,,"August 21st, 2022 marks 30 years
since we learned the government will kill your dog, shoot your 14yr old son in the back and snipe your wife in the doorway while she holds your infant child - all over how long the barrel of a shotgun is. #RubyRidge https://t.co/ecAfdMZU7U",2
8800,8800,20,NotsoScarySheri,2022-08-21 22:44:01+00:00,65,2,8,0,,"I’ve decided to fill the void in my life with plants.  I now have a little indoor herb garden, an aloe plant, a fern and some other things that I don’t know what they are 

Please be prepared for tweets of devastation as I kill them all off one by one 😂",2
8804,8804,24,SheGeminiAF,2022-08-21 21:17:09+00:00,59,10,0,0,,"Chi chi is open to be friends with anybody girl was sitting all alone her friends didnt say ""oh lets sit together"" let her mingle she no kill person or she not allowed to talk to others mtcheewww #BBNaija",2
8807,8807,27,EduardBrichuk,2022-08-21 21:35:40+00:00,98,9,9,1,,"These HedgeFunds, short sellers, bashers, bankers, market makers, infiltrators, frauds etc…are all workings of the devil. 

They are here to “kill, steal, and destroy.” 

…but we have God On our side. Jesus Christ Reigns and We With Him!

We Won the War! #ApesTogetherStrong https://t.co/Qu9AEBYSOg",2
8818,8818,38,_JakubJanda,2022-08-21 19:08:39+00:00,187,36,4,1,,"As Kremlin elite starts to kill each other, it is a great reason to celebrate across democratic world.

Their regime kills tens of thousands Ukrainians, they support it and cheer it.

If these war criminals keep killing each other, that is great news for all of us.",0
8819,8819,39,wifebeam,2022-08-21 21:50:33+00:00,83,7,0,0,,life hack: make all the demon nobles who tried to kill shizun into your minions,2
8825,8825,45,EthicalSkeptic,2022-08-21 19:25:07+00:00,153,16,10,5,,"In Target Motion Analysis, when you prosecute a hiding submarine, all your datum's are 'wrong' - but they are all also 'informative' - and eventually the submarine is a kill.

Beware of those who spin 'wrong' as also 'uninformative' - they are the proverbial 'not even wrong'.",2
8828,8828,48,iamronjosef,2022-08-21 19:22:36+00:00,61,7,1,0,,I swear yall are not ready for the ride that is Orphan: First Kill. We all know the insanity that comes with Esther but nothing's gonna prepare you for THIZZ! 👏🏻🤯 https://t.co/gQrqPPecju,2
8832,8832,52,happyhappywho,2022-08-21 22:49:30+00:00,59,6,2,1,,"@TheRiver_Oshun @DEVandtheCITY When I think of how Black women are constantly disregarded, all I hear are the words of Zora Neale Hurston “they’ll kill you &amp; say you enjoyed it.” The 1st line of that quote is “If you’re silent about your pain…” but loud or silent, we’re expected to enjoy mistreatment. No more",2
8836,8836,56,SpiderManNoWay4,2022-08-21 20:14:15+00:00,98,5,1,1,,"But this scene is the best part of the entire final battle. It's the most emotionally impactful and visceral fight we've seen for Spider-Man in live-action, even without a bunch of blood all over them. Peter is actively trying to kill Goblin, he's not holding back any more https://t.co/nLgak5dglC",2
8849,8849,69,jeff_hawn,2022-08-21 22:48:32+00:00,61,4,1,0,,10/ The reason I am laying all this out is that no one knows for sure who killed Darya and may well have meant to kill Alex as well but there are theories oh there are theories.,0
8868,8868,0,smidg3n,2022-08-21 16:30:20+00:00,480,103,13,0,,make yourself hard to kill https://t.co/93ThsRRbqT,2
8869,8869,1,AdegbolaSulaim3,2022-08-21 06:00:55+00:00,58,39,10,1,,"No kill yourself o
We plenty wey no get money",2
8874,8874,6,leachinsang,2022-08-20 15:58:33+00:00,656,50,2,4,,in Madagascar 2 when Melman was like “i have spots that’s not normal right” and all the other giraffes were like “shit man… best i can do is dig a hole for you to kill yourself in”,1
8876,8876,8,AfcGabeast,2022-08-21 10:30:54+00:00,388,37,6,1,,"If you kill yourself, suicide.

If you kill someone, homicide.

If you haven't won a premier league game this season, Merseyside. 😂",0
8877,8877,9,sk1nvision,2022-08-21 20:25:49+00:00,50,10,2,1,,Ngl twenty one pilots self titled really was the perfect soundtrack to being 12 and wanting to kill yourself,2
8879,8879,11,lerahtokinkie,2022-08-20 23:37:09+00:00,138,6,10,1,,"If you like kill yourself, I will say it again! Phyna and Groovy doesn’t look good together at all!  #BBNaijaSeason7",2
8928,8928,60,AdvoBarryRoux,2022-08-20 11:09:09+00:00,95,17,3,0,,"""I am not going anywhere, if you don't want me anymore better kill me.” Once you find yourself doing this in a relationship, you must know you are part of the problem. Why impose yourself if someone doesn't want you anymore. Stop behaving like you are left with 5yrs on this earth",2
8929,8929,61,Matt_S_Stephens,2022-08-21 17:21:15+00:00,78,10,3,0,,"Chronic stress can literally kill you.

One way to lower stress is to remind yourself often of two things:

1) You choose to let things bother you and you can just as easily choose not to.

2) 99% of the things you worry about are made up in your mind and they never come to pass.",2
8934,8934,66,a_h_reaume,2022-08-21 05:30:34+00:00,144,20,3,0,,I wanted to share because the thing that I learned about suicidality from having a partner who was suicidal for a very long time is that saying you want to kill your self does not always mean you want to kill yourself. Sometimes it’s the only way you know how to express pain.,2
8964,8964,1,doefaced,2022-08-16 03:36:38+00:00,751,62,3,2,,I'm just like the little mermaid but instead of trading my prized voice for legs to pass as a human I traded my prized nipple sensation for a beautiful transsexual bod to pass as a faggot,0
9002,9002,0,exblasian,2022-08-18 12:13:40+00:00,663,19,9,3,,ppl saying I’m doing too much calling it antiblack man have y’all read the damn lyrics? Like can it b anymore obvious? 😭😭😭she said nigger in so many different ways?,0
9028,9028,0,tequilatempura,2022-08-21 21:46:20+00:00,970,78,2,1,,"ur married to her i’m liking her tweets, we play equally important roles in her life",2
9031,9031,3,storyofpjm,2022-08-21 21:26:29+00:00,55,6,4,0,,when you suddenly remember that you’re never getting married to park jimin https://t.co/iPBSMPcOnp,2
9032,9032,4,_ashowz,2022-08-21 23:32:34+00:00,94,32,14,1,,"I can’t wait to get married and hype my woman like “Iyawo mi atata, ale nobody, mo miss awon ibeji aya re”.",2
9033,9033,5,ashlie_weeks,2022-08-21 23:49:46+00:00,122,5,8,1,,Let's all look on the bright side that we're not married to that Kushner feller,2
9034,9034,6,BA7Kara,2022-08-21 22:04:54+00:00,938,29,3,1,,"@enews This was the most toxic relationship I’ve ever seen on television, they should have NEVER gotten married to begin with.",2
9035,9035,7,V1SENY4,2022-08-21 21:20:32+00:00,53,0,4,6,,its wild to me how this child is gonna be married to daemon at some point... https://t.co/jPjNk6eSaY,2
9037,9037,9,CllrMcHuntSNP,2022-08-21 22:57:05+00:00,133,15,6,6,,"A fellow SNP Nationalist friend of mine is correct - being a fanny is absolutely core to our movement and our party. Our First Minister absolutely loves them, she is even married to one. https://t.co/YKK96gw8rf",2
9038,9038,10,Jin_AitM,2022-08-21 22:16:07+00:00,6512,179,10,5,,@LegallyLove getting married on a plantation immense disrespect aside is such a weird concept. You know what happened there why would you want to celebrate the beginning of your new life on those grounds?,2
9041,9041,13,NIPTUCKPRINT,2022-08-21 23:36:31+00:00,206,8,1,0,,"@cityprxncess @clitereIIa Nicki is already married to Beyoncé, do not intervene like Rihanna tried to do https://t.co/e9TsR0MSyR",2
9042,9042,14,leviseyeliner,2022-08-21 22:11:02+00:00,65,19,3,0,,"I updated that fic again... You know, Levi’s married but his husband is an ass and his kind neighbor Erwin just happens to fill all his empty spots 👀 they're a lot closer now...👁👁https://t.co/tWEnZrjPq0 https://t.co/w4ckPW99wc",2
9044,9044,16,Chadkasa,2022-08-21 22:13:25+00:00,470,12,11,1,,"One of my best friends from high school (who I still talk to &amp; have on IG) &amp; I are the same age (I'm a week older). She's married, pregnant w her first &amp; a teacher. Today V &amp; I (both content creators) had our alone time interrupted by our cat puking. Being in your 20s is wild.",2
9045,9045,17,BBNaija,2022-08-21 22:30:20+00:00,703,42,42,3,,Kess admitted to Ebuka earlier that being married limited him from exploring more in the #BBNaija House 👀,2
9047,9047,19,MrAdamRex,2022-08-21 22:49:23+00:00,263,15,9,1,,"VERY surprised to learn my wife does not also consider the dinner plate to be the ""king of the dishwasher."" Turns out she hasn't been thinking of the dishwasher as a monarchy *at all*. Not sure who I married anymore, tbh",2
9050,9050,22,KHawkins12,2022-08-21 22:20:58+00:00,358,8,3,0,,@enews I’m guessing they had to be married a certain amount of time until the last check clears 🤷🏾‍♀️,2
9051,9051,23,dovidfeldman,2022-08-21 23:02:11+00:00,55,3,3,1,,"Don't overlook the kind, stable man-next-door.

I've never been approached by any woman crying over her relationship with a man who loves her, cares for her and their children, and supports her.

In tears, I'm approached every day by ladies married to jerks, though. 💔",2
9052,9052,24,BarryMattic,2022-08-21 23:20:34+00:00,75,0,7,0,,"Hey babe, I just seen that that wuss boss got married &amp; that just reminded me how my wuss behaviour ended our relationship… I miss the days when I was your top striker &amp; used to get in your section but hey… you don’t have to answer I just thought I should let you know 🥺 https://t.co/dbvyyAi2P7",2
9053,9053,25,ms_eyelash,2022-08-21 22:24:40+00:00,298,12,39,3,,@gtconway3d I don’t understand how you can be married to someone who believes in ideals in total opposition to you. I won’t even date a Trumper,2
9054,9054,26,M3IST3R,2022-08-21 21:41:29+00:00,98,6,4,0,,@kijuler @FloofFloof2 @contxtsonic I'm not married to any Mario characters but Wario has been in my house for the past 5 weeks and he will not leave.,2
9058,9058,30,RE_Venomx021,2022-08-21 23:12:08+00:00,591,1,7,0,,@TheAngelKing47 She's married to Macaulay kulkin,2
9062,9062,34,ani_digital,2022-08-21 21:23:57+00:00,305,25,12,8,,"Miss Universe to allow married women from 2023, deets inside

Read @ANI Story | https://t.co/rKpA8kaetG
#MissUniverse #BeautyPageant https://t.co/OKe5pvSQWp",2
9067,9067,39,sistergaladriel,2022-08-21 21:02:40+00:00,116,0,1,0,,"I married a pretty great guy at 20 and became a mom at 21. We’re thriving, no need to fret about what some sports bro thinks about that. Move along people.",2
9068,9068,40,Cr7Godbrand,2022-08-21 22:24:24+00:00,80,5,1,0,,"@George_uzo1 @LibmayaDexplora @nosafk No try am. Better women with good jobs and money are there. Find a better one. Naija women are opportunistic people. Did it and I am getting married soon. No listen to them. If she hasn’t had kids for u before naija and wasn’t there when u had it rough and was loyal to u, don’t.",2
9069,9069,41,TeacupCandy15,2022-08-21 21:53:13+00:00,66,3,0,0,,@CasIsLoved He’s definitely NOT dead. He’s married to his angel and now running a franchise of shops with Cas and Sam called Supernatural apparently.,2
9070,9070,42,LogarTheOgar,2022-08-21 23:02:39+00:00,52,6,6,1,,"Hey we're playing #Pathfinder2e right now! It turns out that the two characters we thought would make great roommates are ACTUALLY MARRIED.

And NOW we're going to KILL some KOBOLDS.

WATCH US: https://t.co/pwQJ11avRM https://t.co/LQRjE92koL",2
9071,9071,43,Derricktgoat,2022-08-21 22:51:56+00:00,293,41,12,4,,"@PierrePoilievre FYI , they are in their 20’s and her sister was married but is now single with two kids. They did go shopping and she paid to stock her shelves but what about next month ? Month after that ? 
Never thought in Canada, it would be Food and Energy Poverty that people worried about.",2
9077,9077,49,MzJojoB,2022-08-21 22:26:03+00:00,147,1,1,0,,@MommaTo2Howerys Exactly. I was so shocked that Nick actually got married to her!!,2
9079,9079,51,CrissieC,2022-08-21 23:43:57+00:00,69,18,15,0,,"I’m at that stage in life where I have friends that are getting married late in life and friend that are getting divorced…

And I don’t know which ones to go celebrate with… 🤷🏻‍♀️",2
9081,9081,53,Tinashete,2022-08-21 22:35:24+00:00,132,45,3,1,,"Marriage is a scam for women and it's OK to acknowledge this even if you're married or interested in a life partner. You didn't make it, it's not your fault that it's like that.",2
9082,9082,54,FakeAccount0701,2022-08-21 23:46:17+00:00,399,0,3,0,,@Doc_Pox @SketchXuanyun @SpectralAurora_ It took Lois Lane like 50 years to figure out Clark was Superman and they were about to get married,2
9093,9093,65,georgiebingham,2022-08-21 22:15:27+00:00,78,15,12,3,,"If you were born, have a sister, are 
 attached/married to or have ever met or liked any women ever you should find Saudi Arabia repulsive. Their sportswashing attempts to sweep this kind of  pathetic autocratic dick-swinging under the carpet with $$$$$",0
9098,9098,70,VinaigretteGirl,2022-08-21 22:58:30+00:00,90,4,1,0,,"@StealthMagpie @kennedytcooper And before that campaigned for YEARS so women could have our own sole bank accounts, loans, credit cards, mortgages or even birth control w/o a male co-signer. Women used to have to give up our jobs in many sectors if we married, &amp; could get sacked for cohabiting.",2
9099,9099,71,jackmurphylive,2022-08-21 21:32:51+00:00,74,2,11,0,,"I gotta say I’m pretty excited myself. 

Getting married puts the marriage ahead of each of ourselves. 

We make promises in front of God and family. 

We perform an ancient ritual and bind ourselves to history and humanity.

Pretty cool.

Five weeks. 

Can’t fricking wait!",2
9105,9105,77,LKHamilton,2022-08-21 21:56:52+00:00,129,11,2,0,,"Dating in my 20s &amp; 30s I found most men, especially my age &amp; older wanted me to be their cheerleader, but weren’t willing to return the favor. I’m happily married to a man that is secure enough to let me shine without feeling it dims his light, &amp; we laugh at each other’s jokes.",2
9109,9109,81,jiggyjayy2,2022-08-21 23:17:11+00:00,65,9,1,1,,"Mind you she's 40 + has a child with someone, so clearly being married was not high on her list so why she using it to shade you, IDK???",2
9110,9110,82,HypnagogicStryx,2022-08-21 22:11:40+00:00,144,26,0,1,,"“Defend the kids!” is always the slogan until it’s time to protect them from being molested by clergymen, being beaten by their parents, being married off to men 20+ years older than them...

Then all of sudden it’s, “No, what the hell? They’re mature &amp; know what they’re doing!”",2
9112,9112,84,HarleyShah,2022-08-21 21:47:28+00:00,92,1,4,0,,"Me: posts a nice picture of my parents getting married 

Weirdos: I must find a way to be abhorrent",2
9113,9113,85,allmychampagne,2022-08-21 22:20:09+00:00,74,0,1,1,,Thinking about how 2 people from my high school class got married yesterday and I’m going to Harry’s house for the 10th time in the past year,2
9119,9119,0,haribofilm,2022-08-20 21:34:00+00:00,203,29,4,1,,Somebody in the crowd yelled fag but he heard gag and just went with it https://t.co/ToyGtEXjZG,0
9120,9120,1,OurNewHomecoach,2022-08-21 00:25:36+00:00,100,2,32,0,,Making French toast out of all the fag ends of bread in the fridge.,0
9121,9121,2,ManeskinFanClub,2022-08-21 09:18:34+00:00,333,30,0,7,,"🎥 | ‘I WANNA BE YOUR SLAVE’ live today at Summer Sonic Festival in Osaka, Japan. 💫

© fag_nw
 https://t.co/if0xdTgUql",0
9122,9122,3,mailingrmr,2022-08-21 14:44:54+00:00,84,3,11,1,,"AT THE CHIP SHOP, LOOKING LIKE A SLAG, SUCKING ON THE MANAGERS DICK FOR A FAG",0
9124,9124,5,Poems_Future,2022-08-21 00:28:30+00:00,58,7,7,1,,Reminder: Retard was a replacement for “fag”,0
9131,9131,12,eirianqueer,2022-08-21 02:44:41+00:00,51,5,1,0,,"don't talk about how people can't reclaim slurs because they're used to oppress our communities if you're openly identifying as a lesbian because you are literally no different than someone who reclaims fag, dyke, or queer. it's taking back power from our oppressors.",0
9143,9143,24,sedderaside,2022-08-21 18:58:21+00:00,103,3,8,0,,okay y'all can add me on roblox now it's @/seddera_side because some fag took my username already... anyways lets play together :),1
9146,9146,27,LostGlasgow,2022-08-21 09:42:31+00:00,64,3,0,1,,"Happy 70th birthday #JoeStrummer 

Me, fag in hand, watching Joe, in Dukes Bar, Glasgow, on the busking tour, in May '85.

The future is unwritten...

The full story: https://t.co/k7pAFOKsFD https://t.co/TvO6z2jqYo",0
9148,9148,29,thanato34082822,2022-08-21 22:03:36+00:00,60,12,21,1,,"In addition, the dev of Black Myth Wukong said ""there is no need to make girly games to please female players and fags"" and he posted again that ""I lost 200 fans"" and ""it's my fault that I have 27% female fans"".",1
9153,9153,1,Crimson_Cliff,2022-08-18 01:26:33+00:00,57,10,2,0,,@WrittenByHanna They gonna have to call me a faggot to my face 😭 https://t.co/qNSMIeOCbN,0
9154,9154,2,sabatonfan69,2022-08-19 11:44:14+00:00,184,10,7,1,,I shaved my beard and the guy who works at the gas station just called me a faggot,0
9157,9157,5,lilestradiol,2022-08-17 06:23:50+00:00,54,2,2,0,,"People keep calling me a faggot, literally WHAT about me is faggy?

Look at me, an absolute chad: https://t.co/Tgff6k1TFQ",0
9158,9158,6,CharvelStar,2022-08-15 18:55:35+00:00,237,13,8,0,,Me forgetting I can say faggot during american idiot,0
9188,9188,36,KNIFE_TWINK,2022-08-15 05:24:15+00:00,60,2,1,0,,"tactically calling my mother a faggot when she asks me to ""clean up my room"" (trying to take away my twinkcel rights)",0
9193,9193,41,ShamirBailey,2022-08-20 16:49:00+00:00,117,3,2,0,,It's the way me and all the other dumb faggots thought this was about Taylor 😭 now I'm out here looking like the next Christian walker 😭😭,0
9213,9213,0,PunkActual,2022-08-16 15:13:55+00:00,81,45,15,0,,"GM🌞Only a few coons left to giveaway, check out my pinned tweet!! https://t.co/5ekktnaQYK",0
9214,9214,1,stretchfchw,2022-08-15 19:00:33+00:00,203,25,1,3,,"My goodness, not Coon Cat 😂😂😂",2
9216,9216,3,jackpilled,2022-08-16 18:57:31+00:00,86,102,4,7,,"‼️PLEASE READ/SHARE‼️
my cat, patrick swayze(the big handsome orange maine coon) needs emergency surgery ASAP. i’m trying to raise enough money to afford what will be a life-saving procedure to keep his urethra from blocking. there’s a gofundme link in my bio, anything helps. https://t.co/rSf9T8L7GD",2
9217,9217,4,ariffano,2022-08-16 10:28:44+00:00,28,117,3,1,,"Hello everyone, my grandma’s cat went missing in Putra Heights since yesterday. She’s a 7 months old Maine Coon named Honey. If you have seen her please contact me :( https://t.co/s3i2XOZ75V",2
9223,9223,10,laurabeck85,2022-08-19 00:15:29+00:00,56,0,2,0,,"@TheDUIGuyPlus This is her, my Maine Coon mix https://t.co/x3leandTLp",0
9227,9227,14,1tech4,2022-08-18 19:53:23+00:00,116,17,3,0,,"It’s official #squaddies, I am one degree of separation from Prince Harry. Sen Chris Coons was my group leader and trainer for public advocacy during the Obama/Biden presidential campaign. 
Don’t be jealous. 😢😢😢😍😍😍",2
9302,9302,0,4theluvofbj,2022-08-21 21:53:53+00:00,2575,883,2,107,,a nigga only gone change for who he want so if you constantly gotta ask him to just let that goooo,1
9303,9303,1,_Qwezyy,2022-08-21 13:27:02+00:00,121,19,13,13,,"I didn’t even ask Keith to do this but look how he waving the speaker back and forth like a true bottle girl. 😭😭😭😭

I love that nigga so much man 😭😭😭😭 https://t.co/PzCD4V2PiR",1
9304,9304,2,dollazduh,2022-08-21 18:21:31+00:00,95,4,6,0,,"I just wanna sit on a nigga face, is it that hard to ask? https://t.co/RVFd1XBnww",0
9307,9307,5,KeyNyata,2022-08-21 19:56:20+00:00,261,18,14,4,,"This picture means a lot to me. Cudi music dun got me through a lot of shit fr. This the only time I ever felt “starstruck” couldn’t even say what I really wanted to say, barely was able to ask for a picture 😂 nigga was cool AF tho. S/o @KiDCuDi https://t.co/d3W1GdYZgl",1
9308,9308,6,20bands1night,2022-08-21 00:50:04+00:00,765,41,12,30,,@Cimeryy @FakeKenty Ain’t nobody ask that nigga the price he look like a slave that go to brunch 😂,0
9314,9314,12,6ixfignig,2022-08-21 23:02:58+00:00,558,125,3,5,,This is an NBA twitter question. You ask this in real life and niggas gon look at you like you ruhtarded,1
9315,9315,13,_benjvmins_,2022-08-19 13:23:05+00:00,1050,44,7,8,,all 5 of my niggas helping me move? somebody gone ask some questions,0
9318,9318,16,RotimyRudeBoi,2022-08-20 19:12:27+00:00,258,63,8,2,,"“He broke the bro code” Ask whether na your bro first,niggas no send you o.",1
9383,9383,81,jd_occasionally,2022-08-19 22:56:57+00:00,80,5,3,2,,"Cheating on your girlfriend doesn’t = gay?  Niggas will literally brag on the timeline about cheating on they’re pregnant girlfriends for no reason. Hell, yo daddy will cheat on yo mama, and if you ask him “are you gay” he would laugh you out the room",0
9388,9388,1,BeezyyTatted,2022-08-21 22:14:26+00:00,1883,474,29,169,,Im not holding no nigga down that keeps going to jail !!! Better find you a boyfriend in that mf since you like going BYEEEEE,0
9389,9389,2,Juggtone,2022-08-21 21:38:05+00:00,1505,142,21,14,,Yea i like boba nigga i like balls in my mouth let it explode,1
9390,9390,3,VH1PNUT___,2022-08-21 23:16:30+00:00,82,25,0,6,,WOMEN USED TO COOK AND CLEAN... NOW THEY DRINK HENNY AND CALL NIGGAS A PUSSY LIKE 21 SAVAGE,1
