,Unnamed: 0.1,Unnamed: 0,User,Date Created,Number of Likes,Number of Retweets,Number of Replies,Number of Quotes,Number of Views,Tweet,class
2527,2527,69,Netsi217,2022-08-21 23:51:13+00:00,32,93,0,0,,"!!They tied me up in the field and  5-soldiers raped me for 3-days.
[.... there was nothing to eat. I was eating leaves.], Mariam said. 
#AshendaTigray
#Justice4TigraysWomenAndGirls
@hrw @EU_Commission @POTUS @CNN @BBCWorld @Netsiyee https://t.co/PGCe0vtq6g",2
2529,2529,71,MarkRonchettiNM,2022-08-21 19:30:41+00:00,187,55,55,7,,"Yet another repeat offender who stabbed and raped a woman after being released. 

This is what soft on crime judges bring to our communities. 

We MUST end catch and release and appoint tough on crime judges if we are ever going to restore public safety. https://t.co/d3CN4xhfNq",2
2531,2531,73,amlestgiday,2022-08-21 22:44:11+00:00,28,69,0,0,,"👉🏼Mehrawit, 27, was separated from her sister &amp; locked in a room with only a thin, dirty mattress, for 2weeks gang-raped her repeatedly by 🇪🇷n soldiers.
I urge you to assure 👇#Justice4TigraysWomenAndGirls on this week of #AshendaTigray @POTUS @USAmbUN https://t.co/CmchB75Z02",2
2533,2533,75,stevesilberman,2022-08-21 22:16:43+00:00,85,46,6,1,,"In addition to Tucker's freakshow buffoonery, note that @FoxNews is re-normalizing ""homo.""

What next?

""How to protect your daughter from being raped by big n***ers?""
""Are k*kes baking their matzos with the blood of Christian babies?""",2
2534,2534,76,tigray_ferest,2022-08-21 19:27:39+00:00,38,110,0,0,,"!!They tied me up in the field and  5-soldiers raped me for 3-days.
[.... there was nothing to eat. I was eating leaves.], Mariam said. 
#AshendaTigray
#Justice4TigraysWomenAndGirls
@hrw @EU_Commission @POTUS @CNN @BBCWorld https://t.co/NfrCmVKD8z",2
2535,2535,77,tigray_ferest,2022-08-21 19:17:28+00:00,41,116,0,1,,"!!Not only was Sara raped, but also they inserted plastic bags &amp; plastic syringe inside her womb, and finally they threw her away, 

#AshendaTigray
#Justice4TigraysWomenAndGirls
@EU_Commission @POTUS @shakira @Oprah https://t.co/NfrCmVKD8z",2
2537,2537,79,FPWellman,2022-08-21 23:04:47+00:00,103,8,4,0,,@Amb_Ulyanov You invaded their country. You murdered them. You raped them. You flooded the country with mercenaries. They will get all the support they need against you war criminals. You will pay.,2
2539,2539,81,HY0UMA,2022-08-21 22:40:37+00:00,50,5,1,1,,being excited abt a character being raped is so insane pls get help these are not normal headcanons,2
2542,2542,0,sabbox97,2022-08-21 15:38:31+00:00,261,54,13,0,,fuck a talking stage are u down to feral slay rat bussy periodt on god sis in my no cap hehe honk shoo era or no,1
2543,2543,1,niggabutwhy,2022-08-18 07:08:29+00:00,552,2,1,0,,@254_leakey @KandonDortch fuck is u talking about? https://t.co/U8vrirfoAg,1
2545,2545,3,xercexe,2022-08-17 00:20:33+00:00,190,23,3,6,,i hate it when low confidence people keeps talking down abt themselves... like we get it u are ugly and hideous and u hate urself... SHUT THE FUCK UP,0
2546,2546,4,kvrtzwcrld,2022-08-19 16:41:33+00:00,319,41,7,1,,"some of u guys are so fucking annoying the scene isn’t abt steddie it’s abt steve and eddie talking abt dustin and how much he means to them. steve doesn’t fully know how much dustin loves him until eddie puts it into perspective, can u guys pls shut the fuck up",1
2547,2547,5,NIIllIA,2022-08-17 21:27:27+00:00,56,2,3,0,,NO MORE TALKING STAGE LEFT IN ME FUCK U AND UR FAV COLOR👍🏻,0
2548,2548,6,ne0CITY___,2022-08-16 14:36:18+00:00,1825,92,7,11,,"@Joniahhh I think the ppl in here talking abt waiting until their older aren't getting that never dating anyone during those times really FUCKS with how u look at yourself and your view on dating. Being the only ""undesirable"" in the friend group and watching all your friends date  fks u up",2
2551,2551,9,nellieLOA,2022-08-20 22:30:26+00:00,121,31,1,1,,"where u guys tend to fuck up at, is affirming &amp; revising but still thinking of the old story. 
ex: u revise that u guys never stopped talking or never broke up, but ur still thinking of that situation. u keep replaying that scene. STOP! it never happened, so stop thinking of it!",2
2566,2566,24,hateurice,2022-08-21 22:38:02+00:00,65,0,1,0,,@MoKhanW @wholelottanews W name fuck is u talking bout,1
2575,2575,33,EDGEOFABLAD3,2022-08-15 04:28:37+00:00,179,7,1,0,,"all in all: mcr shows are intense as fuck so please make sure that u eat and drink enough water to handle or u’ll end up in an ambulance and no, u won’t get to meet the band. and get some sleep. also don’t heckle while gerard is talking cause it’s rude and everyone will hate u",0
2610,2610,68,JessiSummer,2022-08-20 13:53:06+00:00,57,6,6,1,,"Back hey again cause ""sometimes it pays to mind your business""? Lol.  Who tf she talking to?

If i pay you for something and don get it...das my business bitch.  Fuck u mean?",1
2617,2617,0,slyforestnymph,2022-08-21 22:25:59+00:00,1093,204,7,9,,"Apologetic pervert teacher.
""Oh fuck im gonna lose my job. Oh fuck oh fuck oh fuck. Maybe it's not too late to- fuck that feels so good. Just keep sucking like that kiddo and I'm gonna give you a special treat at the end okay? Fuck I'm so gross I'm sorry kiddo""",0
2618,2618,1,liamgallagher,2022-08-21 17:42:40+00:00,2508,98,132,5,,AJ chill the fuck out go relax on a beach life too short you got out the Robin stay away from SHOWBIZZ and all those fucking Bumbaclarts LG x,1
2619,2619,2,Fuck_you_toooo,2022-08-21 22:29:57+00:00,174,23,26,43,,"Gidi to deji: amaka dey follow me
Deji: chi chi too dey follow me
Gidi: omooo, me I want Bella but shegzz no dey leave her
Deji: the girl is caged #BBNaija",2
2620,2620,3,WeLoveNATO,2022-08-21 04:44:15+00:00,142,6,9,0,,"Fuck you too, Twitter https://t.co/ocBuOCM1x1",1
2622,2622,5,areiksane,2022-08-21 18:59:05+00:00,78,17,0,3,,"HE SAID IT THREE TIMES AND I DIDNT EVEN KNOW BECAUSE I JUST BLACKED THE FUCK OUT
""i love you too! i love you too. he loves you too.""
im going to sleep forever https://t.co/g85VwjMjfV",1
2626,2626,9,parrymusic,2022-08-21 17:39:01+00:00,60,6,1,0,,"""Just deleted X people off my friends list. If you see this I fuck with you""

Thanks person I have never met in my life. I fuck with you too",1
2628,2628,11,Paras1t3H1ll,2022-08-21 16:09:22+00:00,72,6,3,0,,"What the fuck was I dreaming last night

I had a very weird dream of TWF4 but it wasn't??? Like, the title was called ""You Have Lungs For Screaming"" and it was 58 mins long. There was a lot of animated scenes but a lot of animatic. 3d scenes too kinda like the Brian scene.",1
2638,2638,21,emkay_boo,2022-08-21 14:18:02+00:00,665,6,1,1,,"Who gives a fuck about what happened in mcc, it doesn’t matter. Literally doesn’t matter, I’m over it and you should be too. It’s frustrating in the moment but leave it alone the next day. It’s only Dream y’all get this pissed about.",1
2641,2641,24,SoumaMooncrest,2022-08-21 04:41:03+00:00,62,5,1,0,,@conceitedassjas @MsKana9 @bodaknugget_ @Headgraphix Not to mention Caine is hood too the fuck did you think he was gonna do? Of course he was gonna slap that boy around,1
2643,2643,26,megan_thescript,2022-08-21 18:30:03+00:00,124,14,4,0,,"I’m a tired fighter in my mid 40s who has been stuck too long in survival mode. I need you to believe me when I say the needle on my Don’t Give A Fuck meter is buried. 

BURIED.",1
2647,2647,30,HoneyBadger10,2022-08-21 19:41:31+00:00,59,11,4,2,,There are a lot of men that truly hate women. Nothing about this is funny and fuck you too.,1
2649,2649,32,supertanskiii,2022-08-21 19:21:01+00:00,251,3,3,0,,"@reece_dinsdale Mate. I know how hard body dysmorphia is and suffer too, it’s harder if ""up"" than down in weight to cope with for me. It’s literal hell. You’re wonderful and lovely, fuck them.",1
2654,2654,37,tobimanish,2022-08-21 21:29:03+00:00,105,33,1,0,,"Fuck it, if it’s all the same, I’m proud of me
God is me and I am Him, This is revelation for beginners, This is flow to walk on water, that’s a word to Jesus, I wouldn’t say nobody saw me coming, 
You all did but you ignorеd!! @itsLaycon this is too hard for my ears Bro 💐❤️",2
2656,2656,39,wilmonsmile,2022-08-21 10:55:53+00:00,72,1,1,0,,"wille (pretending to be upset): oh so YOU don't miss me?
simon: i mean, you're the needy one in this relationship.
wille: oh fuck off.

*they both giggle* 

simon: i miss you too. but i have to be honest, i've found a way to miss you a little less. 
wille: what?+",2
2659,2659,42,RisingPhnx22,2022-08-21 16:41:33+00:00,169,1,1,1,,"“Yeah, fuck you too,” Yoongi said and put his jacket and bag into the wardrobe closet next to the door, but could despite his grumpy mood not hide a smile.

“The Lees are coming in today for the cake tasting,” Tae said without looking up and smiled.",1
2670,2670,53,diionysustkk,2022-08-21 13:49:55+00:00,74,9,6,7,,Who the fuck mentioned attacking anyone??? Your breed is literally dragging jungkook  calling him fucking names and taehyung too and you want us all to sit and watch yall? Stop playing the victim here. I said defend not drag and stop putting words into my mouth freak https://t.co/yMxEjcoYI1,1
2676,2676,59,varindeus,2022-08-21 11:11:57+00:00,142,2,3,0,,"How will you take a look at my profile, and my banner, AND still think I have a single fuck to give about your opinion of me? 🤣🤣way too optimistic.",1
2677,2677,60,ImaginarySnow_,2022-08-21 19:18:47+00:00,137,0,1,0,,"His musings got cut-off when the door to his room suddenly opened with force.

""JIUJIU!""

""Fuck, A-Ling. Can you stop yelling?! It's too early! My head hurts!"" Jiang Cheng yelled, even without Jin Ling calling him, he knew it was his nephew.

""Hmph. It's your fault for drinking!""",1
2678,2678,61,deportablediz,2022-08-21 20:46:16+00:00,65,2,5,0,,"Sorry but if someone's whole deal is being a supremacist freak who wants to wipe others out, I don't give a fuck what happens to them. That goes for the Ukrainian Nazis too. If you glorify violence I'm not gonna cry about any harm done to you.",1
2684,2684,67,Fream,2022-08-21 06:37:52+00:00,234,0,1,0,,"@BubiVT awww, thanks :D 
fuck you too!",1
2686,2686,69,girldrawsghosts,2022-08-21 12:27:53+00:00,94,1,6,1,,"this is directed at cis ppl too. I know replying with medical journals seems helpful but all blogwarts wants is to bury the conversation in layers of minutia. they want you to argue about gametes and whatever the fuck

*that’s why they’re here*

pfft https://t.co/nToOxEMzZ5",2
2687,2687,70,danceliketae,2022-08-21 23:51:22+00:00,276,1,1,9,,"“Tae?”
“I..” Ask him out. Do it Tae. He tried to say, “I missed you.” Fuck.

“I’ve missed you too. Do you want to go on a..” Jeongguk began.

“A friendly meetup! Yeah!” Fuck! Part two. What the hell did he mean friendly?

“Oh.. friendly? Yeah, sure. Tomorrow Let’s meet?”",1
2688,2688,71,danceliketae,2022-08-21 23:38:38+00:00,272,2,1,3,,"He paused for a second so Taehyung had to find out the rest of the sentence.

“But?” He asked him.
“You’re still too far away from me.”

Fuck. That was kind of hot. He was always so sweet and careful with his words. Taehyung didn’t want to get ahead of himself.

“Jeonggukie..”",1
2689,2689,72,inkydaegu,2022-08-21 09:51:26+00:00,57,0,1,0,,"yoongi knows he tried. yoongi /watched/ him try.

""i'm in love with /you/,"" namjoon announces - although yoongi has known that all along, too. ""i'm so in love with you that it terrifies the fuck out of me, like if it ever feels /real/ i'll be drowning in it until i'm out of air.""",1
2694,2694,1,_JonnyHotcakes,2022-08-19 21:21:16+00:00,98,9,9,2,,"girl, are you the state because i fucking hate you",1
2697,2697,4,alarrielife,2022-08-19 02:56:34+00:00,87,6,5,0,,STUPID FUCKING BITCH I HATE YOU I HATE YOU I HATE YOU,1
2700,2700,7,jason__jasonson,2022-08-20 22:36:50+00:00,50,18,11,0,,i hate you guys so fucking much.,1
2701,2701,8,SpillerOfTea,2022-08-20 09:59:38+00:00,345,54,4,0,,"Love how the media got together at some point and collectively decided to start saying ‘controversial’ in place of ‘bigoted fucking binfire of a human’.

Really great way to minimise and normalise hate, you guys xx",0
2710,2710,17,myglyricbot,2022-08-21 14:00:39+00:00,138,37,0,2,,"dear my friend, how are you? well, i'm doing fine, as you can see. dear my friend, i'll be honest with you. i still fucking hate you.

› dear my friend",1
2721,2721,28,subbbyprincesss,2022-08-17 23:50:43+00:00,735,3,1,8,,"before dual screams of ""we hate you fucking Deku"" sounded in the room and the two boys stomped upstairs banging their doors and they locked themselves in their room.",1
2739,2739,46,subbbyprincesss,2022-08-18 00:19:48+00:00,709,2,1,0,,"// flashback //

""Its because I fucking hate you Deku, I hate this life, I hate this monotony, you never wanna do shit that doesn't involve the kids, you never wanna be my fucking husband for a damn moment.""

""But Kacch -""",1
2770,2770,0,devilshe11,2022-08-18 05:33:30+00:00,82,13,16,1,,"A room full of roses 
A crisp white  bedsheet 
Cuddling and kisses 
Mood today 🍁",2
2771,2771,1,TheSleepyMia,2022-08-18 23:56:55+00:00,763,24,28,0,,"Y’all I’m at an open mic night this shit is crazy. Room full of black ppl, white lady gets up and recites a poem about Aunt Jemima 🧍🏽‍♀️",1
2772,2772,2,CaslonRichard,2022-08-21 11:28:33+00:00,148,23,18,1,,"So this is the big weekend where Mike Lindell has his 
moment of truth summit which will immediately put Trump back in the WH. Anyone have a livestream of the moving vans arriving and leaving the White House? Or is Mikey full of *beep* as usual?",2
2773,2773,3,namwella1961,2022-08-21 14:15:37+00:00,106,83,8,3,,"It's Sunday so I'd like to remind GQP Christians that Jesus wasn't white, didn't speak English, and wasn't a Christian.

He would condemn your worship of Trump.

He would say when your heart is so full of hate for liberals that you'd kill them, there is no room in there for me. https://t.co/G43SQP6B5A",2
2774,2774,4,soonersonly,2022-08-19 00:40:42+00:00,518,31,27,2,,"Still fucking pissed about OU selling out for these corporate white tent tailgates.

What OU fans want is to bring their own OU tent, bring coolers full of beer, cook ribs, burgers and dogs, and have a grand time on their own budget. 

OU is giving a middle finger to the fans.",2
2775,2775,5,NaliJulia,2022-08-21 22:55:56+00:00,119,5,3,0,,"so much space in medical humanities feels full of white cis faculty who are interested in individual moral formation of the doctor role, but aren’t the ones interested in critiquing the moral formation of systems, underlying foundations of medicine or pushing for radicalism.",2
2776,2776,6,nikicaga,2022-08-17 22:41:11+00:00,354,11,27,7,,"OK can somebody explain to me why stan twitter, and KPOP twitter in particular, is full of misandrist, transphobic, anti-race mixing and unironically racist against white people teenage girls",0
2777,2777,7,reincarnatedbp,2022-08-20 17:34:32+00:00,391,0,1,0,,@questionablyme_ @LooveDLuffy @hopewrldaj You never been in a school full of white teenagers🙁,2
2778,2778,8,131Weeks,2022-08-20 11:54:23+00:00,203,28,9,3,,"Have you ever heard the one about Michael Collins having a child's white coffin full of gold bullion and coins tucked under his feet in the car he was travelling in which was ambushed at Béalnablath?
It remains one of the most bizarre and enduring stories about that day...
🧵1/16 https://t.co/rccaTPjkiN",2
2785,2785,15,marcowenjones,2022-08-21 17:21:15+00:00,47,11,61,9,,Doing a class on the White Helmets tomorrow and catching up on the Vanessa Beeley and Eva Bartlett. Just a coincidence now that their TLs are full of love for Russia and disdain for Ukraine I guess.,2
2787,2787,17,coughdrops,2022-08-20 03:01:24+00:00,86,1,7,0,,Still dont know why I thought it was a good idea to pack a ziploc bag full of powdery white bath salts in my carry on but I’m glad I did not get in trouble.,2
2789,2789,19,mauraleecorrupt,2022-08-20 16:36:09+00:00,159,1,0,2,,@que_sera9 @ggreylis @PopCrave her tik tok comments…”my stomach churned just reading that message” 😭her tik tok comments are full of white women acting like amandla shot her. https://t.co/wzr3P1xKfF,2
2791,2791,21,SueSuezep,2022-08-18 21:05:26+00:00,72,17,17,0,,"If we could all just please listen to our betters  &amp; do as we are told, life would improve for us So lets all stop smoking 60 a day, guzzling down all that white lightening, stuffing ourselves full of greasy takeaways, get rid of those annoying smart stuff gadgets, &amp; knuckle down",2
2795,2795,25,pastelteacher,2022-08-21 15:46:15+00:00,109,0,15,0,,"Before and after! 

New furniture ordered, three coats of white paint, a wall full of mould sorted, paint all over the carpet and a trip to a&amp;e for a very deep puncture wound. All in 2 days. Looking forward to a rest at work tomorrow 🤣 https://t.co/Ab0Ls7eUNk",2
2799,2799,29,spacetwinks,2022-08-19 19:09:24+00:00,257,66,6,0,,"our country just chock full of people doing tons of white collar crime, tax evasion, tax fraud, tax manipulation to get unfathomably richer and they will celebrate that wealth by eating one slice of default birthday cake and watching a documentary on ESPN classic",2
2808,2808,38,Nelba_MG,2022-08-21 16:33:17+00:00,422,17,1,0,,"full of scripture and pockets filled with cash blaspheming the gospel to maintain white supremacy. And lastly, to see how many people still cling desperately + naively to neutrality and “not rocking the boat”.

If we ever needed white and all Christians in the US to rock the boat",2
2811,2811,41,thebiggestyee,2022-08-19 13:05:12+00:00,85,0,5,1,,girl on tiktok posted about how coming back to chicago is “so sad” for her bc the neighborhood she grew up in is “full of white lulu lemon gentrifiers now”. the neighborhood you ask? the gold coast. LMFAO.,2
2816,2816,46,rajandelman,2022-08-20 20:11:50+00:00,81,0,5,0,,"Me: So there's video going around of Catcher in the Rye that purports to be why the book's bad, but it's actually about why Holden's bad, but it's ACTUALLY about why reading lists full of white men is bad. It's just kind of a strange, coded discourse
You: So yes to drinks",2
2821,2821,51,kvanaren,2022-08-19 18:50:39+00:00,87,2,11,1,,consenting adults can do whatever they'd like but if you make me send a plain white tshirt to camp and you hand me back a ziploc bag full of sopping wet dark purple dye all tied up in rubber bands you're dead to me,2
2824,2824,54,WingfieldNFL,2022-08-21 01:33:01+00:00,152,4,5,3,,ZaQuandre White's college tape is full of pressing play side and getting to that cut back lane. Adding in that element of his game as a pass receiver sure as hell makes him intriguing.,2
2837,2837,67,LamaYesheWisdom,2022-08-21 00:28:32+00:00,54,9,1,1,,"Relax with this white beam. The body is full of the white beams, which are coming from Guru Shakyamuni Buddha’s heart. Then, like that we can try to fall asleep.
-Lama Zopa Rinpoche

The Yoga of Sleeping
🛌 https://t.co/5shrBnc7im https://t.co/qEUbL0gYmN",2
2844,2844,74,MeghansMole,2022-08-20 20:42:16+00:00,164,1,45,0,,"@Canellelabelle I was the only ethic girl at a school full of rich white children,boys would spit on me, girls would torment me&amp;harass me every single day. They would call me all kinds of racist names

My first day at the school, a boy stepped in poo &amp; wiped his shoe on my school skirt 😵‍💫",2
2859,2859,0,4theluvofbj,2022-08-21 21:53:53+00:00,2577,883,2,107,,a nigga only gone change for who he want so if you constantly gotta ask him to just let that goooo,1
2860,2860,1,MarkiaaG_,2022-08-21 15:18:08+00:00,624,206,3,124,,why do females lie &amp; say they don’t be liking other girls over niggas? 😂😂😂😭 i’ll be the first to say any bitch that dealt with a nigga while i was dealing with him AND KNEW i was dealing with him i do not like your ass idc,1
2861,2861,2,iBeen__Fly,2022-08-21 05:00:08+00:00,1047,265,7,27,,Son Leon Edwards corner willed that into existence idc that nigga looked like he was finna give up and dat Coach told him to BE A MAN,1
2862,2862,3,NIIYMX,2022-08-21 16:11:29+00:00,719,53,10,1,,"ouuu... i want a serious talk on how parasocial some of you niggas are/were when talking abt techno and his passing yall acted like you knew him to make really really weird jokes, talk over his friends grieving and so much more it was weird and i really did not need to see",2
2863,2863,4,guntguardian,2022-08-20 06:35:41+00:00,140,7,13,2,,"Brother came into my room and asked do you know “Nick Fuentes”? He watched him for the first time on sneako, this nigga becoming a groyper fr.",2
2864,2864,5,diamondlishous,2022-08-21 20:06:30+00:00,88,24,4,13,,😂😂😂😂you can have a full convo with yo friend on the phone about why a Nigga ain’t shit then soon as that Nigga call she talking bout some “Hold on this him”,1
2866,2866,7,ThatsBigPopcorn,2022-08-21 02:11:53+00:00,608,27,4,1,,@Headgraphix @vonchalant_ 😂😂😂😂 son G I can’t stand her in this movie. How she have a baby by his homeboy and want him to be a step dad all while preaching about how she don’t want her son around hood niggas the entire movie,0
2867,2867,8,dreadscottx,2022-08-21 03:08:42+00:00,82,10,13,4,,this was in reference to me telling people xerces said nigga on a call with me. i didn't know what to do in the moment. i been to his house more than once so i knew him in real life. i was blown and disappointed. i decided to distance myself from him bout a month ago and i- https://t.co/KG2O0PwEal,1
2869,2869,10,BihVeed,2022-08-21 17:15:35+00:00,199,8,2,0,,@XXL So him saying nigga cuz he virtual aint a problem??😂😂😂😂,0
2873,2873,14,iKan_Di,2022-08-21 17:35:31+00:00,188,83,5,11,,"Why are the gals calling him gay?? Like what if he just didn’t want the damn girl all in his damn personal space lol

If that was a nigga invading a woman’s space then he’s a creep and a predator

Like y’all morals and opinions can’t switch up depending on the gender. Pick a side",1
2875,2875,16,AneleMonte,2022-08-20 13:11:11+00:00,622,43,9,2,,"What I found admirable is that she didn’t even try to tarnish this nigga’s marriage(esp being well aware that he is now married and who the wife is), but she focused on him and dealt with the discontent she has with him.

THAT, tells you a lot about #Moneoa’s character.",2
2889,2889,30,Lxrdforbidden,2022-08-21 04:54:26+00:00,142,1,11,1,,@MichaelBucwa Lol rudest was prolly AKA for me once met him at a charity concert in the Free state and we paid for VVIP which gives us access to even the backstage where they performed everyone allowed us behind em even abo emtee nabo cass but nigga told security he don’t one no one behind him,2
2957,2957,0,MIMI_ZIMA,2022-08-17 20:19:27+00:00,88,7,2,0,,Barbara is such a fag hag name like you literally have bara in your name,0
2965,2965,8,lizduckchong,2022-08-20 06:50:14+00:00,344,47,8,0,,acab also includes every single person trying to find a tranny gene or bottom gene or fag gene or whatever it is they're trying to quietly eradicate.,0
2971,2971,14,blkboyshine,2022-08-16 17:04:53+00:00,213,35,22,15,,"Y’all really booked two Cis -Hetero niggas to play a Beyoncé party, not a femme nor fag in sight?!?

Y’all really failed the assignment, like its a album for the girls, this is unfortunate. There’s to many other amazing DJs in this city for this fail!",0
3019,3019,62,uncanny_eli,2022-08-16 18:19:02+00:00,112,0,3,0,,"not to be a bitch but if you're gonna source 80% of a florence given article from my thread it might be nice to point that out, especially if you're going to misread it by saying that the problem is that given writes the word fag too much LMFAO",1
3025,3025,68,AshleighWildest,2022-08-21 19:33:28+00:00,88,0,1,0,,"@twi__tch Contextualise this?

I’m familiar with comphet, but what has it got to with this conversation?

The only implication I can think is you’re suggesting I want men to like me by talking about masculinity? Which is so off base as a trans masc fag 🤔",0
3031,3031,4,lilestradiol,2022-08-17 06:23:50+00:00,54,2,2,0,,"People keep calling me a faggot, literally WHAT about me is faggy?

Look at me, an absolute chad: https://t.co/Tgff6k1TFQ",0
3061,3061,34,willkostakis,2022-08-15 10:30:27+00:00,77,6,5,1,,"This wasn't a subtweet. This is a preservation of what was said. And I'll say it on a panel.

I've been out there in schools for 10+ years, I got kicked out for being a faggot and I clawed my way back.

I'll show you a champion. https://t.co/xnrGaCckSo",0
3083,3083,1,Gifted_Gab,2022-08-21 03:27:08+00:00,233,24,9,12,,"Sauce Walka been in Seattle for one week is now a whole Skyway nigga, I’m fuckin dying! 😂💙 https://t.co/RRDGR0cIf6",0
3084,3084,2,AkAkumu43,2022-08-21 16:03:01+00:00,139,18,0,0,,"THIS HUG IS A FUCKIN LIE.
#RWBY #RWBYIceQueendom #RWBYIQspoilers https://t.co/TxTZut2vY8",2
3087,3087,5,__Dhinu__,2022-08-21 14:12:58+00:00,743,254,7,8,,"They always said that @VetriMaaran ilana @dhanushkraja ila only caste-based film is a success &amp; blah blah.. but what @Actor_Vivek sir said is only the fuckin truth :) 

#Thiruchitrambalam பட குழுவுக்கு வாழ்த்துக்கள் &lt;3! https://t.co/GwPwPDs3m6",2
3091,3091,9,falloutplays,2022-08-21 15:53:38+00:00,989,8,141,3,,"at the risk of getting severely roasted - what's the point of getting a giant ass mouse pad IF your keyboard is gonna take up 90% of the fuckin real-estate?  This is literally the same as having a tiny ass mouse pad, I feel like I'm taking crazy pills https://t.co/FVFSKRoGDL",1
