,Unnamed: 0.1,Unnamed: 0,User,Date Created,Number of Likes,Number of Retweets,Number of Replies,Number of Quotes,Number of Views,Tweet,class
0,0,0,ErikManny2,2022-08-18 06:09:55+00:00,1454,547,110,38,,When your son's name is Allah Akbar and you lose him at the mall https://t.co/lLIiVS5qhO,2
1,1,1,GigaBeers,2022-08-18 19:35:26+00:00,378,217,58,14,,"If you can’t assimilate, get the hell out. Brandishing a knife  while yelling Allah Akbar is not a good look.

 https://t.co/waF2FbPk8E",2
2,2,2,MJ_007Club,2022-08-18 16:36:24+00:00,1309,674,128,105,,A Muslim was arrested in Birmingham when he threatened to kill everyone with knife while shouting Allah-hu-Akbar in show of solidarity towards Multi-Culturalism &amp; Humanity. https://t.co/ZTv4YA0AQu,0
3,3,3,AdityaRajKaul,2022-08-19 16:37:11+00:00,3488,1210,169,68,,"This is the state of United Kingdom. An Islamist seen here climbing houses in #Birmingham chanting Allah-u-Akbar with a knife. Tasered by the Police and taken in custody. Over years Birmingham has become a hub of thug Islamists, mainly from Pakistan.

 https://t.co/QAc2o5A6wB",2
4,4,4,El_Hunto,2022-08-19 19:51:48+00:00,2096,300,11,7,,"Allahu Akbar, Alkahu Akbar, Allahu Akbar!

Allah ﷻ blessed me yet again to visit His house on a Friday. SubhanAllah just before this video there was a sandstorm a really bad one. Visibility was low and sand everywhere. Made dua for the rain and thunder followed by a downpour. https://t.co/aGfUo2OZfW",2
5,5,5,Aish_sayss,2022-08-16 07:33:26+00:00,57,4,20,0,,"Pictures from inside the Ka'bah
ALLAH HU AKBAR.❤ https://t.co/y7632rbFIU",2
6,6,6,MJ_007Club,2022-08-15 03:33:30+00:00,2890,1080,127,56,,"France: After screaming ""Allah Hu Akbar"", a Muslim migrant beheaded his father and walks around with his severed head because he considered that his father has done something 'non-Islamic'",2
7,7,7,Noor9__2,2022-08-19 14:21:03+00:00,40,72,1,0,,"Is this the state of Madinah? 🤔
Allah Akbar♥️
#گستاخوں_کایارعمران_خان https://t.co/XPAX1y8TIj",2
8,8,8,Amanullah6064,2022-08-17 07:49:00+00:00,370,90,58,0,,"This party was the largest welfare party of Pakistan, its current name is Allah Akbar Tehreek, its president is
@Saif_UKhalid and @HafizIbnSaeed
 Even today we have banned them to please America
Thank you for stating the truth
@ImranRiazKhan @IRKsays https://t.co/PfIs1iVyrk",2
9,9,9,Starboy2079,2022-08-17 06:01:27+00:00,465,205,3,5,,"A large number of the participants were reported to have been armed with iron bars and lathis After the afternoon namaj, mob of around 1 lac Muslims attacked Hindus n started to butcher them. 
Mob were shouting “le kar rahenge Pakistan” “nara a
taqrir allah hu akbar” https://t.co/Tl2PuqGd2J",2
10,10,10,fakeeri_nafar,2022-08-17 17:02:43+00:00,76,1,0,0,,The voice Allah U Akbar is always heavy and high ❤,2
11,11,11,Didzzz13,2022-08-21 16:18:58+00:00,130,3,32,0,,"131 pts , qual for Finals CCC with @Jokzz4 Allah u akbar❤️❤️❤️ biggest pop off❤️❤️❤️ https://t.co/MyMV55FVIg",2
15,15,15,pete_carswell,2022-08-17 05:42:34+00:00,407,22,39,17,,"@KefilweLekabe Stand on your luggage, reach into your jacket and shout ‘allah akbar’ 

Please don’t do this.",2
16,16,16,naimat_allah_ki,2022-08-21 08:10:28+00:00,59,12,8,0,,"Kisi buzurg ko dekhein toh kuch na kuch unse khareed liya karein..
chahe apko wo cheez ki zarurat ho ya na ho...
Allah hu Akbar he must be around 80-85yrs still managing every bit of his strength to earn halal income!!! https://t.co/keslxalnjh",2
17,17,17,amitsurg,2022-08-15 13:10:20+00:00,87,25,4,1,,"Was watching the Independence Day celebration at #AttariWagahBorder - this video was taken by me on our visit there a few years back. While our side was in grand party mode, the Pak side was solemn with “Nara-I-Taqbeer Allah o Akbar” being the only slogan. Same today as well. 1/2 https://t.co/qmNihyBrRF",2
20,20,20,avroneel85,2022-08-15 13:31:04+00:00,50,32,8,0,,"This event is today.  I still don't know what happened.  I will update when I know.  But in front of these police, Hindu temples, houses and Hindus were attacked with Jai Bangla and Allah Akbar slogans, and the administration was a spectator. https://t.co/1IsWGmsNkj",2
22,22,22,shazzzazzz,2022-08-16 17:05:54+00:00,100,5,2,0,,@leonidax22 @FinalFatnasty7 @niacerise ohhhh so when they say god is great it’s okay but whenever i say allah hu akbar it’s a whole different story 🙄🙄🙄,2
32,32,32,Abdulhere17,2022-08-16 05:16:47+00:00,62,0,1,0,,A Japanese doctor converted to Islam inspired by azaan's call 'Allah O Akbar',2
43,43,43,Mohamed68123389,2022-08-20 23:41:16+00:00,343,2,7,0,,@TheSNEAKO You still mocking it with the Insha’Allah Allahu akbar just close your mouth on Islam,2
44,44,44,Ahmad_S_Mada,2022-08-15 09:22:31+00:00,55,16,0,0,,"Shaykh Muhammad Salih ibn Uthaymeen RahimahulLah said: ""If you truly contemplated the meaning of Allahu Akbar (in Salat), the world would vanish from your thoughts. This is because Allah is greater than everything, and you are standing before the One greater than everything.”",2
46,46,46,drickalesyne,2022-08-17 04:26:43+00:00,112,0,4,0,,@frodeci Imma yell “ALLAH AKBAR” and see the reaction 🤣🤣,2
48,48,48,yoyo_fangirl,2022-08-18 18:11:27+00:00,146,10,8,1,,"Sharjeel Smashes a shot and that hit straight to Faheem who was standing at non-striker end. 
Sarfaraz behind the stumps: ""Allah Hu Akbar , Allah Hu Akbar , Faheem kaise ho ? Zour se to nahi lagi ?"" 
A man with golden heart ❤
@SarfarazA_54 @iFaheemAshraf",2
55,55,55,CCK_Mojo,2022-08-16 15:00:49+00:00,59,0,1,1,,"@jiggyjayy2 She won't be praising god when I start yelling ""Allah Akbar"" &amp; clear that whole terminal out.",2
73,73,73,rainaamit,2022-08-18 04:16:53+00:00,60,24,7,0,,"A Hindu funeral with slogans 'Nara-e-tadbeer, Allah ho Akbar' is sign of secularism and united society for PDP and its Stooges. Even after his death, the Sunil was denied the dignity his dead body deserved.",2
88,88,0,osullivanauthor,2022-08-21 16:53:01+00:00,2556,830,242,72,,"Florida is banning ""To Kill a Mockingbird.""
Disgusting on every level.

Blacks were treated abhorrently in the south.  
Learn from it.

The GOP is trying to whitewash our country's history.",0
89,89,1,WillieJMontague,2022-08-21 16:56:41+00:00,845,136,52,10,,"I’m 2017, 49% of Blacks identified as “liberal”.

Fast forward to 2022 and that number is down to 34%.

When these political pundits say Black districts are tough to win, they’re simply not telling the truth.",2
90,90,2,HESOG0LDEN,2022-08-21 23:04:15+00:00,472,89,10,19,,knowing what MAGA really stands for and how much it triggered blacks &amp; poc the past few years one of y’all thought it would be funny to make a sign with it for grape juice ? for his diverse fanbase to see ? for his BLACK band members to see ? y’all really are dumb,2
91,91,3,webnetcity,2022-08-21 21:33:46+00:00,114,25,4,4,,"🤨

Democrats once told Blacks they were born to be slaves
Now they are telling Whites they are born to be racist

This is not about race -
This is about playing God
Dehumanizing people to rule over them

This is about power 

Same demonic spirit of division - different face 🇺🇸🤨",0
92,92,4,DreamLeaf5,2022-08-21 22:38:47+00:00,242,8,15,0,,I saw “blacks” was trending so I took a look and it’s mostly just… people being racist? Idk what I expected. https://t.co/xyOdA4E4KL,2
93,93,5,Gamuroger,2022-08-21 20:06:53+00:00,180,63,11,3,,"In 1994, the ANC handed power to the enemy through  Codesa Heist Constitution. 2024 the enemy  will  push the ANC out of political power through their Multi _Party Coalition Agenda: a code name for Apartheid Government. Clever blacks &amp; racists will disagree. Hope you understand",2
94,94,6,JaneotN,2022-08-21 19:21:31+00:00,120,48,4,3,,"In the 2020s the Ku Klux Klan had a massive resurgence. Originally focussed on blacks, this new KKK also fought against immigration, minorities, homosexuality, political corruption. It was a white, Christian America for all.

Sorry. That was the 1920s.

We’ve been here before. https://t.co/2btg7u62cI",2
95,95,7,Whiteliberalsa1,2022-08-21 20:57:09+00:00,55,10,6,0,,Seeing old head blacks with yard flags and signs still up supporting JimCrowJoe knowing how both treated blacks shows why wisdom doesn't always come with age.,2
96,96,8,starhistorian,2022-08-21 22:45:36+00:00,79,2,9,1,,@Angry_Staffer Wow it’s a white guy! Usually only blacks get beat like that by cops 🤷🏼‍♀️ fire them all and charge them with assault,0
113,113,25,dakaner,2022-08-21 20:49:34+00:00,64,0,4,0,,"@DrewSav eh a lot of their efforts to ""court"" Jews are a lot like their efforts to ""court"" blacks",0
120,120,32,_tshmo,2022-08-21 19:14:03+00:00,77,14,1,1,,"Whites: they were arguing then she slapped her. 

Blacks: Asare nywe nywe ba more fhaaaa!!👏🏿",0
124,124,36,LABD777,2022-08-21 23:29:53+00:00,57,5,7,0,,"@libsoftiktok I have to 🙄 at these racist ""blacks"" the majority of them have a lot of white in them...looks to me she's got a white parent or grandparent, does she have her guard up around her white relatives 🙄",0
137,137,49,BaileyCold,2022-08-21 20:30:42+00:00,71,0,6,0,,"@wil_da_beast630 @ninaturner I wouldn’t say “all gaps in performance.”  There are plenty of discrepancies that are ignored or dismissed when they are politically inconvenient to the left.

Such as incarceration rates for example:
Blacks &gt; whites must be racism
Men &gt; women NOT because of sexism",2
143,143,55,DvineExpression,2022-08-21 20:51:17+00:00,89,25,19,6,,"Not at all impressed by this! ALL descend of enslaved Blacks in the United States remember this day clearly as the day this nation stole liberty. So over empty symbolism.

Biden marks Slavery Remembrance Day: ‘Great nations don’t hide from their history’ https://t.co/oFymksphvO",2
146,146,58,the_meghaning,2022-08-21 20:27:56+00:00,64,11,3,0,,"White men in power everywhere: ""Things will be better if we blame the Jews. Ok, then the Blacks. No, the gays! Immigrants! Wait, the dirty trans! Dammit we're gonna run out of scapegoats - let's just blame 'wokeness'!""",0
163,163,75,MedGold_,2022-08-21 19:23:57+00:00,68,2,2,2,,Most people who hate cities hate them because they hate blacks (right &amp; just) or because they didn’t excel there sexually. We’ll never know the truth. It’s easy to lie online.,0
173,173,85,ReformedWriter,2022-08-21 23:12:16+00:00,62,1,1,0,,"@AmoneyResists “Thousands of unarmed blacks people get shot by police for existing.”

You lying, race-grievance hustler.",2
180,180,92,jdflynn,2022-08-21 18:39:21+00:00,77,18,3,3,,"“The pro-life movement - including those who fund the pro-life movement - have to actively open their arms to specifically embrace African-Americans and Blacks.”

https://t.co/ZkxaqVAJzS",2
186,186,5,Tafadzwa____,2022-08-20 09:01:41+00:00,134,13,8,3,,My niggers be Alphas on Twitter but simps in real life😑,0
187,187,6,FinalDraftJunki,2022-08-20 16:03:28+00:00,141,4,1,0,,@CeeHawk From “hear me out” to “Niggers!!!” Took no time,0
194,194,13,AnnieVanns,2022-08-21 01:50:11+00:00,66,7,4,1,,I’m trying to figure out why u would want a baby by a man who uses racial slurs and is adamant about not having a child. U have a baby by him now he really gone call your mixed baby that he didn’t want a nigger #familyorfiance,0
197,197,16,iamvandal617,2022-08-20 23:09:07+00:00,100,34,7,3,,Woke is a proxy for nigger. Just know that.,0
200,200,19,MainGuyFX,2022-08-19 14:08:40+00:00,151,0,6,0,,@LameloTime @P1MPCECE @DailyLoud ‘Always the excuse’ lmao like he called him a jerk or something. He called someone a nigger over fucking chicken. Also he clearly wasn’t trying to kill him,0
211,211,30,romayofficial,2022-08-19 17:02:28+00:00,50,2,4,0,,"@2ATeee @DailyLoud Bro said ""My nuggets are cold nigger""",0
261,261,0,Jadedfoxx26,2022-08-21 15:22:38+00:00,470,34,31,3,,"If Justin Fields is surrounded by trash and he balls out this year,I don’t wanna hear a goddamn thing because we coming with them receipts playa,believe that💯 #JustinFields #DaBears",2
263,263,2,tyredcyclist,2022-08-21 17:42:51+00:00,82,2,3,0,,"@TheSpaceshipper The JMC Red Dwarf, “a gigantic red trash can with no brakes and 3 million years on the clock” https://t.co/cfS4bqzCGk",2
266,266,5,guymrdth,2022-08-21 23:35:19+00:00,166,6,3,2,,pedro pascal is a really talented actor if I was producing a tv series in the most iconic movie franchise of all time and cast him I probably wouldn’t give him a character wearing a trash can with no depth that he can play over facetime,2
272,272,11,CrashStL,2022-08-21 21:30:16+00:00,90,7,15,0,,I'm still trying to figure out why CB Bucknor was pissed. Dude has been 100% trash today. He was very aggressive with Oil.,2
274,274,13,swati_gs,2022-08-21 16:17:33+00:00,1643,463,25,4,,Those earning Rs 100 crores per trash film are the new 'khatre mein hain' gang. Entire 'secular'&amp; ecosystem is standing with them as if they will be homeless if boycott calls continue,2
279,279,18,NimbyPatrol,2022-08-21 18:14:33+00:00,79,11,12,2,,"Roads good, sidewalks and bike lanes are for crackheads? 🤔

""The sidewalks? No one walks on them for the most part aside from crazy crackheads. The ridiculously wide bike lanes? You'll see two or three homeless dudes with a bicycle trailer full of trash in an entire day."" https://t.co/kl5Zz1hCe3",2
292,292,31,magmagirlMSU,2022-08-21 21:05:23+00:00,285,1,2,0,,"@coachmontel @DrMarinaHarris According to the BMI I've been obese my whole life, even with 8% body fat and 6 pack abs, as girl. I'm tall, I'm built like a tank and build muscle easily. BMI is trash.",2
298,298,37,miztwocents13,2022-08-21 20:38:48+00:00,52,0,6,0,,@ctvottawa Send the Peterborough Mayor in there. SHE knows how to deal with the trash!!!,2
303,303,42,michcast05,2022-08-21 18:17:40+00:00,252,3,13,1,,Turned the game on -stepped outside to take out the trash -got talking to my neighbor - came back in the house -Phillies up by 4 top of 2nd. Now I have to go back outside and stay in the front yard 😳. Not messing with any Mo-Jo. Let’s go Phillies.,2
308,308,47,MarsStudio1970,2022-08-21 21:00:08+00:00,50,3,1,1,,"@HRustyBuck @CthuhluRisen The specific interview that the quote was misconstrued from he was just talking about how people getting in the industry only have experience with previous manga and anime and no human or lived experience otherwise, so it all becomes stagnant, he just didn't call it bad or trash.",2
310,310,49,dymingi,2022-08-21 22:22:51+00:00,56,0,1,0,,"@theorypoppins and when you argue with them they come with ""OUTSOLD YOUR FAVES THO"" ok id rather they dont outsell with good songs than outsell with absolute trash",2
328,328,67,ziibiing,2022-08-21 17:30:22+00:00,185,13,3,0,,"We were called “the Minneapolis Mafia” by the DFL party chair, treated like absolute trash, and mostly pushed out.

They never asked how we were innovating, how we were doing so much with so little. Never.",2
338,338,77,ForestServiceNW,2022-08-21 22:08:16+00:00,62,16,3,2,,"Please take everything you brought into the woods out with you or placed securely in trash cans where available when you leave our beautiful forestlands. That way we can all enjoy the wonders of nature without the trash

#RecreateResponsibly

@forestservice @USDA @nationalforests https://t.co/FkXN75AOdm",2
353,353,0,222corn,2022-08-21 04:32:34+00:00,11942,470,60,46,,imagine fuckin someone wit asthma thinking u boutta make her finish whole time she’s jus dying for sum air,2
354,354,1,BadGyallRiRi,2022-08-20 19:27:46+00:00,482,198,4,9,,Life too expensive rn to be fuckin with a nigga who dont do shit for u,1
355,355,2,xoxok3ll_,2022-08-21 01:28:50+00:00,285,12,0,0,,U fuckin wit me den ya dreams came true😘 https://t.co/p9u5QuUfP8,1
356,356,3,peakamani,2022-08-21 18:09:15+00:00,162,22,8,0,,how tf some of yall let ur moots dictate what u do and dont do😭😭 be srs… so fuckin embarrassing,1
359,359,6,f0lake,2022-08-21 18:25:32+00:00,385,38,0,4,,a semi-irrational pet peeve of mine is when people text me extremely viral news as if i wouldnt have known if they didnt inform me. like be fuckin fr i didnt need u to tell me who won the presidential election i think i woulda found out 😵‍💫,2
369,369,16,lovedoveclarke,2022-08-20 20:45:41+00:00,577,31,1,0,,if you think it’s possible for a 12 year old to dress like a whore you are probably a fuckin pedophile 👍🏽 hope this helps u figure some shit out about yourself,0
383,383,30,BROONOart,2022-08-20 03:11:36+00:00,54,7,1,0,,"-u must be the EVO moment 37 AF1 Nike collab shoe designed by @MarkMan23 if u think we fuckin 

me: https://t.co/ZCsvE3dWul",1
393,393,40,RileyMiner,2022-08-20 05:27:48+00:00,67,1,9,1,,hockey twitter is such a fuckin trip one minute ur like just joking w ur friends next thing u know matt beniers is being outed as a pedophile,2
396,396,43,verwetti,2022-08-21 01:33:24+00:00,164,1,6,0,,@Konvy na are u a fuckin loser? jesus,1
402,402,49,millzeeyy,2022-08-21 04:07:35+00:00,67,0,1,0,,@SatanSplainer @arielhelwani Oh fuckin hell are u serious mate?? Get him OUT the ufc asap!!🤬🤬🤬,1
422,422,69,KatoProducer,2022-08-20 22:25:42+00:00,87,4,11,0,,Artists work their whole fuckin lives to have their music played like this n then have to watch 🤡s disrespect u like this once u get there. Fuck this guy n everyone like him 🖕🖕🖕,1
429,429,76,FrenchieFie,2022-08-20 00:46:45+00:00,62,0,0,0,,@Saberspark HOW FUCKIN DARE U https://t.co/BpcRf19XJi,1
455,455,0,b_nginkosiNkosi,2022-08-18 21:00:26+00:00,623,43,14,2,,Nigger what's up? I just killed a lion call me Bayede Dawg https://t.co/CHZNO33Mti,0
456,456,1,Etrouse,2022-08-17 02:34:02+00:00,88,9,5,1,,Calling me a nigger and shit over made up characters? I’ll spit on you bitch. Calm down.,1
482,482,27,Auntkaren01,2022-08-19 14:05:59+00:00,141,7,39,12,,"Serious question: When did you first experience racism? I was 5yo walking to kindergarten with my grandma in Brownstown MI, when a white man in a 90s red pickup truck, pulled up to us &amp; called us niggers. My grandma squeezed my hand &amp; pulled me close to her. It haunts me.",0
512,512,0,Tsu_Surf,2022-08-21 22:12:25+00:00,406,32,48,49,,Yo this a WHITE ASS BATTLE 😂😂😂. https://t.co/dl1rXtz05l,0
513,513,1,Eve6,2022-08-21 16:42:07+00:00,549,18,31,3,,i would sit mozart’s white ass down and make him listen to some alternative rock,0
514,514,2,AntiPiker,2022-08-21 19:01:05+00:00,140,1,1,0,,AND UR GONNA SIT UR WHITE ASS DOWN AND LISTEN!!! https://t.co/N9rMIUvbRr,0
520,520,8,crustedtoast,2022-08-21 15:42:48+00:00,236,56,2,0,,"slutty teen eren not-so-subtly flipping his skirt up to flash the hot, dark haired, tattooed stranger in the bread aisle one late night in the grocery store. he spreads his thighs apart and rests his elbows against the shelf, wiggling his ass while inspecting the white bread in–",0
527,527,15,nynesugrls2077,2022-08-21 19:58:14+00:00,371,9,0,0,,@internetslagg @DEATHWORSHIPPED sitting my white ass down and listening,0
529,529,17,Betty_Ass_Me,2022-08-21 18:13:40+00:00,268,5,5,0,,@10stDayDay He still shouldn't look that bad. He aging worse than a white person,2
535,535,23,N76247476Man,2022-08-21 20:15:02+00:00,361,90,47,13,,Well you fuckers bare responsibility for it. You did everything you could to destroy the real president and you dumb fucks ran cover for the nincompoop in the White House. So take your poll and stick it in your ass sideways with habenero hot sauce Chuck Todd.,1
551,551,39,Ron_____33,2022-08-21 14:45:41+00:00,96,0,4,0,,@UTDfavour @UTDTrey Ter stegen is white mendy both ass,0
557,557,45,NicolasEdny,2022-08-21 03:32:49+00:00,232,45,18,6,,"White women liberals are bragging ab switching to the gop so they can vote for liz Cheney. 
They gonna vote for a whole ass Republican before they ever consider voting for the Black woman.
Thats how deep their racism is.
Everything boils down to it:
The preservation of whiteness.",0
566,566,54,themoosef,2022-08-21 22:41:57+00:00,155,20,6,1,,"I wish the writing community knew how often she talks out of her ass. Like, I DO KNOW THAT HER VIDEOS ARE HELPFUL but it is VERY anecdotal, off the cuff, and 90% of the time it's bogged down in publishing's brand of white supremacy. And if you heard about her bts, you know why.",1
570,570,58,mar3uss,2022-08-21 20:58:12+00:00,221,16,0,1,,How the weird ass white men was acting when the joker come out that’s how imma be when I see Jennie on my screen,1
581,581,0,FWNFILMS,2022-08-21 22:00:45+00:00,353,47,0,6,,go white boy go !!!!  https://t.co/q4uvJHgCEf,2
582,582,1,the_meghaning,2022-08-21 22:35:50+00:00,1625,189,47,7,,"""I WILL NOT BE REPLACED"" is trending and if you're a conservative white male, boy do I have some bad news for y'all.",2
587,587,6,wilburisok,2022-08-21 18:17:28+00:00,93,8,4,0,,"i love hasan but every leftist white boy i know repeats everything he says word for word like they’re saying the most revolutionary shit as if women, queer people and poc haven’t been saying it for years 💀",1
588,588,7,veebinladen,2022-08-21 17:12:36+00:00,69,17,6,3,,"too many white people be at burna boys concert, what they even know bout him fr",2
589,589,8,The_Wolf_Mother,2022-08-21 23:47:29+00:00,130,18,13,4,,"@Leon_edwardsmma @attheg8s @USMAN84kg every white boy on #MMA twitter after your win 🇯🇲

https://t.co/kOyuWsmHhN",2
592,592,11,bradharmon_,2022-08-21 18:24:00+00:00,50,0,3,0,,requisite haircut photo feat. the white boy non-smile + subtle salt n pepper https://t.co/zrJfI6Mw63,2
593,593,12,ajamubaraka,2022-08-21 19:30:41+00:00,330,49,6,1,,"You &amp; the White supremacist, Eurocentric liberal/left with your insulting position that non-Europeans who don't embrace your pro-Western line are somehow under the spell of some white boy out of Russia is incredibly backward. And what is sad &amp; funny is you are proud of your work.",2
594,594,13,FreeBlckThought,2022-08-21 23:32:11+00:00,553,100,22,5,,"""My parents homeschooled me &amp; my five sisters in the '90s &amp; early '00s. Their peers called them White. Our peers made fun of us. My parents knew that putting me in public school could have made me another statistic. Today, 75% of Black boys read below grade level."" 
—@JoDaviMusic https://t.co/PGlnB2yViy",2
602,602,21,RWTrollPatrol,2022-08-21 17:47:35+00:00,244,48,18,2,,@EverettStern1 He's now the poster boy for insurrection and white supremacy. https://t.co/CATfTFRauZ,2
604,604,23,AgainstRevisio1,2022-08-21 15:51:30+00:00,483,138,8,3,,"August 21, 1944 in the Warsaw Uprising, a German sniper shot 11-year-old Wojtuś Zalewski ""White Eagle"" 

His body was carried under fire by Mieczysław Mirecki ""Lightning"".

The tombstone placed is symbolic that the boy's body could not be found. https://t.co/JGb00Ag09W",2
606,606,25,hotmessice,2022-08-21 20:02:13+00:00,106,9,1,0,,ok so when niki cried in mcc she was being a baby and it wasnt sexism but NOW it's sexist because it's happening to ur fave white boy?? :(((,2
609,609,28,any_open_eye,2022-08-21 16:05:28+00:00,53,8,1,0,,lrt truly try not to be That Asshole but I’m sitting here like why watch [redacted white boy drama] when you can watch bad buddy,2
610,610,29,Thechallengerd1,2022-08-21 16:09:56+00:00,58,13,0,0,,"I gotta make 3 all white fits for Miami carnival weekend is ridiculous 😒 ..

Burna boy bout to be the best i can already tell",2
619,619,38,FattusPrickus,2022-08-21 15:54:52+00:00,96,2,5,0,,"Both Billy boy teams getting two men sent off in one weekend against the green and white alliance, did anyone have money on it?",2
623,623,42,nescartridges,2022-08-21 23:29:19+00:00,552,40,14,0,,andrew tate getting banned is 9/11 for 14 year old white boys,2
626,626,45,kirkxxs,2022-08-21 19:00:40+00:00,117,15,1,2,,yall don’t know how hard it was being in the teen wolf fandom as a kid and watching people hate scott in favor of stiles as if stiles one personality trait wasn’t just being a mean white boy 😭,2
631,631,50,Feldfrog,2022-08-21 14:59:09+00:00,91,3,0,0,,"I’ll have you know, my father was an epic white boy",2
636,636,55,GoddessTriV,2022-08-21 14:42:06+00:00,1533,15,36,2,,"@ARArman17045246 @literallysofie I'm unsure if you're pointing out that internalized racism is also a problem, or using this as a gotcha. Either way, non-white people can be white supremacists, too. Look at the leader of the Proud Boys being a whole Latin man.",0
639,639,58,WRomancho,2022-08-21 22:36:55+00:00,59,23,4,0,,"@GOPChairwoman The US terrorist problem is not border crossers, it’s domestic terrorists, white supremacists, Proud Boys, Oath Keepers and other insurrectionists. The majority of border crossers are impoverished families seeking work and survival. Republicans have created the bogeyman identity.",0
640,640,59,gartmartin9,2022-08-21 21:39:42+00:00,112,6,1,0,,"@DashDobrofsky No push back from Tapper because he is a fan
boy of all veterans. Especially if they are white.",2
642,642,61,rhiharper,2022-08-21 15:47:44+00:00,54,4,1,0,,"Reading Catcher in the Rye is such a good litmus test to tell whether 1. Do you pay attention to what you’re reading and 2. Do you lack basic compassion.

This is no “white boy wank fantasy of being misunderstood”, he’s a child with adult problems that many… (con)",2
645,645,64,carmmartinezatx,2022-08-21 17:00:30+00:00,189,164,26,14,,"And there you have it folks, Texas has  white supremacists as content advisors for school curricula. Any thoughts on this @GregAbbott_TX ?? oh never mind, Gregory also loves to take pictures with his proud boys buddies. One of the same.
#TexasDeservesBetter 
#BetoforGovernor2022",2
648,648,67,AivaDaily,2022-08-21 20:36:38+00:00,66,19,2,3,,"Adekunle walking around happily with his white trad😭😭😂😂, this boy will make me old soon 😂 #BBNaija https://t.co/5h1ZFBghXD",2
