,Unnamed: 0.1,Unnamed: 0,User,Date Created,Number of Likes,Number of Retweets,Number of Replies,Number of Quotes,Number of Views,Tweet,class
1819,1819,1,microjer,2022-12-20 17:46:06+00:00,183,35,1,4,13861.0,"I’d be selling my stock, too, if I were invested in a company and found out that the CEO’s closest advisors were Kim Dotcom, Billy Markus &amp; Ian Miles Cheong. Get me the fuck outta here lol $TSLA https://t.co/RLjxXBZSy3",1
1821,1821,3,JanM_TrueBlue,2022-12-20 16:35:46+00:00,89,19,2,0,2569.0,"What is that murdering muppet, Kyle Rittenhouse, whining about now?  
Nobody likes me... 
I didn't murder anyone.... 
let me quote the bible to look pious.... 

True, False, Get the fuck outta here.",1
1822,1822,4,lessucrito,2022-12-20 20:55:59+00:00,63,17,3,2,5039.0,tryna guilt trip me for not being there for you when you KNOW i am dealing with so much myself is super gross and unacceptable. fuck outta here. ya make it so easy to cut ya off when ya lack emotional intelligence,1
1824,1824,6,BobDigi69,2022-12-21 00:39:38+00:00,179,22,5,3,,"You fired cavil but look fwd to making movies w 7 bucks

Fuck outta here w that ba",1
1832,1832,14,BobDigi69,2022-12-19 22:51:45+00:00,53,11,3,0,1120.0,"Its not that people are upset at the choices and attitude it's that everyone is toxic instead.

Fuck outta here with that.

Consequences.",1
1833,1833,15,HighFlyLo,2022-12-20 03:18:58+00:00,57,1,1,0,,Fuck outta here https://t.co/1Kfb4EO19P,1
1834,1834,16,Mersh,2022-12-20 06:58:58+00:00,54,8,9,0,2390.0,"Imagine still simping for Republicans. Entire party needs to be destroyed and rebuilt from the ground up. ""Patriots"". Fuck outta here. Half of y'all have a coffee brand or a GoFundMe. The other half are feds. Give it a rest.",1
1843,1843,25,travbryanmusic,2022-12-21 14:29:47+00:00,155,9,4,0,3876.0,@NBA_NewYork Wally..keep talking your shit. They been making fun of the Knicks for decades and thats corny. Fuck outta here.,1
1848,1848,30,AllyMcCormick5,2022-12-21 14:41:02+00:00,81,0,7,0,5132.0,"@Prince_Dmon @MMAFighting @ArmanUfc Gathje I can understand cause hes been so inactive but Dustin? Nah man he lost 2 championship bouts, yes.. but when did he last lose outside of those 2 fights? And you all think he needs to give it up? Get the fuck outta here.. if you want to be number 1 you have to beat number 1",1
1849,1849,31,nathanxromeo,2022-12-21 02:13:52+00:00,465,0,3,0,11454.0,@ddog__1121 @xx_candyflip @ComplexSneakers Me and my main boy taking a selfie. Fuck outta here with your pic of another grown man you weirdo 💀,0
1853,1853,35,Stevenson_Snake,2022-12-21 16:46:33+00:00,326,3,2,0,5661.0,@amorr143 @fauxfresh Dramatic? Homeboys clearly having a panic attack…fuck outta here bro,1
1867,1867,49,defnoodles,2022-12-20 06:03:06+00:00,61,4,3,2,17254.0,"Nah fuck outta here bro, we’re not doing this again. Get Osmosis Jones to take care of this because we’re not doing this again",1
1905,1905,0,liliandaisies,2022-12-21 22:12:58+00:00,1653,499,31,53,94455.0,"In Greece, a woman was sexually abused by her father from the age of 11, and at 19 she was held hostage, raped and trafficked by a police officer. Today, the prosecutor said the men should be found not guilty and what the woman went through was her decision. https://t.co/hMnIGc7vZp",2
1906,1906,1,anneapplebaum,2022-12-21 21:39:17+00:00,18850,1121,186,32,520101.0,"Or you complain because he might ask for more weapons to prevent the children in his country from being deported to Russia, the elderly from having their home destroyed and the women from being raped",2
1907,1907,2,unpackingexmo,2022-12-21 20:52:03+00:00,309,34,20,5,12470.0,"No, I'm not proud of my Mormon heritage. At. All.

My ancestors were white supremacist polygamists who raped teenagers (""underage wives""), massacred American Indians, and didn't believe black people were worthy of the temple or eternal families. 

Not a legacy to be proud of.",2
1908,1908,3,responsiblerob,2022-12-21 18:31:46+00:00,1602,60,8,3,64964.0,this picture in memento is so funny in context. “this is you after you killed the guy that raped your wife! look at how happy you were!” https://t.co/c25If2JRnJ,2
1909,1909,4,RKOTOfficial,2022-12-21 21:30:38+00:00,1424,609,63,39,79045.0,"Seeing the EU leaders meeting up with the Islamic regime’s officials today in Jordan shining a smile with each other whilst children are being raped and killed in the streets of Iran by the regime’s forces is the true image of political hypocrisy and injustice. 
#MahsaAmini https://t.co/NblVEK7BST",2
1910,1910,5,CleggAdrienne,2022-12-21 21:30:02+00:00,83,19,37,5,4589.0,"You can't make this stuff up🤣
A young home invader arrested after calling the police himself to report he was being raped by his victim’s dogs, has filed an $850,000 lawsuit against his victims, alleging physical and psychological trauma. https://t.co/vSRVafoLOH",2
1911,1911,6,KarenRo08012406,2022-12-21 22:23:13+00:00,227,71,14,3,2809.0,"So that's it I guess. We the wo.en of Scotland have lost all.our rights due to a woman hating FM and her SNP. 
Each and everyone of you who vote SNP over our women and young girl's safety should be totally ashamed. 
If you're daughter, sister, mother is raped who's fault?
Yours?",2
1912,1912,7,AndyBuzz72,2022-12-21 23:50:33+00:00,163,12,58,4,5717.0,"The christian god watches children being raped and he does nothing.

Tell me why the christian god justifies inaction ?",2
1915,1915,10,KarenRo08012406,2022-12-21 20:10:19+00:00,168,18,8,0,2578.0,@elliebgomersall I wonder if you will feel that way when a young girl or woman gets raped. Go you!,2
1920,1920,15,Infantry_bucky,2022-12-21 19:56:28+00:00,76,8,14,1,1263.0,"So.. a dude was dating this woman , they broke up , he became a “trans” and then brutally raped / murdered his ex ..
Now people are saying “oh that’s so strange for a woman to do that to another woman” .. a woman ? Well Is it strange for a woman to have a peen? I mean damn y’all",1
1921,1921,16,donnacarino7,2022-12-21 19:55:07+00:00,133,8,4,1,4376.0,"@RoddyQC They must have limited life experiences. Sheltered perhaps in a world where they haven’t been raped &amp;know the consequences &amp; ramifications for everyone surrounding, nor worked in areas to see the huge mental health traumas. They haven’t met rapists #GRC",2
1922,1922,17,jaxs_talks,2022-12-21 19:10:49+00:00,275,11,50,2,5410.0,"@JenniferJJacobs and? People including children in his country are bombed, raped, tortured and killed by Russian invaders. His choice of attire shows that he is in a country at war, and he stands with his soldiers. Seems rather odd to question the way he is dressed.",0
1924,1924,19,FrankDeScushin,2022-12-21 21:16:04+00:00,163,19,5,0,3435.0,"@Klaus_Arminius This French case is reminiscent of Amanda Kijera, the white liberal activist raped by a black man in Haiti who blamed white men in general, but the French case is worse because an actual man’s life was at stake. 

Many woke folk are incapable of holding non-whites accountable. https://t.co/02mvpSxrmR",0
1925,1925,20,tinagwee,2022-12-21 19:06:38+00:00,100,6,5,0,7158.0,"@JackeeeBabyyy About 4 years ago a young woman (abt 17 yrs) was walking home very drunk in Mile end, London &amp; CCTV found that she was SAd possibly raped by 3 men within twenty mins, none where with each other.  All 3 saw her as an opportunity to assault rather than to help.  Its so scary",2
1926,1926,21,RosaZambonini,2022-12-21 19:35:46+00:00,81,20,9,2,7087.0,Remember these are the same Tories that are so concerned about women and girls that they wanted them to prove that they’d been raped if they had a child and needed financial support…..,2
1929,1929,24,wittertalk,2022-12-21 18:05:24+00:00,136,14,5,0,2914.0,@TransMpireSlayr Don’t forget that during “her” trial the woman raped by she/her must refer to the she/her rapist when giving evidence as she/her throughout just in case the feelings of she/her are literally hurt.,2
1930,1930,25,bobeaubreaux,2022-12-21 19:56:22+00:00,77,20,2,5,10666.0,They should of the way he violently raped a woman at a party where witnesses gave statements and LAPD refused to press charges. Kinda where he needs to be.,2
1931,1931,26,Les1004,2022-12-21 20:43:46+00:00,55,11,3,0,842.0,"I am so sick of hearing about markle and wish all these people who are focused on her, would focus more on what matters and that’s the white young girls being raped. I wish they would spend the same amount of time on them than trying to glorify poor markle",2
1936,1936,31,amoderatetake,2022-12-21 20:41:38+00:00,51,2,29,0,2134.0,"@alexbruesewitz Classic blaming the victim. 

“If they didn’t want a successful attack, they should have had more security”

Is the same as

“If didn’t want to be raped, she should have dressed differently.”",2
1938,1938,33,berry__of,2022-12-21 19:08:34+00:00,28,123,0,0,311.0,"Why are women's of the world not being voice for the raped, bombed, massacred, starved, malnourished women's of #Tigray?

We call @UN_Women @UN_Women @NobelWomen @USAmbHRC @UN @USAmbUN @PowerUSAID on this #HumanRightsDay seek #Justice4Tigray &amp; force #EritreaOutOfTigray @bo @hrw https://t.co/bqejZtMpa6",2
1939,1939,34,NormanBrennan,2022-12-21 18:19:15+00:00,632,94,99,13,35341.0,"BREAKING NEWS; A Monster has been sentenced to a FULL Life tariff for the Murder of his Pregnant partner &amp; 3 Children one of whom he also Raped; EVIL BEYOND BELIEF!

Killer behind 'inexplicable' quadruple murder will never be released - Stoke-on-Trent Live https://t.co/LZr7iD0uvF",2
1941,1941,36,Neveroutofwork,2022-12-21 21:14:43+00:00,82,6,1,0,3009.0,"@refiloefifs1 @JackeeeBabyyy Reminded me of I seeing a photo of a young lady at a protest, in dungarees &amp; baggy jumper.

Her sign said something along the lines of:
“THIS IS EXACTLY WHAT I WAS WEARING WHEN I GOT RAPED!”

😔",2
1949,1949,44,BramanTavish,2022-12-21 20:54:56+00:00,55,3,4,0,1524.0,"@CamiLee13 @bennyjohnson Facts! Ukraine is in war, u think being dressed up is on his mind! 🇺🇦 citizens r being raped, murdered, tortured, food shortage, not electric, good water. All for Nothing. Putins selfishness. I respect this 🇺🇦 president. note: Biden backing 🇺🇦 is the only thing he’s done good ✅",2
1963,1963,58,chilternbear11,2022-12-21 20:22:27+00:00,118,13,6,1,2063.0,@JeremyClarkson They found more offence in your joshing than the thousands of white working class girls murdered or raped by the Pakistani rape gangs. The ‘be kind’ mob are selective in their outrages.,2
1965,1965,60,Wisewonders,2022-12-21 22:05:35+00:00,58,8,2,0,479.0,"@josh_hammer And who are you???? Not that it matters, quite obviously you are a cold hearted awful person. Russia soldiers have RAPED women young and OLD, little girls, killed innocent people by tying their hands behind their backs and shooting them, bomb Women and Children’s Hospitals. 1/",2
1967,1967,62,armedwithjello,2022-12-21 23:51:38+00:00,79,12,0,0,2950.0,"@JackeeeBabyyy A BF years ago had an epiphany, that a man's idea of a bad date is being put off and leaving, but a woman has a very real chance of being raped, beaten, or murdered. He said that moment changed his whole view on women's cautious behaviour.",2
1969,1969,64,standmonitor,2022-12-21 19:48:52+00:00,287,70,23,7,8473.0,"Twitter speaks out: @LeahRemini's shaming of sexual assault victims to support rapist Paul Haggis isn't acceptable in Hollywood or anywhere.

Remini testified Haggis, the rapist, was ""the victim."" The jury awarded the real victim—the one Haggis raped—$10 million. @GameShowNetwork https://t.co/XUA3HCuOvY",2
1970,1970,65,joshgerstein,2022-12-21 19:16:40+00:00,516,197,61,21,49792.0,NEW: Trump plans challenge to NY law that allowed E. Jean Carroll to file new suit over claim he raped her in NYC department store dressing room in 1990s. Carroll's lawyers also pressing to release Trump's deposition re rape claim. Story via @erinmdurkin https://t.co/dUzuDwhhYR,2
1975,1975,70,IzzysNplPiercin,2022-12-21 20:29:22+00:00,57,0,1,0,579.0,"Jim starts talking before Olu can ask a question. They stare down at the deck, tension in every line of their body, knife moving so fast it blurs as they spin it over their knuckles

""They raped him.""

Izzy feels the air punch out of his lungs, legs going slack. Jack holds him up",2
1977,1977,72,AdrianCalamel,2022-12-21 23:46:50+00:00,51,34,6,4,1676.0,"This is the body of a dead high school student dumped in the streets by the very regime you believe can be reformed @SecBlinken. 

She was kidnapped, tortured, raped and killed for protesting. 
#IranRevolution https://t.co/0JeZHTZbFJ",2
1978,1978,73,iamacallahan,2022-12-21 21:28:49+00:00,81,1,1,0,3435.0,@JamilahLemieux @BET This is real. I was raped as a teen. I had sympathy for the mothers who begged my mother to drop charges because it would ruin their son’s ability to get out of the hood to go college. I didn’t want to be make their life harder. Fortunately my mom was wiser and chose to defend me,2
1979,1979,74,DarcyWAHF,2022-12-21 23:46:17+00:00,75,19,0,0,882.0,"@agcolehamilton Not one country that has introduced self id is collating evidence on how it impacts women and girls. We know that women in california prisons are given condoms and some have become pregnant,we know that Karen White raped two women in prison in England. You are a disgrace",2
1980,1980,75,WomanFromAfrica,2022-12-21 21:54:00+00:00,143,4,1,1,1074.0,"@Meidas_ZobethC @RealDeanCain Very fortunate it doesn't affect you. Women being raped in prisons; those in refuge's/rape shelters &amp; forced to call their rapist/abuser ""she""; those losing places in sport or bursaries/roles; those needing intimate care or self-excluding from schools/venues - would disagree🤷🏾‍♀️",2
1981,1981,76,politico,2022-12-21 20:00:31+00:00,83,26,21,6,34804.0,"Trump's lawyer plans to challenge the New York law that allowed a woman to file a new suit alleging Trump raped her in the 1990s.

The lawyer will argue the law is unconstitutional, so the case should be tossed. A judge replied: ""I wouldn’t count on that.” https://t.co/QvuoWxIUPe",2
1982,1982,77,GebremeskelGeb,2022-12-21 22:01:21+00:00,21,54,0,1,845.0,"A 16-year-old #Tigrayan girl got gang-raped in #NorthWesternTigray by the invading troops from Eritrea. 

Her dad had been attacked by other 🇪🇷n troops &amp; is now struggling with his life.

He's in a refugee camp &amp; couldn't undergo surgery due to financial hardship. 

@HMcPhersonMP",2
1983,1983,78,DivestSPD,2022-12-21 21:44:36+00:00,64,32,2,2,6039.0,"The Boy Scouts-affiliated Police Explorers program has hundreds of documented cases of sexual abuse, mostly girls. 

This young woman was groomed and raped by several officers since age 13. She wound up dead of an alleged suicide while she was pregnant by one of the officers.",2
1984,1984,79,JinkiesJerrica,2022-12-21 20:56:04+00:00,86,14,4,2,5826.0,"cw // rape

i just watched the Daniel Radcliffe movie, Horns, and that turned out to be a huge mistake

i’m so tired of women being raped and murdered in movies, especially when it’s to advance the plot of a male character 

women deserve better as an audience, and as people https://t.co/uwJfwHLCbg",2
1988,1988,83,shinigami_dak5h,2022-12-21 18:40:46+00:00,87,0,3,0,13845.0,"@chefshomz @sportbible He raped your club with a hattrick and 2 assists child pipe down, everyone knows you're just a Salty Yanited fan. 💀",2
1990,1990,0,aallleeexxxxxx1,2022-12-18 18:28:07+00:00,89,15,4,1,8945.0,i don’t know what the fuck u are talking about and i hope i never figure it out,1
1997,1997,7,someone83920326,2022-12-20 17:46:03+00:00,57,1,1,0,3077.0,@NDIRE15 @BasedAngloZ @rq_99 @emiliallure @FungersTakingLs Ok bro what the fuck r u talking about https://t.co/gQ28GfajAk,1
2013,2013,23,domiiomii,2022-12-20 12:13:31+00:00,300,29,3,0,9056.0,Why r u talking like any of us give a fuck about contradicting the manga Lmfaoooo this isn't the Bible 💀💀💀,1
2025,2025,35,SamRacine9,2022-12-17 22:12:18+00:00,99,0,1,0,623.0,@ChiefPatriot70 @RGIII The fuck u talking about?,1
2026,2026,36,zlivk,2022-12-19 15:32:36+00:00,56,0,2,1,1543.0,@DavidJevn @MicahMipetson @ViralLeaksTV chrisean is a whole ass man the fuck u talking about,1
2029,2029,39,di3tcoladrinker,2022-12-18 14:55:46+00:00,78,3,1,0,562.0,@dablackcorleone @superrjoint I don’t see you talking about or posting about any resources or charities that have to do with sex trafficking. And if u gave a fuck about victims u wouldn’t be on here using them as an excuse to shit talk a celebrity. So please save the bullshit for someone else,1
2032,2032,42,ILilrick,2022-12-20 06:56:46+00:00,110,0,0,0,452.0,@moneymakinnz @thoughtfulbae Da fuck u talking bout ?,1
2069,2069,79,szmyda1,2022-12-18 04:02:16+00:00,54,0,0,0,1259.0,@925__silver @NoEmmeG girl what the fuck is u talking bout https://t.co/aD49ZeHfvi,1
2073,2073,0,MagaForlifeFLA,2022-12-21 18:41:33+00:00,1178,266,91,27,12415.0,To anyone who stands with the Ukraine. Fuck you too https://t.co/97wGKXfe0K,1
2074,2074,1,cuteasstyy,2022-12-21 19:09:59+00:00,317,36,6,10,19778.0,These plugs be too busy for me fuck you mean you in a meeting ????,1
2090,2090,17,Elliotigbe,2022-12-21 13:29:59+00:00,54,14,2,0,2078.0,"People saying “Messi shouldn’t have allowed Dibu to hold that doll mocking Mbape around him, lol The Messi you saw in Qatar does he look like he give a fuck?, he been disrespected too much in the football world even by Mbape at PSG, I don’t think he cares anymore!",2
2099,2099,26,ThreeTheMartian,2022-12-21 14:15:28+00:00,74,4,1,2,7389.0,@KALIYAHSL So y’all don’t look at the person you finna fuck genitals before y’all let it touch you? 🥴🥴 Yeh I’m too old for this app😂,1
2112,2112,39,NayshaLopez,2022-12-21 21:14:09+00:00,129,0,8,0,7480.0,I’ve not used the block option too much but sometimes it’s just useless to go back and forth with some people.  It gets exhausting and I’ve made the mistake of engaging and letting it drain my energy.  Here is to using #blocked and getting you the fuck out my space and energy !,1
2121,2121,48,TouchMyTeapot,2022-12-21 20:43:51+00:00,58,1,2,0,1659.0,"In the transfem community we very clearly have an issue with masculinity and respectfully you guys need to get the fuck over it.

If you can't bring yourself to care about how it hurts transmascs, consider how it hurts transfem(?) butches and mascs too.",1
2124,2124,51,ziggyhaim,2022-12-21 19:12:36+00:00,74,4,0,8,3499.0,my therapist told me to say something kind about myself without thinking too hard and i said “i’m tough as fuck and cut a good promo” and idk if that was what she wanted but it did make me feel a lil better so i encourage you all to WITHOUT THINKING say something nice about you!!,2
2131,2131,58,PLAYYPENN,2022-12-21 09:47:11+00:00,160,3,1,0,4548.0,girl shut the fuck up LMFAOOO you mentioning a whole separate fanbase for another group. you too grown to be acting like that makes sense. 😭😭😭,1
2132,2132,0,fauxfresh,2022-12-19 02:40:38+00:00,68,20,2,4,11895.0,If you subscribed to Twitter blue I fucking hate you,0
2134,2134,2,Newtybot,2022-12-21 07:13:15+00:00,98,14,13,3,2399.0,"""compelling"" ""relatable"" villains: Ohhh 🥺 I was bullied as a child... now I must kiII... 😈

Genuinely cool and awesome villains: I just fucking hate you",1
2136,2136,4,TheyLuvKage,2022-12-19 16:08:03+00:00,61,2,29,0,2127.0,"Yk im so angry right now i could make a thread explaining what went down but- im gonna log off for a lil bit

And if you see this just know i fucking  hate you https://t.co/LTsXMf5WdU",1
2138,2138,6,gwenjamjam,2022-12-19 22:06:24+00:00,52,13,6,3,2274.0,"it's almost 2023 why do harley and joker shippers still exist. You are shipping a known abusive relationship, you're acting like it's all fun and rainbows when in reality Harley is getting abused, time after time.

If you ship them i fucking hate you. https://t.co/MDKGHYrEqP",1
2140,2140,8,SpanishBalde,2022-12-18 17:02:33+00:00,99,3,1,0,4316.0,Fucking hate you Argentina,0
2142,2142,10,d2lyricbot,2022-12-19 10:47:47+00:00,73,15,0,2,2557.0,"dear my friend, how are you?
well, i’m doing fine, as you can see
dear my friend, i’ll be honest with you.
i still fucking hate you.",1
2144,2144,12,izseongmin,2022-12-20 16:58:13+00:00,282,86,1,2,12592.0,before boys planet starts i want every fucking kpop stan to apologize to woonggi for bullying him into hiatus i will never forget and i'll always hate you guys so much for it,1
2145,2145,13,AgentGuz,2022-12-19 06:32:24+00:00,94,17,5,2,8767.0,"I fucking hate you stupid ass bitch ""this is y'all's peak fiction"" never say some stupid ass shit like this again",1
2156,2156,24,THEBANNERNJ,2022-12-21 17:00:15+00:00,65,4,1,1,2126.0,"I cant believe i gotta make this post but if you in anyway support/enjoy this Loli/Shota art stuff immediately stop listening to my band, burn any merch you may own and kindly throw yourself into a fucking chipper shredder. I hate you and want bad things to happen to you.
♥️Joey",2
2166,2166,34,_tinyytin,2022-12-18 05:46:03+00:00,55,8,2,1,1275.0,"“Maybe because you’re hot so you’re used to getting away with things but that doesn’t excuse the fact that you’re a horrible person and I hate fucking hate you more that anyone, do you not see the effect of your actions to others?”

“Oh yeah? You think I’m hot?” https://t.co/Nsv72De89h",1
2178,2178,46,Moonx4real,2022-12-21 11:42:29+00:00,446,3,1,0,4739.0,"@AltroGamingBros @realMax0r ""MAXOR GET THE FUCK OUT OF MY CHAT YOU FUCKING SHIT TALKED NEOPETS AND I HATE YOU FOR IT""

thats what she said..",1
2184,2184,52,keyngpin,2022-12-21 15:42:31+00:00,121,2,0,1,5002.0,@omegamiso @Prof_Keu @AliasREEEEEEEE @tize4PF i fucking hate you dawg https://t.co/JsKCd4Pf8K,0
2198,2198,66,iBDWSSBM,2022-12-19 04:58:08+00:00,284,0,1,0,14370.0,@TSM_Leffen I fucking hate you…,0
2199,2199,67,GNutsofHorror,2022-12-20 09:50:16+00:00,58,0,1,0,3086.0,"Taking offence at one comment, Amanda made when she was 14 when her dad started his affair and split from Amanda's mother.  

And the comment in question ""I hate you and her"" 

Fucking hell she was a 14-year girl witnessing the break up of her family.",1
2207,2207,0,Thom_Hartmann,2022-12-21 01:51:57+00:00,16840,5537,329,655,1505353.0,"1/ Let’s put the House Ways and Means Committee releasing Trump’s tax returns in context. While Spiro Agnew was Richard Nixon’s vice president, he was taking bribes in the White House. Literally. People came to the White House with briefcases full of money for him.",2
2208,2208,1,AngryBlackLady,2022-12-18 13:14:57+00:00,1031,75,28,6,66774.0,I honestly don’t need white dudes telling me what to do. And Post just seems like it’s full of white dudes telling people what to do without the backstop of other people telling them to shut up lol,0
2209,2209,2,GK_arlen,2022-12-18 13:49:24+00:00,489,45,5,2,16523.0,"Engelberg was full of white/red colors and that ofc not thanks to Swiss flags. There are more Polish fans than local Swiss in Engelberg.
Have you heard them singing the Polish anthem at the podium ceremony? Awesome atmosphere. Was almost a home World Cup for the Polish team 🇵🇱",2
2210,2210,3,dariusaniunas,2022-12-19 18:45:08+00:00,418,40,15,4,14902.0,"I hope your day is full of marshmallow clouds. 

White Crest beach, Wellfleet. #capecod #weather https://t.co/qimouGZSmC",2
2211,2211,4,Liubovmeanslove,2022-12-18 09:54:13+00:00,972,120,20,7,10295.0,"Christmas tree in the centre of Kyiv is being decorated - blue, yellow balls and white doves. So simple but yet so full of meanings. https://t.co/1TDl5YXbq3",2
2213,2213,6,townhallcom,2022-12-19 20:14:43+00:00,174,30,48,6,13996.0,KJP is trying to pretend that the White House is full of dedicated free speech activists. https://t.co/m54xuozClI,2
2214,2214,7,Yair_Rosenberg,2022-12-20 02:53:58+00:00,1668,119,34,5,114285.0,"As the tallest person in a room full of tiny Jews, it falls to Biden to personally take the White House Hanukkah party selfie (via @JRabhan): https://t.co/J4Q3vpUfqm",0
2215,2215,8,PeloniMaria,2022-12-19 10:04:31+00:00,140,47,5,3,3000.0,"In a world full of black and sometimes and white....
Only the colour of the Love make the difference... https://t.co/VV1dyk4AyD",2
2216,2216,9,notcapnamerica,2022-12-18 04:35:01+00:00,440,64,61,5,48097.0,So many “Black” and “BBC” searches in states full of racist white people 🤔,0
2217,2217,10,PratiksAngel,2022-12-19 16:28:19+00:00,64,68,0,0,1727.0,"Pristine in white 🤍 and full of gratitude with his signature pose, Mr Sehajpal 🫰🏼🧿

BDAY PAWRI WITH PRATIK 
#PratikSehajpal https://t.co/9T2UA4vMAF",2
2219,2219,12,tj1969t,2022-12-18 12:43:38+00:00,125,38,4,2,1589.0,"Black actors used by a food charity handing hot meals to white families. Ironic virtue signalling given white families are declared to have white privilege, and are required to pay reparations for colonialism. Nothing is real in a woke world full of falsehood and ignorance.",0
2221,2221,14,riverotterr,2022-12-20 22:47:24+00:00,597,17,7,4,11381.0,"@SchicksalAvalon @Azul_Yellow @Rodri7567 1. you don't like her design because you're racist
2. you don't know what a bad design is
3. your account is literally full of horribly designed pasty white characters please https://t.co/9DwaicjJXp",0
2222,2222,15,petersize10,2022-12-17 19:40:55+00:00,78,3,0,0,3021.0,Today was wild. Standing in a blizzard full of the white stuff in front of the colours that commercialise Christmas. https://t.co/0FjjGN53Us,2
2223,2223,16,Nick_Metcalfe,2022-12-18 22:10:30+00:00,149,4,6,1,16377.0,"Neal Foulds, Mark Selby and Mark's daughter Sofia opening Christmas presents full of Jimmy White memorabilia was the festive treat we didn't even realise we needed.

#snooker",2
