,Unnamed: 0.1,Unnamed: 0,User,Date Created,Number of Likes,Number of Retweets,Number of Replies,Number of Quotes,Number of Views,Tweet,class
6522,6522,56,DavidHundeyin,2022-12-21 23:43:48+00:00,150,44,2,0,15927.0,"Africa DOES need to industrialise and move up the value chain from resource exportation - but the way to do that is NOT to run away from hard work, investment and policy decisions by outsourcing industrialisation to rich white guys so you can later expropriate what they build.",2
6529,6529,63,PostcardDepot,2022-12-21 23:13:35+00:00,60,0,0,0,1413.0,"@rynkrynk He brought respect to the White House - and has deservedly earned respect - neither of which Benny Who has or is likely to do. Clothes don't build character, they just keep you warm.",2
6536,6536,70,DarcyWAHF,2022-12-21 23:46:17+00:00,75,19,0,0,882.0,"@agcolehamilton Not one country that has introduced self id is collating evidence on how it impacts women and girls. We know that women in california prisons are given condoms and some have become pregnant,we know that Karen White raped two women in prison in England. You are a disgrace",2
6539,6539,73,TheTruthJackson,2022-12-21 23:44:27+00:00,89,5,226,14,363429.0,"white nationalism is wild. These thugs create their own fiction, and believe in it as if it's a fact. @IamTheImmortal, what you said didn't happen; you didn't even have to voice your ignorant opinion. But I get, it's the white fragility in you.",2
6546,6546,80,Tonya_Song,2022-12-21 23:39:47+00:00,147,19,1,0,1941.0,"It's not letting us as Indigenous ppl tell our own stories, our own experiences, our own perspectives on things both history, views of the future, culture, etc. Instead this is a perpetuation of white storytellers stealing that &amp; giving a skewed view of what they THINK we are.",2
6551,6551,85,Tonya_Song,2022-12-21 23:46:26+00:00,106,14,0,0,2052.0,It is key for us to take this all back. It is key for us to be at the forefront of media that portrays us. It is crucial so that we can end these white supremacist ideas that we are a primitive ppl who need a more advanced one to take care of us. It affects policy against us.,2
6613,6613,0,croffeepot,2022-12-21 21:32:34+00:00,843,94,5,3,12374.0,adore how she looks like shes about to kill someone all the time https://t.co/B4dCDWjcWd,2
6616,6616,3,daddyuuji,2022-12-21 21:08:55+00:00,359,96,7,2,12555.0,"skfs au

When Memi was just starting his acting career, wide-eyed and naive, seasoned actor Satoru told him,

""Never sleep with your co-star. That's a sure-fire way to kill all the sexual tension while you're shooting scenes together and it will like shit on camera.""",0
6620,6620,7,Watermelonie4,2022-12-21 23:28:30+00:00,223,77,3,2,5642.0,"When you team up with the local evil loser to kill the pharaoh and after you brainwash multiple people and threaten the pharaohs life a few times all he's done so far is get one guy(1 guy) hospitalized and it was himself
#yugioh #yugiohfanart https://t.co/UJ7nlzzPOg",2
6622,6622,9,CaesarSZN,2022-12-21 22:39:58+00:00,348,10,8,1,16680.0,"Dashy has grown into my second favorite player of all time. I’m so fkn sad man. Just hope the guys figure it out, and hope Bruce kills it wherever he goes. Way too good not to succeed :(",2
6623,6623,10,NewJeansCharts,2022-12-21 23:03:26+00:00,1258,276,15,36,39237.0,"'Ditto' — 08:00AM KST:
 
#1. MelOn (=)
#1. Genie (+5)
#1. Bugs (=)
#1. Flo (=)

MelOn ULs: 439,450 (+919)

MelOn ULs [1h]: 44,882(+10,939)

Ditto 46th RAK (Real-Time All Kill) 🔥

#NewJeans #뉴진스 @NewJeans_ADOR",2
6630,6630,17,TheInsiderPaper,2022-12-21 23:30:00+00:00,85,38,12,6,11644.0,"US says seizes enough fentanyl to kill all Americans in 2022

https://t.co/4B3XEDg0TE",0
6643,6643,30,KyivPost,2022-12-21 21:25:56+00:00,388,70,33,7,34086.0,"Dear readers, let us all help out @BBCWorld with the headline here:

""Russia's war on Ukraine: Russia not to blame Russia for attacking Ukraine -- Pathological Liar.""

Stop delivering the utterances of people who lie and kill as if they have an air of worthiness to them. https://t.co/oXZcZ25y5t",2
6645,6645,32,mosesibb,2022-12-21 21:45:53+00:00,139,30,10,1,4911.0,$ICP is not Eth killer or any other Chain killer #ICP is here to help them survive and not to kill them👌 lets not put fear into people bags that's why they are fighting us with all they have 🤔 we are here to integrate them and help them survive 👌,2
6650,6650,37,ZaleskiLuke,2022-12-21 21:15:10+00:00,1522,122,66,3,32707.0,@RepMTG Trump’s “defense” is that the insurrection didn’t happen and it was a hoax and Nancy insurrected herself to make him look bad and kill Ashli Babbitt who wasn’t breaking in but that it was all ok because he actually won (he didn’t) and the attackers should be pardoned. Make sense?,2
6654,6654,41,NewJeansCharts,2022-12-21 21:03:23+00:00,495,108,0,3,12854.0,"'Ditto' — 06:00AM KST:
 
#1. MelOn (=)
#1. Genie (=)*
#1. Bugs (=)*
#1. Flo (=)

Ditto 45th RAK (Real-Time All Kill) 🥳

#NewJeans #뉴진스 @NewJeans_ADOR",2
6662,6662,49,Attention_spy,2022-12-21 23:02:10+00:00,63,15,0,0,1507.0,"[📊| @NewJeans_ADOR | Ditto — 12.22.22 | 08:00AM KST 

🍈MelOn Top100: #1 (=)  
🇰🇷 FLo: #1 (=) 
🧞Genie: #1 (🔺⁶)
🐞Bugs: #1 (=) 

MelOn ULs: 439,450 (+919)

— 46th Real-time All Kill 🎉🔥

DITTO RAK
#DITTO_OUTNOW
#NewJeans_Ditto
#NewJeans #뉴진스",2
6690,6690,77,NateRockQuarry,2022-12-21 21:38:42+00:00,79,14,7,1,5798.0,"Just ask a follow up question.
If simply touching fentanyl immediately kills you, why isn't there bodies everywhere? How can the seller move the product? The buyer, doesn't get a chance to use it, he just dies?
It's all fear propaganda to justify the never ending war on drugs.",2
6696,6696,83,RussReallyWins1,2022-12-21 23:50:24+00:00,52,47,7,0,3642.0,"⭐️🏒NHL 5U FREE PLAY🏒⭐️

RT/ Follow @RussReallyWins1

Have destroyed #NHL all season.. let’s continue to kill🔥🔥🔥🔥🔥

#GamblingTwitter #sportsbetting
#bettingtwitter #NHLbets https://t.co/hS3yMCP1dU",2
6703,6703,0,ShitFartCustoms,2022-12-21 22:17:26+00:00,321,31,5,0,9313.0,If you aren’t top 100 you should kill yourself,2
6704,6704,1,ElijahSchaffer,2022-12-21 06:06:17+00:00,729,88,39,3,43884.0,"Routines help you not kill yourself 

No joke 

If you’re feeling depressed 

Find something to do first thing when you wake up and before sleep 

It will create a starting point and anchor at the end 

Practical steps combat psychological warfare

Prayer counters the spiritual",2
6705,6705,2,provii8,2022-12-21 09:07:23+00:00,349,124,30,14,12314.0,"The 10k you gave her, wey be like 5m for your eyes 👀  person dey give her 100k with ease 

No dey impress woman 🙏 no kill yourself o",2
6712,6712,9,obikoyaemmanue1,2022-12-21 08:49:45+00:00,87,18,14,2,3317.0,"Don't kill yourself because of a woman , learn to enjoy your life as much as possible .",2
6713,6713,10,_Shege001,2022-12-21 07:19:43+00:00,82,29,12,1,2148.0,"I know you all are passing through a lot, but please don't go and kill yourself I'm not done with you yet🙏",2
6714,6714,11,Aikoges,2022-12-21 11:51:42+00:00,298,56,7,4,4066.0,“Even if you kill yourself for some people they will still complain that you didn’t die well”🤪,0
6718,6718,15,feralballads,2022-12-20 17:06:52+00:00,55,12,1,3,9688.0,"If I asked you to kill me, would you? / What.. what would I do? I couldn't live without you. / You’d kill yourself too, then?",0
6721,6721,18,iconawrites,2022-12-21 17:12:20+00:00,618,123,4,3,17489.0,Don’t let school tests and the pressure to “gain marketable skills” kill your curiosity. Dare to learn some “useless” facts about trees or toadstools or llamas just to remind yourself that being fascinated about the world is one of life’s greatest joys.,2
6732,6732,29,Ollie_XVX,2022-12-21 16:59:41+00:00,81,4,2,0,1799.0,"Doctor: You need to be on this medication. 

Insurance company: no we only cover the similar medication that kinda works but also gives you diarrhea. Shit your pants or kill yourself whatever you choose we don’t care lmao",0
6745,6745,42,ughramik,2022-12-21 02:23:17+00:00,57,3,3,0,4011.0,"Y'all take alcohol poisoning too lightly, there are less painful ways to kill yourself",2
6749,6749,46,BlueAng82837092,2022-12-21 14:04:41+00:00,74,0,5,0,2664.0,"@friendlybot9002 @poopoomanyt @AzzlackGuhnter @wedoinyourmom @youtube_bad The joke is that trans people are dead. The fact you kill yourself is funny to them, they are happy that you die, this is the opinion the vast majority of the popuiation has of you",2
6758,6758,55,antisocialite0,2022-12-20 22:40:34+00:00,67,0,1,0,2149.0,"@magitek_x @samanthrax @punished_cait Wait til his older coworker jams the copy machine, but keeps feeding the job through to try and make it work. That shit makes you want to kill yourself.",0
6760,6760,57,xskinn,2022-12-21 08:30:24+00:00,276,20,16,1,3487.0,"Now remember it’s the festive season and fine let’s celebrate cause it’s been a big yr,but do not drive under the influence of alcohol or drugs,it’s not on,if you kill or maim someone you’ll never forgive yourself,just get a taxi or Uber,it just makes sense. Merry Christmas🎅Ian",2
6767,6767,64,SKYRIDER4538,2022-12-20 19:23:12+00:00,78,22,2,1,3068.0,A physician that helps you kill yourself after taking an oath to save lives is a fraud.,2
6779,6779,76,Assimalhakeem,2022-12-21 03:46:40+00:00,118,19,0,0,8090.0,Do not debate or argue with them and never defend yourself when they bully you. Just smile and not reply and this would kill them softly and they will feel neglected and stupid and will stop after a while,2
6784,6784,0,Will_Kellogg,2022-12-17 00:03:15+00:00,66,2,1,0,2828.0,sorry but like this fruity little pose……………faggot https://t.co/g3eXFxAErC,0
6787,6787,0,JadeDaGem,2022-12-20 20:22:05+00:00,111,2,8,1,14539.0,are u calling me a nigger too?????? I just looked up “nigga” on your profile and soooooo many tweets popped up so I feel like yes u did,0
6795,6795,0,sxr389,2022-12-21 21:53:59+00:00,974,32,82,54,103248.0,I’m 20 and a guy at work said I should get married soon bc I’m about to expire??😭,2
6796,6796,1,bloodpixiie,2022-12-21 23:19:53+00:00,60,9,20,10,94353.0,talking about meg not being a good person meanwhile this is the man your fav is married to 😭😭😭😭 https://t.co/llbOMY4dP9,2
6797,6797,2,p8stie,2022-12-21 23:02:06+00:00,536,11,22,2,50368.0,It’s low key dangerous to suggest women move to SF . If they’re dumb they’re going to get ran thru by a bunch of weird dorks with money who can’t even get it up because they’re on SARMs. If they’re smart they’re going to get married to some rich guy and their kids are set 4 life,2
6798,6798,3,sweatystartup,2022-12-21 23:33:29+00:00,436,30,45,2,221099.0,"Don’t forget gift limits as the year winds down:

Each person can gift $15k to another person tax free per calendar year.

Example:

As a couple (if you’re married) you can gift $60k total to your parents. $120k if both sets of parents.

Get it done before year end!",2
6799,6799,4,negaversace,2022-12-21 22:33:31+00:00,4712,301,28,64,222796.0,"Every chubby goth woman with a septum ring has been married for ten years to a service sub husband who worships the ground she walks on, meanwhile the trad girlies keep humiliating themselves in hopes of getting attention from men who, uh, know what a femboy is",2
6801,6801,6,smackednat,2022-12-21 21:55:25+00:00,195,32,7,2,11989.0,"The feminine urge to get married, serve my husband, have lots of babies, and love the Lord with all my heart.",2
6802,6802,7,DontHateRah,2022-12-21 22:34:07+00:00,107,23,0,1,26121.0,Me after Jeanie Buss has to sell the Lakers because she married a racist https://t.co/eDfaOF5fwF,2
6803,6803,8,AcEvAne,2022-12-21 22:32:35+00:00,92,1,6,1,5921.0,Also if you’re married to a rich man your Husband is single.,2
6804,6804,9,CalebMPowers,2022-12-21 22:39:40+00:00,415,54,21,7,18039.0,"It is awful that Christians today view the literal sin of fornication as a much lesser problem than ""getting married too young.""

Many parents are condemning their children to sexual sin by discouraging them from even *thinking* about marriage until they have an education/career.",2
6805,6805,10,mmidnitesnak,2022-12-21 21:48:43+00:00,87,4,6,4,4852.0,People that can’t grasp the fact that Karlie being married to Josh doesn’t make her a conservative racist are the same people who think if you eat a watermelon seed it’ll grow in your stomach,2
6807,6807,12,CaitlynBBS,2022-12-21 21:36:00+00:00,56,3,4,1,1993.0,"My mum's BFF is Protestant but is married to a Jew and basically only knows Jews, so she is hosting a Christmas party on the 25th...with a 100% Jewish guest list. My father, a rabbi, is planning to wear reindeer antlers because 'that is what you wear for Christmas'.",2
6808,6808,13,reallyashleyyy_,2022-12-21 22:31:57+00:00,150,4,5,1,17587.0,@AshleyShyMiller Don’t judge her she is hurting. She was married to a cheater who manipulated her and used her. Pray for her with y’all perfect asses smh,1
6812,6812,17,kitgrier,2022-12-21 21:43:11+00:00,183,0,11,0,5659.0,"Name a better duo, I’ll wait

Two years married to bae AKA @DanielleKGrier 🎉 https://t.co/dhPqjzS7Qi",2
6816,6816,21,lunehwx,2022-12-21 21:59:54+00:00,155,16,3,0,3795.0,"I need someone to write something with that trope of secret agents who need to go undercover and pretend to be married, except they're married and need to pretend they hate each other and it's wxxsxn https://t.co/qSmiI1kFnP",2
6822,6822,27,rice_rust_belt,2022-12-21 23:09:22+00:00,65,1,2,0,3641.0,"I think this person is married to NJDOT

Divorce is too kind of a fate.",2
6827,6827,32,CedAuto,2022-12-21 21:34:38+00:00,79,0,1,0,2320.0,@Dee_Katoure @SakazukiStan @Mr_Lane_1990 @bankierrr Nope it’s what our preference is. Ain’t nice fake ass here and there but I’m %100 sure more men are married and committed to natural women across this earth than they are married and committed to the Tupperware women,2
6828,6828,33,richardgoals,2022-12-21 23:11:05+00:00,130,24,2,0,4456.0,"@maitlis It’s simple. We are no longer in safe governmental hands. I’m married to a nurse- it’s not her or the NHS - it’s the Government who’ve brought workers to their knees, Brexit, Lies, Corruption and Falsehoods. I voted Tory until 2017. We must let the scales fall from our eyes",2
6847,6847,52,ladydragonjj,2022-12-21 21:13:29+00:00,92,0,7,0,3238.0,"I was today years old when I learned that Jack Quaid's' parents are Dennis Quaid and Meg Ryan. I was like, proly maybe related to Dennis or that weirdo Randy...but Meg Ryan connection? SHE WAS MARRIED TO DENNIS? THEY HAVE A CHILD? me: dumb bitch juice. https://t.co/72K3Qh6Qlw",1
6855,6855,60,_denisesalcedo,2022-12-21 22:59:20+00:00,100,4,10,0,10890.0,"i feel bad for my husband he married someone dramatic 😂😂 i send him texts like this all time -- meanwhile the man is at work trying to do shit lol 

but fr my tongue hurts now lol 😂😂 https://t.co/js0DMJKT9T",1
6856,6856,61,Bencjacobs,2022-12-21 22:41:21+00:00,69,25,8,1,7646.0,"""Meanwhile, none of Santos’ maternal ancestors 'suggest any closeness to Judaism,' Koifman said. 'All were baptized, married and buried according to Catholic rites and traditions.'"" https://t.co/MylnycJcBe",2
6867,6867,72,Maknificent07,2022-12-21 21:14:23+00:00,54,0,4,0,2186.0,"Older black family when u havent seen em in awhile be like:

U look just like yo (insert one of parents' names)

U still in school?

U married?

U got a gf?

How old u is now?

I remember when u were ""this"" tall

What happened to you and (insert an ex name)?

Lol smd man",2
6876,6876,81,_TechJess,2022-12-21 23:08:01+00:00,78,1,5,0,2822.0,I asked my husband if he wanted to watch lord of the rings with me over winter break and he was like “are you trying to get married again?!” Lmao 😌yes give me another ring https://t.co/I7NGOnHQz1,2
6877,6877,82,GroovesteinLabs,2022-12-21 21:29:31+00:00,286,16,6,0,9107.0,"@pissmarck He may be a biological royal, but he long ago stopped acting like one. He found the vacuous  values of celebrity so much more alluring than nobility that he married a very junior-grade one and then allowed her to corrupt his very heart.",2
6881,6881,86,_ethatsme,2022-12-21 21:58:08+00:00,111,4,3,0,11074.0,"@MaseratiRiq Patti LaBelle. She was once engaged to Otis from the Temptations, but broke it off. Then she married a school teacher. He eventually became her manager. She divorced him 2003.",2
6886,6886,0,bbyllunaa,2022-12-21 03:51:42+00:00,419,58,29,8,43701.0,"Not to be a depressed fag or anything, but in all honesty I feel like I’ll never be good enough.",0
6896,6896,10,jowilliams293,2022-12-21 08:22:17+00:00,450,81,16,3,11048.0,Scotland… where 16 year olds can’t buy a pack of fags but can legally change gender. Ludicrous. Dangerous. Horrific.,0
6901,6901,15,theomotional,2022-12-21 11:20:23+00:00,73,0,3,0,2655.0,@testochunky MEEEE every time i go into queer spaces i get they/them’d and that’s very nice they’re not assuming my gender but im just here with a beard and an earring im just a fag yall,0
6910,6910,24,testochunky,2022-12-21 11:21:38+00:00,55,0,1,0,2071.0,@theomotional yeah it feels like being a trans guy who is a fag (at least at the stage i’m at) is not a gender that translates to some queers and that makes me very sad,0
6912,6912,26,GylesB1,2022-12-21 10:15:37+00:00,109,10,3,1,11470.0,"Ending his year on a high:
""Happy Daze"" by Mark Graham

Take solace in the solstice
It signals longer days
Night begins its slow retreat
Whilst winter works its ways
It’s not that I’m a druid
The robes are not my bag
But I like to mark such moments
With a hand rolled ‘herbal’ fag",0
6917,6917,31,iamSivN,2022-12-21 04:57:45+00:00,84,3,5,0,11542.0,Fag is such a homophobic/hateful word and I’m a size 10 heel you fucking piece of shit!,0
6932,6932,6,COOPERNlCUS,2022-12-19 20:39:34+00:00,60,0,2,0,3135.0,"Came out to my Shiny Gyarados this weekend

He called me a faggot and released himself 😕",0
6937,6937,0,rondeaulivia,2022-12-17 06:29:44+00:00,222,6,43,3,12094.0,My pronouns are coon/coonself,0
6938,6938,1,LorenzoTheCat,2022-12-20 14:06:38+00:00,3615,181,88,20,89260.0,"Maine Coon Alert---my new friend, Sriracha. She lives with @thejoshl and has the most magnificent belly. I'm in love. ❤️ https://t.co/yO0V3oXPsT",2
6939,6939,2,N76247476Man,2022-12-17 16:29:00+00:00,2181,154,587,30,27224.0,"People on here are tough in Dm calling me names like coon, Uncle Tom and so on. Bet if I was in front your face you would be kissing my ass.",0
6940,6940,3,coon_doggie,2022-12-21 17:32:49+00:00,62,6,7,0,1263.0,just my humble opinion: LPRM = perfection ... https://t.co/QlGoDPKN70,2
6941,6941,4,KajolMomento,2022-12-15 14:09:22+00:00,145,40,6,0,,"Harry said: ""..me &amp; my wife we've moved on..!!"" Here's Harry's essay with Senator Chris Coons.... https://t.co/Fe9x0eQv0X",2
6942,6942,5,razzlededazzle,2022-12-15 23:15:53+00:00,61,1,25,1,2712.0,"Had a heart breaking evening.
I was out at a festive evening and came home to find my Maine Coon cat dead.
He was two and a half years old, he was fine earlier, playing, eating etc.
He was not unwell and made no signs of being unwell.",2
6947,6947,10,IWashington,2022-12-18 19:35:13+00:00,122,15,8,3,6305.0,"I’ve been called a Shit Stirrer; a Big Mouth; a Trailblazer; a Maverick; an Uppity Negro; a Line Stepper and a Midnight Gutter Coon by those who’ve never obtained, lost or accomplished anything that I have on my terms. They’re just empty words. Ehh..I identify as a Disruptor now! https://t.co/olh4N5w36L",1
6986,6986,49,TheDUIGuyPlus,2022-12-21 22:38:10+00:00,212,0,30,3,21640.0,"To my surprise, turns out, according to their report, Zinnia is 0% Bengal. Despite the fact that she exhibits all of the Bengal traits: She is active, energetic, and playful. She is primarily a Broadly Western/Ragdoll Polycat with a Maine Coon/British Shorthair kicker. https://t.co/cM1Nq2kpFo",2
7004,7004,67,VTuberCringe,2022-12-18 08:06:23+00:00,55,6,2,1,4387.0,"On the other hand, I've seen people that police language actually be genuinely racist and use racial slurs against people of color that disagreed with them on issues of perceived racism.

My black friend was called ""coon"" by a so-called progressive.

https://t.co/qplqZKlO6k",0
7010,7010,0,somerichgirl1,2022-12-21 22:21:36+00:00,950,206,18,41,46693.0,soon as a nigga ask “ when we gon link “ that’s when i go ghost,1
7011,7011,1,AshleyShyMiller,2022-12-21 20:46:47+00:00,5801,481,20,43,330868.0,"Why Caresha ask Herbo if he cheated on Ari with his current girl and has he cheated on her too? Nigga hit with, “did you know about that baby before October?” Answer the question! https://t.co/9giervm2lq",1
7012,7012,2,somerichgirl1,2022-12-21 11:10:58+00:00,288,66,7,27,22830.0,"don’t ask me for advice , ima tell you give the nigga another chance",0
7015,7015,5,blackgyal711,2022-12-21 03:59:19+00:00,116,6,1,1,10800.0,This nigga is not eating takis at the gym 😂😂😂 finna ask for a couple 🙄,1
7016,7016,6,munnybagshawty,2022-12-19 17:17:31+00:00,78,22,1,2,5924.0,a nigga ask me for battery money ima whoop his ass right there,1
7024,7024,14,TheeTinaSnow__,2022-12-21 04:00:14+00:00,702,78,6,5,32576.0,"@niicole__nicole @__Keionn My dad told me Men don’t bring women through their storms. They get their shit together and then date and if there are storms after marriage, THEN as partners you get thru them together as a team. Otherwise, RUN when a nigga ask you to struggle with them to prove your worth.",1
7026,7026,16,DasTooBad,2022-12-21 19:30:56+00:00,51,19,1,2,4672.0,If I had a dollar for every time a nigga promise to do something for me Ine even ask them for I’d be rich,2
7032,7032,22,KaputBen,2022-12-21 04:15:27+00:00,343,50,14,24,31524.0,"@wewantasiar Ask one of your Onlyfans to buy your son a PS5, and a backpack too. Those niggas will do it",0
7096,7096,0,ARIPBITCH,2022-12-21 21:22:51+00:00,3587,1228,7,128,204433.0,"He ain’t believe i was ignoring niggas, now I’m ignoring him like the rest🤷🏽‍♀️",1
7097,7097,1,unoi_69,2022-12-21 22:04:01+00:00,2783,95,7,1,67129.0,@DailyLoud Going to act like this nigga didn’t do it first? https://t.co/94rUiILzqQ,0
7098,7098,2,Owrldhere,2022-12-21 23:53:07+00:00,1562,92,36,17,916059.0,@upblissed @SamuelLJackson nigga just like me fr! (not really) (don’t check my likes) https://t.co/zez6Ydu9X3,0
7104,7104,8,_kianaoffbelly,2022-12-21 23:01:37+00:00,128,25,5,17,15885.0,you ever see two bitches arguing over a nigga you hit and it didn’t have you riled up like that so you a lil confused on the beef ?,1
7105,7105,9,uanjay23,2022-12-21 21:25:02+00:00,1873,12,1,0,222627.0,@upblissed @SamuelLJackson Nigga was on twitter like this https://t.co/k4zVabYgpX,0
7106,7106,10,Zvbear,2022-12-21 22:15:43+00:00,682,59,14,8,40274.0,"Imagine being an OnlyFans demon that’s been showing ass naked for years… then a nigga like me with a fitted comes out the trenches from nowhere talking shit and gets more impressions and spins than you LMAO, I’d hate me too",0
7108,7108,12,SkubaBaby,2022-12-21 21:13:26+00:00,55,7,7,5,11809.0,Like the hip roll music from the HighSchool parties still top 5 not 5 and every time the freaky niggas started hip rollin takin the hoes I started a fight kuz I kouldnt do it 😭😭 I beat a Nigga so bad at harpos one night,1
7111,7111,15,_kianaoffbelly,2022-12-21 21:57:38+00:00,55,36,1,4,6835.0,"i really don’t give niggas the chance to fuck me over. you literally got one time to be inconsistent, one time to think we just bout to lay up and fuck all the time, one time to go missing all day/hours unaccounted for. like i just don’t do the sneaky weird non communicating shit",1
7112,7112,16,patchfvce,2022-12-21 23:53:55+00:00,114,6,5,0,3454.0,Nigga look like tengen,0
7117,7117,21,7minus1,2022-12-21 23:45:31+00:00,111,0,8,0,4817.0,FUCK! Niggas still trustin niggas that like they own fuckin tweets man https://t.co/4duXdYMGXO,0
7118,7118,22,Cu6ana,2022-12-21 23:13:26+00:00,87,34,2,5,7024.0,- I like when a nigga not scared to show he care even if he gota get a lil crazy 😂,1
7121,7121,25,rokkai_,2022-12-21 21:47:22+00:00,111,7,2,0,5027.0,How do niggas record shit like this n don’t say anything at all?? I woulda been like “DAMN” 😂😂😂😂,1
7125,7125,29,Righteous_bsr,2022-12-21 23:48:00+00:00,79,4,43,7,43592.0,"@raphousetv2 Y he acting like Dolph was a innocent nigga, when he was talking about “hoe gotti” and how he fucked his BM… Dolph knew that shit was on his body… U ain’t suppose to be speaking on a boss nigga BM, &amp; think a nigga ain’t gone hit u with some hot shit…",1
7132,7132,36,Quasarheard,2022-12-21 23:51:07+00:00,65,5,7,2,2560.0,"I legit think we should do another Red Sixth again, Make that nigga like the true ruler of Shugodam and that's where the two reds clash on being the leader of Kingohgers",0
7134,7134,38,PatsOnYaBack,2022-12-21 23:56:44+00:00,296,24,16,1,34941.0,This nigga punch like Thanos,0
7148,7148,52,AsapMAM8A,2022-12-21 21:44:48+00:00,101,0,1,0,2805.0,"@GunCorky @bopperxd @XXL Yea Jimmy cooks sounds like middle of the ocean, you niggas just love saying anything on twitter",0
7181,7181,85,MopsyFlopsyDoo,2022-12-21 23:46:21+00:00,88,6,1,0,1052.0,@blackcatgirlz And when you realize that deku was letting niggas with soccer ball heads make fun of him for being quirkless like bro literally just make a goal,1
7184,7184,0,bblackgoldd,2022-12-17 05:01:13+00:00,71,7,4,7,16803.0,"Unfortunately, “one less lonely nigger” is also a hit in this household
 https://t.co/fo1xNnPgo0",0
7189,7189,0,JadeDaGem,2022-12-20 20:22:05+00:00,111,2,8,1,14539.0,are u calling me a nigger too?????? I just looked up “nigga” on your profile and soooooo many tweets popped up so I feel like yes u did,0
