,Unnamed: 0.1,Unnamed: 0,User,Date Created,Number of Likes,Number of Retweets,Number of Replies,Number of Quotes,Number of Views,Tweet,class
0,0,0,Al__Quraan,2022-12-17 17:28:10+00:00,103538,17261,379,704,3074183.0,"Imagine going to Mecca and Madina with your family, Allahu Akbar. Unmatched satisfaction Wallahi. It has been a wish always. Ya Allah 😭 https://t.co/qyuXt7n4Fl",2
1,1,1,JaipurDialogues,2022-12-15 14:10:30+00:00,4188,1424,29,8,,"Remember MS Dhoni had Indian Army Insignia on his Gloves and the whole World was after him to remove it!

Yesterday, in Morocco vs France the whole stadium and players were shouting Allah Hu Akbar and no one said anything

Thats how big the Propaganda is!",2
3,3,3,TahirTalba,2022-12-18 18:10:39+00:00,224,55,34,9,8347.0,"#TeamMessi Allahu Akbar. Allah ya yi.
CONGRATULATIONS TO THE BEST IN THE WORLD. NO DEBATE!!! https://t.co/al1FxxQCMh",2
4,4,4,AmyMek,2022-12-15 05:56:56+00:00,1083,446,25,13,,"Islamic Brussels

200+ officers are on sick leave to protest the repeated attacks by enrichers after a child (11) stabbed an officer 

A few weeks ago an officer was slaughtered to cries of Allah Akbar by a Muslim on the ""watch list"" who was released by the court the same morning https://t.co/9jHC4Hgxbi",2
5,5,5,ForumStrategic,2022-12-15 11:05:27+00:00,344,47,54,4,,"MAY ALLAH ALMIGHTY HAVE MERCY ON OUR EMEMIES 🐲 ⚡ 🦅 🚀 ⚛ 🇵🇰 

It was a stupid, amateurish &amp; miscalculated move to poke The State of Islamic Republic of Pakistan 🇵🇰

You wanted our attention, you have our attention now, TAKE IT.

ALLAH HU AKBAR, Pakistan Zindabad 🇵🇰 https://t.co/80bKAZjGmG",2
6,6,6,meykubtau,2022-12-19 10:17:56+00:00,391,78,14,0,3034.0,"Imagine we goin' to Mecca and Madina with our family, Allah hu Akbar. ❤️Unmatched satisfaction Wallahi. It has been a wish always InshaAllah Ameen 🥺😭 https://t.co/ZhHptIiItC",2
7,7,7,sub_allah,2022-12-20 21:03:12+00:00,624,87,5,4,13546.0,"Imagine going to Mecca and Madina with your family, Allahu Akbar. Unmatched satisfaction Wallahi. It has been a wish always. 🤲🏼 https://t.co/UFvJUlmbar",2
8,8,8,xoxokeish,2022-12-21 17:35:22+00:00,184,14,4,4,27819.0,BUT IM STILL ALIVE … Allah knows best and gives the toughest battles to his strongest soldier!! I’ve opened and realized I need to get closer to my god 🙌🏼 ALLAHU AKBAR ALHAMDULILLAH!! 🤲 https://t.co/GU5I3jS84w,2
15,15,15,thepowerofpak,2022-12-17 19:04:43+00:00,217,24,3,0,2893.0,"Imagine going to Mecca and Madina with your family, Allahu Akbar. Unmatched satisfaction Wallahi. It has been a wish always. Ya Allah 😭 https://t.co/EGyHjivg0z",2
16,16,16,DialoguePak,2022-12-16 10:28:17+00:00,104,12,5,0,20301.0,"Bushra Iqbal, former wife of Dr Aamir Liaquat Hussain (late) posted a tweet that said, ""Allah Hu Akbar (Allah is great)"" 

#DialoguePakistan #BushraIqbal #DaniaShah #AamirLiaquatHussain #FIA #Arrest #Wife https://t.co/To7pHarAxa",2
23,23,23,Matthew95929557,2022-12-20 02:37:51+00:00,116,5,2,0,1493.0,@boogerjuice_irl @MortalAlvah Bro doesn’t have a issue with “ I kill everyone allah Akbar!!!!” But “I love jesus” makes him want to tear his ears off LOL,2
26,26,26,JamshaidBM,2022-12-19 06:59:49+00:00,1393,120,18,2,73703.0,"Imagine going to Makkah and Madina with your family, Allahu Akbar. Unmatched satisfaction Wallahi. It has been a wish always. Ya Allah !! 

#PakistanStandsWithBBZ security #FIFAWorldCup2022Final Pervaiz Elahi Imran Khan #لیکر_رہیں_گے_آزادی https://t.co/FeGhhocjt5",2
30,30,30,Abdiaziz_M_Omar,2022-12-18 10:06:09+00:00,67,5,0,0,1244.0,"Imagine going to Mecca and Madina with your family, Allahu Akbar. Unmatched satisfaction Wallahi. It has been a wish always. Ya Allah 🥲🤲 https://t.co/aMgyM1j8Yb",2
92,92,0,UltraDane,2022-12-21 18:27:43+00:00,853,485,362,127,45843.0,White Supremacy is so bad it gives Blacks Alzheimer's... according to Rachel Levine. https://t.co/KXs5BCXtRX,2
94,94,2,mikawilson777,2022-12-21 18:34:02+00:00,1098,104,48,5,19233.0,"@Toure Meghan is hated for the same reason that black military officers and wealthy blacks were the number one lynching targets in the past: she reached above her station, and must be punished as an example to the other “uppity ones“!😒 https://t.co/cUA8tn8U6d",2
95,95,3,KanarioRey,2022-12-21 20:27:37+00:00,173,31,1,2,8597.0,#lucemond In a world where the Blacks win the war for the throne and Aemond has to face a punishment worse than death. https://t.co/wpFFaXewYa,2
101,101,9,1BlackManSpeaks,2022-12-21 18:38:19+00:00,56,6,0,0,1193.0,"@SilentCalm19 @tariqnasheed @nasescobar316 @Marcel4Congress There would be nothing for you to come here for. Blacks we’re among the Founders of Los Angeles. Afro Latino Pio pico. You would still be worshiping the King of Spain if not for Afro Mexicans.

Your Welcome https://t.co/ufbDNJB0NS",2
106,106,14,Stilltobz,2022-12-21 18:50:20+00:00,164,8,2,1,24047.0,@realone992 @raphousetv2 On god. Jail make cribs and bloods unite and realise they blacks first before those silly colours,2
110,110,18,Thislilbirdies1,2022-12-21 20:07:04+00:00,91,9,6,1,1312.0,@SammyMarkleReal @TheWantonWench @GBNEWS @danwootton Well deserved.  Well played. She hated it there anyways. She hates blacks. It’s just a game to her to play that card in my opinion. Her IMBD card- white.  Only since suits did she pull out the black playbook card. She’s a hustler and everyone know it.,0
112,112,20,SenatorCardin,2022-12-21 19:58:26+00:00,70,9,2,1,5162.0,"Two men. Both Marylanders. Both SCOTUS Justices. But Justice Roger Brooke Taney authored 1 of the worst decisions in SCOTUS history, perpetuating the myth that Blacks were inferior &amp; couldn’t be citizens, while Justice Thurgood Marshall was a beacon of hope for racial equality. https://t.co/8naa6JDzRW",2
114,114,22,Engolotshe_B10,2022-12-21 18:23:25+00:00,62,1,24,0,3286.0,@PrinceNtuli7 Do you think whites love blacks?,0
124,124,32,hammerslond,2022-12-21 18:54:33+00:00,130,1,0,0,4890.0,@NaeSimon Non blacks need not apply.   No racism here 😂,2
129,129,37,TexwellTheWiz,2022-12-21 19:20:43+00:00,74,19,1,0,548.0,@Wallstreet504 Stop 🛑. Blacks being irresponsible with money is a trope the needs to die. As a whole are actually the most frugal ethnicity. We must be by necessity. Only a tiny slice of our income goes to discretionary spending. https://t.co/eWV7c4pDjN,2
130,130,38,Matash_SA,2022-12-21 19:29:26+00:00,87,12,7,3,27429.0,"Messi aside, everything about Argentina, it's people and their history towards blacks is horrendous.",2
135,135,43,vesperzys,2022-12-21 21:46:36+00:00,50,6,7,65,59969.0,"@motheralicent Alicent is just supposed to see the Blacks take the iron throne, Dragonstone, Driftmark, probably all of the priviliges, the best positions in court and marriage pacts for them and she and her children get nothing? Screw that.",2
136,136,44,CentralReserva9,2022-12-21 21:22:38+00:00,66,3,1,0,575.0,@Femi_Sorry @nimayndolo From the unemployable grifter who's never paid a penny in National Insurance who bragged on Twitter about his family jumping the queue for covid vacs as Blacks,2
137,137,45,Gamuroger,2022-12-21 20:08:36+00:00,87,19,9,0,3829.0,@Newzroom405 ALLEGEDLY the NPA must go to the courts and argue their case. I said it that the NPA is a political party. Where is Batohi?But racists and clever blacks will disagree. Hope you understand,2
139,139,47,martyrmade,2022-12-21 21:22:03+00:00,227,29,17,2,111160.0,"New MartyrMade Substack essay (audio version soon to follow): Before There Was Kanye: Blacks &amp; Jews (pt. 1 of 2) 
https://t.co/HoaLQDNZ2j",0
155,155,63,GullahSc,2022-12-21 23:32:45+00:00,135,25,2,0,2574.0,"When she was a child, Miss Deas moved to Charleston with her father, where she was able to go to and graduate from high school. (At the time, she says the school for Blacks in McClennenville only went to the eighth grade.) She went on to train as a welder.",2
181,181,89,HiRezTheRapper,2022-12-21 22:14:37+00:00,99,4,12,0,3784.0,@alieyzer oh shit all the russian citizens are terrorists? All blacks are criminals? All muslims are terrorists? All jews run the world? Damn didn't know you felt that way!,0
186,186,0,NoEmmeG,2022-12-20 13:25:41+00:00,2686,283,847,27,384626.0,u called me a nigger???,0
188,188,2,JadeDaGem,2022-12-20 20:22:05+00:00,111,2,8,1,14539.0,are u calling me a nigger too?????? I just looked up “nigga” on your profile and soooooo many tweets popped up so I feel like yes u did,0
192,192,0,K8Willson,2022-12-21 21:51:32+00:00,81,58,9,1,3525.0,Your dirty little secret is out 😁 Also we’ll be keeping the gold ✨ and your future crypto is dead already #CBDC Now kindly F all the way off and take your #trash with you #fed https://t.co/j4ZJJvtiig,2
193,193,1,VicVijayakumar,2022-12-21 17:29:14+00:00,1440,69,43,14,172627.0,As a frontend developer joining this 50K person Twitter Space call from my phone I’m confused why Twitter has more than 20 employees. What is even so complex? Can’t you just trash everything and rewrite it in a weekend with React? I saw a guy do it on YouTube.,2
195,195,3,_Cells4Me,2022-12-21 21:37:24+00:00,1591,30,37,8,109321.0,"@TheNBACentral I love my Grizzlies, but us and the Suns be talking the most trash to not have accomplished anything.  Let's make a final appearance before saying can't nobody in the West mess with obviously, because obviously that hasn't been the case.",2
201,201,9,Admone7,2022-12-21 19:29:50+00:00,64,26,2,1,693.0,The GOP had better do something about the criminal J6 witch hunters. Stop being wimps and Help Trump fight those goons!  Or GOP leaders will be next once they get away with their hate-fest travesty of Justice!  And the GOP will be relegated to the trash heap of history.,2
204,204,12,Retro53978853,2022-12-21 18:34:52+00:00,51,10,4,0,1321.0,"Hello everyone, just a reminder, with so many new releases coming out, please remember to pick up your trash!! It makes movie theater employees lives so much easier!! If you don't pick up your trash, at least have some decency and don't hide it under your seats 🧵 https://t.co/wgcJwntTzy",2
205,205,13,FrankiePaul64,2022-12-21 18:46:52+00:00,54,3,6,0,1935.0,"Won this Marvel Team-Up lot. 18 books (3 were trash. See reply. 
15 were decent though. 1st 2 pics are 8.0-9.0. Second 2 pics are 6.0-7.5 range. Seller was a little sketchy with info, but I did ok. Crossing the midway point of completing the series. https://t.co/XK1hDBR6Nf",2
206,206,14,bruno_KUg,2022-12-21 19:38:05+00:00,69,10,5,0,2423.0,"You are busy friend zoning good men because they don't have big bank accounts but when the men with big bank accounts hurt you, then you start saying ""men are trash""",2
213,213,21,kassbird,2022-12-21 19:29:11+00:00,125,0,2,0,2652.0,"@jdesmondharris When I was in high school, my dad decided that Gilmore Girls was his favorite tv show, and would watch it with me. Clearly he just anted ti hang out. When I left for college, we’d talk on the phone about the most recent episode and Rory’s trash boyfriends.",2
218,218,26,lenubienne,2022-12-21 22:07:35+00:00,83,16,1,1,4877.0,"Cardi sued a blogger so hard, she fled to an unnamed location in Africa. The trash bloggers are going to have to move to space after Meg is done with them.",2
224,224,32,OutlawSilverado,2022-12-21 18:27:54+00:00,134,3,5,0,5171.0,"@CallofDuty The leveling system is so TRASH, bring back the 10 prestiges with exclusive prestige icons and then Prestige master after prestige 10 then have prestige master go to lvl 1000 with exclusive calling cards and emblems to show off ur grind and dedication to the game! Black ops 🐐",2
236,236,44,HuskerlandBlog,2022-12-21 20:23:48+00:00,83,0,7,0,4146.0,"@CUBarstool As a Nebraska fan, I must say this trash talk from JP is completely unnecessary.

You literally have recruits posing with purses, nothing more needs to be said!",2
241,241,49,DrSpEdinNV,2022-12-21 22:44:48+00:00,160,11,4,0,3823.0,"@YNB I thought I knew about the royal family, but I did not know the depth of the deal with the press, that they basically sell out lower ranked family members to tank stories about senior family. I’m glad Harry is putting this all out there. It’s trash.",2
251,251,59,Lindquist4444,2022-12-21 22:46:12+00:00,60,8,6,0,973.0,"I'm very happy and surprised that Vivo got so much good feedback ihj😭❤️❤️❤️ 
They are originally built from a super old TV Vox found in the trash, they'll get more colorful with age 🥰❤️ right now it's baby 
Loves cuddles, LOVES them 
Their little feet are very quick! https://t.co/rKptBWWnd2",2
253,253,61,HunterHodies,2022-12-21 15:36:02+00:00,136,6,5,0,9581.0,"Alexis Lafreniere literally ripped Marcus Pettersson's helmet off back in May which led to Mika Zibanejad's goal with 5 minutes left in Game 7. 

Get the hell out of here with this trash.",2
258,258,66,TheEliteOne333,2022-12-21 19:51:25+00:00,56,1,0,0,1015.0,@KwnStorm @Quitcherbichen A fucking frog could come up with better than that trash,0
265,265,73,goldbelly,2022-12-21 21:47:44+00:00,112,20,13,5,58057.0,"Trash Can Nachos… but make it Christmas! From Flavortown to your door, these off-the-hook nachos are loaded up with cannoli chips and a whole slew of toppings. Tap the Link to roll out with @GuyFieri!

https://t.co/gWDvxpzR3k https://t.co/j37H8xeQ3S",2
272,272,80,skolsquadron,2022-12-21 21:48:36+00:00,247,0,4,0,2799.0,@SmokeyJoe215 @hustinjerbert @Robtush @CJE_NFL I will come there and say what I want. Philly trash gonna just deal with it.,2
280,280,88,yeezy55,2022-12-21 20:29:49+00:00,95,2,1,0,2959.0,@KimKardashian She’s like 42 with 4 kids she needs to grow up.  These thirst traps are so trash,2
286,286,0,lowkeyalbert,2022-12-21 19:28:05+00:00,30894,7802,79,1007,1607157.0,get u a dude who loves u even tho ur a fuckin brat,1
287,287,1,http_woodz,2022-12-21 14:49:32+00:00,92,17,0,1,3267.0,luizy you don’t know who u fuckin' with https://t.co/fQq4GqputF,1
288,288,2,noreaIangels,2022-12-21 14:37:48+00:00,15736,247,11,8,199629.0,@LottieMoss girl we don’t fuckin know u!,1
289,289,3,Gluvvvvvv,2022-12-20 18:50:18+00:00,387,183,1,39,50530.0,ik ian posed to laugh at ppl addiction but how u addicted to a fuckin vape lmaoooooooooooooooooooooooooooooooooooooooooooooooo,2
290,290,4,bydecki,2022-12-21 08:33:20+00:00,159,32,1,1,11265.0,FUCKIN THESE HOES MEANT TOO DAMN MUCH TO U,1
292,292,6,alicentology,2022-12-21 23:18:55+00:00,172,20,0,6,6066.0,damn can u guys just stand next to each other for five fuckin seconds while I get the camera out!!!! https://t.co/hsV8zEAW5R,1
293,293,7,UnniBad,2022-12-21 14:14:14+00:00,94,18,10,0,7148.0,"“Like what u see Master?”
LOOK AT THIS BEAUTIFUL SKEB by @/mitarashi1018  
SO FUCKIN PRECIOUS #shota https://t.co/OoGNK5qaHH",2
294,294,8,luv3flow3rs,2022-12-21 04:50:03+00:00,60,9,0,1,906.0,r u tryna seduce me? BECAUSE I WANT YOU TO FUCKIN SEDUCE ME!!!!!!!!!!! https://t.co/KF5SrEhHux,2
297,297,11,damnitsjocelyn,2022-12-20 17:27:18+00:00,52,9,2,4,10897.0,men r fuckin insane lmfao…wdym u still think ab me when u HAVE A WHOLE ASS WIFE,1
298,298,12,niloveuu,2022-12-21 05:56:40+00:00,166,5,5,0,2511.0,do u guys fuckin remember when ryusei debuted and TRtwt lost its absolute shit over him,1
299,299,13,T2T_KB2,2022-12-20 20:55:46+00:00,184,10,16,7,13382.0,"What if i told u theres gonna be some big news for esd and the portal...but we havent heard about it bc ITS NONE OF OUR FUCKIN BUSINESS. You a fan, stay in ya place n enjoy the show. 

#GoGators",1
304,304,18,GL1TTERBNUUY,2022-12-21 02:44:38+00:00,77,23,1,0,1490.0,"MERRY CHRISMIS EVERYOAN!!!!!!1!!!!!111!!

Take my fuckin DnB christmas art while I smo- I MEAN, I work for my aunt job :]

u know what is Dave cooking, u dont know what is Dave cooking (:

#daveandbambi #vsdaveandbambi #vsdave https://t.co/2oLVgeB49u",2
325,325,39,Wolin805,2022-12-20 05:36:33+00:00,366,3,2,0,4394.0,@notsh4y @b3anqueen “Yall that got cancer yall just gonna stay in the hospital?? What if u have kids to provide for??” If it was that easy to overcome depression it wouldnt be a fuckin problem now would it💀,1
329,329,43,joshuaIover,2022-12-21 10:00:03+00:00,89,21,3,12,10382.0,"idk who needs to hear this but you do not need to defend the fuckin million+ dollar companies in kpop just bc idols u like are under them. it's okay to be critical especially of companies that basically own their idols, being critical is the only way these companies will get any",2
334,334,48,ofcourseuwont,2022-12-21 22:45:13+00:00,118,0,0,0,6465.0,@killmesIime u know fuckin game,1
339,339,53,DreTha_Truth,2022-12-20 20:05:21+00:00,138,0,1,0,4809.0,"@excusemyextraz U didn’t, u just talked about fuckin the next nigga after 🤣",0
345,345,59,JadeDaGem,2022-12-20 22:28:56+00:00,80,2,1,0,9607.0,“okay she called u a bald headed scallywag monkey but why are u posting ur hair? ur a disgrace to black women everywhere” like be so fuckin fr rn 😂😂😂😂😂😂😂😂,0
356,356,70,crxpford,2022-12-21 17:17:40+00:00,114,0,0,1,3504.0,nah they really fuckin it up did u see them in syc 😭,1
373,373,2,JadeDaGem,2022-12-20 20:22:05+00:00,111,2,8,1,14539.0,are u calling me a nigger too?????? I just looked up “nigga” on your profile and soooooo many tweets popped up so I feel like yes u did,0
374,374,0,1Nicdar,2022-12-21 21:06:23+00:00,287,225,15,4,8610.0,"🚨White Privilege My Ass!

👎💯😡😡😡 https://t.co/VoeqlzrSBX",0
375,375,1,bad_dominicana,2022-12-21 15:59:24+00:00,52,9,2,1,8683.0,ice spice is a classic jabá. lmfaooo thats what that is. not white ass bad b*nny. 🙄,1
376,376,2,Mudaship39,2022-12-21 20:33:06+00:00,210,27,1,2,12104.0,So avatar way of water also has Navi with indigenous pasifika facial tattoos… Have a lot to say about this white savior ass movie,1
377,377,3,Sillysalesmanyo,2022-12-21 04:35:37+00:00,77,1,8,1,4408.0,Be honest y’all would a 12 ft Na’vi woman date my white ass? https://t.co/E5UbvLx7RR,0
380,380,6,RegimeChangeInc,2022-12-21 19:42:15+00:00,231,45,14,2,23481.0,Some Americans are whining that President Zelenskyy didn’t wear a suit to the White House. Yeah? Check out this photo. General Sherman didn’t even comb his hair to kick the South’s ass. Grow up and get over it. https://t.co/a4gZhaohSP,2
385,385,11,ItBeLikeThatCuh,2022-12-21 12:50:21+00:00,533,0,8,0,13449.0,@SourdeathSam @KurtzTeddy @nyknicks I’ve said it once and I’ll say it again. Those are some regular ass white chicks. Aint shit bad about them,1
390,390,16,thedandangler,2022-12-21 17:39:21+00:00,197,2,6,0,74638.0,I really need a good ass white wig. Like really good human hair wig. And someone to fit it and pluck it. Is there a service out there? Lol or do salons do it?,0
393,393,19,chainedking305,2022-12-21 21:46:59+00:00,1198,15,8,0,54085.0,@__nkulehh @SixBrownChicks Hell the outcome was right with this white parent. The way she snatched him best believe his grown ass about to get the belt 🤣,0
429,429,55,NatalieAng_99,2022-12-21 05:56:01+00:00,53,13,0,0,3477.0,Lmao they are so annoying anytime I see a white person with this stupid ass sign I make sure to let them know I am judging them up and down. Y’all come to our country bc it’s “cheap” and “interesting” yet want us to fund your travels to view us like vermin. Kepalahotakkau,0
454,454,0,AudioOpera,2022-12-21 23:27:22+00:00,86,5,0,0,4982.0,White boy speaks perfect English https://t.co/zMAxb0sond,2
455,455,1,tencityhana,2022-12-21 23:23:54+00:00,213,28,3,6,10055.0,DO NOT LET THE WHITE BOY DISTRACT YOU!!! IT'S ACTUALLY REALLY FUCKING GOOD!!! https://t.co/YJjYDqQdcC,1
461,461,7,superiorsantina,2022-12-21 22:41:33+00:00,58,5,1,0,5959.0,"that white boy doing those ""white ppl vs black ppl be like"" tiktoks is just more proof that history is doomed to repeat 2013 vine humor",0
465,465,11,Brieyonce,2022-12-21 13:10:47+00:00,59,11,2,2,5105.0,I seen you nig nogs defending that white boy doing those white people vs Black people skits and idc I haven’t cracked one smile,0
466,466,12,Jittt904,2022-12-21 17:35:29+00:00,56,0,3,0,1740.0,@Jim_Malmstrom @PolitiCat14 @BabzOnTheMic Your a privileged white boy from New Jersey sit this one out buddy https://t.co/kr0DlPKDOw,2
472,472,18,on_da_spectrum,2022-12-21 23:58:19+00:00,146,7,5,0,5700.0,the government will not allow me to become a doctor because it is afraid of what would happen if they allowed a soulful white boy with an air of mystery about him to deliver compassionate but thorough medical care to its most at-risk citizens,2
474,474,20,riffygriff,2022-12-21 16:57:30+00:00,168,5,5,0,3955.0,"someone just called me a ""big pawed null white boy""",2
475,475,21,LakotaMan1,2022-12-21 22:45:53+00:00,3187,152,43,4,20054.0,@bennyjohnson Calm down Benny. Don’t get your panties in a bunch. He’s fresh off the battlefield you whiny little white boy.,2
476,476,22,avishaiw,2022-12-21 16:56:36+00:00,225,37,3,1,20635.0,"Normal folks when they see Spider in AVATAR 2:
“Funny little goober, lil dude, feisty friend, fire extinguisher rocks, how do we feel about white boy locs”

VFX folks when they see Spider in AVATAR 2:
“What IS that what the FUCK IS THAT how the FUCK DID THEY DO THAT”",0
483,483,29,OmarHolmon,2022-12-21 22:16:16+00:00,104,7,1,0,3395.0,"Sheila: So, it's my first day at school and this older white boy is messin with me. After school, I see Scott standing over him shouting and pointing at me "" Yall mess with my sis, then you messing with me""

Scott: ...The white on white violence went up a lot when I was enrolled. https://t.co/VMsUruFDsf",0
484,484,30,gumby4christ,2022-12-21 23:46:22+00:00,250,52,8,5,19566.0,"Oh hey what's this? Crypto-shilling alleged pedophile Brock Pierce, who was accused in a lawsuit of raping and drugging a teenage boy, chilling at the White House with AG Merrick Garland. https://t.co/JNGVyLK5GN https://t.co/hzm6nNQGIK",2
485,485,31,YessicaYesOrNo,2022-12-21 23:37:11+00:00,107,62,0,3,8020.0,To be clear these white people went to Uganda to do child trafficking and to torture a 10 year old disabled Ugandan boy for two years. Hopefully these charges are a warning for other sadistic white people looking to torture disabled African children.,0
486,486,32,cantonacj,2022-12-21 20:04:40+00:00,50,0,1,0,959.0,@jiggabiggaa @TrapDaddyKun1 @_nnnoj @Arkele_ nah white boy right. no reason i should overpay because someone look like me😭,0
488,488,34,anditjuicytoo,2022-12-21 18:58:27+00:00,410,7,1,0,25176.0,"@glowyruby Battle of the favorite white boys, I’m backing Tom https://t.co/DpupZGgTGe",2
497,497,43,lucky24524,2022-12-21 18:42:47+00:00,86,2,9,2,7339.0,"@whitenigerian Guy i like you for one thing, despite your skin color, you still show more love to this great country naija than some of us. I salute you and wish one day you'll be the first white boy to be in the national assembly, so they'll know that true patriotism is not by color.",2
518,518,64,rachelweinerwp,2022-12-21 19:18:18+00:00,67,18,3,0,3300.0,"Tough going seating jury for Proud Boys trial. So far today, potential jurors included a former law partner of U.S. Attorney Graves and a woman who says the group ""brings to mind White supremacy and violence"" (Both dismissed, the latter after a long debate over hats in court)",2
520,520,66,citrusymikan,2022-12-21 13:52:50+00:00,62,0,1,0,3446.0,THE WORST PART WAS me being like “I don’t wanna sit with this kid he has lice you can tell he has lice by all of the scratching he does” WAS SEEN AS BEING DISCRIMINATORY!!! THEY WERE LIKE “don’t judge a book 😌” HE WAS A LITTLE WHITE BOY AND ALSO HE DID HAVE LICE SO,2
529,529,75,peabojmusic1,2022-12-21 15:50:09+00:00,155,0,1,0,48994.0,"@Top5Fights White boy made things worse when he  hit him with the little not pad, that really pissed him off.",2
535,535,0,PrinceNtuli7,2022-12-21 17:41:42+00:00,491,42,369,56,55566.0,"According to the EFF, every white person is a racist 🙄",0
536,536,1,DavidDa54355054,2022-12-21 18:51:31+00:00,108,24,11,3,2242.0,As a white person i find this disgusting and want this woman cancelled. https://t.co/gGtlqdScYJ,2
537,537,2,gggrlck,2022-12-21 20:44:02+00:00,93,15,1,0,7882.0,This plays in my head everytime i see a white person tweet like this now https://t.co/WJqcyq6ykF,2
538,538,3,novamutualaid,2022-12-21 16:52:11+00:00,108,118,32,4,6322.0,"here’s todays #HappyHolidays2022 thread i’m burned out and am not receiving any help so i’d like everyone to post their own asks in the thread today 

if you’re a monied white person this is the place to distribute your disposable income thank you &lt;3 https://t.co/cqb5KFovVg",2
539,539,4,edna_days,2022-12-21 22:09:51+00:00,165,7,3,1,25180.0,What about this type of white person https://t.co/0x49lVFklY,2
541,541,6,showmetheyamz,2022-12-21 23:45:05+00:00,184,14,6,2,18479.0,anyone else ever in the middle of doing something totally normal and have a visceral flashback of some racist comment a white person confidently and casually made to you in high school,2
542,542,7,DrEricDing,2022-12-21 20:01:37+00:00,6192,1383,719,110,638525.0,"What a difference 3 years makes. One man is now @TIME magazine Person of the Year and back in the White House. Other man now grifts NFT trading cards. 

Video by @atrupar 
https://t.co/KZB6GB393n",2
543,543,8,SaveWildBees,2022-12-21 15:33:15+00:00,3233,719,13,13,91853.0,"As a brown person who has had scarlet fever (that was misdiagnosed for days by my white doctor), let me tell you the rash is not ""bright red"" for everyone. Educators and Public Health folks need to use proper information/language so BIPOC can screen properly.",2
548,548,13,Goldxn_Violin,2022-12-21 17:28:15+00:00,97,1,7,0,2236.0,"A WHITE person just told me to go back to where I came from 
I AM ALSO WHITE",0
