,Unnamed: 0.1,Unnamed: 0,User,Date Created,Number of Likes,Number of Retweets,Number of Replies,Number of Quotes,Number of Views,Tweet,class
4901,4901,26,AndyKindler,2023-02-21 23:09:17+00:00,71,6,8,1,5739.0,"Joe Rogan celebrates Ron’s “Don’t Say Gay” law and his racist rejection of history. Why? Because Rogan is a racist who doesn’t understand why white people can’t say the n word, and why people don’t all agree that Jews are money hungry. Thanks ⁦@Spotify⁩! You’re MAGAriffic! https://t.co/oK8IS63hHx",0
4908,4908,33,readrovers,2023-02-21 22:10:19+00:00,102,3,0,0,2854.0,"Eight unbeaten in all competitions. 🇼
4th in the division. 4️⃣
Four clean-sheets in eight. ⛔
Dolan delights despite no Dack or Díaz. 🤸‍♂️

💙 JDT's Blue &amp; White Army! 🤍

#Rovers 🌹⚽🇩🇰",2
4910,4910,35,Shalalashanta,2023-02-21 23:43:04+00:00,145,8,18,3,7108.0,"Being a person of color can be tough what with all the systems of oppression in place, but I do love the little boost I get whenever I hang out with a white person and see how many more wrinkles they have than me. ❤️",2
4913,4913,38,Permaculture123,2023-02-21 23:45:26+00:00,91,8,7,2,3687.0,"15 fruit trees, 200 asparagus crowns (purple and green), 100 bare root strawberries in (everbearing), 4 goji, 8 grapevine (table grapes), 3 hardy kiwi (fence line), 4 blueberry, 4 rhubarb, red and white clover paths - all in today and the day before last with 20+ more fruit… https://t.co/EoE5u0YbT7",2
4914,4914,39,LikeADroppedPie,2023-02-21 23:37:57+00:00,73,2,231,5,11899.0,"@OzraeliAvi All I see is another old white guy complaining that he can't be racist, homophobic and transphobic without being called out on it anymore.",0
4917,4917,42,GeniusLingo,2023-02-21 22:37:26+00:00,64,6,199,4,6758.0,"@RepAdamSchiff Let’s say, hypothetically, Russia had an asset in the White House. Their top priorities would be:

- Sow divisions in American society
- Damage trust in American democracy
- Reduce American influence/security in Middle East
- Kneecap NATO

Trump is doing all of those things. Why?",2
4923,4923,48,Emilio2763,2023-02-21 21:52:38+00:00,56,7,4,0,2806.0,Hey Dummy. You are 1 of about 60+ people in the last 2 Years that’s said they can find ‘millions’ of the same videos of White people. Not 1 person Has At ALL. You’re a Fucking Clown…,0
4929,4929,54,DocElovitz,2023-02-21 22:21:55+00:00,62,1,11,1,22885.0,"Nothing like being on a call and having a senior white male take credit for all your grants and research productivity 🤯 

Ffs",2
4933,4933,58,steve,2023-02-21 22:55:18+00:00,89,13,8,0,48305.0,"Uncle Timmy and @stevewilldoit gambled with Dana White all night. Details are live on a new episode 6. Rumble, Spotify &amp; Apple. #WW3",2
4935,4935,60,1984IsNow1776,2023-02-21 22:58:50+00:00,109,35,14,1,4349.0,"The ones who overturned an election were the @DNC mules &amp; Dominion Voting Systems who altered the will of the American ppl. W all thats going on in the White House &amp; WWIII, all u have to hold onto is Fulton County? Only follow the liberal leads. How very American. @RepAdamSchiff",2
4937,4937,62,its_hipolita,2023-02-21 23:03:39+00:00,85,3,3,0,1344.0,"Mirror's Edge, for all its faults, did this brilliantly and shamelessly. Whenever something is bright red (against a game that is 90% stark white) that means you can do parkour there. It's okay. Most people aren't Gamers.",2
4943,4943,68,kyran_delroba,2023-02-21 22:46:02+00:00,89,0,7,0,4054.0,@The_Real_Fly White people are now paying reparations in all kinds of ways.,2
4957,4957,82,indumathi37,2023-02-21 23:41:49+00:00,117,23,3,0,6100.0,It’s legitimately hard to understand how this is speaking truth to power *in Seattle* when all the white people testifying are pro ordinance.,2
4959,4959,84,ToddWitteles,2023-02-21 22:34:43+00:00,76,0,11,1,8680.0,I'm ready for apologies from all the white knights who had the nerve to attack me for simply pointing out some obvious inconsistencies in a very shady money request.,2
4967,4967,0,gayandold,2023-02-21 18:10:53+00:00,761,49,8,3,60136.0,gays always take “go fuck yourself” to the next level,0
4968,4968,1,_Jacobwho,2023-02-21 23:38:49+00:00,1356,87,12,17,36912.0,"Arthur Darvill on a possible return to Doctor Who: 

“Fuck no, Amy was always kissing the Doctor, Rory deserved better. My personal canon for him is that in those 2000 years he was smashing everyone”

Source: Doctor Who Magazine https://t.co/1M3RnArV7C",2
4969,4969,2,ginaa510,2023-02-21 20:34:15+00:00,107,33,1,1,7451.0,I hate a bitch who always got a problem girl shut the fuck up,1
4970,4970,3,RAtheRuggedMan,2023-02-21 17:16:56+00:00,76,8,4,0,6666.0,Augustus Gloop will always be a FAT fuck that why we love him. lol,1
4971,4971,4,MillennialJQ,2023-02-21 20:55:51+00:00,110,0,9,0,5060.0,Never get fucked always fuck a bitch https://t.co/kfcIqNvivJ,1
4972,4972,5,thebarbimya,2023-02-21 22:01:35+00:00,72,31,4,4,6417.0,Bitches always speaking on loyalty and about fucking people niggas but be literally fucking on their family/friends niggas. Bitches be grimey in real life! If that’s not the bottom of the barrel I don’t know what the fuck is.,1
4976,4976,9,coltybrah,2023-02-21 21:45:01+00:00,526,22,11,6,63209.0,"funny how cats in America cleaning yachts, gardening mansions, etc. etc. are always smiling blasting mariachi music drinking beers happy as fuck

people that own the mansions &amp; yachts and shit are usually highly miserable /ungrateful 

always notice this when In OC for too long",0
4984,4984,17,DatingSims,2023-02-21 17:49:38+00:00,152,13,14,2,7050.0,Always like those game dlcs where I don't know who the fuck the people are lmao https://t.co/DGmkg6F0h3,1
4986,4986,19,davida_1875,2023-02-21 22:14:11+00:00,51,4,1,0,5438.0,England seem to have the best everything but always go and win fuck all,1
4993,4993,26,JordanSVP,2023-02-21 15:31:32+00:00,64,1,17,0,4295.0,"Ever since I was in my teens I always wanted to grow out my hair.

But my family was always like ""It doesn't look good on you/doesn't suit your face/you're not gonna find work.."" etc etc. 

Finally said fuck it, and now I feel comfortable in my own skin, a bit more self confident https://t.co/M9vnBwynoY",2
5001,5001,34,Vanfleetdub,2023-02-21 18:18:07+00:00,63,6,7,0,4732.0,"this is one of my best tf2 clips ever w/@syzymusic
I always think back to it trying to decipher what the fuck I was even saying. https://t.co/VkSkbPHT7L",1
5003,5003,36,SainAsylum,2023-02-21 19:05:07+00:00,172,21,6,5,11326.0,"People outside of Memphis always want to include us in Tennessee bull shit but never want to include us in Tennessee real shit 

Fuck y’all 

We from Memphis",1
5006,5006,39,jetfury,2023-02-21 21:42:23+00:00,95,3,11,1,19858.0,"I’ll always support #Ukraine 
And it’s incredible people 

But #NATO can go fuck itself 
And it’s corrupt Arms dealing military assholes that would rather make money to see the world burn 

They are the cause of this horrific shit 

#fuckNato #SupportUkraine",1
5007,5007,40,VoicesByZane,2023-02-21 22:02:50+00:00,1376,110,44,6,40162.0,"People always made fun of Episode I for ""being about trade routes"" but I genuinely would watch the fuck out of a star wars series about resource management or something else incredibly mundane. ""Chinatown"" but Star Wars. I don't want to even hear the word ""jedi"" or ""force""",2
5009,5009,42,LavendarHoney,2023-02-21 18:16:33+00:00,246,8,1,0,6166.0,"@MayoIsSpicyy cool; please wake us up when there's an actual perp walk about to happen?    I'm asking for that, because A) a perp walk needs to happen and B) the orange blob is always freaking the fuck out, innit?""",1
5041,5041,74,HeatFlockAllDay,2023-02-21 20:14:02+00:00,426,0,1,0,24054.0,@raphousetv2 Dude used to live like 2 houses down from me real cool dude always showed love never acted hollywood or nothing i fuck wit Gang🤞💯,1
5047,5047,0,elephant_ring,2023-02-21 10:15:11+00:00,68,5,25,2,8544.0,"Now I know this weak ass white boy ain’t talking.
Simping for his girl while she got her ass out for all of us to see.
He wifed what everybody else already had.
And the last pic? I don’t even gotta say it. We all know what’s up. Ole boy tagging his girl in front of him. Promise u https://t.co/vkTFKx0yzs",1
5050,5050,3,liixies,2023-02-21 17:22:51+00:00,55,2,1,3,1066.0,Can they please get rid of this ugly ass white border around the album covers https://t.co/KhM856ul0o,0
5053,5053,6,nelthreepoints,2023-02-21 23:45:07+00:00,62,5,6,0,1066.0,Trans folks should do big gender reveals like white people do for their dumb ass kids. Like change your pronouns and light a field on fire. Chad shit,1
5055,5055,8,helloimbernardo,2023-02-21 17:50:20+00:00,69,3,3,0,1208.0,"him: you better not be balloon walter white when i get there

my whimsical and rebellious ass: https://t.co/hZOz6TU4nL",1
5056,5056,9,JosNamesnotJo2,2023-02-21 13:06:22+00:00,71,6,9,0,1914.0,To the niggas that put Minnie's Mouse's fat rat ass on my timeline o just wanna say you are never seeing the pearly white gates https://t.co/tBTUWG1moe,0
5064,5064,17,emcsquaredxx,2023-02-21 23:09:58+00:00,69,6,14,3,6583.0,"- Yellow ugali&gt;brown ugali&gt;white ugali 
- pancakes&gt; waffles
- Chocolate cakes should be made with a good amount of dark chocolate instead of milk chocolate or with espresso...to add richness instead of making it aimlessly sweet 
- Fruit cake is ass 
- Day after pizza&gt; Fresh pizza",2
5070,5070,23,HanumHusen,2023-02-21 15:15:34+00:00,66,3,1,0,3577.0,"@Busy_royals Ass patting, ass grabbing, ass caressing, it's all fine, if you are a white royal, even if it's your own daughter's ass.",1
5090,5090,43,EenPluviometer,2023-02-21 10:57:09+00:00,65,0,4,0,2606.0,"@Archang17382675 @CitizenFreePres So because he's not directly affecting your white American ass, he surely can't be the bad guy here. What a selfish way to look at things man.",0
5123,5123,76,awfullyfamished,2023-02-21 11:44:41+00:00,92,0,0,0,1268.0,@paulmassonbrand @ChudsOfTikTok @_real_Dominic Imagine thinking supporting Warren makes you anything but a white ass Chud,0
5125,5125,1,CourtTV,2023-02-21 19:43:00+00:00,574,121,799,56,264612.0,"Forensic engineer Mike Sutton, a crime scene reconstructionist for Alex Murdaugh's defense, testified that the person who killed Maggie and Paul Murdaugh had to be between 5'2"" or 5'4"".

The defendant Alex Murdaugh is 6'4"". 

#CourtTV What do YOU think? ⚖️👇 #MurdaughTrial https://t.co/8ALdlvZu1N",2
5126,5126,2,adriang86518036,2023-02-21 19:46:23+00:00,141,44,6,0,5935.0,"On this day 1988 Aiden McAnespie is gunned down by British soldiers on his way to the local GAA ground. McAnespie was an election worker for Sinn Féin, he would be hounded by British soldiers and threatened to be killed on several occasions. https://t.co/ZQDF9dZ8IE",2
5127,5127,3,MyBoxerLuvMac1,2023-02-21 23:50:00+00:00,210,312,13,6,4533.0,"💔Sky💔
#NYCACC #164035 2y
▪️To Be Killed: 2/23💉
◽Urgent Medical🚑
Adorable sweetie has pneumonia + anorexia. Not responding to tx, struggling 2 breathe+ losing weight! Social, friendly, needs loving, N.East #Adopter/#Foster, 4 MD tx, TLC + security, 2 heal. 
Pls #pledge
💞Sky https://t.co/SJbas6yLl2",2
5129,5129,5,LIONLOVERS5,2023-02-21 21:37:50+00:00,359,238,88,32,16763.0,"Heartbreaking 💔 

Post by @BigCatVoices IG 

Steve Winter documented lions in South Africa that were being farmed for the canned hunting trade, where they will be hunted and killed within their enclosure. https://t.co/XWdZuiebhK",2
5132,5132,8,_Pehicc,2023-02-21 21:15:49+00:00,38,66,3,0,905.0,"6  beautiful sweet pups at #NYCACC
6 🚨KILL COMMANDS🚨
6 pups who will be KILLED if no one is willing to #foster 
6 lives that will END 🌈 because of a rotten system
#NYC pple PLEASE #Save them 
#foster🙏#foster🙏#foster🙏#foster🙏#foster 
🙏#foster 
They need u RIGHT NOW ❣️❣️🙏 https://t.co/LakbG4oUXV",2
5135,5135,11,InfiDale3476,2023-02-21 23:10:59+00:00,162,26,12,3,2399.0,"Every time someone has spoken out against religion, for the last few thousand years, they’ve either been killed or somehow silenced.

“Be respectful” is just the 2023 version.

I’m sorry, but I refuse to “be respectful” to an ideology that’s not respectful to humanity.",2
5136,5136,12,tez410_,2023-02-21 19:36:38+00:00,6088,1249,231,420,649417.0,Then the bitches be like “why him” cause he killed my cousin bitch that’s why😂😩,1
5138,5138,14,TatiJayy_,2023-02-21 19:57:02+00:00,96,23,3,1,5157.0,Let’s be honest…we all stopped watching after y’all killed Poussey.,2
5139,5139,15,wcbuecker,2023-02-21 23:43:45+00:00,102,22,20,2,2298.0,"Marjorie Taylor Greene says all businesses will move to her United States because there will be no
Yes you read that right 
NO 
Regulations on companies 
This went really well in the 1800’s when workers were killed at work every single day",2
5140,5140,16,eireacht,2023-02-21 23:43:07+00:00,80,42,3,1,2528.0,"Lithuania 1991 was also victim of agent provocateur snipers, who killed 14 to frame the red army eventually leading it to be the 1st to cede the USSR

For exposing this, Investigative journalist Algirdas Paleckis faces ~7 years prison as a Russian spy by ""state secret"" evidence https://t.co/J4Po8v9l2p",2
5143,5143,19,SteveStaeger,2023-02-21 22:22:41+00:00,295,6,17,2,24173.0,"I like to think that even people who ""don't know how to handle themselves"" when stopped by police - don't somehow deserve to be killed.",0
5146,5146,22,AlexaTurnOnGH,2023-02-21 23:06:25+00:00,127,9,19,13,11396.0,Apparently Trina should be worrying about who killed her boyfriend (who?) instead of kissing Spencer. The haters are so cute when they're mad and bitter. https://t.co/PQRKl9pHKq,2
5149,5149,25,eireacht,2023-02-21 23:44:30+00:00,71,27,1,0,1664.0,"Venezuela 2002, 19 were killed by agent provocateur snipers, fortunately, democratically elected Chavez wasn't toppled, although not for the lack of effort from the CIA.

The coup plotters even recorded a statement to be televised, talking of the deaths before they even happened https://t.co/NuW7uQPkEr",2
5155,5155,31,saltonseasalt,2023-02-21 21:46:35+00:00,129,1,0,0,2645.0,like would it have killed you to be nice. and now something else killed you for real.,0
5157,5157,33,whittakertp,2023-02-21 21:42:18+00:00,51,20,1,0,606.0,Bill 124 has killed the public healthcare system in Ontario. People that could not be bothered to vote cannot afford a two-tier for profit healthcare system.,2
5170,5170,46,elizfarrell,2023-02-21 21:01:06+00:00,188,10,8,0,7183.0,"Meanwhile, the defense's expert on how Maggie and Paul were killed and how tall the shooter had to be (tiny, according to the expert) etc. is an engineer who analyzes how car wrecks happen (and boat wrecks ... he was retained by Jim for Paul's criminal case) ...",2
5173,5173,49,cheascake,2023-02-21 22:13:31+00:00,68,7,3,0,1969.0,I think the reason why I don't like driving newer cars is because they are so quiet and smooth. Cars are a kind of horse and if the horse is very quiet that means it is dying of disease or you are about to be dying of being killed to death by big danger.,2
5178,5178,54,NewtownAction,2023-02-21 23:29:49+00:00,134,30,1,1,2772.0,"Carmen Schentrup should be celebrating her 22nd birthday.

Carmen was killed in the MSD shooting over 5 years ago. She was 16.

Her brother @RobSchentrup, is now an organizer with @Team_Enough.

We must follow his lead &amp; #HonorWithAction by calling for an #AssaultWeaponsBan. https://t.co/yoAyYqHkfr",2
5185,5185,61,adamjohnsonNYC,2023-02-21 23:28:55+00:00,310,23,11,0,22434.0,"Oh man what a take. Absolutely. a pandemic that’s killed 1 million Americans and counting, let’s definitely make sure politicians don’t over-prepare or over spend one penny. All fluid, historic, mass death events should be met with EXACTLY the right amount of spending",2
5189,5189,65,CATACLYSMICEVIE,2023-02-21 20:38:52+00:00,124,1,1,0,2400.0,"He’s beyond hearing what anyone has to say. He won’t sleep. He won’t eat.

He listened to the love of his life beg not to be killed. He listens as their son, too young to understand death, asks when she’s coming home.

There can be no understanding.

There can be no forgiveness.",2
5196,5196,72,ijabadenuyi,2023-02-21 23:11:41+00:00,235,192,17,7,21404.0,"This day will never be “forget”in the history of Nigeria, youth were killed and many were missing at Lekki toll gate and you are yarning “Emilokan”. It is the time of Nigerians and we shall meet at the Polling booth come 25th February 2023 vote (LP) 🔝to ⬇️https://t.co/Gmy6QujWyz",2
5218,5218,0,aftermathvids,2023-02-21 23:38:11+00:00,1230,120,69,50,101715.0,"How would you handle this? Your son keeps disrespecting and threatening to beat up the family. 

Dad checked him. https://t.co/L1lXfZckRN",2
5219,5219,1,JBspherefreak,2023-02-21 23:40:35+00:00,1579,211,28,10,70163.0,"So Monolith are trolls and added this accesory to the game. After you beat EVERY stage S rank in Challenge Mode, he gives you the Archsage's Flower Fan but talk to him again in a NEW NG+ playthrough and he gives this item instead...AMAZING 😂 https://t.co/MDWgbESbLG",2
5220,5220,2,iamMauriceW,2023-02-21 19:29:22+00:00,108,101,14,9,4555.0,"Mobile, Alabama, 1981 Michael Donald (19) was killed by KKK members after falsely being charged with the murder of a White cop. Klan members beat him with a tree limb, strangled him with a rope and slit his throat, before later hanging him from a tree in a local neighborhood yard https://t.co/DSSEwls0vW",0
5223,5223,5,inkbog,2023-02-21 23:16:38+00:00,2880,434,10,34,63897.0,only thoughts on the csm chapter is i think it’s time for yoshida to be beat up by a lesbian again. not because i hate him or anything i just think it would be funny. this was his best era https://t.co/3RCaqfF7Ru,2
5224,5224,6,ilomi7o,2023-02-21 17:02:13+00:00,126,9,5,0,1875.0,"the way she looks at him, the satisfying movement of her head to the beat, the crouch…she soooo 
https://t.co/XiK1TkKMY0",2
5226,5226,8,mixkanawat,2023-02-21 21:14:55+00:00,1537,241,10,40,33987.0,"so in just one day we learned that:

– firstkhao have an app on their phones to check each other's locations 24/7
– once first put his hand on khao's chest and he heard his heart beat say his name (hence he named him ""firfir"" in his contacts)
– first's neck is extremely sensitive",2
5231,5231,13,kilday_morgan,2023-02-21 22:59:24+00:00,60,5,13,0,3617.0,"Everybody thinks it's easy to beat Ted Cruz until they run against him. 
It's disappointing and if you would have told me a year ago I'd have this opinion about Texas I would have said you were full of shit. I don't think a Democrat can win statewide in Texas.",1
5232,5232,14,camclark25,2023-02-21 18:17:04+00:00,623,3,3,1,17629.0,@USFLPanthers @bmocj77 Lol u used a pick of him getting beat and holding the defensive player 😂😂😂,2
5236,5236,18,WraithFightz,2023-02-21 21:24:53+00:00,267,10,3,0,29528.0,"How He Let Little Dude Beat Him Like That?😭😭

#fight #fightsvideos #fightvideos #fightingvideos #schoolfight #knockout #ko #shegotbeatup #shegothands #Fights #fightvids #fightpage #fighting #FightVideo #fightsvideo #hoodfight #hoodfights #gore #funny #viral https://t.co/0swRdfTSdR",2
5240,5240,22,PiusO1,2023-02-21 20:31:32+00:00,50,14,2,0,1241.0,"They will tell you online polls don't count but they have been pursuing Peter Obi @PeterObi trying to beat him but Obidients, you guys are so amazing.

Just imagine the gap we have given them, don't mind the naysayers we are winning this election by a wide margin. Link to vote 👇🏾 https://t.co/Xr3U2RmyG8",2
5249,5249,31,bossmaneslim_,2023-02-21 19:32:42+00:00,50,18,4,21,53701.0,This is why I’ll just stick to men with no kids because I don’t understand why he has to do for you? It doesn’t make him a dead beat because he doesn’t take care of you. His only responsibility is his child but hey 🤷🏽‍♀️ different strokes for different folks I guess.,2
5256,5256,38,jtuck151,2023-02-21 21:01:17+00:00,469,44,68,3,166052.0,Now ppl understand why Zeke went to Cabo the cowboys gonna run him into the ground for 4 years .. Tag him and Squeeze out a 5th and tell him hit the market in year 6 .. Saquon coulda did the same if not for injuries he beat them to it,2
5261,5261,43,RJ_Young,2023-02-21 18:43:38+00:00,230,24,11,2,85128.0,"Coming off a year where he helped lead K-State to a Big 12 title. Before Will Howard could fly, Adrian Martinez showed him how. 

He beat Oklahoma.

Mike Riley is certainly going to make use of his ability to rush too.",2
5266,5266,48,stumeister69,2023-02-21 18:43:09+00:00,54,0,4,0,3680.0,@MMAFighting @JonnyBones Reyes beat him though,2
5283,5283,65,NicholasPascar5,2023-02-21 20:21:54+00:00,66,2,0,0,3176.0,"Thank god, I would much rather see him get beat the hell up and thrown around and done in 3 minutes than seeing him with some important arc",2
5285,5285,67,Babygravy9,2023-02-21 21:05:26+00:00,284,0,2,0,52106.0,"@power_ethics I remember seeing Gardner beat him. A shame, but Karelin is still a titan all the same.",2
5289,5289,71,copcrisis,2023-02-21 23:06:45+00:00,58,39,1,3,1246.0,An Arkansas law enforcement officer who held down a man while two others beat him during an arrest recorded on video is back on the job after he did not face any criminal charges https://t.co/sj18YZ2IH4,2
5297,5297,79,matthayesthfc,2023-02-21 21:16:55+00:00,105,2,4,1,16350.0,"I don't watch Real Madrid often so I don't know if Vinicius Jr always does this, but he seems to pull as wide as possible when he receives the ball to draw Trent out &amp; create the space behind him because he knows he will beat him 9 times out of 10.",2
5310,5310,92,power_ethics,2023-02-21 21:02:40+00:00,467,0,3,0,77590.0,@Babygravy9 Absolute unit. The guys and I watch his highlights sometimes before class.  I’m glad an American beat him but honestly I wish no one did.,2
5312,5312,94,power_ethics,2023-02-21 21:11:59+00:00,60,0,2,0,5183.0,"@Babygravy9 All the champs lose to Father Time eventually. I mean let’s not pretend Slavic G-Chad wasn’t also the product of wild Russo-anabolic experiments, lol even cyborgs being to rust.  And Gardner baaaaarely beat him. A wins a win but it ain’t no pin.",2
5314,5314,0,QueenBeeBrookeV,2023-02-21 23:45:23+00:00,325,11,14,3,9800.0,"like yes, actually i am to blame for the chicken shortage. cope. https://t.co/hMeLEoLM8R",2
5315,5315,1,jjabbott,2023-02-21 23:27:08+00:00,251,81,2,8,11567.0,"Mastriano’s top priority besides banning abortion was gutting tens of thousands of regulations on corporations like Norfolk Southern. 

PA GOP’s whole economic agenda is gutting regulations. 

Now they’re trying to blame the derailment on anyone but NS. 🤔 https://t.co/lKUVR10v3N",2
5317,5317,3,wintrfcll,2023-02-21 23:46:42+00:00,114,20,0,0,4826.0,putting the blame on womens vanity when HE was the one who decided to sculpt a naked woman https://t.co/1HJ4BfusvG,2
5318,5318,4,k8ttlynn,2023-02-21 23:19:45+00:00,360,15,3,0,11951.0,"all ima say is, knj sold meet and greet tickets separate for a reason. you chose to risk the chance of not meeting them so why try and blame knj bc things didn’t go ur way https://t.co/nj9uXcgaHF",2
5320,5320,6,BeverleyKendall,2023-02-21 23:20:06+00:00,106,6,3,0,2108.0,"Please do not blame the people who don’t know the clear rules of the game and have chosen not to play. We have that right. 

I’m not on Spoutible going off on their CEO. He’s on Twitter going off on us.",2
5321,5321,7,GleamyD,2023-02-21 23:37:38+00:00,192,52,3,3,11282.0,"For anyone talking about not attending @HarmonyPonyCon or disliking them because of what happened this weekend, I would like to say they were actually very helpful in this case and helped us arrange getting everything resolved. ❤️
Do not blame the con for ONE individual at it.",2
5322,5322,8,soleisdaylight,2023-02-21 23:28:09+00:00,95,15,3,0,2416.0,"I’m hoping we get a tour countdown and more interaction from taylor leading up to tour, but we don’t deserve anything from taylor at this point. the way some of her “fans” treat her as only a commodity is disgusting and I don’t blame her for not wanting to see the nastiness 🧍‍♀️",2
5325,5325,11,Hongdiu51920262,2023-02-21 23:31:41+00:00,227,32,2,3,7271.0,"There are some who say these boys failed, flop. While the boys and their fans worked so hard during their rookie days. Don't blame TPST and their fans.But look at how you support your idols. https://t.co/fD8nLUELS6",2
5327,5327,13,RealityJunky804,2023-02-21 23:14:56+00:00,71,4,4,0,2272.0,"Watching the Gorgas first episode and watching todays preview, it’s tiresome how much the Gorgas have been whining about the same shit for over 10 years and people didn’t see their BS until now. They blame the Guidices for everything till this day #RHONJ https://t.co/XGz8ZmyHFn",2
5329,5329,15,Kris_Willis,2023-02-21 23:15:07+00:00,72,2,8,1,7171.0,The Hawks have replaced their GM and their head coach. Running out of people to blame,2
5330,5330,16,ga11acher,2023-02-21 23:38:19+00:00,52,11,7,0,1168.0,"Nicola Sturgeon is a dark shadow a grim reaper that hangs around her New SNP project her creepy agenda of gender extremism will fester and destroy the remnants of SNP, she scuttled off for cover before the shit hits the fan leaving others to take the blame",1
5331,5331,17,_molini_t,2023-02-21 22:53:36+00:00,58,2,0,0,3856.0,"I think Jojo is not secure. You dont have to lie about Slee, yes she said that, but not with that tone or attitude. I blame Nonku though, she wanted approval from the group, Jojo to be specific, and when she didn't get it she just painted Slee black. #RHODurban",2
