,Unnamed: 0.1,Unnamed: 0,User,Date Created,Number of Likes,Number of Retweets,Number of Replies,Number of Quotes,Number of Views,Tweet,class
0,0,0,FKihamu,2023-02-17 21:04:36+00:00,4470,116,377,27,167579.0,"February 18th, this Man was born🙏🏻! Allah Akbar, Alhamdulillah for another year on earth💙 https://t.co/cGCCUCFIfr",2
1,1,1,ImtiazMadmood,2023-02-17 17:24:24+00:00,13375,2641,498,148,373613.0,"Karachi Police Headquarters:

The attackers and defenders are both shouting Allah hu Akbar.

Now calculate which side is Allah on.",2
2,2,2,RealAdeshina,2023-02-17 11:19:38+00:00,101,31,8,2,4022.0,"Allah Akbar! BAT can now stand straight, Tinubu can hold stick for many hours…. This is beautiful from our Milkano &amp; Obiediots guys… https://t.co/AzOt7ugYhF",2
3,3,3,RealBababanaras,2023-02-17 18:16:58+00:00,629,115,10,5,50936.0,"Attackers were shouting - Allah Hu Akbar

Security Forces were shouting - Allah Hu Akbar

Outside the encounter site, public were shouting - Allah Hu Akbar

We are just audience !

Don't bleed #Kashmir. Keep safe #Karachi.

Every player has different playing style

🌎 Is family https://t.co/xdUvUuLA3c",2
4,4,4,DuncanAbigaba,2023-02-19 18:30:46+00:00,146,8,18,1,16486.0,"IRANIAN FOOD; lamb leg, steamed rice, and green tea. This is the closest to African food you can find in Saint Petersburg. Also, Iranians are the most warm-hearted people I have found in this city. Very friendly and helpful people. Allah Akbar! https://t.co/tQfW049fCB",2
5,5,5,Serene_being,2023-02-20 01:38:13+00:00,856,157,16,6,17558.0,"I wish to spend some time alone in front of the Kabah when there aren't many people around so that I can freely talk to Allah, cry uncontrollably, look up and around, say Allahu Akbar, subhanallah, and Alhamdulillah, and then fall into sujood and cry my heart out once again. https://t.co/1cSkrScA9m",2
7,7,7,Vigo_Driver,2023-02-17 17:48:10+00:00,197,46,6,6,40605.0,"#BreakingNews
#Karachi

As per reports, SFs have killed all the terrorists and cleared the building. Soldiers chanting Allah ho Akbar can be  Heard from the roof top.
#Sindhpolice #TerrorAttack #SindhRangers #TTP #KPO https://t.co/nVhHUqoiaz",2
8,8,8,justujuuu,2023-02-18 21:37:10+00:00,81,16,6,0,3387.0,There's a storm brewing. Remain steadfast; the next few weeks are going to be tough and decisive. Allah u Akbar!,2
9,9,9,AndPakistani,2023-02-16 20:11:00+00:00,119,74,2,0,8007.0,"🚨People of Lahore reciting nar e takbeer outside Imran Khan’s house! Allah ho Akbar! Allah is with Khan sb. 
In shaa Allah all will be well🤲🏻

#Zaman_Park #زمان_پارک_پہنچو https://t.co/tNUfvAQ5U7",2
19,19,19,2_hodor,2023-02-17 17:47:48+00:00,269,21,3,0,2517.0,"@thepowerofpak Attacker shouting - Allah u Akbar
Police shouting - Allah u Akbar
Citizens Shouting - Allah u Akbar
Those dying - Allah u akbar
Politicians - Allah u akbar",2
20,20,20,AyassToure,2023-02-20 08:39:12+00:00,87,4,0,0,22966.0,@Al__Quraan The most noble of you in the sight of Allah is the most righteous among you. Allah Akbar,2
23,23,23,aaaniket2,2023-02-16 16:11:55+00:00,336,3,5,1,17250.0,"@MAJEDALKHELAIFI Inshallah
Bismillah
Allah hu Akbar

Somebody please tell me he's a reliable journalist/source i beg man",2
27,27,27,alifewithallah,2023-02-16 10:04:58+00:00,236,56,1,1,10495.0,"Allahu Akbar: A Magnificent Phrase

Allāhu Akbar is one of the most magnificent phrases a human being can ever utter. Allāhu Akbar is a declaration of Allah’s grandeur, and an affirmation of our submission to His majesty...",2
30,30,30,One_Dawah,2023-02-16 20:10:31+00:00,266,44,15,4,35111.0,"Perennialism is kufr akbar!
This Bait Ibrahimi is nothing more than a perennialistic idea.

The only religion accepted by Allah, is Islam! https://t.co/goclpZVBr7",2
36,36,36,WokePandemic,2023-02-18 04:43:49+00:00,116,14,2,1,2801.0,"Pakistan occupied Karachi will be free soon 

Allah Hu Akbar",2
62,62,62,AsadAToor,2023-02-17 17:52:50+00:00,305,83,17,9,25764.0,"#BREAKING: Advisor to CM #Sindh @murtazawahab1 announces that operation against terrorists in #Karachi police headquarter concludes and all 3 terrorists killed. Brave policemen chanting Allah o Akbar on the rooftop of police building, another sign of successful operation.",2
64,64,64,ZoyaAnwerNaqvi,2023-02-16 10:36:20+00:00,92,6,1,0,3923.0,"In words of my classmate, who witnessed a clash near Arts Lobby
""They were throwing stones at other group shouting Allah Ho Akbar, but the other group is also Muslim, why are they bringing Islam in their own fight?""
Mind you we were not some liberal arts kids out for discourse",2
72,72,72,Ahmed1Parveen,2023-02-15 05:48:22+00:00,172,11,2,0,8056.0,"@Majstar7 @One_NationUK SubahanAllah .. little girl is teaching us so many things. Her gratitude towards her helpers and her humbleness and her imaan . Allahu Akbar.. she is so articulate and so clearly expressing her thoughts and her bravery.. May Allah protect her, volunteers and donors on last day",2
79,79,79,alifewithallah,2023-02-16 10:04:58+00:00,73,19,0,0,2741.0,"We remind ourselves through Allāhu Akbar that Allah is the greatest over everything: in His essence, in His power, in His honour, and in His majesty. Allah is the King of kings unto whom everything is subservient.",2
94,94,0,la_Blacks,2023-02-21 23:07:26+00:00,309,58,2,8,7879.0,need i say more? https://t.co/Ie7kxYacB7,2
96,96,2,la_Blacks,2023-02-21 21:30:51+00:00,86,6,1,1,1998.0,i swear i will send you ten cases of the best wine of your choice directly from Italy if you give us what we have been waiting for for years https://t.co/aORV8MCkNr,2
97,97,3,Manny_Funes,2023-02-21 21:34:09+00:00,96,17,18,4,2514.0,"Perhaps, their last name is ""BLACKS""  

It's totally possible, 
right ?🤷‍♂️ https://t.co/lC3mSaKC28",2
99,99,5,niggy_stardust,2023-02-21 20:46:57+00:00,1227,52,31,7,192845.0,"pure sophistry. chattel slavery in the US was undergirded by a legal system premised on blackness as a permanent condition of disenfranchisement. free blacks, even slave owners weren’t considered citizens and as such had virtually no opportunities for upward social mobility",2
101,101,7,pr_conservative,2023-02-21 21:38:37+00:00,54,26,23,12,9305.0,"Bro!!! Now Biden said he grew up in a Polish neighborhood? I thought he grew up with blacks, then Puerto Ricans..
😂
Biden in Poland: ""... everybody in town was either Polish or Italian. I grew up feeling self-conscious my name didn’t end in an S-K-I or O""
#LyingBiden https://t.co/GVCYuU58vb",2
103,103,9,dondika3,2023-02-21 23:32:09+00:00,84,11,4,2,5034.0,Low self esteem like a MF. Nu Blacks like this idiot make my blood boil,2
105,105,11,grassfay,2023-02-21 21:52:40+00:00,51,0,8,0,3347.0,non blacks dni: the way y’all are moving makes me wonder if y’all don’t consider me dark skin,2
107,107,13,Nazboleon,2023-02-21 22:40:21+00:00,79,12,3,1,14963.0,"@RichardHanania Whay had Blacks failed to become ensnared in opioid addiction? CDC conclude ""Doctors didn't trust BIPOC not to abuse opioid, so they prescribed them painkillers at far lower rates than they did Whites""
A case where racial stereotypes had protective effects
https://t.co/9pxNqEEMVH https://t.co/CHlsv50ozW",2
110,110,16,monitoringbias,2023-02-21 23:41:07+00:00,271,15,6,0,10474.0,"When whites commit violence, blacks are the victims only 3.6% of the time. (By ""violence"" here we mean assault, robbery, and rape.)

With respect to murder, all races commit homicide mostly within their own race.",0
111,111,17,LTRNForever,2023-02-21 18:59:46+00:00,61,47,16,1,1301.0,Schools canceling honor classes for EQUITY? Blacks are under represented. My daughter is Asian and was in honor classes. It was bc she excelled PERIOD…,2
112,112,18,ClarkHat,2023-02-21 21:56:21+00:00,60,4,4,3,4273.0,"5/

This is not surprising, because this is about the single dumbest way to ""massage"" your taxes, and blacks are the lowest IQ demographic in the US.

The tweet thread kind of peters off here, but ""blacks get audited more than anyone else because they're -1 std dev"" sounds right.",2
113,113,19,KeneAkers,2023-02-21 19:39:44+00:00,563,259,56,32,24689.0,"I think it's despicable that whites in Mississippi want to be separate from Blacks, makes me think how many more think like this. Remember who made the first move. | Mississippi lawmakers seek a return to Jim Crow with a separate white system of justice. https://t.co/PbDDbjoPbj",2
115,115,21,niggy_stardust,2023-02-21 20:46:58+00:00,264,0,2,0,9756.0,insane figures and percentages being given for the amount of slaveholding free blacks in those replies. i wonder where all this data is coming from? reputable scholarship &amp; not racist facebook memes i’m sure,2
119,119,25,echoteia,2023-02-21 21:01:22+00:00,101,19,2,2,4503.0,This not even new blacks or “i wasn’t black enough for the black kids” blacks but a third more sinister and divorced from their own culture thing.,0
120,120,26,ClarkHat,2023-02-21 21:54:55+00:00,68,3,1,0,1817.0,"4/

twelve tweets in and we learn that blacks are far more likely than anyone else to under report their income (which is to say ""tell very very stupid lies that the government can catch trivially bc of paperwork filed by employers"")",2
124,124,30,ClarkHat,2023-02-21 21:58:51+00:00,55,5,1,0,2132.0,"6/

full paper here

https://t.co/J5NeNbxMVF

title ""Measuring and Mitigating Racial Disparities in Tax Audits""

why in fuck would we want to MITIGATE this?

If low-IQ blacks are filing fake tax returns in order to get checks from decent citizens, MITIGATION is last thing we want",2
126,126,32,YourFriendDubs,2023-02-21 23:25:52+00:00,66,3,0,0,1487.0,@Klaus_Arminius It makes a lot more sense when you realize that blacks are narcissists. Both in the individual and tribal sense.,2
127,127,33,stillnotziora,2023-02-21 23:41:18+00:00,231,3,2,0,3495.0,@jjmastermind @WoahMarley_ acting like we were crazy for covering their cameras…niggas wanted their 5 minutes of fame so bad whole time they’re gonna post the video titled “angry HBCU blacks”😭😭🐒,1
128,128,34,Lamar2Zay,2023-02-21 23:46:48+00:00,81,0,1,0,705.0,@KingOfThorns1st @RGameScreenshot @DiscussingFilm “Blacks” is so crazy to me,2
143,143,49,wemimospot,2023-02-21 21:27:51+00:00,187,31,29,0,19217.0,"@AfricanArchives Black history is so dark that it sends shivers down the spine!!!!

I don't know HOW to relate these to children without making them hate white people and without blurring out the truth either!

It's worse that blacks are still despised in 2023!!!

😭😭😭💔💔💔
#BlackHistoryMonth",0
149,149,55,0x49fa98,2023-02-21 20:57:24+00:00,170,6,3,0,3595.0,"@timothymmurphy1 if tomorrow we started calling all blacks ""your majesty"", ""your majesty"" would become a slur within a year, just like any word you invent for the male organ becomes a slur the moment you utter it. The underlying reality is crass.",2
174,174,80,JKernerOT,2023-02-21 23:07:21+00:00,67,13,6,2,1225.0,"@libsoftiktok 80% of ALL people - all races and ethnicities - are NOT racist. Of the 20% who are racist, they are equally divided among races. So 20% of whites are racist, 20% of blacks are racist, 20% of Asians are racist, 20% of Middle Easterners are racist, 20% of Jews are racist, 20% of… https://t.co/jMqmJDl9rs",0
175,175,81,L1ttleLucyy,2023-02-21 22:46:41+00:00,112,27,1,1,2369.0,"#lucemond idea!
Where the greens win and Lucerys is the only survivor of the blacks. They plan to make a show of the boy to discourage those who would think of overthrowing them. 
All the dragon are dead, and many eggs are left beginning to turn cold.",2
176,176,82,Vonn_Diesel,2023-02-21 19:44:13+00:00,81,0,2,1,1887.0,@Aristos_Revenge @anthonyvclark20 @raphousetv2 Blacks fundamentally think petty crime is legal,2
183,183,89,wellgasemall,2023-02-21 23:29:39+00:00,61,1,0,0,1250.0,@Klaus_Arminius Majority of blacks agree that homicide should be legal if the victim is nonblack.,2
184,184,90,ClastonB,2023-02-21 22:58:32+00:00,52,10,4,0,7820.0,"@DrIbram “True, history is to be taught without distorting the facts. However, when obscured to drive a certain narrative we should be cautious. In today’s America and the West, Blacks are often depicted as needing a liberal savior or programs to right https://t.co/2Z52iYkQQv…",2
194,194,0,s0tce,2023-02-21 20:06:00+00:00,539,91,0,1,20494.0,i have difficult conversations and i keep promises and i throw out trash and i am patient with people who need it,2
195,195,1,4ocean,2023-02-21 19:17:06+00:00,566,157,6,17,54801.0,"The face you make when you realize 4ocean has officially recovered 28 MILLION pounds of trash from the world's oceans, rivers, &amp; coastlines 🎉 

That's right, we just hit a new milestone! 

RT to celebrate with the clean ocean movement. https://t.co/jxlRn5Kdfg",2
196,196,2,LucyWoodslucy70,2023-02-21 21:44:33+00:00,923,406,27,25,20997.0,"At best  they  did not have a clue about  simple economics , trade with the richest block in the world, near neighbours.
At worst they were corrupt, underhand  and total liars.

All Tories are  Trash and Liars https://t.co/veO2yi2LKK",2
197,197,3,0xSxint,2023-02-21 17:20:13+00:00,163,63,67,7,52034.0,In 2014 Mr Adeboye the leader of RCCG led a march against Jonathan because of Osinbajo. Four days to the polls with only one viable Christian  and he is spilling silent trash. Mr Paul Adefarasin is preaching cowardice. Please ask RCCG when God became a snub. Nigerians wake up!!! https://t.co/9yTjRFyYMY,2
198,198,4,sadsongforever,2023-02-21 18:44:12+00:00,326,28,9,4,15179.0,"Scuse me, who hates who!!! Pelin u should be ashamed of urself cuz u r the 3th person in their relationship not her .. U r so lucky cuz she's sitting there &amp; being civilized with a piece of trash like u 🚶🏻‍♀️

#YalıÇapkını #SeyFer https://t.co/L0UOJlfwqS",2
200,200,6,ockytop,2023-02-21 21:40:17+00:00,70,17,2,0,2620.0,"Bama fans defend murder, sucker punching women at ball games, etc. Good group of people. Absolute trash program along with a trash state.",2
201,201,7,trash_snapp,2023-02-21 20:03:54+00:00,66,34,1,2,6428.0,"With the dangerous weather coming up today and tomorrow, consider donating to Unsheltered Utah! They host overnight movie marathons to help keep people out of the cold, and they have volunteer info on their social media (or DM me and I can send you the info) https://t.co/ahhBcf4Bls",2
202,202,8,MatthewVocke,2023-02-21 23:50:27+00:00,51,4,31,2,2990.0,"Country music trash, combines with city music trash to make a lovecraftian horror beyond imagination. What brother and sister had this inbred mutant of a song?",2
203,203,9,HorsepowerProd,2023-02-21 20:48:33+00:00,82,4,5,0,7489.0,"sometimes I despair for this industry. the same old tired line ups with once hyped oldsters that were trash to begin with and newcomers fashioned in the same mold by the same management hacks.
thank goodness for the underground.",2
206,206,12,lilkd4wg,2023-02-21 23:34:58+00:00,50,0,9,0,6976.0,Get you a man who will watch and enjoy your trash tv shows with you 🥰,2
209,209,15,pfeifferpack,2023-02-21 20:18:53+00:00,103,164,5,7,1832.0,"NYCACC will add dogs at 6pm,they aren't playin' with the euth orders. At this moment 5 lives are in great danger: ARIES, BABY P, AKIRA, PAPA, &amp; KING all may be minutes or hrs from a needle &amp; trash bag. STEP UP! DM @notthesameone2 to foster/adopt if you live between Maine - N. Va. https://t.co/eg0V7DuRNS",2
210,210,16,spidersam616,2023-02-21 23:45:18+00:00,62,5,2,1,5022.0,"Don Cheadle on the return of David Tennant to Doctor Who 

“ I don’t even know who that is, is Doctor Who the one with the beam me up? or the one with trash bins that are robots?”

Source: Doctor Who Magazine https://t.co/Vwy9qw1xmq",2
212,212,18,Chocobotwinkie,2023-02-21 19:22:18+00:00,343,4,1,0,3426.0,"@ask_aubry If you’re gay, own it. Be proud of it. Don’t trash women cos you don’t wanna have sex with them.",2
215,215,21,GoAwayWithJae,2023-02-21 16:52:20+00:00,228,36,6,2,9335.0,"😬Let it be known that the ""leftover US Army rations"" was often discarded food that US soldiers threw into the trash &amp; starving Koreans dug out of the garbage to eat. The US military wasn't handing out cans of unopened Spam or beans to share with Koreans, as this article implies. https://t.co/Gy3M9bStjF",2
221,221,27,PaulyBlackk,2023-02-21 13:46:53+00:00,210,6,5,2,10536.0,"@jiggyjayy2 And these niggas that’s ok with his woman having that mindset are trash too. If my BM need help with something that’ll ultimately make my child life easier, imma do it. My girl Gon have to deal with it or she know where the door at. 🤷🏿‍♂️",2
237,237,43,PoliticalTragc,2023-02-21 20:48:31+00:00,59,23,3,2,1065.0,"It’s totally unwatchable. I listen to the Radio now after watching early German/French/Al Jazeera news on @SBS.  @NewsBreakfast is no more than infotainment trash with Millar leading the giggling line up of fools. 

It’s really sad what has happened to our public broadcaster.",2
241,241,47,areola_ayatolla,2023-02-21 16:45:25+00:00,242,5,5,0,3412.0,"@CNN I have to believe now that CNN just wants to fail. There is no other explaining this sort of trash article with no supporting details, and a premise that should be obvious by now that no one is buying.",2
243,243,49,Bitanees,2023-02-21 18:31:19+00:00,698,26,4,1,15652.0,"@bangantangirls AND dori belongs in the trash can because no matter what her name is (it is persian with a turkish suffix) she is a stereotype that targets the whole swana but specially arabs so no one can ""make her okay""",2
248,248,54,SamuelWBell,2023-02-21 17:26:37+00:00,54,4,2,1,4156.0,Great time cleaning up trash in southern Mt. Pleasant with @MSanchezPVD and @DavidMoralesRI at the cleanup we sponsored through Amos House! https://t.co/xrVoY4Mpht,2
252,252,58,AngBonaTv,2023-02-21 21:34:07+00:00,154,24,6,1,2947.0,"This company is utter trash!  I closed my account over 2 months ago, and im waiting for my security deposit to be returned to me, and now im just getting the run around.  Seems im not the only one waiting for these fraudsters who i have had issues with since day 1. https://t.co/Vdc6WrYMyv",2
266,266,72,shadysanctuary,2023-02-21 18:33:02+00:00,108,13,1,2,3861.0,"@people He’s a creep who trash talks his wife’s sister in DMs with fans, all while allegedly being given her money through shady means.",2
278,278,84,PhilipThalis,2023-02-21 20:25:30+00:00,77,3,1,0,5876.0,"@Cobylefko Such large footprint, mono functional, unadaptable buildings are the dinosaurs of the age.
More broadly we need to trash the failed concept of a CBD, &amp; return to real mixed city centres, ennobled with public buildings &amp; places, calmed tree lined street, public &amp; active transport",2
280,280,86,hexminaj,2023-02-21 17:43:04+00:00,81,2,6,0,644.0,"@iamcardib go pick up that damn trash, along with your music career and put it in the garbage, you botched face excuse of a rapper",2
281,281,87,byetwit,2023-02-21 23:41:28+00:00,124,9,1,1,1264.0,"@pattykazUSA Let us not forget that the media invented ""Protocols"" to trash Meghan for every style choice, and that same media is now praising Kate. 

Peak colonizer
Proving that they NEVER had a problem with anything Princess Meghan did, they just had a problem with HER doing it",2
288,288,0,yannaa__x,2023-02-20 22:23:37+00:00,5658,1509,11,327,385734.0,when we fuckin i need u to lose all yo morals 😭😭😭😭,1
289,289,1,DB_SB_32_72,2023-02-20 01:57:43+00:00,65,11,3,0,4256.0,since u got ur degree &amp;&amp; u kno every fuckin thing;^)))) https://t.co/lB3fGifCSC,2
293,293,5,obkatiekat,2023-02-21 22:00:40+00:00,605,17,22,0,41670.0,u fuckin wot m8 @DeputyARUUU https://t.co/tDxcUCgpaX,1
295,295,7,BadGyallRiRi,2023-02-21 19:03:02+00:00,515,135,4,9,28202.0,"If you do not like a job, quit. Leave the fuckin work. But do not stay there and sabotage the ppl business or make you and the ppl around u uncomfortable. It’s simple. If u unhappy with a job, quit. If u cannot quit, do wtf u collecting the ppl dem money for. Do your job",0
296,296,8,southcentralJAG,2023-02-21 18:27:02+00:00,167,6,42,6,22184.0,Lost my fuckin brother last night!! Nigga u da reason a JAG was even created!! I love u bro bro…I miss u dawg!! Dis one hurt…we gone turn up for u tho on da set!! #LongLive89 🙏🏾 rest up my g…,1
306,306,18,joshuaIover,2023-02-21 09:03:38+00:00,78,0,25,4,5061.0,here is my timeline of being a freak on the internet if u knew me before 2021 no you fuckin didn't! https://t.co/zYKw5TWQHF,1
308,308,20,DejaRu22,2023-02-21 15:15:21+00:00,553,58,25,2,30911.0,"No need to overfink fings bruv

U already kno the anser 
U already know what 2 do

U just overfink fings in ur head as a way to continue to B a pussy bruv

Just fuckin do it bruv stop overfinkin fings",1
310,310,22,I_SHOOT_COPS,2023-02-20 15:06:21+00:00,345,36,6,2,11882.0,this a fuckin fossil bro u smoking on triceratops dung,1
325,325,37,BIMBOMINDSET,2023-02-21 15:10:36+00:00,53,1,5,2,4058.0,i really need these men who sit around around and bitch about masculinity and gay people and woke cereal boxes or whatever to pick up a fuckin woodworking hobby. how bout u go build something??,1
328,328,40,DIZASTERBANNED,2023-02-20 20:42:09+00:00,172,8,12,3,22982.0,Man @metaphormessiah and @NUJERZEYTWORK are so diverse with this shit right now . Its making me wanna do something again like the ketchup thing but even crazier . Inspirational ass wordsmithing . Fuckin love u guys this shit has been better than actual battles 🤣🤣🤣,1
335,335,47,dwtarig,2023-02-21 00:10:41+00:00,54,1,1,0,11364.0,"fuckin w u (feat john legend)
https://t.co/Z9sFSbKUuM",1
340,340,52,nytherzz,2023-02-21 00:13:42+00:00,84,0,2,0,3348.0,@cxlame he jst kept fuckin her n went bout his night like???? u good bro? cassie dumb ass jst there quiet,1
357,357,69,MounkeyM,2023-02-21 22:14:34+00:00,593,0,2,0,7234.0,"@RespectElves @bigpennies2323 wow, the fuckin ""no u"" comeback, creative",2
365,365,77,popbasae,2023-02-21 13:56:27+00:00,73,1,2,1,2156.0,"Don't jump me but all of the leaks were scrapped for a reason, exept outgrown, jada, my way and fuckin with u...",1
398,398,0,elephant_ring,2023-02-21 10:15:11+00:00,68,5,25,2,8544.0,"Now I know this weak ass white boy ain’t talking.
Simping for his girl while she got her ass out for all of us to see.
He wifed what everybody else already had.
And the last pic? I don’t even gotta say it. We all know what’s up. Ole boy tagging his girl in front of him. Promise u https://t.co/vkTFKx0yzs",1
400,400,2,nelthreepoints,2023-02-21 23:45:07+00:00,62,5,6,0,1066.0,Trans folks should do big gender reveals like white people do for their dumb ass kids. Like change your pronouns and light a field on fire. Chad shit,1
402,402,4,helloimbernardo,2023-02-21 17:50:20+00:00,69,3,3,0,1208.0,"him: you better not be balloon walter white when i get there

my whimsical and rebellious ass: https://t.co/hZOz6TU4nL",1
403,403,5,JosNamesnotJo2,2023-02-21 13:06:22+00:00,71,6,9,0,1914.0,To the niggas that put Minnie's Mouse's fat rat ass on my timeline o just wanna say you are never seeing the pearly white gates https://t.co/tBTUWG1moe,0
406,406,8,liixies,2023-02-21 17:22:51+00:00,55,2,1,3,1066.0,Can they please get rid of this ugly ass white border around the album covers https://t.co/KhM856ul0o,0
415,415,17,emcsquaredxx,2023-02-21 23:09:58+00:00,69,6,14,3,6583.0,"- Yellow ugali&gt;brown ugali&gt;white ugali 
- pancakes&gt; waffles
- Chocolate cakes should be made with a good amount of dark chocolate instead of milk chocolate or with espresso...to add richness instead of making it aimlessly sweet 
- Fruit cake is ass 
- Day after pizza&gt; Fresh pizza",2
422,422,24,HanumHusen,2023-02-21 15:15:34+00:00,66,3,1,0,3577.0,"@Busy_royals Ass patting, ass grabbing, ass caressing, it's all fine, if you are a white royal, even if it's your own daughter's ass.",1
429,429,31,EenPluviometer,2023-02-21 10:57:09+00:00,65,0,4,0,2606.0,"@Archang17382675 @CitizenFreePres So because he's not directly affecting your white American ass, he surely can't be the bad guy here. What a selfish way to look at things man.",0
478,478,0,iastonmylist,2023-02-21 22:19:20+00:00,355,49,6,3,11101.0,white boy holy trinity https://t.co/auiiGAAEda,2
479,479,1,UpdateHLD,2023-02-21 16:31:29+00:00,6387,355,44,89,177170.0,"“You know what it is? He really works hard. And, that little white boy can sing! He really can sing! I was like, ‘Oh help, he’s singing! Show out!’ It’s an amazing show, it’s just him and the band so there’s not dancers, and he can dance and all that.” 

-Jacob from Gabriels on…",2
480,480,2,Harry_StylesUp,2023-02-21 16:32:30+00:00,307,20,2,2,17359.0,"“You know what it is? He really works hard. And, that little white boy can sing! He really can sing! I was like, ‘Oh help, he’s singing! Show out!’ It’s an amazing show, it’s just him and the band so there’s not dancers, and he can dance and all that.”",2
481,481,3,F41RYTA1L,2023-02-21 19:21:59+00:00,54,5,6,0,3098.0,white people just be saying anything bro why this white boy said “this is so ghetto and boujee…” like those are contradictory asf 😭 and then when i asked him if he even knew what boujee meant he said no,0
483,483,5,RightWingWatch,2023-02-21 19:15:54+00:00,928,228,342,93,241300.0,"White nationalist Tyler Russell says ""we're in 2023 now, we've got to stop dissing the Nazis. We got to look back at our boys like Oswald [Mosley], like Francisco [Franco], like Benito [Mussolini]. We gotta be like, 'Yo, we're ganged up out here.'"" https://t.co/S8ljCTUofi",2
487,487,9,p4tthebunny,2023-02-21 18:42:12+00:00,52,1,1,0,3522.0,Me and the quirked up white boy i pulled by being a beautiful biracial princess https://t.co/hv5aZyzZ1s,2
