,Unnamed: 0.1,Unnamed: 0,User,Date Created,Number of Likes,Number of Retweets,Number of Replies,Number of Quotes,Number of Views,Tweet,class
6664,6664,87,alitlstrawberry,2023-02-21 22:06:53+00:00,109,0,0,0,5766.0,"@lovedoveclarke i've rarely seen anyone get the type of hate you get constantly. people are so weird to you. you seem very happy in your relationship and have such a fun sense of style, and some people are miserable and mad that you're not also miserable i think",2
6665,6665,88,DembaiVT,2023-02-21 22:29:33+00:00,121,2,0,0,724.0,"@tgwrh @ThomasF59266788 @AmirTalai Honey it's like you think we don't actually grow up that way. I was groomed repeatedly by the church, including an up to sexual abuse from my pastor. It didn't make me any straighter or less trans. You. Are. Already grooming us.

And we don't hate you. You hate us.",0
6669,6669,0,Theesovereignn,2023-02-21 23:24:22+00:00,4346,1828,84,185,286905.0,Maybe when a white man tells you how crooked our judicial system is you will believe him. https://t.co/xkBzXARCXg,2
6670,6670,1,miamingus,2023-02-21 23:42:43+00:00,1278,400,5,12,62922.0,"Disability Justice requires systemic change and that we reimagine and build a world that values disabled people (and our communities) and that is not rooted in abled supremacy, exploitation, oppression, violence. 

Please adjust white-washed definitions accordingly.",2
6671,6671,2,BialkoAndrew68,2023-02-21 23:14:08+00:00,156,74,57,12,6904.0,I can't tell is this more white supremacy,2
6673,6673,4,snowflyjoe,2023-02-21 23:29:19+00:00,57,6,0,1,1235.0,Jaebeom just in a white t shirt but my god is he good looking https://t.co/uQxMbgruRG,2
6674,6674,5,PAPatriot16,2023-02-21 23:42:10+00:00,55,63,7,4,2480.0,Who else has seen this? The Chat GPT AI system is woke. Computer language models like this will soon be performing many tasks currently done by humans and they'll all be programmed to discriminate against white conservatives. https://t.co/Fq98ZSMf87,2
6675,6675,6,monitoringbias,2023-02-21 23:41:06+00:00,2402,352,48,13,104398.0,"White violence overwhelmingly targets other whites  —82.4% of the victims of it are white.

But black violence mostly targets other races  — only 40.9% of the victims are black.

Is this one of those statistical disparities that Kendi says proves racism?

https://t.co/I2y1H7RLQz",0
6677,6677,8,TridentTruee,2023-02-21 23:35:22+00:00,56,2,0,1,1990.0,Evan White is SO back https://t.co/v9nY1pBlwQ,2
6678,6678,9,knflkkollective,2023-02-21 23:39:58+00:00,170,44,21,22,18488.0,"There are a lot of things worth gatekeeping, but language should not be one.

Black folks, white and other non-Black folks using AAVE is not the end of the world and helps us all communicate.

As such, I’m giving a guide to a few popular words/phrases they can use to communicate",2
6679,6679,10,KamilaShakur,2023-02-21 23:26:25+00:00,57,30,1,1,3657.0,Growing up in your decolonization journey is realizing your beef not just with white people lol.,2
6680,6680,11,chefmade_92,2023-02-21 23:25:58+00:00,385,112,11,13,38973.0,I may have the answer to this. The reason why elder black people pre-boil meat goes back to the Jim Crow Era. White butchers would purposely sell bad or tainted meat to black customers. This is a reason why black people order steak well done. 🪡 🧵,0
6683,6683,14,St1Station,2023-02-21 23:44:15+00:00,3742,361,46,11,318046.0,"A locked friend once said to me of white Zoomers that he is increasingly worried that many of them “are no longer being taught  to be politically incorrect where it counts, where it is literally life and death.”

This is exactly what he means.",2
6686,6686,17,beau_throws,2023-02-21 23:34:04+00:00,55,3,1,0,2807.0,"Nike athletes that win an Olympic or World Title receive a Golden🥇 uniform kit for the following year. Some examples👇

V. Alekna (2006-white top)
V. Alekna (2007)
Christian Cantwell (2010)
Ryan Crouser (2023)

My fav is the 07' Nike Kit🔥 https://t.co/ZhTImVFGSs",2
6687,6687,18,nontobeko_ngu,2023-02-21 23:18:57+00:00,61,1,4,1,4324.0,"Jojo is such a snake , everyone understood what Slee meant but now you’re turning it into something else . She’s such a white lady  #RHODurban",2
6694,6694,25,emcsquaredxx,2023-02-21 23:09:58+00:00,69,6,14,3,6583.0,"- Yellow ugali&gt;brown ugali&gt;white ugali 
- pancakes&gt; waffles
- Chocolate cakes should be made with a good amount of dark chocolate instead of milk chocolate or with espresso...to add richness instead of making it aimlessly sweet 
- Fruit cake is ass 
- Day after pizza&gt; Fresh pizza",2
6697,6697,28,pharnzwurth,2023-02-21 23:38:24+00:00,60,11,12,0,805.0,"@annatime94 Apparently anyone complaining about this is just trying to white ant Labor 
- paraphrasing - 
""they must stay in government to change things, but they can't change anything because they must stay in government""",2
6699,6699,30,emo_garfield420,2023-02-21 23:27:58+00:00,51,0,3,0,2956.0,"When I walk through my neighborhood at night everyone is like ""ayy you aight, white boy""",2
6701,6701,32,LikeADroppedPie,2023-02-21 23:37:57+00:00,73,2,231,5,11899.0,"@OzraeliAvi All I see is another old white guy complaining that he can't be racist, homophobic and transphobic without being called out on it anymore.",0
6706,6706,37,Cocogoatcutie,2023-02-21 23:54:58+00:00,415,40,6,0,7118.0,"You guys are lunatics. Simple as that.
You are mentally deranged.
You are seriously trying to compare a woman crying after getting dogpiled for playing a VIDEO GAME, to racist white women playing victim to get black men LYNCHED!? Jesus fucking Christ. WHAT is wrong with you?💀",0
6707,6707,38,BrookIT2,2023-02-21 23:37:02+00:00,52,5,3,0,2086.0,"Many such cases.

Batman should use guns. (They are completely against his principles).

Batman would hate and fear Superman. (He thinks supes is a better man than himself)

Batman is a rich white asshole who beats up poor people. (Most of his enemies are rich white assholes.)",0
6711,6711,42,AndrewPollackFL,2023-02-21 23:47:16+00:00,168,30,11,1,12953.0,"Those other ‘high income’ countries you speak of have a higher % of White &amp; Asian populations — they also do not have God-given 2nd amendment rights. 

Ignoring fatherlessness, mental illness &amp; the deterioration of community as a culprit to mass shootings is flat out ridiculous.",2
6714,6714,45,brokencrosses,2023-02-21 23:29:47+00:00,103,0,3,0,1886.0,"@RedxRedxWhine @NotHoodlum Yeah, let's feel sorry for the child of privilege who is a white supremacist",2
6718,6718,49,JoeDanaReports,2023-02-21 23:30:35+00:00,88,17,30,6,21307.0,🧵The concepts discussed in a bestselling book is at the center of debate at the Scottsdale Unified School District tonight. A superintendent's job might be on the line for it. Our @MichaelDoudna will have updates at 5pm and 10pm on @12news.  The book White Fragility proposes https://t.co/x2qGrrdWOq,2
6721,6721,52,jonalexart,2023-02-21 23:36:10+00:00,84,0,1,0,3896.0,"@CoreyBrickley White to match that absolutely ski slope shaped skull, why is the crown of her head looking at me?? https://t.co/ebPDJMZrtM",2
6742,6742,73,MsMariaT,2023-02-21 23:29:19+00:00,89,5,1,0,1351.0,"@RonFilipkowski Lol, the jury foreperson is a white female, kinda hard to scream racism.",1
6743,6743,74,jordanzakarin,2023-02-21 23:42:18+00:00,52,7,3,0,1202.0,"Randy Fine is Jewish (as am I), but that does not give him permission to compare doctors who treat children live their best lives to an evil sicko who tortured people to death. 

Fine is doing the work of white nationalists and a governor beloved by Nazis. He should think hard.",2
6749,6749,80,TonyStuart55,2023-02-21 23:36:40+00:00,261,32,41,3,19560.0,"What the heck is this @NZStuff? Do you endorse this overt racism and anti-white rhetoric. Does repetitive swearing now  count as ""art""? Would you publish this if a white person was celebrating the murder of a famous Maori or person of another race or culture?",0
6750,6750,81,indumathi37,2023-02-21 23:41:49+00:00,117,23,3,0,6100.0,It’s legitimately hard to understand how this is speaking truth to power *in Seattle* when all the white people testifying are pro ordinance.,2
6829,6829,0,BanklessHQ,2023-02-21 21:23:24+00:00,19,4,64,9,56885.0,Will AI kill us all?,0
6830,6830,1,ukilaw,2023-02-21 22:52:54+00:00,7262,2681,158,102,289926.0,"What will you choose if asked by a barbarian militia outside 1. Accept servitude, 20% of all what you own is ours forever. 2. We kill men &amp; take women as sex slaves. 3. Accept Islam &amp; Mohammad as the true prophet &amp; we spare your life. Millions made these stark choices before you. https://t.co/kQDlPNosi9",2
6831,6831,2,TheRedmenTV,2023-02-21 22:31:54+00:00,401,18,40,1,48718.0,It's the hope that kills you and all that...,2
6835,6835,6,TheImmortalKop,2023-02-21 20:53:49+00:00,1129,54,10,2,44855.0,"I’m fuming man I witnessed a Nunez all timer goal and then we bottle a 2-0 lead to kill the mood, 2nd half run it back",2
6836,6836,7,NS_Provo,2023-02-21 23:08:13+00:00,96,22,1,5,8187.0,"The Male rappers telling u to kill, rob, scam, pop perks, spend all ur money. 

The Female artists telling u to cheat, prostitute, not need a man, fuck his best friend. 

Loll the world is cooked!",1
6839,6839,10,NMBewitched,2023-02-21 20:32:30+00:00,122,204,2,4,2670.0,"#NYCACC
4 New Kill Commands

Akira 2yr 44lbs
Stuffie lover &amp; adventurer

Jack S 3yr 80lbs
Treat &amp; Toy Boy

King 4yr 69lbs
Our long stay

Papa 2yr 70lbs
Big Gentle Baby

All need time, security, guidance &amp; love
Pls #RT #Pledge #Foster https://t.co/rrmeLui2XJ",2
6843,6843,14,iGamer4tv,2023-02-21 23:00:36+00:00,668,2,6,2,62157.0,@JakeSucky JAKE IM LITERALLY NEVER GONNA BE FREE 😭😭 thank you for all the blessings though. I currently have 74 spin wheel challenges too so I can’t even get kills on the board 💀,2
6852,6852,23,MathsPlusPlus,2023-02-21 23:38:26+00:00,413,36,8,2,9807.0,@DrKGregorevic @ProfMarkBowman When you board an airliner the airline has thrown every defence available at preventing a crash that might kill you. All based on scientific and engineering principles and no RCTs. Would you like them to remove all those safeguards and replace it with a cost benefit analysis?,2
6857,6857,28,littleWolff_,2023-02-21 20:38:52+00:00,74,5,4,1,3167.0,"So uhhh. Are we doing solo funerals or a big joint service tonight after the #TheRookie Episode kills us all? 
#Chenford

ʰᵒʷ'ˢ ᵗʰᵃᵗ ᶠᵒʳ ᵈʳᵃᵐᵃᵗⁱᶜ",2
6862,6862,33,rusinformatsia,2023-02-21 21:03:11+00:00,97,3,31,0,9307.0,"Dmitri and Dmitri wented on mission in #Bakhmut today. They return with 6 prisoner on BMP and they kill nazi:

89x 🇺🇦
320x 🇵🇱
226x 🇫🇮
189x 🇬🇧
167x 🇬🇪
153x 🇺🇸
111x 🇸🇪
61x 🇮🇹 (immediate surrendred)
24x 🇯🇵 (all destroy)
3x 🇳🇴
2x 🇮🇱

What notice? All is from notorious NAZI country.",2
6912,6912,83,Prolife_Sam,2023-02-21 21:52:49+00:00,51,5,3,1,1514.0,"“No no, see we are still the good guys because the abortion pill doesn’t directly kill the child, it just removes their life support so it’s all ok!”

It directly kills them by purposefully removing their access to life support until they starve but either way, horrific argument.",2
6921,6921,92,Nerbit_13098,2023-02-21 20:00:56+00:00,482,40,19,0,8381.0,"""If your house is solar powered could you kill a vampire by turning on the lights because it is energy from the sun""

Something I said this morning that has been in my head all day lmao",2
6922,6922,0,pissboymcgee,2023-02-21 01:57:44+00:00,3990,256,12,21,187885.0,this flag is for all my accountant friends. i’m protecting the thin green line this tax season. please don’t kill yourself i love you and i want my tax return https://t.co/SYwNM0cClN,2
6923,6923,1,Paul_Mohlakoana,2023-02-21 13:45:27+00:00,126,15,14,5,9526.0,To all runners don't kill yourself 😂😂😂😂😂😂 https://t.co/D2HARE49Kx,2
6927,6927,5,x_senastr,2023-02-21 11:02:33+00:00,80,4,1,0,3275.0,"~ Over Attitude and Confidence will Kill Yourself...

Meanwhile Me: https://t.co/gjrRA5pj8o",2
6930,6930,8,sinxsakurai,2023-02-21 22:16:48+00:00,54,1,1,1,3407.0,"As someone who tried to commit suicide, I can say ""kill yourself"" /s",0
6937,6937,15,akhynl1nks,2023-02-21 13:45:11+00:00,61,22,8,2,3163.0,"After the outcome of election, Tinubu, Atiku and Obi will dine together. 

They are friends don’t kill yourself for them o👋🏽",2
6938,6938,16,Yonnitheducc,2023-02-21 17:34:03+00:00,87,4,21,1,2741.0,if youre 15 kill yourself,2
6940,6940,18,aaronaxolotl,2023-02-20 22:37:09+00:00,77,3,0,0,2534.0,"Kill yourself, you absolute disgrace. https://t.co/oosF8rDIpN",2
6942,6942,20,ComradeMDU,2023-02-21 19:34:35+00:00,77,11,11,1,4739.0,"You forcing your luck too much. You will collapse so painfully.

We will be here watching you.

You will be embarrassed and you will even wish to kill yourself.

Be warned. https://t.co/2p8en9g22e",2
6943,6943,21,unrealpathan,2023-02-21 10:52:14+00:00,54,5,1,0,1430.0,"the ""kill yourself"" beast in me is hungry",0
6950,6950,28,camerobradford,2023-02-21 05:18:15+00:00,178,8,0,0,6813.0,"Know your rights: if you tell a cop that you recently fumbled a bad bitch, they’re required to let you use their service weapon to kill yourself",1
6955,6955,33,BrightEyes1170,2023-02-21 11:43:40+00:00,129,1,3,0,5014.0,@GlasnostGone Now...... Let´s speed up to the part where you kill yourself in the bunker...,2
6972,6972,50,AightWhiteBoi,2023-02-21 04:56:42+00:00,208,2,1,0,7800.0,"@RRadRyan @_BarackSays The trump ""kill yourself"" at the end got me hard",2
6973,6973,51,sometherapist,2023-02-21 04:26:06+00:00,134,12,4,0,3681.0,To anyone out there who thinks it’s preferable to kill yourself than to do the incredibly hard work of admitting you made a mistake: it’s not. Many people before you have found the strength to admit to themselves that they made a major mistake. You can do it too and you WILL find…,2
6979,6979,57,renoomokri,2023-02-20 20:27:25+00:00,174,44,20,2,17404.0,"These 5 things will kill your mind, your dreams and your goals, and eventually your body:

Overuse of social media 
Comparing yourself with others 
Not sleeping at least 7 hours daily 
Being nice and saying yes to everyone 
Tolerating abusive relationships 

#RenosNuggets",2
6988,6988,66,AHandyGingerGal,2023-02-21 13:01:02+00:00,112,13,18,2,14539.0,"Armed intruders break into your home while you &amp; your elderly mother are sleeping.

You use your legally owned firearm to defend yourself &amp; kill 1 of them.

You are arrested, &amp; charged with murder. One of them is arrested and NOT charged with attempted murder.

Oh, Canada",2
6995,6995,73,hse1232,2023-02-21 06:15:29+00:00,68,5,4,2,5674.0,"I’ve met this brother when he was in his late teens.

He was a staunch Muslim, full of energy &amp; idealism

His teen self would hate what he’s become

Western politics kill your imam

You’re constantly being asked to demonstrate how ‘un-Muslim’ you are to prove yourself trustworthy",0
7002,7002,80,Jackiew80333500,2023-02-21 11:08:55+00:00,127,59,2,1,3823.0,Always putting yourself as the victim makes you able to say 'We will never forgive the Arabs for making us kill their children.',2
7006,7006,84,AdrianConway_,2023-02-21 17:05:33+00:00,143,25,8,1,23389.0,"@CrossFit demands a humility and self awareness some aren’t yet prepared for.  You don’t just walk in and “kill a workout” at good affiliates. You learn about yourself, meet yourself where you are, and constantly try to grow and evolve from where you are today. 
#morethanfitness",2
7010,7010,0,doefaced,2023-02-21 20:45:42+00:00,1398,232,15,14,36882.0,"My antidepressants are testosterone, sex with faggots, and smoking weed in a little patch of soft grass",0
7011,7011,1,undeadbestie,2023-02-18 08:47:10+00:00,52,3,4,0,2567.0,drew a little faggot boymoder in the void https://t.co/oinMAIFexf,0
7012,7012,2,n__c__l,2023-02-16 04:38:42+00:00,173,2,7,0,10447.0,had a slur screamed at me while I was holding hands with a man last night and I’m genuinely shocked at how little power the word faggot has over me at this point lmao,1
7021,7021,0,thehaalag,2023-02-21 23:43:54+00:00,1916,384,13,13,62786.0,"Allahummabarik everyone is either getting married or going to Umrah, i would love some of the barakah that’s in the air 😭🫶🏻",2
7022,7022,1,JaneHalifaxMelb,2023-02-21 21:41:53+00:00,1115,360,69,21,23668.0,"So, Libs candidate for #Aston is a conservative lawyer with no links to area, writes articles for The Age, is married to Murdoch Herald Sun journalist James Campbell &amp; is being parachuted in by Libs factional powerbrokers rather than local vote by members? 🤣 #auspol #AstonVotes",2
7023,7023,2,isSHINeeback,2023-02-21 21:26:52+00:00,371,88,0,2,5860.0,Jonghyun's lil' ponytail in the Married to the Music era is what is currently holding my sanity together https://t.co/QpMNsak82o,2
7025,7025,4,zeenatmikail4,2023-02-21 21:31:53+00:00,82,14,6,0,1563.0,"People think they want to get married, but to me, marriage is not the goal. A successful marriage is a goal. I don't just want a ring on my finger. I want a happy marriage. A long-lasting marriage where joy, pleasure, respect, devotion, admiration &amp; true love is always present.",2
7026,7026,5,olivier_patti,2023-02-21 23:37:21+00:00,145,58,8,2,2735.0,"I found this..
Thought I  would share  with you...
From President Carter to his beloved wife Rosalynn
They have been married  for 76 years...
Isn't it beautiful.. !!
So Loving 
I am so grateful  they are  together at their home now..🙏❤️
#JimmyCarter https://t.co/8gjBW99vQO",2
7028,7028,7,CartoonCrap,2023-02-21 22:56:33+00:00,57,12,2,3,3679.0,"BREAKING: Bob Iger hints at the premise of ‘Toy Story 5’.

“We were thinking about other concepts we haven’t explored yet. How do Toys get married? How do Toys pay their taxes? How do Toys make love to each other? And most importantly, how do Toys have babies?” https://t.co/jmXiDC0nOq",2
7033,7033,12,boxerbriefanon,2023-02-21 22:05:32+00:00,249,10,4,0,8893.0,"“You got married!”
“I did!”
“But not to Christopher…”
“Which is weird, I know…”",2
7036,7036,15,LegoKingo,2023-02-21 22:50:51+00:00,64,6,4,0,2429.0,"i kinda get not wanting batman to be married off, the 'mature' version of the character is a gruff single dad who loves his kids and is still working, but there is absolutely no reason for Peter Parker to not be the Jay Garrick of marvel right now",2
7040,7040,19,RiverFairy68,2023-02-21 23:49:46+00:00,61,0,7,0,825.0,"Time for me to lock up. Not sure where I gave some the impression that I was lost but I assure you, I’m not. My DM’s are not open to your disgusting images. I am not political &amp; I am a witch &amp; very married to a Druid &amp; should you not like my post, unfollow me https://t.co/E2uh7HQzE4",2
7043,7043,22,animmaimota,2023-02-21 21:25:59+00:00,71,30,2,3,62625.0,harriet tubman when she came back to the plantation and saw her husband married somebody else:,2
7045,7045,24,channel_pup,2023-02-21 22:39:54+00:00,129,21,13,3,3804.0,"""She's more like a sister to me"" whether you're trying to assert that they can't happen or not, this is horrendous. Peter, you fucked her numerous times. You literally married her. What the fuck, Peter. https://t.co/0RitX4iO2D",0
7047,7047,26,swiftlymel,2023-02-21 22:06:06+00:00,52,1,6,0,1185.0,here's my New doll  she  doesn't have a name yet i need help naming her her backstory is She poisoned her  ex husband  during their marriage to Get away  with a girl bc she's actually Lesbian   And she's soooo beautiful   She never wanted to get married but her parents did https://t.co/DYcxB5hVb8,2
7051,7051,30,RiotLinguist,2023-02-21 22:47:12+00:00,520,83,13,3,37796.0,"this is completely normal &amp; widespread in evangelical communities. my two best friends were both married to older men at 18, one to her 23yo boyfriend she'd been with since she was 13. the youth pastor below is 24.

the other friend was married to a 30yo man she'd been with at 17",2
7067,7067,46,deliclit,2023-02-21 21:54:53+00:00,147,8,1,1,7716.0,girls changing their insta @ to their new name after they get married https://t.co/qCWg1FieRE,2
7069,7069,48,CheeniAmmi,2023-02-21 22:40:18+00:00,52,2,1,2,6370.0,"Some women even quit their jobs when they get married to become SAHMs. In some fields, a few years out of the workforce means your skills are considered obsolete.

Should something happen (death of a spouse/terminal illness, divorce, etc), you have to start from scratch.",2
7078,7078,57,EllieGSing,2023-02-21 22:05:12+00:00,82,0,5,0,2237.0,"Applied to grad school, got married, visited 2 seminaries, and February isn't even over yet 🥳

Here's a pic of me about to smash a candle with a hammer on the back deck of a convent https://t.co/H9ftn5S97J",2
7083,7083,62,walterkirn,2023-02-21 21:20:38+00:00,246,11,27,1,12242.0,"Happy Birthday @amandafortini  , a writer of outright spooky perceptiveness and refined precision on whom, to use a notion from Henry James, ""nothing is lost."" You might have married a prince, but you married me -- and turned me into an honorary prince. Many happy returns!",2
7085,7085,64,Canellelabelle,2023-02-21 22:26:46+00:00,168,0,3,0,3683.0,"@HRHGrandDuchess Everyone knows William is happilly married to the love of his life, instead of some used up yatch girl who likes to sliding in Rich men's intagram DM. I am glad my posts trigger you. 😎",2
7090,7090,69,mediocremumsy,2023-02-21 22:44:38+00:00,111,1,2,0,9165.0,"@Swilua Mine is that I got broken up over text because he had a dream he was in the temple getting married and he saw a girl that wasn't me. He didn't even go to school there. Just me lol
God helped me dodge a bullet there ;)",2
7091,7091,70,MavenOfMayhem,2023-02-21 22:53:13+00:00,264,3,3,0,6252.0,I've been with my wife for nearly 30 years and married for over 25 of them. We've raised four great kids. We have an incredible amount of love for each other. Come back to me when you can show me you know how to love someone and be loved by them better than that.,2
7101,7101,80,RiotLinguist,2023-02-21 23:29:45+00:00,217,41,0,0,3645.0,"not only are evangelicals the primary political barrier to banning child marriage, but in many states where a child can be married to an adult, that child cannot legally file for divorce until they are 18.",2
7107,7107,86,Nwando__,2023-02-21 21:49:17+00:00,52,12,9,9,15237.0,"Ooo this exact thing happened to me and my then best friend. 

We didn’t set him up. I don’t believe in those things… I confronted him, he didn’t stop. I had to tell her, I even showed her texts he sent me. 

Mama told the whole world I was jealous of her. They are married now.",2
7115,7115,94,mrsbaruela,2023-02-21 22:05:07+00:00,52,0,0,0,1499.0,@Canellelabelle MM talking about Waity Katy when she’s the one dying to married into The Royal Family! She got in and got out real quick 😂🤣😂,2
7118,7118,2,WhoisSatrn,2023-02-21 14:19:51+00:00,56,4,6,2,2641.0,Shut up you talentless fag https://t.co/RviN9r23lZ,0
7119,7119,3,theSaltyAlty,2023-02-21 21:35:53+00:00,63,4,8,0,3286.0,"Soooo...People shit on the Hogwarts game for being transphobic somehow, but GTA 4 had missions where you protect your OUTRAGEOUSLY stereotypical gay friend, and someone calls you a ""fag lover"" and beats the shit out of the gay guy, and suddenly they don't care????? Fascinating :)",0
7120,7120,4,chuugagotoku,2023-02-21 16:33:08+00:00,166,27,1,1,4223.0,our fag means death https://t.co/5EkNg8BVDn,0
7121,7121,5,hekateanfoodie,2023-02-21 03:07:24+00:00,52,10,4,1,1134.0,Ohhhhhmyyyy 😍😍😍😍😍 by Mikeybooch on tumblr @pinko_fag https://t.co/069iw09KjT,2
7123,7123,7,gay_goths,2023-02-21 19:56:02+00:00,70,4,3,1,2752.0,i know i’m not the only fag drowning in beautiful women,0
7131,7131,15,M4TTDAN,2023-02-21 15:24:07+00:00,54,1,7,0,1487.0,all that on vapes 😭😭😭😭 just buy fags at this point they look so much cooler https://t.co/SFxYBpsOpg,0
7144,7144,28,nickelsgb,2023-02-21 10:34:59+00:00,75,0,18,0,1220.0,4 Weeks yesterday without smoking but what a long day. I was very tempted to go to my mates over the road and have a joint  I was in a lot of pain but I never and feel much better for it. It's so nice to get up without worrying whether I've got enough fags or running round shop.,2
7156,7156,40,gayest_tone,2023-02-21 05:26:34+00:00,80,1,1,0,471.0,@JeannaHoch In 2000 you could call gays mentally ill fags too but see we stopped doing that,0
7159,7159,2,ArtieBucco69,2023-02-21 18:04:28+00:00,73,1,7,0,5393.0,"Some guy came in to the coffee shop and asked if we had hand sanitizer. I said “no but we have soap and water in the bathrooms” then he scoffed, called me a faggot and took a thing of Clorox wipes off the counter in front of me lmao",0
7166,7166,9,djdave43,2023-02-16 23:59:21+00:00,284,11,15,1,16806.0,@uxiedust I love when people call me a faggot like the lil gay boy I am 🥰🥰💞♥️🥰♥️🤤🤤🤤,0
7167,7167,0,BrobergMaine,2023-02-21 01:32:43+00:00,52,4,6,1,1777.0,"My Maine Coon Cat, Lars, is in love with MSNBC’s Nicolle Wallace. https://t.co/PmbjXUOBWv",2
7168,7168,1,PeterBrandEgypt,2023-02-15 00:25:48+00:00,76,4,5,1,3063.0,My Maine coon cats Ramesses and Khufu had a fluffy tail contest. Ramesses came in second https://t.co/zbM7d6bZrE,2
7181,7181,14,SandStoneArtis1,2023-02-15 06:51:29+00:00,148,27,12,1,16030.0,"Hello everyone! I am SandStone your fluffy maine coon (cat breed) Detective! I am a variety streamer and a voice actor! My debut is on March 16th, I also frequently do collabs! I can't wait to meet you, let's solve lots of mysteries together~ #vtubersupport #VtubersEN #vtubers https://t.co/niEYcQ6SbV",2
