,Unnamed: 0.1,Unnamed: 0,User,Date Created,Number of Likes,Number of Retweets,Number of Replies,Number of Quotes,Number of Views,Tweet,class
8216,8216,34,_Silvervale_,2022-06-21 21:06:39+00:00,743,10,5,0,,@zentreya i hate you,2
8237,8237,55,TheAgeofShoddy,2022-06-21 20:14:55+00:00,63,11,1,0,,"“Not giving power to people who obviously hate you and have an arsenal of excuses for why hurting you is justified” is a pretty basic political orientation, and if your theory of change involves convincing people to ignore it over the long term, well, good luck.",2
8259,8259,0,sugarstoohigh,2022-06-18 10:33:37+00:00,588,17,13,7,,"At Frankfurt airport customs, us boys got asked if we were here to play Rugby 🏉 

Sis, we are faggots… we are here for an art exhibition 💅🏽😂😂",0
8279,8279,20,womudotcom,2022-06-21 12:59:04+00:00,107,1,2,0,,"my good bitch it is santa cruz california!!! it is legal here maam!!! i know it's 6:30 am and this shit im smokin on my front steps is dank as shit and that these bitches im pulling are smokin hot and shit but like i am allowed to be a faggot druggie on my property, Ma'am!!!",1
8297,8297,0,Paula_White,2022-06-21 23:14:00+00:00,6281,805,184,21,,Nothing is impossible to those who believe,2
8298,8298,1,tariqnasheed,2022-06-21 23:17:47+00:00,2097,561,227,61,,"This Bill Cosby civil case farce is further proof, that in a system of white supremacy, no matter how financially successful you are as a Black person, a white person can LIE on you, and you can be systematically punished based on that lie.",0
8302,8302,5,supacreamss,2022-06-21 23:37:02+00:00,152,40,2,1,,"I got tired of not being able to draw so I snuck this into my schedule :D

Bad Ms. Frosty is probably one of my favorite Filia palettes and I wanted to shade white so here it is!

#skullgirlsfanart #Skullgirls #FiliaMedici https://t.co/JcIEHingLE",2
8303,8303,6,CoachPags775,2022-06-21 23:15:58+00:00,175,23,5,5,,"Common for high level lefties to drop their back foot toward the plate during sac attempts 

This allows for:
1. Both eyes to be square to ball
2. Larger plate coverage
3. Open hips to create a running lane to first

IT’S NOT ILLEGAL

AL YOU NEED IS A CLEAT ON THE WHITE
#BuntLife https://t.co/HbnxUvAu3E",2
8304,8304,7,chrysinspring,2022-06-21 23:30:06+00:00,361,9,2,0,,"@mrkandes @RiccardoTheCat @Jaybefaunt The U.S. didn’t end slavery Mark, they expanded and recontextualized it. The “lingering division” isn’t a festering scar of the past. The scar has never healed. Division lingers because the beast that is white supremacy has yet to be abated.",2
8307,8307,10,MakhanyaPBR,2022-06-21 23:46:40+00:00,51,15,0,1,,Is he still a President ?If yes tell him we waiting for resignation letter and his white friends are coming for him #PhalaPhalaFarmGate https://t.co/sXFTs08Kjd,2
8308,8308,11,AHHHnnaliese,2022-06-21 23:30:56+00:00,60,5,5,4,,"Bostons vaping epidemic is over, saw some white 13 year olds was chain smoking newports today",2
8316,8316,19,chipfranklin,2022-06-21 23:52:50+00:00,260,89,6,8,,"I grew up in DC, listening to old white men spout racist, ignorant rants. My parents said it was immoral, but kept me at a distance.
Today, while I recognize my white privilege, the children of these white men instead call me ""woke."" But the right word is awake. #ItsTime https://t.co/ARXeovmvLr",0
8318,8318,21,stuartlosaltos,2022-06-21 23:15:06+00:00,50,15,2,0,,"Ceasing to receive preferential treatment is only an attack to a person whose life up to that point, has been an uninterrupted series of green lights. It's hard to find people who are not white, male &amp; financially secure who interpret a loss of preferential treatment as an attack",2
8320,8320,23,ChuckGarfien,2022-06-21 23:26:34+00:00,61,4,4,0,,"White Sox PreGame Live at 630!

This is my 106 degree heat index look. https://t.co/MiN9QmoP2N",2
8324,8324,27,jbrown11871,2022-06-21 23:12:35+00:00,216,41,19,1,,"@AunaGoodman @Cums_well Supreme Court precedent, in Texas v. White, holds that the states cannot secede from the union by an act of the state. In 2006, Supreme Court Justice Antonin Scalia stated, ""If there was any constitutional issue resolved by the Civil War, it is that there is no right to secede.""",2
8328,8328,31,SethAbramson,2022-06-21 23:08:08+00:00,700,113,4,0,,"31/ Powell, Byrne, Flynn, and a Powell assistant only got into the White House because an aide to Peter Navarro let them in; it is unclear what this aide knew or did not, but he has since revealed himself to be a far-right radical and that is an *understatement*. But they got in.",2
8329,8329,32,DeronIsDope,2022-06-21 23:28:51+00:00,449,11,9,4,,"@Scorpianreina2 The number of women using “dated white” as an excuse to date an admitted drug dealer, is…. not surprising, honestly.",2
8331,8331,34,SethAbramson,2022-06-21 23:19:17+00:00,602,89,3,0,,"39/ ...nor do we know what the status of Byrne and Powell are except that the latter is in the process of being disbarred and the former recorded the deranged confession videos PROOF published) all hell broke loose.

Why? The White House lawyers suddenly broke into the meeting.",2
8336,8336,39,huhnyunjin,2022-06-21 23:59:31+00:00,63,0,22,1,,"legally inscribed timeless beauty is her preeminent right. in the wind that stirred her magnificent hair, a subtle fragrance spread throughout these white room. witnessing the perfection that spreads across the universe, she became a legend of beauty. do you agree? https://t.co/hLSxjU1z4N",2
8339,8339,42,shudonkey,2022-06-21 23:51:26+00:00,90,1,2,1,,"@scottfawcett White circle is 1.0 putt range red circle is 1.5 putts range , blue circle is 2.0 putts (all on average) and red oval is dispersion pattern for a 7 iron for a specific tour player overlayed on the putt data to optimize scoring showing mathematically optimal target.",2
8340,8340,43,lunminyard,2022-06-21 23:49:04+00:00,57,0,3,2,,@shibanba777 Ok but why kaeya is white?,2
8348,8348,51,_theyloveary_,2022-06-21 23:41:25+00:00,62,0,3,0,,@AhDaze @samaiyaaaa I mean technically it is still an hbcu since hbcu stands for “historically black college/university” and that white person going there doesn’t change the fact that its HISTORICALLY black.,2
8353,8353,56,RustBeltRebel,2022-06-21 23:23:47+00:00,83,9,3,1,,"goddamn it--liz cheney (who is my sworn enemy bcz her dad alone) is making one of the most pointed critiques--lady ruby and shaye moss, who don't have power or money, just fucking COURAGE--have testified, but powerful white men like mark meadows and others are 'taking the fifth.'",0
8359,8359,62,Minervasbard,2022-06-21 23:26:13+00:00,272,28,6,0,,@uptown_al_ I’m RTing this because more white folks need to read this tweet and take it to heart- he’s correct: that is exactly what the threat meant,2
8363,8363,66,DeeTwoCents,2022-06-21 23:10:14+00:00,66,8,5,0,,This country is disgusting. Donald Trump stole their lives and is walking around free and unbothered. But that’s what white supremacy does… destroys everyone it comes into contact with and is never held to account because it’s the foundation of everything. #WokeAF,2
8364,8364,67,bjpenndotcom,2022-06-21 23:46:58+00:00,79,10,26,3,,"Dana White says it’s “undeniable” that Kamaru Usman is the greatest welterweight ever 🧐 #UFC #MMA

https://t.co/Vqc7ihEYV1",2
8371,8371,74,Xxsethmonsterxx,2022-06-21 23:38:32+00:00,90,12,1,0,,Like everything is low capacity and poorly maintained because it's low capacity. Everythinnnggg. And the farmers are the people who OWN the farm. And the farm hands are the non white people doing all the real work. And the farmer is like I'm gonna only pay you .50 cents.,2
8373,8373,76,XilleIlahi,2022-06-21 23:05:35+00:00,86,5,7,0,,"Grapes, melons, now mangoes. Ye Japanion ka ajeeb hee fruit culture hai. Can bet this is nowhere near as delicious as a white chaunsa.",2
8375,8375,78,jenny2x4,2022-06-21 23:23:13+00:00,253,1,2,0,,@whip_poor_wont Wasn’t this crew saying that calling white passing people white is totally fair game yesterday lol,0
8385,8385,88,jenny2x4,2022-06-21 23:48:10+00:00,57,0,0,0,,@Chinchillazllla Oh yeah. Some of the most racist stuff I have seen on this app is from the white people in that crew,0
8431,8431,0,explophile,2022-06-21 20:53:56+00:00,4029,146,30,12,,Simply kill them that is all,2
8432,8432,1,MrAndyNgo,2022-06-21 23:10:31+00:00,3630,1022,173,77,,Breaking: The Indianapolis man who went to Portland to join #Antifa to try to kill police during riots in 2020 has now been federally sentenced for possessing bombs. He was already convicted on state charges. The sentence for all convictions is 10 years.https://t.co/cH20qHfsk4 https://t.co/gTRuoHPSsl,2
8435,8435,4,AmandaTheJedi,2022-06-21 21:02:16+00:00,609,75,19,4,,"🌈NEW VIDEO🩸

Starving for gay vampires and Netflix is FEEDING me with FIRST KILL

Is it perfect? No. Does that matter? Also No

ALL MY THOUGHTS AND PANICKED FREAK OUTS and why I DESERVER THIS live now
https://t.co/AItHewxBzz https://t.co/7Y8VuPBIfc",2
8436,8436,5,derby_evan,2022-06-21 20:41:27+00:00,323,41,3,0,,"gas price policies are thought of as helping a wide swath of americans when in fact the continuation of auto-centric transportation and land use policy costs all of us a lot of money, kills our neighbors, and drives us further into climate disaster",2
8437,8437,6,buffy_script,2022-06-21 22:40:00+00:00,83,21,0,4,,Your job is to kill the Slayer. But all you can do is follow me around making moon eyes.,2
8438,8438,7,CAKESDAKILLA,2022-06-21 22:13:36+00:00,307,33,1,3,,"I can’t wait for y’all to discover disco, electronic, soul, jazz and funk! The think pieces are gonna kill me whatever it takes to get the people back! It’s a win!",2
8440,8440,9,abolishwokeness,2022-06-21 20:34:54+00:00,66,43,15,2,,You can’t make this up. The vaxxes are approved for all children down to 6 months now. Why would a parent need to fill out the box to donate their child’s organs? What could possibly kill a young child? Is it normal now for parents to outlive their children? #PfizerMedical https://t.co/FeULOFphNS,2
8441,8441,10,egy_philosopher,2022-06-21 20:12:06+00:00,530,27,2,2,,"David told him that he would kill him and cut off his head,
and all the world shall know there is a god in Israel. All those who are gathered here shall see that the LORD saves neither by sword nor spear; the battle is the LORD’s and he will put you all into our power.",2
8445,8445,14,imysawhore,2022-06-21 21:47:40+00:00,51,1,1,0,,@HAWKINSMASSCARE Imagine they kill of the only canon lesbian in the show…Ive seen this all before 😭,0
8449,8449,18,OhTheSunnySide,2022-06-21 21:07:58+00:00,457,67,28,2,,"Y’all are so sick 
it ain’t the dog it’s the owner you fish
they have the most kills bec they were abused and pushed into those behaviors
it’s never the dogs fault it’s the owner",2
8454,8454,23,BBerbari_3K,2022-06-21 19:55:20+00:00,325,4,8,14,,"@wherexbyers Such a good thread. 

Sadly, we will all be sobbing when Will has to ask El to kill him bc they learn that part of Vecna's soul lives in Will, and he must die for Vecna to die",2
8456,8456,25,furyofthegodz,2022-06-21 23:34:06+00:00,319,16,1,2,,the entire movie showed wanda on a mission and that she’d do anything to succeed so not only was she going to kill anyone in her way but the powers at her disposal would make it increasingly easy to do so. not to mention training herself to learn to control all of her power 😭,2
8458,8458,27,TheSevndeep,2022-06-21 21:11:15+00:00,55,13,4,1,,Can we kill this narrative of only liking house music now because Beyoncé and Drake did it? Y’all don’t get tired of always being real dumb?,1
8513,8513,82,ElochukwuOhagi,2022-06-21 21:01:15+00:00,103,112,1,0,,"They will pay for the bullet that will be used to kîll them. 

These are forests Mazi Nnamdi Kanu used ESN to sack all the Fulanii terro-rists hiding in them. That's after they trooped into South East during covid 19 lock down.",2
8516,8516,85,SlowNewsDayShow,2022-06-21 21:15:38+00:00,50,17,2,2,,CRISPR beef: the product so necessary they had to kill off all the real cows in order to force it on you,2
8521,8521,90,fatfabfeminist,2022-06-21 21:57:20+00:00,64,2,1,0,,"no hate to the actress at all, im sure she’s gonna kill it. just sad that even in a fantasy series fat people just like,,, don’t exist outside of being explicitly evil :/

idk the percy jackson series just means a lot to me and this made me a bit sad",0
8524,8524,0,VulcanLoL,2022-06-20 20:11:00+00:00,22327,2034,71,67,,League of Legends is like playing Chess except all of your pieces move on their own and tell you to kill yourself,2
8525,8525,1,zapiii_og,2022-06-20 21:13:22+00:00,640,80,13,1,,Overwatch is like playing an elaborate game of chess except all of your pieces move on their own and tell you to kill yourself,2
8527,8527,3,godlessbot,2022-06-20 14:32:44+00:00,213,59,0,14,,"If I asked you to kill me, would you? / What.. what would I do? I couldn't live without you. / You’d kill yourself too, then?",0
8533,8533,9,snaketaper,2022-06-21 16:51:55+00:00,101,11,2,1,,"koga: dude kill yourself
adonis: why would you say that to me
koga: no adonis. its what friends say to eachother
adonis: oh! you should kill yourself oogami",0
8538,8538,14,coopercooperco,2022-06-21 11:52:02+00:00,463,4,5,0,,"Having not had a vacation in more than five years, let alone one that was two weeks, I forgot just how much the flip side is straight up wanting to kill yourself when you go back to working.",2
8539,8539,15,irismwang,2022-06-21 14:57:09+00:00,77,10,2,0,,"Prioritizing taking care of your family financially and making sure you have enough money to survive and fund your hobbies is okay! You don't have to kill yourself to pursue a ""passion"". You can find your passion outside of work.",2
8541,8541,17,arachnixe,2022-06-20 18:36:33+00:00,267,71,8,2,,"A gentle reminder that Empty Spaces is so much more than just stories of witches and dolls.

It is also angels and tears and spiders and fungal rot and a moth behind the mirror and a whisper in the back of your head telling you to kill the gods that make you less than yourself.",2
8546,8546,22,BadassLars,2022-06-21 05:33:06+00:00,103,36,0,1,,"If you get to 40 and you still can't look at yourself in the mirror without criticism, it's time to kill those bitchy voices in your head",2
8548,8548,24,aalovesvanilla,2022-06-21 08:29:25+00:00,149,60,0,3,,Please don’t downplay COVID-19 it ruins people’s lives. Also it can kill you and people you love. Kung di ka pa vaccinated it only says how you disregard other people’s lives. You get vaccinated not for yourself but for people around you. Please normalise getting COVID19 vaccines,2
8550,8550,26,Laffs_Dynamics,2022-06-21 20:25:04+00:00,84,17,4,3,,"A reminder of what ""Just Following Orders"" looks like.

You don't have to be a threat, the police will attempt to kill you regardless. 

Protect yourself with guns, even against the police. https://t.co/hKP1HVDUSd",2
8563,8563,39,ZodiacFacts,2022-06-21 14:12:07+00:00,192,54,4,12,,"#Aquarius,#Leo,#Gemini,#Sagittarius,#Aries,#Libra: Instead of arguing with you all day they would rather block you and keep it moving. They will let you argue with yourself behind the block button. They know it will kill you more not having any type of access to them.",2
8578,8578,54,ppupyfriend,2022-06-21 04:12:32+00:00,57,0,0,0,,"@WHERETHEMPANADA @Sonicrocks152 that shits a ""yooo dont be so offended its a joke"" tier thing that middle school boys did to get away with telling you to kill yourself. what kind of foundation is that for an argument",1
8579,8579,55,hunterbunney,2022-06-20 22:58:09+00:00,97,23,2,1,,"@CordinhalCivet All these people say ""get help"" in the exact same tone and context you'd say ""kill yourself"" so they're not very good at hiding what they mean",0
8584,8584,60,csmlurker250,2022-06-21 18:50:15+00:00,112,5,1,0,,"@PokemanZ0N6 ""wait wait, before you kill yourself, where the fuck is pluton""",0
8586,8586,62,RdotSpoon,2022-06-21 01:04:30+00:00,83,1,3,0,,"Some of us who like to see shit: Wow this show is dark.
Some of you weirdos: Get a better TV or kill yourself.",0
8607,8607,83,DanceSafe,2022-06-21 18:58:01+00:00,112,36,2,3,,"PSA: The biggest dangers of #poppers are 1) ingesting the liquid (this can kill you), 2) spilling the liquid on yourself (which can cause chemical burns and rashes), and 3) combining them with drugs like Viagra (which can cause stroke). #PrideMonth",2
8608,8608,84,cromafterdark,2022-06-21 02:56:30+00:00,105,5,5,0,,"It kind of sucks to be in a position where doing what you know you're here to do is a struggle, but you know in your bones that actually quitting it altogether would lead you to kill yourself. It's why I think ""doing what you love isn't work bla bla"" is a load of bullshit.",2
8631,8631,14,beealbz,2022-06-17 19:28:34+00:00,99,3,7,0,,"Was yelled at and called a faggot this morning. In Astoria of all places. Just for crossing the street.

Dangerous rhetoric from the Right is making things feel a little scarier than usual for queer folks. This is why we need Pride. Stay safe and stay vigilant, friends.",0
8675,8675,0,KeviSkillz,2022-06-21 23:54:12+00:00,3565,90,16,2,,"Nadeshot and Haley officially getting married.

What a time to be alive. https://t.co/RM3y0eyLJy",2
8677,8677,2,rhoasuperfan,2022-06-21 23:33:18+00:00,55,4,14,1,,I forgot that rewatching season 7 of Married to Medicine means I have to see Buffy again 🫠 https://t.co/zxckG0qrg3,2
8679,8679,4,JusticeSquad2,2022-06-21 21:29:31+00:00,5929,340,155,29,,"I’m officially sick of Amber Heard, I mean I was always sick of her but seeing her get comfortable with someone in Johnny Depp’s penthouse elevator while she was still married put me over the edge of never wanting to see her face again.",2
8680,8680,5,SweetFnLucifer,2022-06-21 21:28:06+00:00,881,43,104,7,,"Oh, woe is my wretched existence. I'll be forced to spend hours inside a church on Saturday. My 34 year streak of successfully avoiding weddings is coming to an end, as my sister is getting married &amp; has made it quite clear my attendance is mandatory. Goddamn human obligations.",2
8681,8681,6,SHERRIESMITHGR1,2022-06-21 22:45:22+00:00,51,3,0,0,,Now there is footage of AH making out in the elevator with what looks to be Cara Delevingne while she was married to Johnny.  You people that still are team Amber are so misguided.  She has lied about everything and continues to lie. Karma is a bitch. She better stop talking.,1
8686,8686,11,pradachurch,2022-06-21 23:40:11+00:00,204,7,8,0,,"hrhcollection got married in the most bland dress, party tents, christmas decorations and still got the nerve to talk about peoples bank accounts https://t.co/bxl9Bu3gQB",2
8687,8687,12,SimMattically,2022-06-21 21:54:46+00:00,191,12,13,0,,"Just a thought but catholics be like ""you can only be married to one person until death do you apart"" but then they all believe in eternal life in heaven so like what if you had 2 wifes during your time on Earth?? You have a love triangle in your afterlife??",2
8688,8688,13,SayuOkami,2022-06-21 23:53:28+00:00,244,8,24,0,,"Married to my community 😭🙏
Honestly y'all spoil me so much gdi I don't deserve...ty guys so much❤️ https://t.co/H62qKjEd4z",2
8689,8689,14,corprteUnicorn,2022-06-21 23:04:18+00:00,92,3,6,1,,"Not all committed people want to get married.

Jesus Christ.",2
8690,8690,15,spacetwinks,2022-06-21 23:48:05+00:00,148,6,3,0,,that's enough politics. time to think about getting gay married to splinter from ninja turtles,2
8692,8692,17,EagleWilly22,2022-06-21 22:27:03+00:00,67,0,2,0,,"This weekend I found out my mom tells people, ""you can be a pro runner if you're married to a doctor"". Apparently she thinks I'm a broke boy. 😭",2
8695,8695,20,shaylajcarey,2022-06-21 22:42:01+00:00,1314,97,11,35,,@lovedoveclarke she commits right away because she’s a hopeless romantic but then freaks out cause she’s not sure she wants to commit to this random person for the rest of her life but she can’t uncommit in her head bc falling in love and getting married is the best love story ever,2
8700,8700,25,AncestralFather,2022-06-21 22:08:29+00:00,133,31,6,0,,"If you want to save the world:

-get married
-have children
-limit technology
-love your spouse
-love your neighbor
-start family traditions
-homeschool your kids 

This is how we win",2
8702,8702,27,swimallthetime,2022-06-21 22:57:58+00:00,223,25,4,1,,"I feel like when tdbk get married the expectation is for Shouto to tear up, all soft and pretty but in reality Katsuki’s gonna be the one ugly crying despite himself coz between the 2 of them he’s the big crier ahaha and it’ll be super sweet :)) 💜",2
8706,8706,31,emmasben,2022-06-21 23:34:04+00:00,50,5,0,2,,"""barchies only want them to get married and have kids"" yes that's what i personally want in the end for all of my ships, thanks for pointing out the obvious 🙏",2
8713,8713,38,MichaelBerrySho,2022-06-21 22:53:25+00:00,1612,270,38,5,,"Mexican born.
Immigrant.  
Married to a border patrol officer public servant.
Elected as a Republican in a Dem district.

America’s promise is alive &amp; well.  @MayraFlores2022 proves it.",0
8716,8716,41,Jmmymusic,2022-06-21 22:29:53+00:00,146,5,5,0,,@quakerraina I would’ve been livid! But I’m no stranger to catholic hospitals doing some effed up ish. My mother had me at a catholic hospital and because my parents weren’t married they wouldn’t allow me to have my dads last name or his name on the birth certificate.,2
8717,8717,42,oblalbo,2022-06-21 21:16:32+00:00,180,2,2,0,,@girImuse no bc she rly has the nerve to shit on poor people 24/7 just to get married in a tacky cocktail dress AND make ppl pay to watch it,1
8720,8720,45,HW4BAB3,2022-06-21 22:41:06+00:00,51,0,1,0,,"sexnghwx is yexsxng and wxxyxvng's best friend and it happened that they started dating hxngjxxng's best friends- respectively yvnhx and sxn. (mxngx is married to his music and hxngjxxng honestly envies him.)
so it was only a matter of time for he and sexnghwx to meet.",2
8723,8723,48,bdbilotta,2022-06-21 22:44:57+00:00,55,0,0,0,,"@strivewithkris1 You weren’t married to someone who paid all your bills right? Zero help from parents? You bought your own car, right?",2
8729,8729,54,codeofvets,2022-06-21 23:01:28+00:00,190,195,7,9,,"HOMELESS MISSION #Gainesville #FL

Marine vet Warren is married has 3 minors. Was homeless until last Fri. Still short on rent/security deposit but with some assistance from American Legion Post was able to secure keys/lease to get family out of car $2300

https://t.co/C7nmvp4rpe https://t.co/sQcDj40A5H",2
8733,8733,58,kokoddu,2022-06-21 21:42:45+00:00,92,11,0,0,,"bts army is such a big community that it’s normal to disagree sometimes, it happens, but we all know namjin married.",2
8735,8735,60,EmediongJules,2022-06-21 23:12:44+00:00,69,1,11,0,,"@Neurochauhan To tell me he his married and I’m still single😂
I couldn’t stop laughing because this is a 35 year old grown man😂. 
He said it’s because I have money and my parents are ok that’s why I’m proud and single😂
Such a grown old boy!",2
8738,8738,63,DiasporaDash,2022-06-21 22:04:35+00:00,61,8,1,1,,Y'all don't actually care about Black Liberation. Y'all are too married to the campism to even consider these nuances. Will step right over &amp; NOT listen to actual Black ppl who LIVE these realities day to fucking day and spout off what the gov machine tells you. Rocks for brains.,0
8739,8739,64,latkedelrey,2022-06-21 20:27:29+00:00,102,1,14,0,,a man on a dating app told me that he would love to go out with me but only if we can get married within 6 months of dating,2
8750,8750,75,FentyHeadlines,2022-06-21 21:00:01+00:00,55,4,0,0,,"RHONY star Leah McSweeney on Rihanna wearing her ""Married to the Mob"" designs: ""I somehow got in touch with her best friend Melissa. They were both into streetwear, so I got one of her friends' addresses and would just ship her stuff.."" Via @GQMagazine. https://t.co/5yiXxk0G0z https://t.co/hmvaO1GfTS",2
8754,8754,79,SimonMcCoyTV,2022-06-21 21:19:21+00:00,209,1,10,0,,Married less than a year… and already banished to the spare room… #BloodyCovid,2
8765,8765,90,TomCrowe,2022-06-21 23:58:18+00:00,128,7,2,0,,@JayCaruso Non-veterans shouldn’t be able to play soldiers. People without social disorders shouldn’t be able to play those who have them. People who haven’t been stranded on tropical islands shouldn’t be able to play those who are. Married men shouldn’t play single dads. Etc to absurdity.,2
8768,8768,1,mellaharding,2022-06-21 20:50:31+00:00,227,18,2,2,,"Gotta love Lindsey Duncan - arrives, smokes a fag, delivers a monologue for the ages, and waltzes out leaving pure electricity crackling in her wake… ⭐️#Sherwood #StealsTheShow",0
8771,8771,4,EerieSheepy__,2022-06-21 10:59:26+00:00,71,0,1,0,,@Myth_the_Fag @poopanalysis @RegaladoRaydon @subwaysurfers Devoured even,2
8772,8772,5,jjkmuggle,2022-06-21 16:48:04+00:00,73,2,21,0,,pusy thang pusy clean pusy clean pusy fresh pusy pu pu pusy fag fulla fresh,0
8796,8796,29,HolyCricket_513,2022-06-21 03:26:41+00:00,312,16,10,1,,"R Ashwin has braved injury, battled retirement, and been the best spinner outside Asia in the last 4 years. In the fag end of his career. With not much left in the tank. That he will never be able to banish the ""spin king at home"" tag will be one of the great tragedies.",0
8801,8801,34,MikeMGTV,2022-06-21 18:07:37+00:00,219,14,5,0,,I wana give a special shout out to all the “god hates fags” picket sign protestors for giving all the gays a photoshoot opportunity for free during pride. Thank y’all for the content,0
8808,8808,0,Junyaaper,2022-06-16 15:08:48+00:00,456,106,9,0,,THE SCAM CALLER CALLED ME A FAGGOT https://t.co/OQq2IfvgIM,0
