,Unnamed: 0.1,Unnamed: 0,User,Date Created,Number of Likes,Number of Retweets,Number of Replies,Number of Quotes,Number of Views,Tweet,class
2008,2008,42,kellygirl2600,2022-06-21 19:43:10+00:00,205,7,39,0,,"@ElieNYC @HC_Richardson I’m so sorry. A majority of us white people don’t feel that way at all &amp; we love our black brothers &amp; sisters.We are your allies &amp; we are doing what we can to help.I will be block walking for Beto on Saturday in 102 heat. I’m doing that for you, for POC, for women, for gun safety",2
2012,2012,46,LqLana,2022-06-21 19:13:20+00:00,79,50,6,2,,TFG &amp; cohorts are  privileged white men that have been able to skirt accountability due to skin color and position. They’ve been able to get away w/things no POC could have gotten away with. These hearings show criminal behavior comes in all colors &amp; positions. #FreshWords,2
2017,2017,51,Itmechr3,2022-06-21 16:17:29+00:00,108,1,2,0,,"The other thing I keep thinking about with Everything Everywhere All At Once is how so much Chinese American media's depictions of queerness are focused around Asian queers dating white people as a way to show how their queerness is exterior to 

Moreover, ICE must be destroyed",0
2018,2018,52,salstrange,2022-06-21 21:49:08+00:00,137,24,3,3,,"White America is doing all it can to destroy this country and murder every single person that doesn’t lick the boots of white patriarchy, and too many white women are complicit handmaidens to that abomination.",0
2020,2020,54,williamvercetti,2022-06-21 19:05:47+00:00,60,3,2,1,,not to shake the table but if you promote body positivity/body equality for all but your likes are full of ripped white men then that’s not your lane. it’s going to come across as performative every time.,2
2024,2024,58,TKPcreates,2022-06-21 19:42:21+00:00,67,7,1,0,,"One of the enduring lessons I’ve taken away from activist leaders is how deeply intertwined our liberation is. White supremacy, misogyny, police brutality, gun violence, ableism, homophobia and transphobia are all interconnected. 1/",2
2029,2029,63,terrasapientiae,2022-06-21 22:29:08+00:00,59,0,5,0,,@davenewworld_2 By the looks of this you’d think all airline pilots are white males,2
2030,2030,64,USATRUMPMAN1,2022-06-21 22:08:02+00:00,54,14,5,0,,"The News on TV, Newspapers, Social Media are all lying daily. Google has changed definitions on words so many times it's hard to remember the truth. To disagree is racist, Transphobic or white supremacy even if you're not white. Bidens America",0
2035,2035,69,leebee4life,2022-06-21 17:56:44+00:00,94,22,1,1,,"@IAmPoliticsGirl @DNC @dccc Democrats ARE in the game. The issue is that white folks vote for Republicans. Because Republicans want to uphold white supremacy. That’s what needs to change. And y’all need to stop expecting Dems to say some magic words, and start working on your relatives instead.",2
2041,2041,75,MaxMannis,2022-06-21 19:23:57+00:00,52,1,3,1,,"I have it:

We haven't known it at all, but Albert Abreu and Aaron Judge are BOYS, and the Yankees are bringing Abreu home to get Judge to sign an extension before the arbitration hearing.

Like the White Sox signing all of Manny Machado's best friends, but it'll work this time.",2
2045,2045,79,Xxsethmonsterxx,2022-06-21 23:38:32+00:00,90,12,1,0,,Like everything is low capacity and poorly maintained because it's low capacity. Everythinnnggg. And the farmers are the people who OWN the farm. And the farm hands are the non white people doing all the real work. And the farmer is like I'm gonna only pay you .50 cents.,2
2057,2057,0,RepSwalwell,2022-06-21 15:27:01+00:00,5642,1122,266,42,,Warning: police accountability at Uvalde is important. But it is not an alibi for inaction on gun safety. We are a country of unrestricted weaponry. Unless that changes more kids will be killed. Period.,2
2058,2058,1,MarxOnyeka,2022-06-21 12:42:07+00:00,191,343,16,16,,"It will NEVER be well with Nigeria until it recognizes, apologize and atone for the lives of Biafrans it has killed, all in the name of protecting “one Nigeria.” All we seek is a sovereign Biafra nation, where we will self-govern, develop and progress! https://t.co/oFqXL0CrLJ",2
2060,2060,3,edgarwabwire_,2022-06-21 10:58:24+00:00,233,55,8,0,,"The pressure to drive a sleek car, attract female attention, and drink bottles of champagne in clubs should not force you into stealing from people. You will be killed miserably &amp; trend here for a few hours &amp; be forgotten!",2
2061,2061,4,TomJumboGrumbo,2022-06-21 16:18:57+00:00,81,138,24,5,,"NYCACC dogs to be killed. Thank you for your pledges.

Page 1

ORDER TO KILL
Future $2672
Kato $1224

TBK:
Moo $1518
Nova $650
Pepper $548
Oreo Sunshine $420
Bruno $440
Doggy $518
Chrome $381

Neveah’s $473 (adoption fell through - likely to be on this list again 6/21)",2
2062,2062,5,tortellinius,2022-06-21 22:14:20+00:00,493,6,4,0,,"@JUNlPER “This twitter user killed my dad”
“What? Do you have any proof they killed your dad?”
“The proof is easy enough to find that you should be able to see it on your own and if that’s not good enough for you then you’re a murder apologist.”",0
2066,2066,9,SumitaBasuRoy2,2022-06-21 14:52:18+00:00,40,90,3,0,,"Justice For Sushant
I had a lot of work to do but for sure I will come back to fight for our dear Sushant, it's been two years since he was mercilessly killed and justice has not been done yet so we have a big fight. Justice must be achieved
United We Stand For Sushant https://t.co/97v8Ih6PsP",2
2067,2067,10,RedsoxguyEth,2022-06-21 22:01:06+00:00,84,7,9,1,,"Cool Cats killed Cooltopia. This was needed and every cool cat or pet that was fortunate enough to come see it left very happy. For every holder that wasn’t able to come, y’all should be extremely proud of the team and what they accomplished 🤝 #CooltopiaNYC https://t.co/5E5UdaI3zO",2
2071,2071,14,Plush_bears,2022-06-21 14:26:33+00:00,48,82,12,13,,"Even though the sun will follow its highest path in the sky today   only darkness falls on Yulin, in Guangxi, China  as the annual ‘Lychee dog meat festival’  has just  begun.
This week thousands of dogs  and cats will be merciless killed and tortured for meat @TheSun #Yulin https://t.co/d51nmr0yx2",2
2073,2073,16,Kritika4Sushant,2022-06-21 15:34:02+00:00,25,78,2,0,,"They killed Sushant. We will not let them kill the truth
The wrongdoers will surely be punished. They will face their karma soon ‼️

United We Stand For Sushant",2
2077,2077,20,kundu_koushani,2022-06-21 15:24:59+00:00,47,108,6,0,,"Culprits killed him because he was alone, he fought well but they will never be able to kill his truth because he is not alone now. We warriors of SSR are his voice now &amp; no one can suppress our voices.

United We Stand For Sushant https://t.co/zQ4IHZ2JEU",0
2085,2085,28,joeyayoub,2022-06-21 10:38:02+00:00,500,23,1,16,,"Why was it that easy for that fucker to be killed? He was so beloved by an entire people and it just happened?

Mussolini's death would not have been possible without the Allies defeating fascist Italy. Does that mean there were no anti-Mussolini Italian partisans?",2
2086,2086,29,HeliPandya_SR,2022-06-21 15:18:58+00:00,24,61,3,0,,"@itsSSR we haven’t forgot the oath we took 2 years ago 🙌🙏
This face is going to be a haunting reminder for the culprits how brutally they murdered you and we won’t let them forget how brutally they killed you 🙌😞
United We Stand For Sushant 🤩 https://t.co/RwhNKHkgA6",2
2087,2087,30,ziibiing,2022-06-21 00:54:55+00:00,108,1,10,0,,I found a beautiful leather La-Z-Boy recliner on Facebook marketplace for $150 and they offered to deliver it for free AND didn’t want payment until they arrive..am I going to be serial killed?,2
2088,2088,31,CathieMarise,2022-06-21 10:46:13+00:00,231,51,1,4,,@kambale The Belgium killed Lumumba &amp; they kept his tooth as a trophy for 61 years. This is history African kids should be taught.,2
2089,2089,32,NoHolyScripture,2022-06-21 09:42:34+00:00,68,15,7,5,,"Another sick, Islamic notion

Quran 5:33 

The penalty for those who wage war against Allah &amp; His Messenger … that they be killed or crucified or that their hands &amp; feet be cut off from opposite sides or that they be exiled from the land.

What a jerk, this book character Allah!",2
2091,2091,34,msschillax,2022-06-21 15:32:30+00:00,277,10,1,0,,"@ghostgirlly @NYMag No one ever cares that victims are cancelled every day. This man preyed on teens, punished them w/ bad grades &amp; low status in the band for not being willing victims, ruining my love of music. I was going to be a professional musician; he killed that dream. https://t.co/GfoorIfbpE",2
2093,2093,36,keesain99,2022-06-21 03:32:14+00:00,32,82,8,0,,"This Morning we ask …

CBI Jawaab Do In SSRCase 

Who killed Sushant Singh Rajput? 
When will you file the chargesheet?
When will IPC section 302 be imposed?
When will you arrest Sushant’s Murderers? 
What has CBI been doing for over 22 months?
@PMOIndia @HMOIndia @KirenRijiju https://t.co/54DJpctVdN",2
2098,2098,41,Lululand777,2022-06-21 00:58:17+00:00,56,1,2,0,,"@Angry_Staffer Given the stonewalling that is happening, I think the true horror of the police response is yet to come. Were children caught in and/or killed by friendly fire? Unimaginable &amp; how agonizing this slow drip of info must be for the parents.",2
2104,2104,47,sammartirosyan9,2022-06-21 19:46:04+00:00,116,27,5,0,,"Azerbaijan killed an Armenian soldier a day after this speech, most of which was threats &amp; macho bs talk by Aliyev, but Mr. Klaar decided to selectively quote it &amp; be pleased with it.
So maybe it's time for 🇪🇺 to send someone less biased &amp; more professional to change Klaar.",2
2112,2112,55,MrBlonde_macro,2022-06-21 17:24:13+00:00,122,10,5,0,,"@MacroAlf start to finish they returned 0%, but big swings intra-period for macro minded, intellectually flexible investors.  SPX sold off 36%, rallied 75%, sold off 48%, rallied 73%.  so both bulls and bears can be right...but the stubborn ones will get killed https://t.co/p4vrzQfLtL",2
2113,2113,56,thorstenbenner,2022-06-21 06:00:03+00:00,115,31,1,2,,"🇺🇦 soldiers killed &amp; hurt every day because of lack of armored vehicles. This 🧵details case for 🇩🇪to start supplying them fast, drawing from industry &amp; existing Bundeswehr stocks (that can then be resupplied by industry). Time to switch to ""Let's make this work"" spirit.",2
2114,2114,57,BeerHallProject,2022-06-21 17:31:21+00:00,78,20,1,0,,Public officials having their personal information doxxed to Trump's rabid followers while extremists called for them to be killed if they didn't support throwing out the election results is the stuff of tin pot dictatorships not the United States. #January6thHearings,2
2120,2120,63,gabalexa,2022-06-21 16:46:59+00:00,205,14,5,4,,"""Can I kiss you?"" has worked for me 99.9% of the time but once, I said it to someone on a 2nd date &amp; they told me that it 'killed the vibe' and made the kiss feel 'less spontaneous'. And that's when I knew we simply were not going to be compatible!",2
2122,2122,65,JradRabel,2022-06-21 17:12:34+00:00,55,11,2,1,,"Give up your guns so you can outsource your protection to the police, who will watch your kids be killed and take away your firearms for a pro trump Facebook post",2
2127,2127,70,KendallRaeOnYT,2022-06-21 16:07:03+00:00,288,40,8,4,,"Justice WILL come for Georgia one day🙏 Who Killed Georgia Leah Moses? 25 Years Later, and Her Little Sister is Still Searching for Answers

https://t.co/fLO6TFADh7

Be sure to follow her wonderful sister Angel @SolveHerMurder for updates!",2
2129,2129,72,4WheelWorkOut,2022-06-21 01:04:13+00:00,91,3,1,0,,"In a lot of words I told her this country doesn’t have a history of trying to kill you off or deny your existence. There may have been oppressive laws but at the end of the day, ur white. A white woman. If this were the 60s, my man could be beat or killed just for smiling at u",0
2131,2131,74,dim0kq,2022-06-21 22:12:00+00:00,81,6,2,0,,"I will be cancelling each and every politician based on their weak statement re Russo-Ukrainian war.

When thousands of people get killed in the middle of European continent, there is no place for 50 shades of gray. 

It’s either black or white. Good or bad. Make up your mind.",0
2239,2239,0,neotrin1ty,2022-06-21 21:56:48+00:00,38024,2517,167,150,,this rules so hard and feels very raimi. he really said fuck these cameos and get em outta here in the most comically brutal ways possible,1
2240,2240,1,MachineGunKA,2022-06-21 17:02:30+00:00,773,21,8,3,,Get me the fuck outta here https://t.co/1yBtvBaK0Q,1
2241,2241,2,soIoucity,2022-06-20 18:32:53+00:00,471,22,22,2,,Get the fuck outta here,1
2243,2243,4,SickTv4k,2022-06-21 23:52:46+00:00,60,3,5,0,,Better get create music group the fuck outta here https://t.co/vQVdBM0RbU,1
2245,2245,6,VH1PNUT___,2022-06-20 15:25:32+00:00,65,27,0,1,,IM NOT COMPETING FOR SHIT YOU EITHER FUCK WITH ME OR GET OUTTA HERE BITCH,1
2247,2247,8,PaulTweetz2Much,2022-06-19 22:44:22+00:00,56,58,3,9,,hey man fuck outta here lmao,1
2253,2253,14,nonchalantking1,2022-06-20 05:48:42+00:00,157,8,6,1,,"@juhrayaa Is funny how some of y'all tryna steer the conversation into something else because imma straight black man. Gtfoh, y'all hate accountability. Go heal y'all childhood wounds, go talk to y'all elders. Fuck outta here with that BS",0
2259,2259,20,Jinx_In_Boots,2022-06-20 18:38:36+00:00,331,11,3,0,,"Like yall, I'm a WHOLE ASS ADULT.

I have a job to go to, my online presence is minimal until my days off. But you expect me to check every nook. Fuck outta here",1
2263,2263,24,lifeisbutamemes,2022-06-20 21:54:43+00:00,57,2,2,1,,"@D16584667 @2ndcoming6 @whoisdonta @ModestyQueen19 … The Barbary Slave trade was also not a codified system, while African slave trade became engrained in the economics and politics of the United States, and the Southern United States in particular.
Get the fuck outta here",2
2272,2272,33,GeorgeOD_,2022-06-20 03:51:27+00:00,224,3,9,0,,all i'm sayin is if we ban steve we getting kazuya the fuck outta here too,1
2281,2281,42,JayyRuss_,2022-06-19 12:45:49+00:00,433,1,2,0,,@Ajinks10 @TheValTimes Our? I don’t think you have any ownership of CS 😂 fuck outta here,1
2287,2287,48,blackmiller92,2022-06-20 23:55:42+00:00,122,1,3,0,,@onat_selvi @ACFresh21 Lmao y’all didn’t want him remember ? Fuck outta here.,1
2299,2299,60,kodyChongkc1992,2022-06-20 17:42:49+00:00,56,0,1,0,,@asifquraishi @DarrenDreger Fuck outta here lol,1
2319,2319,80,RCReed40,2022-06-21 13:37:59+00:00,67,1,10,1,,@Nervardia @Ken_1689 Don’t ever let me have a daughter. My twitter feed would change DRASTICALLY. if she wanted me in pink then I was buy a whole new closet filled with nothing but pink dresses and tutus. Get the fuck outta here.,1
2324,2324,0,JGerrings,2022-06-21 22:33:30+00:00,55,6,2,0,,@AndyBurnhamGM Saved any raped children from grooming gangs on your patch yet?,2
2327,2327,3,Ari7ajasmin,2022-06-21 20:01:02+00:00,53,24,7,5,,"A sample of comments following the murder of #NayiraAshraf,the Egyptian student who was stabbed in the daylight by a classmate for refusing to marry him. No 9 is from a lawyer. It says:""It might have been much better if he raped"".#FreeFromHijab 
#IslamicNationsAreUnsafeForWomen https://t.co/CEdtJT0L6B",2
2328,2328,4,dharold13,2022-06-21 18:34:34+00:00,51,1,5,1,,@Billlumbergh23 @twithersAP You don't take money if you were raped either,2
2337,2337,13,emrazz,2022-06-21 20:20:14+00:00,1286,54,7,1,,@lizweil But won’t someone think of the poor boys who lost friends because they violated or raped their high school girl friends. What a tragedy.,2
2338,2338,14,JerryGual,2022-06-21 20:13:45+00:00,40,112,0,1,,"@It’s been more than #1YearOfTigrayGenocide, civilians have been massacred, women &amp; girls gang raped, destruction of healthcare facilities &amp; many more atrocities. #TigrayGenocide #TigrayFamine #TigrayIsSuffering #TigrayCantWait save innocent lives. @PopeTawadros @JerryGual",2
2340,2340,16,Helen287223432,2022-06-21 17:57:17+00:00,43,78,1,2,,"Dear @JanezLenarcic I believe that all violations must be called out addressed 500,000 humans massacred &amp; over 120,000 women raped in Tigray by Eritrean &amp; Ethiopian soldiers.#TigrayGenocide @PowerUSAID @UN @Macky_Sall @AUC_MoussaFaki @POTUS @SecBlinken @vonderleyen @JosepBorrellF https://t.co/GWawCBGnFe",2
2343,2343,19,TigistFtsum,2022-06-21 20:58:44+00:00,91,262,0,0,,"It’s been more than #1YearOfTigrayGenocide, civilians have been massacred, women &amp; girls gang raped, destruction of healthcare facilities and many more atrocities. #TigrayGenocide #TigrayFamine #TigrayIsSuffering #TigrayCantWait @Statsmin @MarinSanna @tigist",2
2345,2345,21,Aynur35423962,2022-06-21 20:32:55+00:00,58,34,3,0,,"Shame on  @mbachelet  
22 years old innocent Uyghur girl was detained in Chinese death camp. 
Tunsagul Memet, 22, the reason of her detention was unknown .

Where is she? Was she killed, raped, organ harvested or became slave in a factor? 

@IntlCrimCourt
@UNHumanRights https://t.co/pgt3pGr3sY",2
2347,2347,23,Northerner0,2022-06-21 18:51:45+00:00,82,10,28,2,,What’s your say on the lady that got raped by arm robbers and later got beaten and a divorce by her husband? What say you?🧐,2
2351,2351,27,LW9Wc4u5uVSrorT,2022-06-21 18:32:29+00:00,103,264,1,1,,"It’s been more than #1YearOfTigrayGenocide, civilians have been massacred, women &amp; girls gang raped, destruction of healthcare facilities &amp; many more atrocities. #TigrayGenocide #TigrayFamine #TigrayIsSuffering #TigrayCantWait save innocent lives. @PopeTawadros
@LW9Wc4u5uVSrorT",2
2358,2358,34,Amberwarrior8,2022-06-21 22:18:45+00:00,74,10,3,1,,"@USAHOLA "" why didn't you film you rape"" ""mr. depp got you that role didn't he"" ""You lied about your rape"" ""Ms. heard lied about being raped with a bottle"" she us the most misogynistic female. #IStandWithAmberHeard",2
2360,2360,36,BriGalTigray3,2022-06-21 19:32:07+00:00,78,196,0,0,,"It’s been more than #1YearOfTigrayGenocide civilians have been massacred, women &amp; girls gang raped destruction of healthcare facilities &amp; many more atrocities #TigrayGenocide #TigrayFamine #TigrayIsSuffering #TigrayCantWaitYour voice can save lives. @PopeTawadros
@BriGalTigray3",2
2361,2361,37,wedi__wukro,2022-06-21 22:53:27+00:00,37,72,0,0,,"PM Ethiopia’s troops In #Tigray have killed 500K civilians, displaced 2.5M+ 120K women raped, infrastructures destroyed, 7M+ppl kept under siege. #TigrayCantWait 
End #TigraySiege 
End #TigrayGenocide now!!
@NicolasSchmitEU @PaoloGentiloni @jwojc @ThierryBreton @ElisaFerreiraEC",2
2362,2362,38,frannypglass,2022-06-21 21:19:52+00:00,100,1,1,0,,@_celia_bedelia_ @auntaminal @TheCut or dared mentioned being sexually assaulted by anyone!!! the documentary Audrie &amp; Daisy?! both girls ended up committing suicide because of how the community reacted after they were raped!!,2
2363,2363,39,TeethLedger,2022-06-21 23:17:13+00:00,68,3,1,0,,"@lizweil When I was in high school, a girl got gang-raped by the football team, violated by a broom handle and had her head shaved. Im sure it will shock you to you find out that the boys faced no consequences and she had to move away and change her name.",2
2365,2365,41,RossCam1965,2022-06-21 18:12:53+00:00,51,1,4,0,,"@tinshh What if that child's parents died. One of Covid as they worked in the NHS where they had little PPE, and it was defective due to government contracts. And the other was raped and killed by a policeman? Where dies the blame lie then?",2
2373,2373,49,juliacarriew,2022-06-21 21:51:27+00:00,235,27,4,3,,"The much much much more common story is that girls and queer kids are bullied, shunned, slut-shamed and abused by their peers *and sometimes teachers* for anything from wearing a tank top to having sex to being raped. This happens every day and it's been happening forever.",1
2377,2377,53,ZiggyMercury73,2022-06-21 21:29:59+00:00,67,1,1,0,,"@DrProudman No-one ""got off on"" her testimony about being raped. People at large just thought it wasn't believable, and it wasn't because it didn't happen.",2
2379,2379,55,cosetthetable,2022-06-21 23:19:17+00:00,101,13,0,1,,"cn:sa
 
as someone who was summoned by my HS class dean to be reprimanded because my friends were only coldly polite (no longer friendly) to the person who raped me, NYMag's editorial team can fuck alllllllllllll the way off",2
2382,2382,58,naledimashishi,2022-06-21 20:30:50+00:00,89,30,2,0,,Tbh based on what has happened in other Gulf states with similar laws this may just result in women who report being raped getting arrested for breaking this law,2
2383,2383,59,AgainstRevisio1,2022-06-21 18:41:54+00:00,55,23,5,0,,"Tens of thousands of Polish women were also brutally raped. Before the Russians came rather than deal with them, women were committing mass suicide because they knew what awaited them.

No this didn’t happen with any other armies.",2
2384,2384,60,JerryGual,2022-06-21 20:14:28+00:00,27,73,0,0,,"@Women in @Refugees camps tell heartbreaking stories of survival. Some were forced to watch while their loved ones executed for their ethnicity, &amp; some were gang raped in front of their families. #TigrayGenocide    SAVE LIVES @MorAphremII https://t.co/9lIH6a6ADL @JerryGual",2
2390,2390,66,LW9Wc4u5uVSrorT,2022-06-21 18:31:28+00:00,51,155,0,1,,"Women in @Refugees camps tell heartbreaking stories of survival. Some were forced to watch while their loved ones executed for their ethnicity, &amp; some were gang raped in front of their families. #TigrayGenocide    @LW9Wc4u5uVSrorT @MorAphremII https://t.co/ExQ5Q4bb9f
@UN",2
2393,2393,69,WomenReadWomen,2022-06-21 18:34:04+00:00,390,186,10,16,,"A judge in Brazil banned abortion for an 11-year-old girl who became pregnant after being raped, prompting widespread outrage.

Pregnancy and childbirth are leading causes of death in teenage girls globally; girls aged 14 and under face the greatest risks.
https://t.co/o3LT7CxYS8",2
2397,2397,73,WediRaya7,2022-06-21 19:42:38+00:00,60,147,0,0,,"""The world needs to see what we and our children are going through,"" a mother cries as she recalls the night she was gang-raped, just moments after witnessing her husband's execution.💔😢 #Justice4TigrayWomen #MothersDay2022 @WediRaya7 @jessicaalba https://t.co/ogJhKxmV7O",2
2402,2402,78,AlexKhrebet,2022-06-21 21:23:15+00:00,52,24,8,0,,"Russia's UN envoy blames the West of inciting Ukraine to Russophobia. In fact, 🇷🇺 is the lone promoter. Dead from the neck up ween Ukrainians will embrace them, after they invaded 🇺🇦, killed, raped, tortured, executed, abducted an inconceivable number of folks.",2
2406,2406,82,NerdPyle,2022-06-21 23:35:08+00:00,61,5,1,0,,"@erinmdurkin @ericadamsfornyc $11 billion with a B in cop overfunding and it’s “don’t be a woman or you’ll get raped” from this empty suit mayor.

What a joke",2
2412,2412,1,izackpaz,2022-06-18 19:04:46+00:00,391,1,3,1,,@jaydiggz4 @JazzCartier fuck is u talking about,1
2418,2418,7,Fadeawzy,2022-06-19 20:51:58+00:00,224,2,2,0,,@NotNight_V3 @lildurk Boy what the FUCK are u even talking about😭😭😭,1
2422,2422,11,3500tammy,2022-06-17 13:16:51+00:00,125,22,5,0,,U a lame ass dickriding ass predator shut the fuck up talking bra,0
2445,2445,34,sibeleth,2022-06-15 20:10:20+00:00,198,35,15,0,,"Ngl, I love the vibes in @nftftc Discord. I feel so good and LMAO every time i start talking w y’all 🖕🏻 I love u fuckers. That’s what we need. Fuck everything else.",1
2446,2446,35,souIstyce,2022-06-21 16:11:19+00:00,92,3,8,0,,how the fuck and u gonna make an Offline version after literally talking about how an Offline version may be a good way to bring it to the west and then NOT BRING IT HERE!!!!,1
2460,2460,49,The25thBam_,2022-06-19 05:34:07+00:00,269,8,3,0,,How the fuck u aint know Asuma had a child nigga u did not even read naruto talking out they ass,0
2478,2478,67,mikey100mike,2022-06-19 13:35:34+00:00,262,13,6,2,,“how the fuck does a marshmallow be non binary” Bro it’s a show about fruits talking idk what logic u expected bro,1
2479,2479,68,berdyaboi,2022-06-17 01:26:53+00:00,131,1,3,0,,the ones that arent quadropeds are all doing the same pose what the fuck are u talking about,1
2487,2487,0,quantick,2022-06-21 07:26:25+00:00,339,43,12,0,,"Say what you like about Harold Wilson, he didn't fuck off to Viet Nam every time things got too tough for him.",1
2489,2489,2,StevijoPayne,2022-06-21 22:55:11+00:00,1672,67,351,7,,"You won't believe it. After all of the tests, blood, urine, nasal swabs, and chest x-ray, the doctor said, ""Stephen, you are a very sick man. You have flu-b and COVID19."" I said ""Fuck."" She said, ""That's what I said too."" I'm at CVS buying a drug store.",1
2490,2490,3,chucksta666,2022-06-21 16:32:52+00:00,88,14,3,4,,FUCK BASSNECTAR. IF U STILL SUPPORT HIM FUCK YOU TOO. ITS TOO MANY GOOD AMAZING ARTISTS WHO ARE GREAT PEOPLE TO STILL BE SUPPORTING THIS NECKBEARD CUNT WITH ZERO STEEZ,1
2491,2491,4,billybrizzle420,2022-06-21 18:35:10+00:00,129,7,10,0,,I don’t know who needs to hear this but I don’t give a fuck who you follow at all because it doesn’t impact me at all and I have way too much going on in my day to day life to ever think about checking,1
2492,2492,5,tlecaque,2022-06-21 22:47:51+00:00,54,3,6,0,,Fuck you too.,1
2494,2494,7,dontasktolink,2022-06-21 12:09:32+00:00,55,27,0,8,,I think I’m the only person who doesn’t give a fuck who tells me happy birthday 😭 like if you do that’s cool.. if you don’t that’s cool too,1
