,Unnamed: 0.1,Unnamed: 0,User,Date Created,Number of Likes,Number of Retweets,Number of Replies,Number of Quotes,Number of Views,Tweet,class
0,0,0,SanjayY09486815,2022-06-20 14:13:56+00:00,53,58,0,0,,"#কে_দেখেছেন_পরমাত্মাকে God kabir met shekh farid for holy knowledge from allah kabir (allah akbar)

Kabir Is God https://t.co/cLdZ6EzfAY",2
1,1,1,el_uthmaan,2022-06-21 06:44:46+00:00,199,84,1,0,,"Abu Huraira reported Allah's Messenger (ﷺ) as saying:

The uttering of (these words):"" SubhanAllah (Hallowed be Allah); Alhamdulillah (all praise is due to Allah), La ilaha illallah (there is no god but Allah) and Allahu Akbar (Allah is the Greatest),""",2
2,2,2,amandajo____,2022-06-21 16:40:13+00:00,310,25,10,3,,"Alhamdulilah that I am not worshipping the sun on this day anymore 🥹🤍🤍🤍🤍 
all praise &amp; worship is for Allah swt alone! Allahu Akbar!",2
4,4,4,islamicfreedom,2022-06-20 14:01:14+00:00,121,64,1,1,,"Make sure you say:

Subhaan'Allah.
Alhamdulillah.
Allahu Akbar.

RETWEET! It will help you ONE DAY.",2
5,5,5,ImtiazMadmood,2022-06-16 10:51:51+00:00,522,84,42,7,,"""Halal sex etiquettes:

Allah, Allah, Allah' with every thrust
and finally ""Allahu Akbar"" when you cum.""

~ Abdul",2
6,6,6,OfficialShiva29,2022-06-17 14:55:29+00:00,208,229,2,1,,"#କବୀର_ସାହେବଙ୍କ_ପରିଚୟ
Kabir is Supreme GOD, Almighty God Allah Hu Akbar and  Samrath means all' capable
In Veds His name (Yuva Kavir)
Supreme Sant Rampal Ji Maharaj. https://t.co/CYOLjXwXP9",2
9,9,9,MahmoodJMI,2022-06-19 11:01:47+00:00,52,17,0,0,,"Just in, #Hijabi girl topped Karnataka in 12th Science Stream. Suno, Ek Hijabi Ladki ne Science Stream se karnataka Top Kardiya. What a slap to entire Islamophobic system in karnataka. Allah u Akbar ✊ https://t.co/VR4MzyHPuP",2
10,10,10,WAR_ishaa,2022-06-17 12:56:58+00:00,50,4,4,1,,"This is very wrong whole country is doing Hindu vs Muslim.. This is very wrong, we should live in unity and make everyone Muslim🤲
Allah hu Akbar.",0
17,17,17,blue_tycoon,2022-06-18 19:29:14+00:00,50,16,2,1,,"Allahu Akbar!
When things just fall in place with little or no effort from your end.
Alhamdulillah!!! When it's time, there will be no time to even check time.
May Allah ease our affairs Ameen",2
23,23,23,Incognito_qfs,2022-06-18 19:29:22+00:00,296,60,6,0,,@total_woke_ #SaiPallavi : Hindus shout Jai Shree Ram before ki11ing cow smugglers. Musl!ms never shout Allah Hu Akbar before blowing up a plane.,2
32,32,32,annie_khalid,2022-06-17 12:34:55+00:00,514,79,21,4,,Allahu Akbar!!!!!! I have no words for this couple!!!!! 👏🏻 May Allah reward them,2
37,37,37,IbnAbdelKhaliq,2022-06-19 21:41:03+00:00,51,11,0,1,,"Listen to these beautiful words of Imam Nawawi (rahimahullah):

Zikr (the remembrance of Allah ta'ala) isnt restricted to saying SubhanAllah, La Ilaha Illallah, Alhamdulillah, Allahu Akbar etc. Anyone who carries out an act of obedience is in fact one who remembers Allah ta'ala.",2
43,43,43,Ujwal240283,2022-06-19 04:59:14+00:00,72,13,0,0,,"@Sai_Pallavi92 your empathy with Naxalism Other community has a problem because, never did Hindus wage a war on other countries. Never. So kindly continue ur stand but be NEUTRAL while speaking, for ex they said “Allah hu akbar and drove Hindus away from valley” thats is neutral",2
65,65,65,LewishamMosque,2022-06-18 14:29:23+00:00,60,10,2,1,,"Allahu Akbar!

Br Lloyd, now known as Muhammad, taking his Shahadah after Dhur Salah.

May Allah (SWT) increase his Eman and keep him steadfast, Ameen!

@iERAorg @Islam21c @5Pillarsuk https://t.co/Hks0D6gjFC",2
67,67,0,la_Blacks,2022-06-21 20:37:37+00:00,118,13,1,1,,soulful big brown eyes https://t.co/peRApZQ2iD,2
68,68,1,L7hunna,2022-06-21 20:47:45+00:00,453,95,4,44,,Dami and Indiyah want to turn this into a tasty blacks scene,2
69,69,2,teefortilly,2022-06-21 20:05:01+00:00,585,149,0,9,,Lost 3 blacks in a week. When I said the ethnic cap was full I didnt mean this!!!,2
70,70,3,zeelovee_x,2022-06-21 20:04:15+00:00,502,126,0,3,,Two blacks gone in one day? BLM down 5 points tonight,2
72,72,5,acnewsitics,2022-06-21 20:29:44+00:00,318,38,12,0,,"Heroin or cocaine because the Blacks.

- Rudy G.

It was a fucking mint candy.",1
75,75,8,Tyreeck_112,2022-06-21 20:16:37+00:00,418,35,1,3,,"Fiat 500 are winning this season, they got the blacks down 4-0 😭 #loveisland",2
76,76,9,Tyreeck_112,2022-06-21 20:04:20+00:00,50,10,0,1,,Only blacks have been evicted so far this season? #LoveIsland https://t.co/oIe2MJ6Xd4,2
79,79,12,bg_bookclub,2022-06-21 20:10:38+00:00,178,45,1,0,,It's gone from ACS to the only Blacks in the student union :( #loveisland,2
84,84,17,DrAndrewJackson,2022-06-21 20:25:02+00:00,109,16,7,2,,"Blacks, Hispanics and Asians are running away from the Democratic Party. 

The Democratic Party will soon be a little group of leftist whites working at Starbucks.",2
89,89,22,IrishRugby,2022-06-21 21:42:08+00:00,442,23,8,4,,"Kia Ora Auckland! 🇳🇿

After a long journey, the squad are settling into our base here in New Zealand ahead of the first match against the Māori All Blacks next Wednesday. 

#TeamOfUs | #NZTour2022 https://t.co/j8e7wPzsyc",2
92,92,25,Onitaset,2022-06-21 22:21:03+00:00,106,29,11,10,,"I think Black people are too noble and it's costing us an understanding of this savage world.

A lot of our ancestors had great characters; Garvey, King, X, all great!

But yt's ancestors were savages and they are in power.

But we as Blacks continue to be so regal and confused.",2
93,93,26,michelle_byoung,2022-06-21 22:47:13+00:00,77,16,3,0,,"@Charlottes_W3bb @IAmPoliticsGirl @DNC @dccc Your advice SUCKS! 
Blacks, Hispanics, Asians &amp; the LGBTQ+ community are WHY Dems win elections
The MAJORITY of W people vote for the GOP &amp; have since 1964
So you want Dems to stop catering to THEIR voters &amp; instead go after the people who DONT VOTE FOR THEM

GTFOWTBS https://t.co/aAHYYxLdJT",2
94,94,27,nesteggPUB,2022-06-21 19:52:57+00:00,99,4,18,1,,"@tribelaw You’re KIDDING, Lawrence???

Those who consume Fox News regularly don’t look at Blacks as HUMAN BEINGS 

THIS changes NOTHING",2
99,99,32,AamerAnwar,2022-06-21 21:00:22+00:00,131,95,5,12,,"For 7 yrs Scot. Police Fed. stated race had nothing to do with death of #ShekuBayoh, today PC Alan Paton was asked about allegations his grandfather made “I remember Alan saying to me that he was ‘a total racist &amp; hated all blacks’” watch 2end! report by @gordonchree Day20 https://t.co/9HKuTplcLp",0
108,108,41,ChloeAL10,2022-06-21 20:31:01+00:00,58,0,0,0,,@wearewatcher Is the day Ryan finally blacks out going to be the day ghosts are proven to be real and Shane has to start his apology tour?,2
131,131,64,_Lisah,2022-06-21 21:54:57+00:00,192,30,9,2,,"@gtconway3d Remember that Rusty Bowers, the Arizona man who almost cried about his constitutional duties, has helped to pass a boatload of voter suppression bills targeting Blacks, Latinos, and Native Americans in his state.

You know, in case anybody cares about such things. (Elie Mystal)",2
138,138,71,rising_serpent,2022-06-21 22:17:54+00:00,68,10,4,1,,"The ""wait till blacks own guns"" argument applied to schools.",2
139,139,72,Blakjizuz,2022-06-21 20:24:55+00:00,53,3,2,0,,@roccatgaming @thesiriusreport Will you keep shut?! Arrogant west thinking the world revolves around them. After what his officials did to blacks trying to escape the war you still have the guts to type this?,2
140,140,73,Chinchillazllla,2022-06-21 23:31:06+00:00,218,2,6,0,,"@jenny2x4 ""There's gonna be a war, man. I can see it. There's gonna be a war between the blacks and between the whites. You ain't even gonna need a uniform no more. This ain't gonna be a war where you pick your side. Your side's already picked for you."" https://t.co/14Pcu5iOzM",2
155,155,0,Kapil_the_Legit,2022-06-21 05:24:38+00:00,88,4,2,0,,We have won 5 UCLs since we last won the copa del rey https://t.co/wMAaFGHaQr,2
157,157,2,hxwlister,2022-06-21 16:26:59+00:00,66,10,6,1,,"I’m tired of speaking on this but. You’re literally just calling people holding you accountable, hate? Like when did you apologize for calling BLACK PEOPLE niggers? Is it that we want your power? Or the fact we would love to see you take accountability instead of fucking https://t.co/GGQ30nEzcW",0
159,159,4,prvdzb,2022-06-20 22:59:45+00:00,803,2,4,0,,@Chrisknickss @DrGuru_ But it does sound like nigger https://t.co/sOEvGQKpBZ,0
161,161,6,MoonMonkeyIsle,2022-06-19 19:16:11+00:00,237,32,17,1,,YOU HEARD THE MAN!! NIGGERS ONLY! https://t.co/H7OtWcSWk2,0
167,167,12,kelly_zvobgo,2022-06-21 13:02:16+00:00,100,1,82,4,,"Haven’t even had my coffee yet and I’ve already received an email saying I’m a “fucking nigger and should be gassed.” Lovely.

Also… isn’t Stannis dead? I distinctly recall he got his ass handed to him at the Battle of Winterfell. https://t.co/NTg2M3IcVo",0
169,169,14,Mergo69,2022-06-21 10:50:22+00:00,17,9,29,57,,@Kopter__ better to be Italian than a nigger,0
185,185,30,Blackamazon,2022-06-19 21:36:02+00:00,57,17,1,1,,"Gotta love the fact “niggers aren’t people” is their platform 

And folks still acting like their cute lil all white panels and call outs aren’t exactly what they want",0
198,198,43,crystalwhatmore,2022-06-21 19:32:55+00:00,90,0,2,0,,@sathungrysimp @autosport So if you call me a nigger in an endearing manner should I say thank you?,0
211,211,56,SoualiganAmazon,2022-06-21 12:16:24+00:00,75,11,5,1,,"This still got me crying. 
They saidt “inaudible nigger yelling. Must be a coconut negro!”.",0
218,218,63,aerial_knight,2022-06-21 08:28:23+00:00,55,1,3,0,,"@Kappische Name a black character in smash, there are very few black main characters in games and even when we do get a create a character feature the black hair options are always lacking. Or the fack that to play online I have to be ok with being call nigger by a 12 yr old.",0
222,222,0,bookslovebot,2022-06-21 18:41:34+00:00,486,56,2,30,,"“i reached for you, in my head, all these years. even after you dumped me like trash and I couldn’t fall out of love with you no matter how much i drank and snorted, my brain reached for you always.” https://t.co/E60AjEyG9K",2
223,223,1,WindUpVinilite,2022-06-21 21:02:49+00:00,64,11,1,0,,"Im trash with captions idk imagine something really cool is typed here okay 

#GPOSERS ♤ #FFXIVScreenshots ♡ #FFXIVSnaps ♢ #Miqote ♧ #EorzeaPhotos https://t.co/tjHlvLknFi",2
224,224,2,PHLSixersNation,2022-06-21 17:02:39+00:00,881,46,11,7,,"Pre-draft workouts should just be 1v1 with Embiid while he talks trash the entire time.

See how they handle it.",2
226,226,4,nylawho1,2022-06-21 20:03:28+00:00,893,15,21,0,,Every single workout I’ve had this month EVERY FUCKING ONE has been absolute fucking trash. I even left the gym with tears in my eyes a few times. But guess what ???? They still fucking counted,1
228,228,6,Elaquent,2022-06-21 17:42:26+00:00,156,22,2,6,,"If you fall out with/no longer fuck with someone, that’s fine, but don’t pretend they’re suddenly trash at their craft lol. That shit is very corny.",1
240,240,18,taraxrh,2022-06-21 17:29:58+00:00,57,0,7,1,,the smell of summer rain mixed with urine mixed with rotting trash in downtown montreal today .. this is why i moved to this city,2
241,241,19,Loganp812,2022-06-21 21:12:17+00:00,2683,18,19,0,,@xstanbx @m_egan11 That just makes me curious why someone would install Google Chrome on a vending machine and why the trash bin isn’t empty. Was someone just messing around with the vending machine before deciding it was time to set it up for service?,2
242,242,20,afrorckprincess,2022-06-21 22:03:07+00:00,90,16,2,5,,Paris came with the receipts!!! Here’s the proof of Chris Brown shading and publicly disrespecting Normani smh. He is TRASH!!! https://t.co/qc7qNbbfiq,2
262,262,40,BNezamoodeen,2022-06-21 20:05:41+00:00,289,2,4,1,,"@DiscussingFilm @krolljvar if disney is impressed with it, it means it will be trash",2
265,265,43,TheSatoProject,2022-06-21 15:35:03+00:00,117,12,3,2,,"Poor Mighty Oscar thinks that having a harness on means he isn’t allowed to move. You can do it, Mighty! With that harness on, it means many safe adventures are in store for you. Since being rescued from a trash can, this tiny sato has continued to thrive in his foster home. 💪 https://t.co/XIylmJqBQE",2
267,267,45,KanyeStanaccou1,2022-06-21 18:41:09+00:00,58,3,0,0,,@PhotosOfKanye @SKKN Am happy with my Fenty beauty products... I trust Riri cause she never used surgery to enhance her beauty no matter what plus they are really working... My skin is glowing... Kanye is good at helping people who trash him when he is at his lowest...,2
268,268,46,mistergeezy,2022-06-21 16:49:44+00:00,56,8,28,1,,"here's my take on Beyonce's Break Your Soul. as a big fan of house music like FOREVER, everything about this song is OFFENSIVE to my ears. Where is the baseline? the vocals were lackadaisical with no energy, the production is all over the place without a purpose. it is TRASH. 👎🏽",2
272,272,50,Lakesh0wAidan,2022-06-21 18:33:45+00:00,265,1,1,0,,@TraSh__Legend i have to find the vid of him breaking the glass gym door with the ball that shit had me laughing for like a month 😭😭,1
279,279,57,deerfella,2022-06-21 17:56:25+00:00,148,4,16,0,,"my take on the abnb thing is i am not paying $400 to stay in a tiny house for a single night with 10am check out and also be responsible for taking out trash, washing/drying/folding bed sheets, and sweeping all of the floors before i leave. wtf is the point",2
284,284,62,Asher_Wolf,2022-06-21 17:26:54+00:00,253,0,5,0,,"This last five months juggling work, Ehlers-Danlos, uni assignments, sole parenting and sick with covid and flu, I kept telling myself: this isn’t your whole story, it’s just a chapter.  Write the best version you can, don’t trash it cos the plot didn’t unfold the way you wanted",2
287,287,65,AbeFroman,2022-06-21 20:26:59+00:00,65,7,9,1,,"I can’t say what I wanna say about Steve King’s trash ass tweet without being suspended from twitter, or possibly even charged with a crime, but I don’t know how the hell this tweet is still up. WOW.",2
303,303,81,deerfella,2022-06-21 17:58:10+00:00,55,0,2,0,,"trust me we stay in plenty of hotels for work and are always courteous with cleaning up after ourselves and making sure theres no loose trash around the room but these freaks buying 20 tiny houses, over pricing them, n then having you CLEAN THE WHOLE THING is insane",2
310,310,0,_LALILULEL0,2022-06-21 18:01:54+00:00,57,32,2,8,,"u got ""boujie bitch"" &amp; ""gold digger"" in ur name and u fuckin w a married dude. u really don't deserve a good man lmao https://t.co/IhG7EdC6T7",1
311,311,1,stebedonnet,2022-06-21 02:33:28+00:00,1081,69,3,4,,very excited to watch Stede notice his cravat still wrapped around Ed’s neck when they’re reunited &amp; Ed is confused wondering why Stede is staring at him all weird until he tracks where Stede’s eyes are focused &amp; tries to play it off cool but inside he’s going “U FUCKIN IDIOT”,2
312,312,2,jonmoxIeys,2022-06-21 23:12:50+00:00,164,11,2,0,,IGOR UR THE BEST AND I FUCKIN LOVE U MY VEZINA WINNER  https://t.co/xEcKojzR09,1
314,314,4,brendan905,2022-06-21 10:59:28+00:00,379,5,12,0,,look I’m having fun in europe what’s with u guys? did u all forget that I make fun of everyone at our shows? lmao like if I actually hated u I’d fuckin stay home relax ❤️,0
317,317,7,kittaveli,2022-06-21 15:14:24+00:00,84,17,7,6,,"HOLY COW!!!!!!!!!!!!!!!!!!!!!!!!!!!!!!!!!!!!!!! i NEED u to fuckin click on this and listen to it or im going to explode . thanks guys 💋💋💋

https://t.co/iV7FFotjlP",2
318,318,8,oranicuhh,2022-06-19 14:01:53+00:00,196,14,2,0,,"it’s crazy cuz the leaning tower of pisa is just an architectural mistake

like when u rly look at it, it’s less majestic and kinda fuckin hilarious",1
322,322,12,counterparts905,2022-06-21 20:28:01+00:00,134,3,2,3,,stuttgart was fuckin psycho also love that u freaks are dancin to our kpop playlist before the set go off goofy,1
324,324,14,psithirissma,2022-06-21 04:55:43+00:00,74,5,1,0,,"finally watching the cutting corner podcast AND HOW DID I SAW NO ONE TALKING ABT THE PART TOMMY SAYS ""and technoblade fanboy but i still am now. ppl will be like Why did u spam techno in your thumbnails and im like /cuz its fuckin technoblade/. (laughs) techno knows that"" HELLOOO https://t.co/mQWRM2C1aw",2
326,326,16,sadcrib,2022-06-21 16:44:42+00:00,2810,23,3,0,,@wydccalamity don't u fuckin touch my shell fish,1
328,328,18,SylverRye,2022-06-20 22:10:14+00:00,92,3,15,0,,"Me: hi ma'am how are u today

Customer: well im truckin instead of fuckin, so my day could be better

These people just say ANYTHING on my line😒.",1
337,337,27,SeraphinaSimone,2022-06-20 12:39:16+00:00,283,5,2,0,,"DON'T BE EMBARRASSED THAT ALL YOU'VE HAD IS FUN
PRIORITISE PLEASURE

Cannot tell u how much these words have been my saving grace so fuckin lucky to get to sing them on stage with angel baby @SELFESTEEM___ ❤️",2
346,346,36,jonmoxIeys,2022-06-20 17:39:33+00:00,80,2,2,0,,the one argument i hate against igor winning the hart is that “he had a couple games where he struggled” ok?? its bc he literally got overused since he fuckin CARRIED THE TEAM THE ENTIRE YEAR hes allowed to be a lil fuckin tired u STUPID BITCH,1
357,357,47,Murdatv,2022-06-19 19:47:28+00:00,94,2,6,0,,2 Days damn near 22hrs in 100 Degree weather in a fuckin wheelchair in Hella Pain and made it Look Easy! This one is For u Lazy ass Streamers to wake tha Fuk up and get out there and Grind!!!!!!!! https://t.co/aW9MMDBOoQ,1
376,376,66,ajwyman,2022-06-21 08:41:49+00:00,62,1,3,0,,"today is my first day back in my own university classroom in 5 years.

you fuckin' bet i'm going to sit on my desk instead of in a chair &amp; be so fervent in my love of teaching &amp; learning &amp; also act like an idiot — who u think all those tv characters we made were based on",2
377,377,67,pakunodykee,2022-06-21 04:58:04+00:00,107,0,0,0,,like how did it get to the point where THAT MANY PPL thought u were a different race/ethnicity lmao thats fuckin wild,0
392,392,0,honeypluton,2022-06-20 20:44:57+00:00,2310,99,7,6,,Sometimes old dyke tattoo sleeves are so ugly it’s actually inspired and erotic. Like blue piano keys going into a sun blast with a portrait of Aphrodite  and a cassette tape. Like yum actually,0
407,407,0,ChOkEoNmYbOnE,2022-06-17 19:57:07+00:00,567,39,18,11,,I just beat up this white man for calling me a nigger n I’m ngl it felt good af,0
469,469,0,tunesintern,2022-06-21 03:45:49+00:00,477,29,57,9,,white chocolate is ASS,0
470,470,1,untotooku,2022-06-21 21:09:19+00:00,72,7,0,0,,he sat his white ass down and listened https://t.co/Uo7VcNX1uD,1
471,471,2,Nickofentse,2022-06-21 16:51:33+00:00,227,28,69,6,,"Listen here you sons and daughters of Witches, Sellouts, House Negroes and White Ass lickers, weather you like it or not, the CIC and EFF President Julius Malema will be the President of the Republic of South Africa. Go argue with your father satan.",0
474,474,5,sexwithuruncle,2022-06-21 21:53:34+00:00,162,9,1,1,,My white ass mother doesn’t respect my appreciation for hood culture,0
475,475,6,buffnamgi,2022-06-21 15:58:06+00:00,620,54,5,8,,"@lesbianamu @CarrieCnh12 and YOU @tylerrasch you nasty white man you sat there in this space and decided to keep your mouth shut while this absolute nonsense was being spouted?? like you weren’t eating with namjoon at a reunion dinner literally A MONTH AGO, have SOME decency as a grown ass man.",0
476,476,7,CoyMayNotExist,2022-06-21 02:06:07+00:00,196,7,1,1,,"Sapnap, I swear on my ancestors that I will get your white Texan ass if this stream isn’t real, I love you but you better not trick me https://t.co/KQGArpLGVj",1
478,478,9,avanjogiasslut,2022-06-20 23:03:12+00:00,675,12,3,3,,"@_haaniyah_ Literally, all this for some white woman who got a big ass forehead",1
481,481,12,PHOTOGRAPHSYRE,2022-06-21 06:24:24+00:00,230,25,26,40,,ariana is not the main girl u guys think she is 😭 she’s a little white girl that cosplayed as black for majority of her career because no one wanted to see her casper ass on any damn album covers,1
485,485,16,JDCowboys4Life,2022-06-21 13:07:10+00:00,94,1,1,0,,@thedoncam0 @papyfaye1 @BleacherReport @JakeLFischer “You alright white boy” ass pic 😭,0
489,489,20,RedSunrise376,2022-06-21 05:17:30+00:00,72,8,4,1,,Why would I listen to some white ass music critic when I got a friend like @DaShaunLH ??? The nigga be better studied than 80% of these magazine writers,0
495,495,26,StrengthEwa,2022-06-21 10:51:04+00:00,115,8,3,0,,My world is fucking simple- all or nothing/ right or wrong/ black or white/ peace or war… half ass attitude gets half ass results. On every life level #strengthtraining #strongwomen I treat life seriously. Because it’s not like death is a joke… https://t.co/UX4L3wHQtJ,0
499,499,30,metalgearobama,2022-06-21 01:06:53+00:00,50,0,1,0,,Not my white ass working on Juneteenth (Observed),1
500,500,31,WessonWifey,2022-06-21 21:39:18+00:00,77,13,1,1,,"y’all always think racism is a fucking game until it’s not. y’all ever lost a friend to the police? a mob of white guys who were transphobic? the prison industrial system? no? then sit your sheltered ass down. i did this shit already, if y’all want proof go through my page.",1
509,509,40,RedLReviews,2022-06-21 15:38:33+00:00,213,32,6,4,,"Seriously even if he wasn’t racist and shit, he was always a pretentious ass person that only ever saw Spider-Man as an angry white dude that deserves to be angry because his life sucks and it has to suck all the time so he can always be angry at life and never get a break",0
510,510,41,IAmClintMurphy,2022-06-21 12:06:36+00:00,222,32,2,0,,"• Work ethic 

Get a white-collar job or be an entrepreneur, but don't lose that blue-collar work ethic. 

Get up like a farmer. 

Work your ass off like a labourer. 

Have a white-collar job with a blue-collar work ethic. https://t.co/FGgTvvrxl0",0
514,514,45,tunesintern,2022-06-21 03:38:09+00:00,159,3,9,0,,@sammerIammer ima get attacked but white chocolate is ass,0
519,519,50,KIR_bigg50,2022-06-21 14:32:47+00:00,53,7,6,0,,Whiny ass liberal white ladies are the worst..,0
537,537,0,Sneegsnag,2022-06-21 16:42:29+00:00,27442,444,289,29,,All your favorite white boys will be at Vidcon but I shall remain. I will fill the void of content you need while they are gone. I will be your substitute white boy,0
538,538,1,PAIDDWAYK,2022-06-21 14:41:19+00:00,58,13,3,3,,"White boy walked in Walmart mad asf… I left all my groceries😩

 Not tf today.. 😭",2
539,539,2,dites_favorite,2022-06-21 18:16:46+00:00,529,59,4,9,,Clarisse not even a bully forreal she just had to put the new white boy in his place before he got all high and mighty 🤷🏽‍♀️,2
541,541,4,ConnorEatsPants,2022-06-21 19:17:49+00:00,5212,35,54,30,,@Sneegsnag you've always been my sub white boy,2
545,545,8,softfuzzymike,2022-06-21 17:47:44+00:00,591,30,13,0,,CURLY HAIRED WHITE BOY LAWYER: your honor (rolls eyes and sways back and forth) why are you so presssedddd haha,2
546,546,9,halfbloodtrio,2022-06-21 18:29:42+00:00,62,13,1,1,,Percy is camp half blood’s token white boy,2
547,547,10,aimseytv,2022-06-21 17:01:36+00:00,11638,59,44,3,,@Sneegsnag sorry to disappoint but i’ve already filled the spot of substitute white boy,2
548,548,11,GameHistoryOrg,2022-06-21 21:00:01+00:00,458,127,9,22,,"Some forget that the Mega Man Battle Network tactical RPG series made it all the way to #6 on handhelds. (This ad scanned from the VGHF Library is for the dual White and Blue versions of #3 for Game Boy Advance, released in 2003!) https://t.co/r5yO5we1aZ",2
549,549,12,snifferish,2022-06-21 18:32:11+00:00,6114,74,25,2,,"@aimseytv @Sneegsnag can you guys let me know the final verdict, which white boy am I supposed to send suki photos to https://t.co/fB8JKE4CCL",2
550,550,13,michaelmalice,2022-06-21 19:25:41+00:00,2738,247,145,10,,"To translate from AWFL to English: ""young white boys are all getting red-pilled despite our 24/7 agitprop attempts to the contrary.""

Theyre losing their grip over the next generation https://t.co/Slnz9fCzjO",2
552,552,15,ErynStreams,2022-06-21 18:16:25+00:00,2478,14,9,0,,"@Sneegsnag i would also substitute as your favourite white boy, sadly that’s out of my skill set",2
554,554,17,ThatOnePoes,2022-06-21 20:05:35+00:00,945,6,1,0,,@sk8terboypercy @PanicStation26 Shdhaidjwjdjd no cos Rick making sure only one white boy in that camp. I love it 😭,2
555,555,18,IamManuelClay_,2022-06-21 19:40:37+00:00,119,31,30,6,,🚫THIS PAGE SUPPORTS VIOLENCE 👉🏾A rare video of “If you can survive in Nigeria you can survive anywhere” Nigerian Man Knocks the sick fuck outta two white boys in UK #ViolenceFC una go like this one😂😂 She’s a 10 | #girlfriend | #LeeMinHo | Cubana | Can I DM | Uncle Kunle https://t.co/JmBehkLS25,0
568,568,31,svartexcellence,2022-06-21 18:00:55+00:00,66,0,2,0,,@SBNstan @Bblmeat17601982 @Lastnamewelcome @MelaninBarb19 @MicahaelBond @sweet_novacanee @__Laolu then why u comparing white boy?,2
577,577,40,VinnieParise,2022-06-21 20:35:19+00:00,117,8,5,0,,"I am looking forward to seeing Dylan Cease pitch against another high powered offense. 

Being 10-0 against a lowly Detroit Tigers team is very nice. I do think he needs to perform better against the big boys. Toronto is a big boy offense. 

Go White Sox.",2
580,580,43,sixofweebles,2022-06-21 19:06:55+00:00,166,0,2,0,,"@MarvelStudios @disneyplus bruno dancing with them… go white boy, go! 😭",0
