,Unnamed: 0.1,Unnamed: 0,User,Date Created,Number of Likes,Number of Retweets,Number of Replies,Number of Quotes,Number of Views,Tweet,class
4943,4943,5,seeker_solace1,2022-06-19 17:28:18+00:00,105,20,2,1,,"He is peddling the same false narrative that RSS is trying to push by fabricating history, that Savarkar is a dalit emancipator. Internet is full of such articles but no amount of white washing can erase what savarkar himself wrote abt manusmriti..1/4",2
4944,4944,6,dizzydayyz,2022-06-21 04:05:55+00:00,122,17,2,0,,That fandom is full of white MFING men who fetishes Asian women. They are proud racist but that FCKING fandom act like they can’t see that. FCK them AND fck that group..,0
4946,4946,8,andyalmonte0,2022-06-20 17:05:51+00:00,57,15,4,1,,Banks closing for Juneteenth in all white neighborhoods w/all white staff on 6/20 while factories full of Black Americans in the same city are working for low wages is the epitome of America &amp; NH,0
4963,4963,25,Victoria_Spratt,2022-06-16 06:48:27+00:00,101,17,7,2,,It’s renting reform white paper day - a day that renters have been waiting for since 2019 when plans to end Section 21 evictions were first announced. Analysis of the white paper - which is jam packed full of policies - from me shortly @theipaper,2
4967,4967,29,blacklikewho,2022-06-20 19:08:48+00:00,50,7,0,0,,The white left in Canada is full of clowns. There. I said it. Get mad now. Tired of ya’ll and your limited imaginations.,1
4970,4970,32,rdcarrington,2022-06-21 11:29:41+00:00,147,28,54,6,,"Another moron full of opinions with no facts.  Harris is treated the way she's treated because she's an incompetent moron who was only picked because she wasn't a white man.  YOU and people like you have caused the damage we're ALL seeing because of it.

https://t.co/rVoLerYigw",2
4981,4981,43,tressiemcphd,2022-06-17 13:44:12+00:00,134,16,2,0,,"""Mainstream country music is full of all kinds of deviance that is only considered okay because it's white.""

https://t.co/9WLflaFmEv",2
4983,4983,45,sobri,2022-06-19 04:37:26+00:00,93,7,4,2,,"Cycled past a hostel cafe moments later, full of 20+ whities, absolutely all without masks. It’s a full on white backpacker phenomenon.

Japan has the right idea. They shouldn’t be allowed in unsupervised. I feel radicalised. This is grossly disrespectful behaviour.",2
4984,4984,46,MIAagainstFash,2022-06-16 22:30:39+00:00,56,27,7,3,,"Is it impossible for the 7+ Proud Boys on the @MiamiDadeGOP to be white supremacists because they are Cuban?

See for yourself: Enrique Tarrio at a central FL rally full of Proud Boys &amp; neo-Nazis. Behind him are white supremacist and Holocaust denial banners. See below for more. https://t.co/WNhPwxYiSM",2
4985,4985,47,wxyzybxz,2022-06-21 03:21:04+00:00,104,36,0,2,,"220621 11:19 The Longest Promise x Xiao Zhan 

Holding the umbrella and meeting the flowers, the eyes are full of hope, and the white and red will be close to each other.  The fate of endless, the love is so deep, and the two hearts are far away. https://t.co/GHSul898L9",2
4988,4988,50,fxxfy,2022-06-16 22:40:47+00:00,52,0,4,2,,Learning once more that I am a “white man.” The world is truly full of surprises and wonders,2
4999,4999,61,RjArsenalBlog,2022-06-15 22:06:11+00:00,125,6,2,1,,"What encourages me is that our squad will be full of players across the backline/midfield who excel at switching the play (White, Saliba, Tomi, Partey, Xhaka, Tielemans (if he arrives), Sambi, Ode). Such an underrated trait in football as the space is always available out-wide.",2
5003,5003,65,blaqueword,2022-06-21 21:54:14+00:00,106,11,1,1,,"White people will learn about systematic oppression Black people face and compare it to every situation they go through ever—

The only time yall even say Black in this article is to invoke the Central Park Five. Yall full of shit",0
5005,5005,67,WaterVole,2022-06-20 18:32:34+00:00,94,14,3,0,,"This farmland wildflower meadow is full of Oxeye Daisies, Common Knapweed, a fair number of Pyramidal Orchids and Common Spotted Orchids. The number of Marbled White and Common Brown butterflies here was reassuring! We need more wildflower meadows across the UK @savebutterflies! https://t.co/y6A3SLTIGF",2
5008,5008,70,BondSarah_Bond,2022-06-19 21:05:07+00:00,268,18,3,1,,"2/2 When we reflect on the past and build a deeper understanding of its implications on the present, we equip ourselves to build a better world, a world that is not simply black and white but full of color and opportunity for all. ❤️",2
5012,5012,74,RenyTure,2022-06-17 14:29:54+00:00,76,13,2,0,,Ukraine gov full of white supremacy. And NATO is literally an alliance created in defense of imperialism ☠️,2
5013,5013,75,gal_suburban,2022-06-17 20:42:03+00:00,79,27,4,5,,"Orgy rooms at ""conservative"" think tank consortiums are full of Tea Party Islamophobia &amp; white grievance evangelicalism. Trump is not the head of this ugly snake, he's what the snake excreted. Go to the sources where he melted his brain w/propaganda.
#InstitutesofMassDestruction",2
5025,5025,5,Butterflypimp1,2022-06-19 21:58:29+00:00,246,13,4,1,,Jordan b is a lame ass bitch you saying God don't play about you and like that's her karma cus her baby died bc you mad over the same nigga that beat your ass and pissed on you while you was pregnant with his child bitch get over it,1
5092,5092,72,Rollitupk,2022-06-21 14:55:58+00:00,177,6,7,3,,Man y’all need to shut the fuck up big lame ass. Unfollow me then Nigga cause ima prank them niggas again. Y’all ain’t see NO DAMN gun. Y’all be tryna seem so gangsta on this bitch and wouldn’t buss a grape in a fruit fight. It’s a pranks. Accept it. Fuck what you would’ve did!!,1
5120,5120,7,Butterflypimp1,2022-06-19 21:58:29+00:00,246,13,4,1,,Jordan b is a lame ass bitch you saying God don't play about you and like that's her karma cus her baby died bc you mad over the same nigga that beat your ass and pissed on you while you was pregnant with his child bitch get over it,1
5187,5187,74,Rollitupk,2022-06-21 14:55:58+00:00,177,6,7,3,,Man y’all need to shut the fuck up big lame ass. Unfollow me then Nigga cause ima prank them niggas again. Y’all ain’t see NO DAMN gun. Y’all be tryna seem so gangsta on this bitch and wouldn’t buss a grape in a fruit fight. It’s a pranks. Accept it. Fuck what you would’ve did!!,1
5244,5244,1,Butterflypimp1,2022-06-19 21:58:29+00:00,246,13,4,1,,Jordan b is a lame ass bitch you saying God don't play about you and like that's her karma cus her baby died bc you mad over the same nigga that beat your ass and pissed on you while you was pregnant with his child bitch get over it,1
5245,5245,2,MarkiaaG_,2022-06-15 15:20:12+00:00,83,68,0,8,,Bitches be wanting you to have a problem with they lame ass so bad 😭 DONT NOBODY BEEF NOMO HOE. Get u some money bitch,1
5295,5295,52,Rollitupk,2022-06-21 14:55:58+00:00,177,6,7,3,,Man y’all need to shut the fuck up big lame ass. Unfollow me then Nigga cause ima prank them niggas again. Y’all ain’t see NO DAMN gun. Y’all be tryna seem so gangsta on this bitch and wouldn’t buss a grape in a fruit fight. It’s a pranks. Accept it. Fuck what you would’ve did!!,1
5319,5319,0,iamkevingates,2022-06-17 05:38:44+00:00,1797,471,132,46,,Had it preconceived you a never fuck wit somebody like me - #Khaza #ShootMyShot,1
5325,5325,6,memphisbleek,2022-06-16 03:39:08+00:00,58,21,7,12,,That one harder than anything he ever spit in his life you can’t ever fuck wit me I’m a prove it!  @thejuelzsantana,1
5333,5333,14,NicKnowsBall,2022-06-15 18:25:19+00:00,83,0,2,0,,@Bennitoe713 @MeWoodOrji @RunItBron He’s spending time wit his son bru hop off 😂fuck you want him to do lock his self in a room until tmr?😂,1
5413,5413,1,Gretchen_Foobar,2022-06-15 10:42:04+00:00,144,14,5,1,,"@ohyesitwitted21 @GwenieThinks Seriously.  The GOP is all for the hispanic vote, actually courting them for it.  Same GOP sees them at Walmart and if they are speaking in spanish, they call them wetbacks, illegals, and tell them to go home to Mexico.",0
5459,5459,0,IluluDrago,2022-06-21 19:03:14+00:00,402,43,2,0,,Show me those pearly whites! https://t.co/DdzDJ4Yar3,2
5461,5461,2,SYFY,2022-06-21 21:01:00+00:00,268,24,10,0,,"Whether you have pearly whites or sharp daggers, show them off on #NationalSelfieDay with the cast of #ResidentAlien. 😄 https://t.co/t0UZJEs8qN",2
5462,5462,3,dobleru,2022-06-21 21:28:56+00:00,971,13,7,0,,"@arman1999200 Sh don't burst his bubble, it's easier to blame the white man for not liking a bland show that isn't marketed towards them. If he was lashing out at negative reviews by white people then I'm on that team, but lambasting the whites for daring to not like the show is a bit...whiny?",0
5463,5463,4,_KRVSX,2022-06-21 18:31:58+00:00,67,6,21,2,,Are the whites okay?,2
5467,5467,8,DrAndrewJackson,2022-06-21 20:25:02+00:00,109,16,7,2,,"Blacks, Hispanics and Asians are running away from the Democratic Party. 

The Democratic Party will soon be a little group of leftist whites working at Starbucks.",2
5472,5472,13,Lifecruzin,2022-06-21 17:18:29+00:00,127,8,19,1,,@VoLinxx @MayoIsSpicyy I'm white and I'm begining to believe we'd be better off if we did replace whites.  It breaks my heart to feel this way but I'm so sick of whites believing there better then everyone else.  Do these supposed Christians think Jesus was white?,0
5474,5474,15,LittleBoats2020,2022-06-21 20:41:59+00:00,183,74,9,4,,"The malignant campaign to demonise &amp; undermine white people in a majority white country is sinister &amp; dangerous

White Wokes attacking their own race is insane but those adding BS like this to the mix will eventually incite a race war that will see whites turn red with rage!",0
5481,5481,22,Steve_Sailer,2022-06-21 22:34:18+00:00,453,76,12,5,,"There are two kinds of gun control: 

The Good Kind: Preventing law-abiding rural whites from legally buying rifles, which appeals to Democrats.

The Bad Kind: Stopping criminal nonwhites from carrying illegal handguns, which is racist &amp; of little interest to Soros-funded DAs.",2
5484,5484,25,MrCheeseballs,2022-06-21 20:21:49+00:00,92,3,3,0,,"@Rilameth @Kyla_Lacey Literally no one is arguing that all white people are rich, but ANYONE can look at this graph and see with their own two eyes that black homes are still significantly less wealthy than whites. This discussion is not about how hard life is for working class white people. https://t.co/3bykwaDR7T",0
5508,5508,49,PunishedHavoc,2022-06-21 23:10:54+00:00,68,1,2,0,,@JUNlPER @jenny2x4 Non racist whites love to type paragraph long instructions about how to be a better black person in the name of proving they aren’t racist,0
5509,5509,50,vrtzee,2022-06-21 19:49:46+00:00,52,0,1,0,,"Osamu snaps, his vision whites out completely, as he comes in long, thick spurts into his underwear and over Suna’s fist. He doesn’t know what kind of noises he’s making through the ringing in his ears, but he must be loud judging by the scratchiness in his throat.",0
5519,5519,60,Perpetualmaniac,2022-06-21 20:10:06+00:00,1216,92,254,10,,"@mariashriver I’m sorry, but Donald Trump did not weaponize the media, social media, make our institutions racist against Whites and rig the elections with mules, machines and other. Nor did he provoke russian to invade Ukraine by weapons trafficking. Nor the inflation mess.

The left did that",2
5523,5523,64,Chinchillazllla,2022-06-21 23:31:06+00:00,218,2,6,0,,"@jenny2x4 ""There's gonna be a war, man. I can see it. There's gonna be a war between the blacks and between the whites. You ain't even gonna need a uniform no more. This ain't gonna be a war where you pick your side. Your side's already picked for you."" https://t.co/14Pcu5iOzM",2
5530,5530,71,froomkin,2022-06-21 18:25:01+00:00,84,27,7,1,,Ooh that fine’s gotta hurt. $115K for years of letting advertisers target housing ads at whites only.,2
5535,5535,76,BreakingBrown,2022-06-21 20:52:05+00:00,89,31,3,1,,"We live in a globalized America, where both whites &amp; POC, who have exponentially more wealth than us, are pouring wealth into their kids, bc that’s what it takes to survive, and some of y’all don’t even think ur parents r obligated to consider u?🥺

https://t.co/gWeznSCqoX",2
5540,5540,81,SiimplyGrinding,2022-06-21 18:52:09+00:00,155,7,4,0,,@BADGEPLUG I dont mind 60 3pt ratings being able to green if they’re good enough to time the shot at that disadvantage but the amount of whites everybody is making is absurd,2
5549,5549,4,genghisbruh,2022-06-20 12:51:33+00:00,195,13,32,4,,"Same white guy: ""We stand with you, our Taiwanese brothers and sisters, against the evil CCP because we Americans are the beacon of freedom, equality, justice, democracy, and civil rights. I bet you Chínk- I mean Chínamen never had any of that stuff before, huh Thai people?"" https://t.co/fiJ9OHzuzi",2
5553,5553,8,kewltie,2022-06-16 11:31:06+00:00,66,2,1,0,,"Izuku suppresses the tremor rattling in his heart. Onaga truly knows how to find the chinks in his armor and dig deep into the open wound. He always been proud of who he is and where he came from, but sometimes shame creep up on him when he is reminded of his own inadequacies.",0
5558,5558,13,tathagata2,2022-06-15 06:52:23+00:00,181,29,13,0,,"An input from a friend of mine,a thinking person. I do not necessarily agree with all of it.
Was Nupur Sharma' s deplorable remarks on you - know - who an unmixed disaster? At first sight it would appear so. But on deeper reflection l see chinks of sunlight amid the clouds....",2
5559,5559,14,stopbeingthem,2022-06-18 21:14:40+00:00,149,7,15,1,,this top 3 will spit on my face and call me a fucking chink,0
5561,5561,16,Wwm_Shakespeare,2022-06-21 23:18:26+00:00,115,4,2,1,,"Thou wall, O wall, O sweet and lovely wall,
Show me thy chink, to blink through with mine eyne!",0
5563,5563,18,mrscabbie,2022-06-19 11:54:37+00:00,62,0,3,0,,So lovely to meet you @shaunwkeaveny and to chink glasses in real life. #kyobc https://t.co/WOLYXFhfuY,0
5582,5582,37,storiesbyjemay,2022-06-16 02:15:11+00:00,57,6,2,1,,"There is a chink in the Harkles Montecito armour.  They are not universally loved by all in California, there seems to be growing local criticism of the duo. Here's two recent local articles 
https://t.co/g73h1AEPCC
https://t.co/lDE7KpgEBR",0
5596,5596,51,iabaseball1,2022-06-21 03:57:40+00:00,77,11,0,0,,"Only one team has managed to find a chink in the Johnston armor and that's @BaseballSEP who yet again split a DH with the Dragons, winning game one 11-10 and falling in game two 4-2! What showing from the Rams who have proven themselves to be a strong force here in 4A. 
#iahssb https://t.co/MIm66fRkwI",2
5603,5603,58,Lee_in_Iowa,2022-06-20 03:35:53+00:00,62,23,3,0,,"@duty2warn Yes, the Trumpians showed us every weakness and chink in the armor of our Constitution and Bill of Rights. For example, we can't entrust the 25th Amndmt to a Cabinet appt'd by the potus who is nuts. 1/2",0
5612,5612,0,TexAgs,2022-06-21 21:37:29+00:00,1665,304,4,17,,"Dettmer. Dealt. DIRTY. 😤

#5 Texas A&amp;M eliminates Notre Dame from the 2022 Men's College World Series #GigEm 👍 https://t.co/bzRvWAe16Q",2
5613,5613,1,DylanOgline,2022-06-21 21:57:10+00:00,18987,3167,1205,186,,"It's crazy that a struggling single mother getting assistance can be billed as getting a dirty nasty ""handout"", that she is lazy and needs to get a job.

But the same thing given to a corporation? Oh that's just a positive subsidy!

That make sense to you?",2
5614,5614,2,Betas_Inferno,2022-06-21 22:31:10+00:00,949,32,42,1,,How tf can you own a bidet and STILL have a dirty ass,1
5615,5615,3,Jennyflower,2022-06-21 20:13:24+00:00,973,187,65,8,,Nadine Dorries as Culture Secretary and Dirty Dacre in the House of Lords. What's next? A horse as a Consul?,2
5618,5618,6,BarstoolTexasAM,2022-06-21 20:53:22+00:00,454,11,0,1,,NATHAN DETTMER APPRECIATION POST!! WHAT A BOUNCE BACK START FOR THE DIRTIEST OF DIRTY!! THANK YOU DETT!! SEVEN SCORELESS INNINGS!! WOW https://t.co/UBwTiiCLxR,2
5619,5619,7,RonFilipkowski,2022-06-21 20:09:59+00:00,3034,528,137,29,,"Time and time again Trump has proven that he is a bully and a coward. A coward because he always asks others - from Roy Cohn to Michael Cohen to Rudy Giuliani to mobs at his rallies and events - to do the dirty work for him, while he hides behind them gleefully watching.",2
5620,5620,8,Chris89858830,2022-06-21 21:26:21+00:00,57,0,18,1,,Had a magic night last night at a beautiful resterauant with my now offically engaged partner Sam Fickling with a special dance to dirty dancing the last dance and proposal https://t.co/571ATia9Ww,2
5621,5621,9,Paddydhrty,2022-06-21 21:41:41+00:00,76,4,10,4,,"Sharing this for those who don’t think homophobia exists in 2022 because I experienced it 1st hand tonight🧵

Tonight walking to the shop for milk in a well-lit street with traffic, a car slowed down, rolled down the windows and shouted out “F you, dirty bender”.",2
5623,5623,11,OMGno2trump,2022-06-21 21:48:34+00:00,313,116,3,2,,"I've noticed a change in news and social media outlets since the Jan 6 hearings started.  As dirty and guilty as many of us know Trump, the GOP and Fox have been, there's always been a degree of reasonable doubt.  But that's gone now.  They're all guilty as hell.  Everyone knows.",2
5630,5630,18,SanAntonioZoo,2022-06-21 21:30:04+00:00,516,46,3,1,,"ZOO BRAG - Nathan “Dirty Dettmer’s” mom works at the zoo, he’s family.Nathan has the heart of a LION! @NDettmer21 @AggieBaseball #GigEm #CWS #CWS2022 #AggieBaseball https://t.co/EpFYJuDJiL",2
5633,5633,21,Urbanartist2,2022-06-21 23:29:59+00:00,121,16,25,2,,"this is my rescue project I started at the onset of Covid in 2020, he was living in a used car lot and it took me six months to convince him to come home with me.I named him Helen Keller, he’s about 12 and is almost blind &amp; deaf. He was dirty &amp; malnourished, now he’s just happy! https://t.co/BVG1T1s4SL",2
5635,5635,23,akintonmide,2022-06-21 22:58:04+00:00,1018,504,28,11,,"Sir @PeterObi, it is time to beef up your security - both physical and mainstream.

Pay more attention to statements made and have a team on a standby to push back against dangerous narratives. It's about to get dirty like the old political play.",2
5636,5636,24,Lingzi_W,2022-06-21 20:56:49+00:00,109,3,43,3,,Don’t be this dude! 😳 it’s your problem if you let you mind went to a dirty place. I was talking about a skin care facial. WTAF! https://t.co/E5pbBcVmG5,2
5641,5641,29,hamilcarenina,2022-06-21 23:52:24+00:00,65,2,2,0,,"I don't mean to sound like a fogey, but here it comes: Kids, you ain't *seen* dark. When I came out, the advice I got was I'd best get used to being lonely, because no one would *ever* want a freak like me. At best, I'd be a dirty secret. AND THAT WAS FROM WITHIN THE COMMUNITY.",2
5646,5646,34,harrisonjbrock,2022-06-21 21:00:03+00:00,63,0,0,0,,Paige getting in full geish for the Hideaway and Jacques turns up in a dirty white vest and boxers #LoveIsland https://t.co/7iECa2Vgf9,2
5647,5647,35,rhinosaur,2022-06-21 20:30:11+00:00,264,5,2,0,,"@samreich @LilyD @dropout @DirtyLaundryDO Had to break this news to my fiancé today. She loves it so much. She’s literally going to play the game at her bachelorette party. 

For the sake of my future marriage, bring back Dirty Laundry for a second season. https://t.co/rSujLNe0IX",2
5655,5655,43,ChrisHeHim1,2022-06-21 23:46:57+00:00,193,64,5,0,,"Jenny West who has a stellar CV was informed in August she had got the job by Gladys Berejiklian before John Barilaro was tapped last week.

Wonder what dirty deal was done or what Barilaro has on Perrottett🤔 

A Govt rotten to the core!

#nswpol #auspol #NSWBudget #abc730",2
5656,5656,44,AndyKHLiu,2022-06-21 22:34:23+00:00,851,126,11,10,,"Let's roll the tape... 

1. Dillon Brooks said screw you Iguodala we got a DYNASTY here 

2. JJJ tweeting Strength in Numbers after a regular season win when no Warriors played

3. Taylor Jenkins goes Full Alex Jones, hides Brooks after dirty hit and blames Poole for Ja injury",2
5666,5666,54,ADoseofBuckley,2022-06-21 21:40:13+00:00,81,7,3,0,,"I'm not really a Trudeau guy to be honest (I know, everyone thinks I'm a dirty lib) but FACTUALLY, Canadians do not have a ""right"" to own a gun. No one wrote it in a constitution 200 years ago. A gun is the same as a driver's license here, it's not a ""right"".",2
5671,5671,59,muchado33,2022-06-21 23:46:13+00:00,51,1,9,1,,Spout a little more nonsense now that I'm your favorite new account. Ya fucking weirdo. QT this and kiss my dirty ass. 😊😊,1
5675,5675,63,WorkingFamilies,2022-06-21 22:42:33+00:00,268,26,2,1,,"We have so much appreciation for @JCisnerosTX. She ran a courageous campaign, enduring smears, dirty tricks, and an endless sea of dark money from Republican billionaires.",2
5680,5680,68,tvalwx,2022-06-21 21:56:18+00:00,61,0,3,0,,I said I would never get a gray horse because they get too dirty…15 years later and I have a water buffalo in the backyard 🐃 #1000lbBestFriend https://t.co/b5S9tfXG9R,2
5681,5681,69,SolaEnSilver_,2022-06-21 23:12:26+00:00,101,6,1,0,,"though you found it hard.  You are slowly doing it.  There's also a strong energy of karma. You'll get what you give.  
-”regrets always at last. ” someone did you dirty or it's you regretting that you did a wrong decision.  Count your loses and succeed 2x.",2
5682,5682,70,FaZeScope,2022-06-21 21:01:19+00:00,57,6,1,0,,"FaZe Proze
FaZe Dirty
FaZe Nio 
&amp; I 
Boutta be a dangerous day in Rebirth 
https://t.co/KyUxUnc5aV",2
5686,5686,74,BarstoolTexasAM,2022-06-21 22:30:04+00:00,210,9,1,1,,"how can you not love this kid? after a poor performance on Friday, he comes in on short rest and throws the game of his life when his team needed it most. Dirty Dett was extra dirty today, and I couldn’t be more proud of him and this team!",2
5693,5693,81,ColinPClarke,2022-06-21 22:09:24+00:00,82,19,3,0,,"3/beyond the most hardcore, e.g. those who go forward and commit actual acts of violence &amp; terrorism, there are several other components; there are the support elements, the propagandists, those that do the 'dirty work,' &amp; a bigger percentage who stay silent &amp; look the other way",2
5697,5697,0,ChOkEoNmYbOnE,2022-06-17 19:57:07+00:00,567,39,18,11,,I just beat up this white man for calling me a nigger n I’m ngl it felt good af,0
5698,5698,1,longbeachgriffy,2022-06-19 19:50:11+00:00,534,8,23,4,,"Okay let me get my day started, I need a T shirt with a Nigger on it, I’ll be right back ❤️",0
5699,5699,2,MissThembakazi,2022-06-21 18:26:44+00:00,375,54,46,3,,"I’ve just listened to a clip from the space saMusa and I’ve concluded two things from it:
1. Chris has a very horrible voice 
2. The nigger ain’t fluent in English, uyapatanisa bakithi 
If I die, I die 😭😭😭",0
5700,5700,3,Mergo69,2022-06-21 10:50:22+00:00,17,9,29,57,,@Kopter__ better to be Italian than a nigger,0
5702,5702,5,kelly_zvobgo,2022-06-21 13:02:16+00:00,100,1,82,4,,"Haven’t even had my coffee yet and I’ve already received an email saying I’m a “fucking nigger and should be gassed.” Lovely.

Also… isn’t Stannis dead? I distinctly recall he got his ass handed to him at the Battle of Winterfell. https://t.co/NTg2M3IcVo",0
5707,5707,10,lavern_spicer,2022-06-17 23:04:54+00:00,354,80,107,40,,"Just found this message here from a twisted soul.

All you racists can call me Congresswoman Nigger real  soon…

Get outta my inbox with that foolishness and speak where folks can see you @AryanAmerican76! https://t.co/jGvj7U0N70",0
5718,5718,21,UncleBari,2022-06-16 21:51:15+00:00,108,2,4,0,,@theeredbar0n @__KC99 did u just call me a nigger,0
5729,5729,32,crystalwhatmore,2022-06-21 19:32:55+00:00,90,0,2,0,,@sathungrysimp @autosport So if you call me a nigger in an endearing manner should I say thank you?,0
5759,5759,62,SoualiganAmazon,2022-06-21 12:16:24+00:00,75,11,5,1,,"This still got me crying. 
They saidt “inaudible nigger yelling. Must be a coconut negro!”.",0
5763,5763,66,aerial_knight,2022-06-21 08:28:23+00:00,55,1,3,0,,"@Kappische Name a black character in smash, there are very few black main characters in games and even when we do get a create a character feature the black hair options are always lacking. Or the fack that to play online I have to be ok with being call nigger by a 12 yr old.",0
5784,5784,14,lavern_spicer,2022-06-17 23:04:54+00:00,354,80,107,40,,"Just found this message here from a twisted soul.

All you racists can call me Congresswoman Nigger real  soon…

Get outta my inbox with that foolishness and speak where folks can see you @AryanAmerican76! https://t.co/jGvj7U0N70",0
5834,5834,64,Blackamazon,2022-06-19 21:36:02+00:00,57,17,1,1,,"Gotta love the fact “niggers aren’t people” is their platform 

And folks still acting like their cute lil all white panels and call outs aren’t exactly what they want",0
5841,5841,0,AuthorKimberley,2022-06-21 22:51:08+00:00,1008,413,57,17,,"Republicans WANT fascism.
Republicans WANT white supremacy.
Republicans WANT autocracy.

Republicans will VOTE for all of it this November. 

Will you be voting? Will your friends and kids and parents be voting? Because Republicans will be voting. They show up. Will you?",2
5842,5842,1,TessaDare,2022-06-21 21:53:09+00:00,216,17,11,1,,Shaye Moss and Lady Ruby Freeman’s testimony is a good lesson for me and my fellow white Democrats that we shouldn’t be relying on Black women to do all the work and letting them take all the public abuse. I need to figure out how to volunteer at the polls next election.,2
