,Unnamed: 0.1,Unnamed: 0,User,Date Created,Number of Likes,Number of Retweets,Number of Replies,Number of Quotes,Number of Views,Tweet,class
4039,4039,5,jadxn_lee,2023-03-05 20:37:37+00:00,88,9,8,3,4807.0,I FUCKING HATE DEVIN BOOKER WITH A PASSION OMFG YOU LAME ASS NIGGA FUCK YOU,0
4042,4042,8,ampaveli,2023-03-02 15:18:02+00:00,83,42,1,8,16196.0,I get it AJ Brown. I know a lame nigga letting his nuts hang on you and you can’t do nothing about it gotta hurt.,0
4044,4044,10,DisAintStunna,2023-03-05 03:33:47+00:00,316,85,11,16,66784.0,This how you holla at a young nigga @ShannonSharpe not that lame ass shit you did,0
4048,4048,14,hollywood_olu,2023-03-02 16:51:35+00:00,99,19,3,1,6753.0,you don’t have to be a lame or a square in your 20s to guarantee success in your later years 😂 niggas never heard of a balanced life,0
4049,4049,15,NoPaper__,2023-03-04 18:57:43+00:00,113,65,0,5,16076.0,Nigga old n lame man lol go be a activist or sumn…errybody yo age met wit Obama or some shit like dat n you on podcast talkin bout old shit lol old ass nigga lol,1
4072,4072,38,ghettocheeks,2023-03-07 20:10:24+00:00,215,2,1,0,1587.0,@etin_james @bubblyqueefs now did anyone ask you to make a cute pic into lame nigga twitter discourse? let’s think mama,0
4081,4081,47,DreaNicole_,2023-03-03 19:36:24+00:00,177,36,17,11,41566.0,"You lame ass niggas be so weird and so jealous of women it's pathetic.. I have never had a nose job, my ass is not fake, and I have plenty of content on the internet wearing my real hair too

I'm the one doing a lot for attention but you a wannabe paying for a blue check? Lol",1
4097,4097,63,purtvspurtioo,2023-03-04 14:58:52+00:00,118,37,1,4,34026.0,You green bro i hope yk as a man you not respected for trying to portray a image you don’t need to. And you have a daughter and you got millions this shit Lame! you lame! niggas will die to be in your position literally💯 @JaMorant,0
4106,4106,72,fattyren,2023-03-04 11:43:47+00:00,375,0,11,0,4141.0,"@cchiIton Laughing at a nigga for losing weight is lame asf , do you want me to be fat forever or what bruh ?😭",0
4126,4126,1,MarkJacob16,2023-03-06 14:28:57+00:00,83,24,1,0,3100.0,"And of course, Black people haven’t been the only targets of bigotry. The official name of a 1950s federal program against undocumented immigrants was “Operation Wetback.” 8/9 https://t.co/qHVMA0H2mJ",0
4127,4127,2,Jessicam6946,2023-03-04 00:31:49+00:00,72,10,8,0,1379.0,If you're going to come on my thread &amp; condemn Ike for operation wetback please do the same for FDR &amp; executive order 9066!  NO president is perfect!   Hindsight is always 20/20,0
4181,4181,0,LucasGage584,2023-03-01 20:40:34+00:00,533,130,53,16,43682.0,"If this was Biden's cabinet, we would all ask, ""When  the hell did the Chinese take over America?"" But since Biden's cabinet is full of another minority that is ""White-passing,"" most people don't realize America was conquered decades ago. https://t.co/lthEfoOh7M",0
4182,4182,1,beachblond52,2023-03-03 14:45:06+00:00,366,173,22,3,3918.0,"We are not born racist, it is learned from parents.The color of our skin should not matter. Don’t be like white supremacists, full of hate. Love and respect one another. We should all be equal. That is love. 💙🕊️

#ProudBlue #ResistanceUnited #DemVoice1 #VoteBIGblue #TruBlue https://t.co/vwPsR0ftBZ",0
4183,4183,2,indigoglow_,2023-03-07 15:56:38+00:00,54,10,5,2,3458.0,It really is so triggering having to sit in a classroom full of White people and have them be subtly and outwardly racist.  TIRED! The end of classes cannot come soon enough.,0
4184,4184,3,swfcBW,2023-03-02 18:03:37+00:00,309,8,5,1,40687.0,"the north east is red and white ❌
the north east is black and white ❌
the north east is full of freaks ✅",0
4186,4186,5,MxKantEven,2023-03-05 22:24:24+00:00,517,81,7,7,48664.0,"So the issue is that Will Smith acted that way in front of white people. 

But Chris Rock insulting a Black woman, in a room full of yts, on a global stage at one of the most prestigious award ceremonies was acceptable? 

Because this isn’t even the first Oscars he did this at.",2
4187,4187,6,daddyowenmusic,2023-03-02 06:13:06+00:00,140,25,9,0,5765.0,"The said NGO is full of white supremacist and  they want to introduce eugenics movement in Kenya! We shall not RELENT! We know thr plan!! We say NO to sodom and gomorra! Hatutakubali MASHOGA na WASAGAJI in KENYA!
#SayNoToLGBTQinKENYA https://t.co/y9a1ciZlOS",2
4188,4188,7,MannFacts,2023-03-06 23:16:36+00:00,512,30,1,1,16759.0,"Tár is a film textually about interpretation, with one perspective as the sole formal focus. It’s not full of black and white decisions and lessons, Field trusting his audience to pick up red and blue pencils themselves, interpreting the subject, her actions, etc. Refreshing.",2
4189,4189,8,S_Scott019,2023-03-07 17:16:35+00:00,142,18,15,5,22479.0,Perk is right in his point on racial bias even if he is kinda full of shit and JJ Reddick is equally full of shit for being as dismissive as he was. Awards voters might not be racist per say but it’s not hard to see the way they cover the white stars different then the black ones,0
4190,4190,9,aftabsheikh2014,2023-03-06 01:40:11+00:00,63,8,3,0,479.0,"The first thing I notice is the sky, so full of blue and the kind of brilliant white clouds that make you ecstatic to have eyes. Nothing can go wrong under this sky.                                                                                 -Jandy Nelson https://t.co/w08yN9zGQB",2
4191,4191,10,deplorablican,2023-03-01 16:47:21+00:00,254,40,75,10,8483.0,Why is my Twitter full of young black people kicking the crap out of white people all the sudden?  Are young white people not doing the same?  Is someone trying to piss off white people to try and start a race war?,0
4192,4192,11,flytyingguy,2023-03-04 18:26:54+00:00,61,7,2,0,1495.0,Idaho is now more famous for being full of fascist white Christian Nazis than for potatoes which is definitively a “you” problem,2
4193,4193,12,LilahRPGtt,2023-03-03 22:24:07+00:00,132,13,2,1,3407.0,"And this attitude is how parliamentary stays full of white privileged men.

If you're expected to work 70 hours so many incredible, hard-working people are kept out. Disabled folk, women, activists who work in community, single parents, people with different culture etc.",2
4194,4194,13,yelimsecaf_,2023-03-03 14:07:31+00:00,60,14,0,0,1598.0,Tsatsii is a very brilliant lady. Just look at the great idea she came up of hosting an all white party. My baby is full of great vibes. Housemates showed up and out and they look great all dressed up. #BBTitans,2
4195,4195,14,GardensHour,2023-03-06 21:30:00+00:00,108,6,10,1,2644.0,"It's crocus season♥ 
Are there any great crocus spots near you?
There is nothing better than a lawn full of purple, yellow and white!
#GardensHour https://t.co/AJnunYNTXy",2
4196,4196,15,warhammer,2023-03-06 14:01:37+00:00,292,13,9,2,30953.0,"Get a look inside this month's White Dwarf! Issue 486 is packed full of Warhammer goodness. https://t.co/ChfJrPlJxn 

#WarhammerCommunity https://t.co/5miS9KzdW3",2
4200,4200,19,peruvianseokjin,2023-03-02 05:12:55+00:00,114,34,2,0,3346.0,"HAPPY BIRTHDAY CHRIS MARTIN 🥺You are an exceptional person. Thank you for your existence, your songs fill me with energy. Precisely ""White Shadows"" is one of them (whose story is full of emotion, he dedicated it to Bruce Paltrow). Listen 😊👇
 #Coldplay  #HBDChrisMartin https://t.co/jeA9KBNc7s",2
4201,4201,20,ChrisBlec,2023-03-01 18:40:06+00:00,96,8,14,2,7533.0,"No, I won't be quiet about the insane level of hypocrisy around racism.

Racism against white people is just as harmful as racism against black people.

Children are exposed to it and growing up feeling attacked &amp; full of hate because of it.

The reverse effect of what you want.",0
4202,4202,21,_Jwehope7,2023-03-02 09:32:15+00:00,280,5,0,0,4942.0,@jnniedukie Stop lying they are not an ARMY and their tl is full of white women,0
4210,4210,29,tunesister,2023-03-06 04:15:38+00:00,51,6,1,1,1607.0,@TheRealDrePapi Clowning a BW hair in a room full of white people is just weird as fuck,0
4214,4214,33,KarenRo08012406,2023-03-02 14:20:54+00:00,327,8,3,1,2143.0,"@SholaMos1 Emmmmm.......the way you live your life full of racism and hatred for white indigenous Brits is appalling. What are you teaching you're family?
When you are not a good roll model yourself I'd stop commenting on others parenting skills.",2
4218,4218,37,_FunmilovesHEAS,2023-03-07 01:43:00+00:00,61,4,1,1,5210.0,Regency historical romance is full of white guilt,2
4220,4220,39,CalamaroColeen,2023-03-02 00:44:19+00:00,52,1,0,0,594.0,"@LeeHurstComic We will not change this.
It is crazy to think it is not ok for a place to be full of white people.
There are places in the UK that are full of brown and black people.
Is that subject to change?
We are just people..
STOP with the colour.
Then we can live together..
AS PEOPLE.",2
4222,4222,41,Doreswami108,2023-03-06 19:36:25+00:00,58,14,3,4,2450.0,@kushal_mehra White coder who has been told he is a genius his whole life. Finds that the tech industry is full of Indian H1Bs who can code 100X better than him (and for less money than he thinks he is entitled to). So he becomes an 'anti-caste' crusader (with the expected depth of knowledge).,2
4226,4226,45,nicolelampert,2023-03-03 00:00:41+00:00,54,6,5,0,4376.0,I never liked Elizabeth Bennet. I didn’t even finish the book. Bennet is a white English cis girl living in a largely male white fairytale land that is full of aristocrats (white elite)….,0
4227,4227,46,nadianoorx,2023-03-07 16:03:00+00:00,161,16,3,0,5470.0,the reason I loathe sci fi is that it often times takes place in a world full of orientalist tropes and has a white savior mc that is oppressed the same way bipoc are oppressed by white society today,0
4229,4229,48,turntineforwhat,2023-03-02 00:51:30+00:00,76,1,2,0,4939.0,when you’re in a room full of people of color and you say “[white person] is so cool” and then someone goes “well…..” https://t.co/quorLFJdzj,2
4233,4233,52,Littlepotdiary,2023-03-04 17:40:03+00:00,87,29,1,0,3681.0,"“The styling is also full of power and refreshing at the same time. They enter the stage as group, wearing all white, but the time is too short, in front of me (around 30/40cm of distance), there's only 3 to 4 seconds, smiling and waving”

🤩🤩🤩🤩🤩
#WangZihao #왕즈하오 #王子浩 https://t.co/Z0YJgkM2Rt",2
4249,4249,68,Needle_of_Arya,2023-03-02 18:15:04+00:00,61,4,1,1,752.0,@vinivinidogo A white left-populist who moves from the North to a large urban center in the South full of Black people and who then attacks them rather than the local fascist Republicans making everyone else's life miserable is complete trash.,2
4251,4251,70,reggienewton22,2023-03-01 13:45:46+00:00,54,0,5,0,2279.0,"@FireTrumpToday @hamcarless they drive a dodge challenger srt hellcat. the soundtrack is by rza and is full of issac hayes &amp; barry white samples. this project is ready, https://t.co/wWVIV3qjXS",2
4254,4254,73,CatPurry9,2023-03-06 21:00:45+00:00,54,14,7,1,921.0,"What was I saying just yesterday?
I have no doubt that this ""right wing Christian"" organisation has its roots and funding in USA evangelical pockets &amp; is full of white supremacists.
For the record: JESUS WAS A LEFTY!!
https://t.co/rWc5heU1eS",2
4261,4261,80,johnhawkinsrwn,2023-03-05 01:43:44+00:00,105,8,4,3,19576.0,"@ClownWorld_ Obviously, California is full of white supremacists or that number would be over a trillion. https://t.co/6B3oKWUHYY",2
4271,4271,0,mOneyMakinNique,2023-03-02 17:39:53+00:00,51,23,0,2,4967.0,Nip proof you can be intelligent and from the street. I be seein alotta you niggas struggle with yal identities in regards to that. As a nigga from the street Ima tell you it’s okay to be smart. Yal be hiding yal wits but how backwards is it you lame for having information ?,0
4273,4273,2,krispykuf,2023-03-05 06:25:47+00:00,93,53,4,12,10206.0,Imagine a lame nigga like Charles cheating on you. I would go ballistic.,0
4274,4274,3,PAYDAYWAYDAY,2023-03-04 18:46:26+00:00,80,44,0,9,14024.0,I think having a kid w a nigga that wants absolutely nothing to do with you is just as lame as being a deadbeat father,0
4279,4279,8,DisAintStunna,2023-03-05 03:33:47+00:00,316,85,11,16,66784.0,This how you holla at a young nigga @ShannonSharpe not that lame ass shit you did,0
4281,4281,10,jadxn_lee,2023-03-05 20:37:37+00:00,88,9,8,3,4807.0,I FUCKING HATE DEVIN BOOKER WITH A PASSION OMFG YOU LAME ASS NIGGA FUCK YOU,0
4282,4282,11,ampaveli,2023-03-02 15:18:02+00:00,83,42,1,8,16196.0,I get it AJ Brown. I know a lame nigga letting his nuts hang on you and you can’t do nothing about it gotta hurt.,0
4284,4284,13,hollywood_olu,2023-03-02 16:51:35+00:00,99,19,3,1,6753.0,you don’t have to be a lame or a square in your 20s to guarantee success in your later years 😂 niggas never heard of a balanced life,0
4285,4285,14,NoPaper__,2023-03-04 18:57:43+00:00,113,65,0,5,16076.0,Nigga old n lame man lol go be a activist or sumn…errybody yo age met wit Obama or some shit like dat n you on podcast talkin bout old shit lol old ass nigga lol,1
4307,4307,36,ghettocheeks,2023-03-07 20:10:24+00:00,215,2,1,0,1587.0,@etin_james @bubblyqueefs now did anyone ask you to make a cute pic into lame nigga twitter discourse? let’s think mama,0
4317,4317,46,DreaNicole_,2023-03-03 19:36:24+00:00,177,36,17,11,41566.0,"You lame ass niggas be so weird and so jealous of women it's pathetic.. I have never had a nose job, my ass is not fake, and I have plenty of content on the internet wearing my real hair too

I'm the one doing a lot for attention but you a wannabe paying for a blue check? Lol",1
4331,4331,60,purtvspurtioo,2023-03-04 14:58:52+00:00,118,37,1,4,34026.0,You green bro i hope yk as a man you not respected for trying to portray a image you don’t need to. And you have a daughter and you got millions this shit Lame! you lame! niggas will die to be in your position literally💯 @JaMorant,0
4345,4345,74,fattyren,2023-03-04 11:43:47+00:00,375,0,11,0,4141.0,"@cchiIton Laughing at a nigga for losing weight is lame asf , do you want me to be fat forever or what bruh ?😭",0
4361,4361,0,mOneyMakinNique,2023-03-02 17:39:53+00:00,51,23,0,2,4967.0,Nip proof you can be intelligent and from the street. I be seein alotta you niggas struggle with yal identities in regards to that. As a nigga from the street Ima tell you it’s okay to be smart. Yal be hiding yal wits but how backwards is it you lame for having information ?,0
4363,4363,2,krispykuf,2023-03-05 06:25:47+00:00,93,53,4,12,10206.0,Imagine a lame nigga like Charles cheating on you. I would go ballistic.,0
4364,4364,3,PAYDAYWAYDAY,2023-03-04 18:46:26+00:00,80,44,0,9,14024.0,I think having a kid w a nigga that wants absolutely nothing to do with you is just as lame as being a deadbeat father,0
4369,4369,8,DisAintStunna,2023-03-05 03:33:47+00:00,316,85,11,16,66784.0,This how you holla at a young nigga @ShannonSharpe not that lame ass shit you did,0
4370,4370,9,jadxn_lee,2023-03-05 20:37:37+00:00,88,9,8,3,4807.0,I FUCKING HATE DEVIN BOOKER WITH A PASSION OMFG YOU LAME ASS NIGGA FUCK YOU,0
4371,4371,10,ampaveli,2023-03-02 15:18:02+00:00,83,42,1,8,16196.0,I get it AJ Brown. I know a lame nigga letting his nuts hang on you and you can’t do nothing about it gotta hurt.,0
4375,4375,14,hollywood_olu,2023-03-02 16:51:35+00:00,99,19,3,1,6753.0,you don’t have to be a lame or a square in your 20s to guarantee success in your later years 😂 niggas never heard of a balanced life,0
4376,4376,15,NoPaper__,2023-03-04 18:57:43+00:00,113,65,0,5,16076.0,Nigga old n lame man lol go be a activist or sumn…errybody yo age met wit Obama or some shit like dat n you on podcast talkin bout old shit lol old ass nigga lol,1
4396,4396,35,ghettocheeks,2023-03-07 20:10:24+00:00,215,2,1,0,1587.0,@etin_james @bubblyqueefs now did anyone ask you to make a cute pic into lame nigga twitter discourse? let’s think mama,0
4412,4412,51,DreaNicole_,2023-03-03 19:36:24+00:00,177,36,17,11,41566.0,"You lame ass niggas be so weird and so jealous of women it's pathetic.. I have never had a nose job, my ass is not fake, and I have plenty of content on the internet wearing my real hair too

I'm the one doing a lot for attention but you a wannabe paying for a blue check? Lol",1
4427,4427,66,purtvspurtioo,2023-03-04 14:58:52+00:00,118,37,1,4,34026.0,You green bro i hope yk as a man you not respected for trying to portray a image you don’t need to. And you have a daughter and you got millions this shit Lame! you lame! niggas will die to be in your position literally💯 @JaMorant,0
4439,4439,78,fattyren,2023-03-04 11:43:47+00:00,375,0,11,0,4141.0,"@cchiIton Laughing at a nigga for losing weight is lame asf , do you want me to be fat forever or what bruh ?😭",0
4454,4454,1,NoPaper__,2023-03-04 18:57:43+00:00,113,65,0,5,16076.0,Nigga old n lame man lol go be a activist or sumn…errybody yo age met wit Obama or some shit like dat n you on podcast talkin bout old shit lol old ass nigga lol,1
4490,4490,0,JaYunnaMonae,2023-03-07 01:41:28+00:00,716,374,0,54,50386.0,If you gotta bitch or a situation you in don’t come bothering me lame ass .,1
4491,4491,1,OG_Lightbrite,2023-03-04 00:11:25+00:00,68,46,0,4,3976.0,you can’t teach a lame bitch new tricks 🥱,1
4492,4492,2,_iamhershayyy,2023-03-05 17:57:41+00:00,84,45,2,4,5363.0,"Every Female Has Stepped Into They “DUMB Phase” We All Do🙄But Baby! The Moment You Step OUT Of It,You Become A Bad As BITCH 💁🏾‍♀️🤩🤩The Glow Of Not Falling Weak 2The Knees About Dawg,Realizing He A Lame,Bum,Dirty Mf,You Standing On Yo Shyt,Him Not Being Able 2 Manipulate You,",1
4493,4493,3,jujusaiditt,2023-03-05 21:02:41+00:00,82,23,6,3,3919.0,You have 2 business days to fmb or im just gone think you a lame bougie ass bitch,1
4501,4501,11,willelfilms,2023-03-06 12:29:16+00:00,56,6,4,1,2165.0,Why does music by or for transmascs always have to be so fucking lame “dont mess w me im  a big boy now and im very scary” shut the fuck up you little bitch,1
4510,4510,20,Solidrev1,2023-03-06 03:03:06+00:00,373,10,74,2,28260.0,"You guys really gonna make me spend $600 on a PS VR2 with all these bullshit GT7 clips. 
So I can throw that lame ass helmet on, play for 30 min be impressed as hell then go throw up &amp; never touch that bitch again.",1
4515,4515,25,parniaistired,2023-03-03 12:03:42+00:00,193,8,6,0,4607.0,"I don't know why some of you bitches are so mad about someone else's body and their own decision to post pics of themselves, y'all are so lame and should visit a therapist asap😭 mind your own business when something doesn't hurt you or anybody else, weirdo.",1
4546,4546,56,MalcolmNance,2023-03-02 21:51:58+00:00,251,13,15,3,6562.0,"@SarahAshtonLV @DvdButler @ami1_ Give it up Sarah. He’s a troll. We don’t even know if he’s real or if it’s his real name, bio etc.  Trolls don’t care. They want the fight. Lame ass bitches gonna still be bitches@no matter what you say. Don’t fight. Just block. Let him howl into the wind.",1
4559,4559,0,lilduval,2023-03-01 02:25:20+00:00,1444,334,57,138,225421.0,You ever see somebody take a death hard and you be thinking “you ain’t even fuck wit them like that when they was alive” 😂,1
4560,4560,1,BigLeafward,2023-03-01 10:32:37+00:00,365,161,5,23,46782.0,This shit ain’t back in da day bitch pick a side. You can’t fuck wit them &amp; us. Bitches giving niggas up every day..pick a side or you gone end up a vic,1
4562,4562,3,brujabitchh,2023-03-05 04:51:11+00:00,1301,114,5,27,35779.0,Their humor is funny. Because they might be playing dumb but if you take a close look it actually requires a lot of wit to make the jokes they’re making. They’re smart as fuck. They’re the scales. They’re always weighing shit out in their head trying to come to best conclusions.,1
4565,4565,6,BigLeafward,2023-03-07 04:14:42+00:00,247,54,13,53,46713.0,I hate a “I got my license they not gone fuck wit you”😭take off or we gone go through somethin turkey man,1
4568,4568,9,BIGJOSHAYBXTCH,2023-03-06 01:14:02+00:00,59,25,2,5,5070.0,U REALLY KNOW WHO FUCK WIT YOU WHEN YOU GOING THROUGH SOMETHING I SWEAR IMA BY MYSELF 99.9 PERCENT OF THE TIME I CANT WAIT UNTIL A BITCH NEED ME CUZ IMA HANG UP,1
4570,4570,11,Nyaberih_,2023-03-04 20:50:58+00:00,90,23,7,2,2513.0,"If I hit a blunt with you, I really fuck wit you.",1
4580,4580,21,TomSweeneyINC,2023-03-07 02:05:09+00:00,517,8,18,0,16424.0,"Me : She’s my partner so it matters.

My Father: Partner!? Don’t tell me you done go to Cali and become a bati boy! Me no want no gay boi wit me name. 

Me: I’m not gay she’s a woman, also fuck you.

So times I wish he just went to get milk and go lost.",0
4586,4586,27,LeNooshi,2023-03-05 23:02:44+00:00,97,13,4,2,3413.0,"HOW THE FUCK YOU LOSE THIS GAME WIT STEPH BACK AGAINST INJURED 11 SEED TEAM😭😭😭😭😭😭😭 @warriors yall really poverty as fuck.

I wont lie i wrote this off as a loss coming into this game",1
4621,4621,62,__Curtdoggg,2023-03-03 21:47:58+00:00,121,8,3,0,9218.0,"Boy idgaf how much it was. It could’ve been a point off. I want my fucking shit. Fuck what you tb bring me my shit or it’s that fytb. It’s the principle. I fought my friend over 50 cent sophomore yr. It wasn’t bc of the money, it’s the principle DONT FUCKING PLAY WIT ME.",1
4629,4629,70,FTate05,2023-03-05 03:36:42+00:00,93,1,4,0,2052.0,"Everybody shut the fuck up talking to me, I am a genius, you niggas ain’t on shit wit what I’m cooking",1
4686,4686,0,SendTheCOMET_,2023-03-07 20:11:13+00:00,181,39,35,10,15854.0,"Black people, mexicans HATE us, I didn’t need this terrible situation to happen to know it. For me, just like with whites, I can sense it, they view us the same way. I get the looks from them as well, I see VERY little difference between them and white people as it concerns us",0
4687,4687,1,Tomhennessey69,2023-03-07 20:41:31+00:00,109,38,54,6,20980.0,Should blacks and whites separate (not segregate) in everyone’s best interest?    The how will be another post..,2
4695,4695,9,deannareads,2023-03-07 21:23:47+00:00,164,1,24,5,13054.0,Streets is saying Rhysand isn’t white??? I thought he was one of them dark whites…the white with a lil olive oil…she say he has a lil tanny tan but it wasn’t giving Fae of Color to me at alllll…,0
4697,4697,11,tacticalfiend,2023-03-07 23:33:49+00:00,67,3,8,0,2517.0,"not to say rose's actress is hideous or w/e but no wonder people think ""whites are more beautiful"" when white characters are supermodels and minority characters are ""representation"" https://t.co/GLaSR3dwhi",2
4698,4698,12,Klaus_Arminius,2023-03-07 20:38:59+00:00,236,42,17,0,8705.0,"Why teach your ‘youth’ that stealing is wrong, or teach them to value education and earn honorably when you can demand Whites give you more money.",2
4700,4700,14,lodgepolepines,2023-03-07 23:44:35+00:00,86,2,4,2,5199.0,It's crazy if white people in the United States voted like Massachusetts whites we'd be living under communism,0
4701,4701,15,emmaroc33249448,2023-03-07 21:16:12+00:00,147,5,13,0,4282.0,@MartinDaubney This boils my blood. The U.K. is mainly white because we are a white indigenous nation that was All White before immigration because we live in the northern hemisphere where all people are white!!!! Exactly and why is it there is this nonsense against whites? Who pushes this?,0
4705,4705,19,Coastal_Duo,2023-03-07 21:41:20+00:00,65,0,2,0,2776.0,@MartinDaubney @ReasonedUK @LiamRodney23 They would say no to both of those questions. It is strictly Western countries they are intent on eliminating Whites.,0
4706,4706,20,Ms_MelaninQueen,2023-03-07 21:49:02+00:00,162,13,7,0,4701.0,"@RizzaIslam So his mother telling him don't fight other blk ppl around whites was just a random lesson he tried to use to appear he was raised better than Will. But degrading, belittling   and disrespecting blk ppl around White ppl is ok???  I'm confused about his mother's teaching 😕 😐 🤔",0
4707,4707,21,lebaneseogre,2023-03-07 21:48:54+00:00,51,3,0,0,2036.0,@l_stone @bnaibrithcanada @maritstiles @SarahJama_ Funny how all these whites are anti-racist until those pesky people of colour start having opinions they dont like. Libs and cons are both anti-palestinian bigots.,0
4709,4709,23,RodrigoDiaz001,2023-03-07 21:23:30+00:00,63,0,2,0,676.0,@Tomhennessey69 Whites are far too nice and tolerant. https://t.co/tHCWmUFrPs,2
4711,4711,25,jewdas,2023-03-07 22:04:53+00:00,190,36,2,0,9707.0,The idea that Rhodesia is an apartheid state is nonsensical and does not reflect the lives of Whites,2
4723,4723,37,LunarArchivist,2023-03-07 20:56:54+00:00,69,2,1,0,784.0,@rainmc @zulkuss Name ten examples of black people being raceswapped for whites within the last 25 years.,0
4751,4751,65,nbstv,2023-03-07 20:32:57+00:00,105,5,31,3,13986.0,".@HonKyeyune: We always tell people that the truth moves on staircases and lies move in elevators. @NUP_Ug was founded on the foundation of reporting to whites, and they always have to provide reports.

#NBSBarometer #NBSUpdates https://t.co/WdKVeULbqG",2
4753,4753,67,leadlagreport,2023-03-07 22:40:41+00:00,92,6,19,2,43220.0,"Yes - and it does. 

The intermarket behavior was NOT bearish today with the exception of the whites of the eyes of the flight to safety trade in Treasuries.

I think a lot of people are getting overly confident very short term on the down side.

Internals do not confirm…yet.",2
4772,4772,3,PulpCovers,2023-03-02 14:22:23+00:00,99,12,8,6,13844.0,"This is the “Specially Revised And Edited” edition of 12 ""Chinamen and a Woman"" 

The original was called ""12 Chinks and a Woman"" https://t.co/fudi39DCpj",0
