,Unnamed: 0.1,Unnamed: 0,User,Date Created,Number of Likes,Number of Retweets,Number of Replies,Number of Quotes,Number of Views,Tweet,class
0,0,0,swati_gs,2023-03-02 10:44:36+00:00,6116,3896,324,205,411262.0,"Students at govt-run Jamia Milia Islamia stopped from playing Holi with slogans of Allah Akbar and Naara E Takbir

Video from the campus yesterday. A day earlier, appeals were made to not celebrate festival of “disbelievers” https://t.co/sekX316fmE",2
1,1,1,MeghUpdates,2023-03-02 11:46:38+00:00,3384,2207,160,77,202230.0,"Delhi: Viral Videos claimed to be from Govt-run Jamia Milia Islamia University, whereby radicals can be seen threatening students celebrating holi and screaming Naara-E-Takbir and Allah-u-Akbar. Earlier also they warned against any holi celebration in campus https://t.co/zaka31XVJB",2
2,2,2,AshwiniSahaya,2023-03-02 17:04:16+00:00,7720,3811,318,246,438861.0,"Sweden 🇸🇪: Migrant muslim man (35) screaming ""Allah hu Akbar"" stabs 10-years-old Swedish girl in the stomach

The girl is undergoing treatment at a hospital in critical condition

The victim's grandmother was also stabbed &amp; injured while protecting the girl + #Sweden #Europe https://t.co/mAGg3Q04qG",2
3,3,3,VlKASPR0NAM0,2023-03-02 13:15:34+00:00,969,528,21,12,14494.0,"Slogans of Allah Akbar and Naara E Takbir at Jamia Milia to stop students from playing Holi

Secularism of India beautifully captured 👇 https://t.co/GqFYuh7LRC",2
4,4,4,AshwiniSahaya,2023-03-04 17:08:16+00:00,2182,1229,97,55,61697.0,"Spain 🇪🇸: A migrant muslim man in Córdoba confronts Spaniard commuters as he screams ""Spain belongs to Muslims from today""

The man can also be heard screaming “Allah Hu Akbar” + #Spain #Madrid #Europe https://t.co/07OAVzCsYM",2
5,5,5,Indian_Analyzer,2023-03-03 13:25:13+00:00,613,174,12,4,18391.0,"Israeli military drove into a major Palestinian town of their country, West Bank 🇮🇱

- Teens started Stone Pelting on the vehicles.

- Fearless Israeli Forces started FIRING &amp; Mohammad Nidal Saleem (15) got Killed.

Palestinians chanting ""Allah-u-Akbar"":
https://t.co/BgWYRtgrTz",2
6,6,6,Chagzyahya,2023-03-04 14:47:38+00:00,297,40,10,10,21828.0,"My hindu friend became Muslim yesterday 😭♥️🫶🫶🫶🫶🫶🫶 so happy for him, when you read the Qur'an with an open heart and sincerely, Allah will guide you. Allahu Akbar Allah is the greatest! ♥️♥️♥️♥️♥️ https://t.co/6749EKGRTw",2
8,8,8,findgg33,2023-03-05 23:24:39+00:00,232,24,10,0,18633.0,"ISLAM WILL CLEANSE THE RAINBOW 🌈 
IN THE 2030s

Allah Akbar https://t.co/KmYDExNzNV",2
9,9,9,monidipadey,2023-03-07 04:03:38+00:00,252,181,16,4,9588.0,"“Holi celebrations by the minority Hindu community of Pakistan attacked in Pakistan’s capital Islamabad. Gun shots fired with slogans of Allah Hu Akbar.”

Video by @widhyarthi 

@minicnair some more news about the “safe” minorities in Pak!stan for you to enjoy your Holi in India! https://t.co/CDQOAxi2GI",2
10,10,10,WldHinduCouncil,2023-03-07 03:49:04+00:00,77,39,2,4,3993.0,"Holi celebrations by the minority Hindu community of Pakistan attacked in Pakistan’s capital Islamabad. Gun shots fired with slogans of Allah Hu Akbar.
 https://t.co/xO95E9qljw",2
12,12,12,rahmanaae,2023-03-05 11:44:00+00:00,165,51,0,5,2057.0,"In indonesian always say 'YA ALLAH' ALLAHU AKBAR"" in the middle konser when eye contact with bias 😭",2
13,13,13,TheSanatanUday,2023-03-02 13:54:07+00:00,78,53,4,5,3482.0,"Slogans of Allah Akbar and Naara E Takbir at Jamia Milia to stop students from playing Holi

Secularism of India beautifully captured 👇 https://t.co/ZaYo18xeVZ",2
14,14,14,jjcromag,2023-03-03 11:57:38+00:00,50,3,4,0,4856.0,Allah Akbar! God is great! No man can stop the rising sun. 🕉️ https://t.co/q86lpm4jcO,2
15,15,15,rainaamit,2023-03-02 05:49:54+00:00,471,249,64,66,61649.0,"'Tum kitne shahid maroge, ghar ghar se shahid niklega.' 'Islam Zindabad' 'Nare e takbeer Allah Ho Akbar'
Slogans shouted yesterday when body of a suspected militant, who had gone missing in custody was found.
Meanwhile @OfficeOfLGJandK continues to claim separatism under control https://t.co/xQgdEeeA5z",2
16,16,16,AshwiniSahaya,2023-03-03 04:15:37+00:00,582,342,27,24,35509.0,"Sweden 🇸🇪: Passing-by youths, guard &amp; an off-duty police officer are said to have brought the Muslim migrant Milad Salari to the ground who stabbed the 10-yrs-old Swedish Girl in her stomach &amp; throat while screaming ""Allah Hu Akbar"" in Gothenburg. + #Sweden #Europe #Stockholm https://t.co/KB4X3gvVEL",2
17,17,17,muzamil_toori,2023-03-01 17:08:46+00:00,53,18,5,0,1495.0,Allah-o-Akbar @AmbassadorNawaf A Beautiful Quran Recitation &amp; Nature Views from Pakistan https://t.co/HrpGFpv5ha,2
19,19,19,Abdullahj233,2023-03-02 11:44:24+00:00,52,9,0,0,2369.0,Allahu Akbar... The way our Allah takes care of us,2
20,20,20,SyedaFatemahuda,2023-03-04 07:13:12+00:00,311,38,5,0,7007.0,Allah blessed Imam Hussain ع with the noor of Ali Akbar ع that was more luminous than noor of moon❤️ https://t.co/ADsyyVmHPk,2
21,21,21,Qursum12,2023-03-07 04:02:54+00:00,154,117,5,0,3066.0,"If you are with 
#بیانیہ_صرف_نیازی_کا
You stand with truth for
Haqeqi Azadi

Remember 
if you want AZADI
AZADI want You

speek loudly 
ALLAH HO AKBAR https://t.co/GDu3JzJHnc",2
22,22,22,OpIndia_com,2023-03-02 14:45:00+00:00,799,412,19,18,32624.0,"Muslim students in Jamia Millia Islamia intimidate, threaten other students against celebrating Holi on the campus, raise Naara-e-Takbeer and Allah-hu-Akbar slogans

https://t.co/LGjgZpj3mJ",0
23,23,23,Bntefatema_,2023-03-03 14:00:27+00:00,298,26,6,0,2923.0,Congratulations to All muslims to birthday anniversary  Of Ali Akbarع ( Similar of Rasool Allahص)  Ibn Hussainع .❤🙌 https://t.co/0HiONANou6,2
24,24,24,Abdul__Maalik,2023-03-07 19:57:52+00:00,120,4,9,1,4724.0,"My Bint wants to take her shahadah. Y’all don’t understand the power of duā! I haven’t stopped crying. Allāh is truly Akbar! Through all the fitnah lately and Ramadhan coming, my heart is filled with joy! May Allāh allow her to accept islaam &amp; stay firm upon the hāqq! Ameen!!!!",2
25,25,25,widhyarthi,2023-03-06 20:17:58+00:00,335,183,12,17,11898.0,"Islamist Pakistan!
Gun fires, slogans of Allah-O-Akbar, attack on Holi celebrations event in Islamabad by Islamist radicals.
Holi is a pure cultural day, a festival of colors, joy &amp; love but in Islamic republic of Pakistan a country created on ideology of Islam. 
@UNDPPA 
1/3 https://t.co/LLSN5gbtbn",2
26,26,26,abu_kutub,2023-03-05 00:21:21+00:00,164,17,1,1,6778.0,Allahu Akbar!!! May Allah protect the Shaykh and guide this brother https://t.co/LaIDPBuvpW,2
28,28,28,SyedaAsmatNaqvi,2023-03-04 09:06:20+00:00,114,12,5,0,1287.0,Peace be upon prince Ali Akbar (a) who is the true picture of Rasool Allah (s) in appearance — 💚 https://t.co/SgOaxzQOru,2
29,29,29,juan_27b,2023-03-05 15:06:03+00:00,96,3,1,0,6633.0,@Cobratate Free to the Tate Brothers Allah akbar ☝🏼☝🏼 https://t.co/AhNtFFeKsw,2
30,30,30,NotYourDruggist,2023-03-04 08:19:45+00:00,51,1,6,0,2459.0,This girl in prayer room said 'tum ny jeans pehni hoi ha aur namaz parh rahi ho?' I could've said 'k namaz k liye jitna cover hony k prerequisites hain wo fulfill ho rahy hain' but instead I smiled at her and said ALLAH o AKBAR for takbeer!,2
31,31,31,HRMOniru,2023-03-03 10:39:37+00:00,423,47,13,0,9831.0,"""He is Allah: the Creator, the Inventor, the Shaper. He ˹alone˺ has the Most Beautiful Names. Whatever is in the heavens and the earth ˹constantly˺ glorifies Him. And He is the Almighty, All-Wise.""
- Quran 59:24

Allahu Akbar! https://t.co/wVnPW1ksGN",2
33,33,33,OmarAbbasHyat,2023-03-03 15:05:27+00:00,249,45,8,2,6626.0,"I despised the man for his rhetoric against Muslims/Islam. However, I am so happy for him now. Takbeer - Allahu Akbar! Indeed Allah SWT guides whomsoever He SWT wills. May Allah SWT keep him steadfast. Ameen! Ehlan WaSehlan Brother Shermon https://t.co/fJlY0L3xdu https://t.co/kkHGNPMHPn",2
37,37,37,curlykrazy07,2023-03-02 12:45:31+00:00,50,33,5,1,2601.0,"This is Jamia Milia Islamia University. 

Some students were celebrating Holi but the radicals had other plan. Like any major Hindu festival is being celebrated these ppl disrupted it but shouting Naara-E-Takbir and Allah-u-Akbar. 

#Delhi is gone case https://t.co/qHpj0FuZ9f",2
38,38,38,LegendsWafflez,2023-03-05 15:39:47+00:00,71,2,1,0,2352.0,"@3lfares I prefer to be named ""tyler"" than ""allah akbar muhammed abdul""",2
43,43,43,qamarunshadow,2023-03-04 04:11:58+00:00,81,15,0,1,5354.0,"How to calm the mind 

From Sh Tareq Amer 

100x 

recite subhannAllah wa alhumdulillah wa lailaha il allah wa allahu akbar 

But with 100% focus and presence with Allah

If you drop your focus for even once, start again

Do this until you clear 100

This will cleanse the mind",2
44,44,44,_peacekeeper2,2023-03-07 06:57:23+00:00,119,134,0,0,554.0,"Islamist #Pakistan's hideous face exposed !
Gun fires, slogans of Allah-O-Akbar, attack on Holi celebrations event in Islamabad by Islamic radicals.
For #Pakistan celebrating any festival other than Islamic ones is Haram.
And then, they talk about minority persecution in #India https://t.co/L2sF4nLBeo",2
45,45,45,shaunto9,2023-03-06 03:36:24+00:00,124,3,0,2,13831.0,@TheOmniLiberal The Sneako arc ends with the inescapable test of his actual conversion to Islam... does he kill destiny?  Only time with tell... allah akbar Sneako,2
46,46,46,LmVamos,2023-03-03 10:04:14+00:00,339,23,12,0,8734.0,"@DaveAtherton20 LEFTIST MSM will quote it as 

""Swedish man, mentally ill, charged at a young girl and stabbed her""

Truth is, he's not a Swede,he shouted ""Allah hu akbar"" and this is a hate crime 🤬

But sweden/france just doesn't surprise me anymore",2
47,47,47,Ahmaadarufai,2023-03-07 15:29:13+00:00,92,18,3,0,3216.0,"Allahu Akbar! Wallahi there’s Hikmah in naming Suratul Nūr, Suratul النور. There’s a visible, hidden and subtle light in this Surah. Imagine Allah Him self defending Aisha {RA} in 2 good pages! (Shii’a in the mud). This surah taught us unimaginable morals and conducts.",2
49,49,49,MuslimsMatterss,2023-03-06 09:04:00+00:00,420,86,4,0,6460.0,"ALLAH is at work in your life, even when you do not recognize it or understand it. So just bow down to Him and say: Allahu’Akbar.",2
50,50,50,matlodge,2023-03-03 20:39:31+00:00,85,12,2,1,903.0,"@Bushra1Shaikh @GBNEWS Are women equal in tbe eyes of your religion?   It incites hatred of unbelievers, gays and other religions Tolerance must be a two way street before you shout of division?  Grooming + rape of white kids, bombers and killers shouting Allah Akbar as they kill innocents doesn’t help",0
58,58,58,NindaTurtles,2023-03-06 08:20:54+00:00,153,46,1,1,4806.0,"Obviously this marriage wouldn't have been done without chanting ""Allah u Akbar"" and ""La Ila illallah""

So they were allowed to say there is not God but Allah in a Hindu Temple

Hindu holding secularism flag high inside them 🙏",2
65,65,65,OlaoyeFeranmi2,2023-03-07 21:43:59+00:00,65,1,5,0,16983.0,"@Naija_PR Kullu Nafsin Zaa’ikatul Maut, Allahu akbar. May Allah (SWT) grant him the highest peak of Jannah and forgive his sins. My sincere condolence. 🙏 rest well…Idan ✊🏿",2
74,74,74,rkivegenre,2023-03-03 15:13:19+00:00,54,1,1,0,3112.0,"@JohanLibert909 it literally SHOWS in my pinned . and there's nothing wrong with saying Allah hu akbar 😭 it literally means Allah is the greatest,  unclench a bit",2
91,91,0,KeneAkers,2023-03-07 23:36:22+00:00,9128,2136,186,116,488027.0,"Let's not forget that back in the day, the White man was called the Cattleman or cow hands, and the Blacks were called; “Cowboys” The term cowboy was original, said to African Americans, and were often called “boy” regardless of their age that stemmed from slavery it was seen as… https://t.co/ScRZLlhkGb",2
92,92,1,la_Blacks,2023-03-07 22:47:28+00:00,287,22,1,2,5047.0,"i just noticed that after eddie's ""alright cowboy come get them"" chim pats him on the back as if to tell him not to worry, buck's gonna be alright and eddie nods to him as if to say i know, it must be okay https://t.co/cGz7XX9lT5",2
93,93,2,la_Blacks,2023-03-07 22:30:26+00:00,86,1,2,0,965.0,the last BUUUUCK!!! hits different https://t.co/DHEt93gKY4,2
94,94,3,idieah,2023-03-07 21:24:57+00:00,256,56,9,47,148802.0,Why do most gay black men only like femininity when it none blacks lol,0
97,97,6,Tomhennessey69,2023-03-07 20:41:31+00:00,109,38,54,6,20978.0,Should blacks and whites separate (not segregate) in everyone’s best interest?    The how will be another post..,2
99,99,8,SunshowerFro,2023-03-07 23:14:56+00:00,118,28,1,2,3163.0,I’m bout sick and tired of you rumplestitskin non blacks derailing my conversations about anti blackness in these kpop fandoms. Don’t nobody give a FAWK if you’re not anti black. If it don’t apply to you then it don’t FAWKING apply to you. Stay in your place and be silent.,2
105,105,14,Deedamai,2023-03-07 18:58:28+00:00,205,12,3,1,7158.0,"And this is the baby team blacks were trying to convince us the greens killed via Aegon’s coronation? This poor baby was never going to make it, let’s be serious rn…",2
110,110,19,Jimmy_no_isms,2023-03-07 23:05:51+00:00,128,2,2,2,4714.0,"@NileGardiner @GaryLineker No blacks, no Irish, no dogs. That wasn't in any history books. It was in the windows of houses in England.  ""Stop the boats"" will be in future history books in the same chapter.",2
115,115,24,Tyler2ONeil,2023-03-07 20:07:46+00:00,70,20,3,1,2832.0,"In 2021, the SPLC condemned as a ""far-right and racist"" view that the riots represented a bigger problem than police violence against blacks. The group claimed that the far right had constructed a ""false alternative reality"" about the violence. https://t.co/qNqCl29eqr",2
116,116,25,red_gottie,2023-03-07 21:27:13+00:00,61,4,4,1,1196.0,@theprism89 @POTUS Gun laws are racist. They were created by the kkk Democrats to keep blacks unarmed. https://t.co/mLlp8Jxo8f,0
129,129,38,wil_da_beast630,2023-03-07 22:03:48+00:00,98,4,8,0,6142.0,"(2) *Among those who knew both*

I mention this because it is an example of the dodo-bird-rare ""meaningful anecdote."" EVERYONE hates wokes -75% of Blacks and 81% of Cauc.s oppose PC culture- and this has the GOP confident. But, people fear the actual/hard right as least as much.",2
137,137,46,richdollaz,2023-03-07 21:44:35+00:00,77,2,51,3,24702.0,@AKISNBA For a white man to tell a black man that his NBA narrative  is false is crazy to me - u literally told that man that his truth wasn’t the truth because it wasn’t based on facts &amp; what blacks people have been saying for decades wasn’t true sounds bout critical race theory to me,2
139,139,48,theprissygrl,2023-03-07 22:57:59+00:00,56,3,0,0,1390.0,"uh oh! the queers, the blacks and the big girls wanna be involved but they don’t deserve to feel glamorous like the WASP moms do",0
144,144,53,TVext,2023-03-07 21:29:05+00:00,293,8,33,0,8118.0,@JeffYoungerTX You wanna blame these little kids but liberal white teachers are teaching black children to hate white people. The libs want a race war between blacks and the Right because the libs are too weak to fight their own wars - you’re feeding their agenda boy,0
148,148,57,lib_crusher,2023-03-07 21:59:27+00:00,173,13,1,0,5988.0,"When Andrew Sullivan used his position as TNR editor to publish a farcical junk science essay about how blacks are genetically inferior, he rose to the rank of Exalted Thought Leader for Daring to question liberal orthodoxy like ""are blacks human?"" Looks great on a resume!",2
169,169,78,MaryMarykf61,2023-03-07 22:31:11+00:00,118,22,3,1,615.0,"@GovRonDeSantis Leading the way to a DICTATORSHIP ..Bigots Ban Books, History Science ,gays , Blacks ..You sir are a disgrace to our country. YOU go against Freedom for all",0
171,171,80,MonaKnows2,2023-03-07 20:36:37+00:00,114,7,4,0,926.0,"@FoxNews Despite that drag insults, mocks, &amp; parodies women the way blackface did to blacks, most people would probably put up with if they keep their shows in the clubs. It crossed the line when they brought their sexualized stuff to kids. It also teaches kids that women are mockable.",2
176,176,85,ChimpMega,2023-03-07 21:39:56+00:00,64,5,5,1,1427.0,@gatewaypundit Jim Crow himself couldn't write a more racist law. In Washington DC 92% of murder victims are black. I imagine it's the same in Baltimore. This law essentially makes killing blacks a misdemeanor.,0
180,180,0,legallyblondead,2023-03-07 12:51:12+00:00,326,7,8,2,8938.0,this just called me a nigger and told me my ancestors were the first that stepped off the ships. https://t.co/ARHMoQijyx,0
182,182,2,LibrarySheet,2023-03-07 14:51:23+00:00,120,27,4,2,5370.0,"A very young Lena Horne

“I disconnected myself to shield myself from people who would sway to my songs in the club and call me 'nigger' in the street. They were too busy seeing their own preconceived image of a Negro woman. ➡️ https://t.co/aBGC03XIfa",0
183,183,3,RevolutionNak,2023-03-07 07:31:45+00:00,193,11,5,1,25862.0,One less lonely nigger.,0
184,184,4,scrufacejean,2023-03-06 22:46:48+00:00,201,12,24,5,16711.0,"After hearin Chris Rocks special &amp; the reason he didn’t hit Will back, I now 100% agree wit wat Will did and almost think Will should of slapped him twice. 🤣 You ain’t wanna defend yourself in front of white ppl, but allow them to say Nigger wit no problem? Yeah slap that nigga.",0
189,189,9,realJLive,2023-03-07 21:11:50+00:00,50,4,4,1,2389.0,"I doubt I'd assault someone for calling me nigger. I'd probably just genuinely laugh in their face. For your insult to mean something to me, you would have to mean something to me. Maybe it's a matter of power dynamics. But I know my power. So I don't waste it.",0
195,195,15,and_annoyed,2023-03-07 01:15:00+00:00,61,2,4,1,2064.0,"@JENNIESBIRKIN @myfaultOG23 Let me explain:

Black people don't use the hard R. Nigga and Nigger are two different words that mean two different things. 
Her intent with using this word in a racist 4chan video chat makes her intentions and feelings pretty clear. 

Hope that helps :)",0
204,204,0,DynamoSuperX,2023-03-07 20:50:27+00:00,6850,1325,88,43,194985.0,"Warner Bros. had a whole DC crossover movie with Scooby-Doo and Krypto The Dog just to trash bin it for tax write-offs.

Now everyone is watching the leaked movie for FREE.  This is what they deserve. https://t.co/YeJFIvJyjS",2
205,205,1,Fw_pete,2023-03-07 23:19:59+00:00,104,24,2,4,16630.0,So all the sudden these trash ass team with no QB don’t want Lamar. https://t.co/fZ07ZBkSf9,1
206,206,2,GGposters,2023-03-07 19:14:34+00:00,54,2,13,1,3490.0,Ok I think Ed is the hottest guy on the show. I’d go through Don Johnson’s trash with him. https://t.co/3apaF613WE,2
208,208,4,NatalieRacing,2023-03-07 23:06:28+00:00,1119,26,157,9,98450.0,Documenting my first black eye.. I got into a fight this weekend.. with a wine glass!! Some would say I lost but the wine glass is shattered and in the trash lol 😂🍷🤷🏼‍♀️ https://t.co/lsiai5Y66r,2
209,209,5,thenickholz,2023-03-07 19:58:12+00:00,137,12,2,0,38643.0,"Meal-prepped food doesn’t have to taste like trash.

Here are 6 easy meal prep ideas packed with flavor: https://t.co/SWUZZNkkXC",2
210,210,6,chuckknoxx,2023-03-07 22:11:20+00:00,208,5,4,2,10376.0,"Saquon Barkley out here fully supporting his brother!!!

Per ESPN - Sources expect a long-term deal with Saquon to be finalized before free agency.

Take your conspiracies to the trash where you put your other theories that didn't manifest today. 

#DANIELJONES 
#NYGIANTS https://t.co/50mqoiSCDM",2
211,211,7,CourtneyEJacobs,2023-03-07 18:15:39+00:00,79,3,10,2,3597.0,I’ve heard stories about children dragging home injured pets and begging “mommy can I keep it” but WHY does my kid do this with industrial trash https://t.co/XTnr1Gbc2y,2
213,213,9,SatoshiSneks,2023-03-07 19:23:57+00:00,77,27,31,1,2281.0,"The Sneks have found some prime real estate next to trash can 7 and are currently digging the Snek Pit with the help of a willing volunteer 👏

Dissscord ssssooon
#ordinals  #Bitcoin #snekslovesharing https://t.co/6rHbjn1LFw",2
214,214,10,jenndvc,2023-03-07 22:10:35+00:00,206,26,6,3,2634.0,Scrapping Bill C-21 isn’t “throwing the baby out with the bath water.” It’s simply “taking out the trash.”,2
215,215,11,corsair21c,2023-03-07 16:39:43+00:00,601,42,5,0,34548.0,"In Iraq’s civil war we used to find bodies tied with electrical cord, tortured.  Made an example of then dumped like trash

I cannot emphasize enough how fake and gay everything is here 

Fake piety, fake passion, fake violence, fake elections, fake news",2
220,220,16,Jimbyrnemusic,2023-03-07 22:30:35+00:00,76,21,4,0,1301.0,"I watched the earlier husting and liked what I saw. I watched tonight and all it did was make me depressed and upset. Why did they think it was a great idea to trash each other and trash the party. 

I guess that's why STV came up with that idea - they hoped this would happen.",2
222,222,18,gscucci,2023-03-07 19:37:25+00:00,59,3,7,0,946.0,"Sometimes, we trash Amazon. Probably rightly so. But we must give credit when credit is earned. Last night, I bought an item for $180. Walked in the door today with a notification from Alexa that the same item is on sale for $130. So, I canceled and reordered the same item. Win!!",2
224,224,20,Barnacules,2023-03-07 23:20:31+00:00,96,17,17,0,9772.0,"Not sure why @ElonMusk deleted this tweet since he's never had a problem with being human trash before? I hope it's because the employee sued him, and the Tweet is now evidence that can be used against him during the trial &amp; set precedent for other former employees to sue! 🍿 https://t.co/RKz3ne7HzB",2
225,225,21,aceofclay,2023-03-07 19:46:10+00:00,69,0,8,0,1610.0,Thanks to these scented garbage bags I accidentally bought I now associate the smell of lavender with trash.,2
226,226,22,RetiredLineCook,2023-03-07 17:55:06+00:00,67,3,3,3,2415.0,*sigh* I wished I still cooked like this: chive ravioli stuffed with crab cooked with a sage and lemon brown butter then I made mussels with shallot butter. I’m trash now. https://t.co/m6NmyTXXPa,2
229,229,25,TradeWithThanos,2023-03-07 19:02:50+00:00,147,39,9,3,7674.0,I wasn’t going to speak yeah but I’m sick to my stomach. I’m not against anyone but I’m for the truth. Wtf is @jidesanwoolu doing? What is he really doing? Raiding social media with trash doings and fake kindness. That has to be the oldest trick in the book. I don’t blame you.,2
236,236,32,palisupernova,2023-03-07 18:45:36+00:00,273,12,13,3,7773.0,"#foodiebeauty That is not me that u are doxxing, you animal abuser, dr*g addict, bald headed, barracuda smelling, teeth rotting piece of trash! There are a lot of Faridas in the world you imbecile!! Why don’t u wear a trash bag over ur head, maybe Salah will sleep with u then.",2
237,237,33,PapiPete1,2023-03-07 19:11:18+00:00,57,17,1,0,1732.0,"this movie is all HAND PAINTED with oil paint, rotoscoping off of live actors it's beautiful, if u think this is trash look in a mirror and see true garbage",2
239,239,35,indyfromspace,2023-03-07 20:28:08+00:00,103,0,3,0,5319.0,I didn't think I could read anything worse than the Throuple: Justifying An Affair With My Student (basically) NYer trash piece and then I read the WSJ op ed on why universities should be more like prisons to facilitate learning and 🤮,2
249,249,45,TrU3Ta1ent,2023-03-07 18:24:10+00:00,138,2,20,0,17317.0,So thoughts on the skull merchant. Prit much same. She's gonna be one of the best killers in the game to 3/4 gen with. Survivors are gonna hate a good one and love a bad one. Not sure how she could have minor nerf tweaks without her ending up trash tier either. Cheers!,2
250,250,46,KoWaretaRingo,2023-03-07 18:50:14+00:00,63,10,2,0,1681.0,"It's finally here:
The argument that a certain fiction is trash because it doesn't have Action.

The whole series is trying to sell with it's main character that only action and murder leads to nothing
Get that ""writer"" out of your bio when you can't understand such a basic theme",2
260,260,56,silenceothebams,2023-03-07 22:44:42+00:00,55,6,1,0,511.0,@MhairiHunter Your man has been doing nothing but trash his competitors with snidey asides and digs since this got underway. You reap what you sow and he had this coming. Exposed as the lightweight we knew he was.,2
267,267,63,JDPluecker,2023-03-07 17:43:39+00:00,50,9,1,2,2207.0,"Book launch coming up for Trash, by Sylvia Aguilar Zéleny @sylviruk with translator (yrs truly) JD Pluecker (published by Deep Vellum @DeepVellum) at Basket Books @basket_two on Wednesday, March 22, 6:30pm. Come come and celebrate! https://t.co/uOrGBalufq",2
274,274,70,Blitz_Burgh,2023-03-07 23:10:44+00:00,70,3,2,0,6673.0,It will be interesting to see how Deshaun Watson performs with a full season this year. He looked like trash against the Steelers in Week 18. #Steelers #NFL,2
278,278,74,Ir10Reen,2023-03-07 18:56:23+00:00,72,1,1,0,1001.0,"@itsallinaname1 @MDymore Katherine just gets more and more beautiful and M just gets trashier and trashier, it all starts with respect, if you give it, you will have it but if you don’t give respect, and trash authority, you become trash!",2
297,297,0,ImLittleNick,2023-03-07 03:05:45+00:00,1915,88,3,4,192819.0,thank u for fuckin with us https://t.co/9SKejqXpv8,1
298,298,1,myfaultOG23,2023-03-07 03:32:19+00:00,3938,967,26,183,1389482.0,niggas that peaked in high school be ready to fight when u tell them there’s more to life than fuckin bitches,1
299,299,2,lovingbrats,2023-03-07 17:21:26+00:00,353,91,0,18,47416.0,get u a dude who loves u even tho ur a fuckin brat,1
