,Unnamed: 0.1,Unnamed: 0,User,Date Created,Number of Likes,Number of Retweets,Number of Replies,Number of Quotes,Number of Views,Tweet,class
1756,1756,2,Beno_ldn,2023-03-07 08:49:59+00:00,796,82,38,6,109749.0,"It’s crazy to see how diverse views are on if Charles Bronson gets released, Yes the man had a violent past but he never killed, raped anyone or harmed a child, yet Nonces like Gary Glitter and Rolf Harris are walking free, there the ones who should be locked up for 50 Year’s 😤",2
1757,1757,3,DenjiUnleashed,2023-03-07 15:49:38+00:00,2656,198,22,10,62611.0,"I love how Yoru's first instinct is to run for her life when facing an unbeatable enemy despite being the War Devil, and Makima's is to smile while continuously getting killed over and over by Chainsaw Man lmao. I can't be the only one who thought back to this moment https://t.co/vSOqYW9LCN",2
1758,1758,4,MichaelPSenger,2023-03-07 19:26:08+00:00,1072,213,58,13,38301.0,"My beef with COVID “moderates” is that they often just don’t seem to care very much. It’s like they’re thinking “Yeah lockdowns killed millions of people and that’s sad and all, but FAR worse would be if someone with an Ivy League degree actually went to jail for any of this.”",2
1760,1760,6,NikolaCizmesija,2023-03-07 22:43:43+00:00,394,19,107,21,50399.0,"You are tasked to build a team for a fighting tournament. Anything goes so any and all franchises are on the table. Lets have some creative fun. It's kill or be killed.  4 memebers only. 

Who you pulling up with? https://t.co/oVnYqxoSuM",2
1761,1761,7,AngelRe96386095,2023-03-07 20:21:26+00:00,220,52,46,5,4545.0,"Why do people always want to blame Biden for EVERYTHING that happens in this world? The people killed in Mexico were in another nation, not Biden's. Our State Dept advised against travel to this area. How can the deaths of these beloved people be Biden's fault? 👠",2
1762,1762,8,VivekSi85847001,2023-03-07 11:54:27+00:00,105,6,2,0,2535.0,"Many active Air to Air Missile in world Airforce

Any target in it's 60Km NEZ will have to be Killed, their is no other option left for them.

Meteor is one of world most deadliest Missile, Mix with IAF 🇮🇳 Rafale makes it's Deadly Beast in whole Region.

India Astra MK-3 

3/4 👇 https://t.co/85i61zLlFF",2
1763,1763,9,pnorvinyo_17,2023-03-07 11:37:10+00:00,83,8,18,1,13303.0,"So this guy be Sarkodie ihn music producer? Bcos u dey live in Ashaiman so u can say anything for anything sake. No be ur fault wai.. ebi Stonebwoy adey wait mke he cme talk den I cme proper. Soldier killed and Soldiers dey do dema work aa, u meners bore 🤦🏻‍♂️ https://t.co/6qZg7vqmXV",2
1765,1765,11,G_l_i_t_c_h_e_d,2023-03-07 21:05:10+00:00,109,5,3,0,4023.0,"@cbschicago Would have been a better headline if it said: 

“Soon to be birthing person, while committing armed robbery, was shot and killed.”

Fixed it for you. PC and factual.",2
1767,1767,13,bluestarrfl,2023-03-07 16:23:48+00:00,898,52,14,0,6053.0,"@AdamKinzinger @SpeakerMcCarthy @FoxNews You should be in jail. You &amp; your fake j6 committee saw Sicknick walking around after he was supposedly killed by a Trump supporter. You, Schiff, &amp; Cheney hate Trump so much you used a man’s death for political reasons.",2
1768,1768,14,CallmeAlfredo,2023-03-07 13:23:47+00:00,390,163,25,2,78270.0,You guys don’t understand and it’s sad. The military shouldn’t be able to brutalize civilians because their colleague was killed. They should allow the police to investigate. It’s not okay for them to disregard laws like that.,2
1777,1777,23,vpaskalskyv,2023-03-07 17:45:46+00:00,197,20,0,0,3366.0,"he was studying to be an artist, a painter, but he went to defend his home for 9 years

and today he was killed",2
1779,1779,25,WhereisRussia,2023-03-07 11:44:37+00:00,114,21,14,3,8454.0,"With more than 20,000 Wagner personnel reported to be killed in 🇺🇦, Wagner PMC 🇷🇺 are now recruiting patients from psychiatric hospitals. 

What does the future hold for these new recruits?  

#Russia 
#Ukraine https://t.co/bp76YpLHDh",2
1794,1794,40,AdolfMathebula,2023-03-07 14:24:45+00:00,64,23,1,1,12273.0,I don’t think people moved on; just that if someone get’s killed in public like that (in front of cameras and witnesses) you expect the case to be the easiest to solve. The fact that no one had been arrested yet makes it hard for people to get involved. Something is fishy,2
1806,1806,52,Pataramesh,2023-03-07 17:26:44+00:00,75,5,3,0,5839.0,"I should however note that at least S-300PS is so powerful that at some distance, before the ~8km max. range of Sadid PGM, S-181 would be killed

The method of survival would be the combination of terrain-masking &amp; low-RCS in cutter

For that S-129 as airborne relays is necessary https://t.co/HdTh684Gif",2
1812,1812,58,TomJumboGrumbo,2023-03-07 05:41:37+00:00,44,72,9,2,2243.0,"Dogs to be killed. Thank you for your pledges.

Please follow @Olbermann2023 on Instagram as a back up account

ORDER TO KILL: 
Felix $2320

NYCACC TBK 3/7:
Diamond $645
Archer $587
Crescent Moon $630
Maui $448
Quincy $1025
Lola $371
Velvet $230
Nirvana $455
Apollo $239
Leo Rio…",2
1819,1819,65,tkesho3,2023-03-07 18:43:13+00:00,181,51,5,1,12572.0,"Went through three wars in my lifetime, lived through April 9, 1989 when soviet russian soldiers killed peaceful protesters, thought my kids would not have to go through this in 21st century but alas Russian empire still strikes back! Freedom can never be taken for granted!",2
1835,1835,81,IndiCat_Ranger,2023-03-07 16:58:05+00:00,66,6,4,1,3074.0,"@its_the_Dr Wow... she's the only one who was killed on a jet, which had a crew of at least a pilot &amp; co-pilot, if not a navigator or flight attendants of some form.
For her to be ""killed by turbulence"" the aircraft had to be a real martini shaker. 

Why was no one else killed?",2
1841,1841,0,aasokiyahh,2023-03-02 22:52:50+00:00,195,19,3,2,34096.0,"THIS THE BITCH MADE ASS NIGGA WHO DID THIS TO MY FRIEND?!?! On my life fuck him, fuck his family, FUCK EVERYBODY WHO KNOWS HIM?! https://t.co/iUuFq5fvMw",1
1843,1843,2,guccthaagirl,2023-03-02 23:58:00+00:00,136,97,1,9,10895.0,"its bitches in this world that cant do shit without a NIGGA HELP 😭 i be thanking god everyday no matter whaa i go through , ialways been a independent self made WOMAN 💗..",1
1845,1845,4,kkingstat,2023-03-05 23:01:50+00:00,242,13,7,15,15936.0,Dat white girl frm tiktok that made her nigga a pb&amp;j sandwich from scratch got me fucked up💯💯 ain’t no white bitch finna out cook me,1
1849,1849,8,wayydaminn,2023-03-04 22:22:53+00:00,211,50,0,18,16829.0,"""U mAdE mE This WaY""
Nigga how I make you fuck 30 bitches 😭 &amp; a nigga",1
1918,1918,0,Wander_Lust324,2023-03-07 13:10:29+00:00,60,19,2,0,2277.0,Fuck outta here with all that tomfoolery.,1
1919,1919,1,DiamondJayMMA_,2023-03-06 22:48:26+00:00,141,17,22,3,8037.0,Fuck outta here. Jamahal in 3. https://t.co/DHaQ4UOlii,1
1921,1921,3,SaltyBuc91,2023-03-07 20:01:28+00:00,147,17,13,3,8082.0,"“HOLDING. 76. OFFENSE.”

IT’S FINALLY OVER!!! GET THAT BUMASS THE FUCK ON OUTTA HERE!!! https://t.co/EAO6i5v3An",1
1922,1922,4,justzahra5,2023-03-07 05:56:24+00:00,84,28,0,5,3057.0,fuck it i'm outta here https://t.co/F25YKmqMPt,1
1927,1927,9,LakersDynastyLD,2023-03-07 15:53:56+00:00,61,7,13,1,5761.0,No one cares about Mr Clean rejects opinion. Fuck outta here,1
1928,1928,10,NubianBella_Don,2023-03-07 12:41:19+00:00,80,26,11,6,15458.0,"That oke hated Kiernan and absolutely nobody can convince me otherwise. Betrayed him at his most vulnerable and fraternized with multiple enemies. Ge the fuck outta here with all that fake ass love and tears, sies",1
1938,1938,20,Kamiorra,2023-03-06 01:19:47+00:00,57,9,4,4,2560.0,AND YOU NIGGAS THOUGHT JERICHO WAS GONNA WIN. FUCK OUTTA HERE NIGGA,0
1939,1939,21,PeeWeeDaPlug,2023-03-06 15:40:46+00:00,427,3,18,0,28444.0,Y’all silly asses really got people wishing me a happy 30th 🤦🏽‍♂️😭😭😭😭😭 fuck outta here,1
1943,1943,25,Cyb3rnita1,2023-03-07 21:13:20+00:00,71,0,5,0,10796.0,"People comparing me to toopoor on tiktok then Kali uchis after, fuck outta here I’m sick and deleting everything .",1
1946,1946,28,_Rewhan,2023-03-06 23:56:06+00:00,157,31,6,0,2412.0,Fuck outta here consent-manufacturing an eighteen hour workday.,1
1977,1977,59,markfism,2023-03-06 23:29:35+00:00,93,0,1,0,3014.0,@hyckgasm he said i need to get the FUCK outta here,1
2002,2002,0,Madonna,2023-03-07 20:25:19+00:00,9559,1153,844,162,585140.0,What I look like is more important than what I do. If I get raped it must have been my fault. If I get bashed I must have provoked it. If I raise my voice I’m a nagging bitch. If I like fucking I’m a whore.  - Leslie Winer. https://t.co/5tWa49hgOW,1
2003,2003,1,UltraDane,2023-03-07 20:11:14+00:00,2008,1259,503,119,127168.0,"On 03.07.09 Esme Kenney went jogging near her home, while she was out, Esme was attacked by Anthony Kirkland. Anthony told the police, ""I kicked her, punched her in the stomach &amp; Stomped her."" He brutally raped the 13 yo before strangling her to death &amp; setting her on fire.... https://t.co/Zebc74kITe",2
2004,2004,2,MuellerSheWrote,2023-03-07 22:51:24+00:00,17382,1309,290,24,235531.0,@LannyBrown78 This is what I was wearing when I was brutally raped. Stop making excuses for rapists. It makes you seem like one. https://t.co/zuu4il9DSL,2
2005,2005,3,kdlifey,2023-03-07 19:11:44+00:00,402,73,62,15,29258.0,"In Nicki Minaj new single. She stated “Karl Malone tell em im going post tho” 

If you guys don’t know ,Karl Malone is a retired Nba player who raped a 13 year old girl. https://t.co/cTnshnd1Nd",2
2006,2006,4,jessphillips,2023-03-07 23:33:12+00:00,7235,195,91,8,336292.0,@RishiSunak And by have sex I mean be raped by 30 men a day.,1
2007,2007,5,systemnutte,2023-03-07 20:13:16+00:00,79,21,6,4,3185.0,"The whole world should have realised by now that surrendering to RuZZians means being humiliated, raped, tortured and killed. No matter whether you are soldier or civilian.

#EndRussia
#СлаваУкраїні https://t.co/sBzzbnix8w",2
2008,2008,6,sara_geee,2023-03-07 19:49:01+00:00,54,89,1,4,4338.0,"An independent investigation is important to me because Senayit, a Tigrayan women who was drugged and gang raped by Eritrean soilders for 10 days only to wake up next to her dead son’s body, deserves justice #Justice4Tigray https://t.co/Qhp79wMVnX",2
2009,2009,7,LailaMickelwait,2023-03-07 18:53:11+00:00,840,276,19,23,47111.0,"These 12 year old children were raped on P*rnhub for profit. One was a boy, the other a girl. 

Both courageous survivors are suing the literal hell out of P*rnhub for heavily monetizing &amp; globally distributing their assaults to 130 million site visitors per day. #Traffickinghub https://t.co/3lfuOS8kcl",2
2010,2010,8,TruthdriverOn,2023-03-07 21:33:53+00:00,251,68,21,6,5213.0,"Nothing has put more people in danger,caused more chaos &amp; seen more people bashed,raped, severely injured &amp; murdered than the removal of the cashless welfare card,it has to be the worst political decision ever made for communities by this atrocious Labor Gov #Auspol2023 #auspol https://t.co/pLBM08tKEv",2
2011,2011,9,DrProudman,2023-03-07 21:01:45+00:00,3797,696,457,66,338737.0,"For those saying we need an “international men’s day” — 1 in 4 women are sexually assaulted or raped, 1 in 3 women suffer domestic abuse &amp; over 60% of women are sexually harassed. Everyday is a celebration of male entitlement under the patriarchy. Let women have just one day #IWD",2
2012,2012,10,Feher_Junior,2023-03-07 19:44:05+00:00,79,20,26,3,4822.0,"🤡Lukashenko, who seized power in Belarus, who persecuted activists, who had people beaten to death and raped with police batons in prisons, who allowed Russia to invade from his territory, calls President Zelensky a ""scum"" while he comments on the A50 incident in Makhulishchy. https://t.co/IhPA78x1Dc",2
2013,2013,11,unkleken_,2023-03-07 20:37:29+00:00,3066,686,27,9,129782.0,"I’m sorry, but you don’t let someone who’s raped 21 women and killed 16 people out on “parole”. Nope. He needs to literally rot in there.",2
2015,2015,13,IrishRedDevil76,2023-03-07 23:17:36+00:00,207,30,16,2,20140.0,"Ben Lowry follows Vincent McKenna. The editor of a newspaper follows someone who raped his own daughter, he doesn't mind that because he's sore on republicans. Like WTAF?",2
2016,2016,14,MtnMama406,2023-03-07 19:08:15+00:00,109,81,10,4,2444.0,"Human smuggler arrested. One of hundreds who smuggle illegals into our country every day. Our border crisis is escalating!!  Female agents being beaten and raped, dangerous pursuits, and innocent lives lost. We need more agents and a wall. WE DEMAND SECURE BORDERS.  #BUILDTHEWALL",0
2023,2023,21,temie123,2023-03-07 23:31:47+00:00,18,56,0,0,206.0,"@UN @antonioguterres An independent investigation is important to me because Senayit, a Tigrayan women who was drugged and gang raped by 🇪🇷|n soilders for 10 days only to wake up next to her dead son’s body, deserves justice #Justice4TigraysWomenAndGirls 
#Justice4Tigray 
@volker_turk @UN_HRC @UN https://t.co/xmKlwrFxYr",2
2025,2025,23,BBCNews,2023-03-07 23:00:46+00:00,50,11,12,3,115568.0,Builder raped woman in her own home https://t.co/IJEooPjssV,2
2028,2028,26,blightedkudzu,2023-03-07 22:58:33+00:00,89,7,1,0,1943.0,"im muting this because bad reading comprehension and malicious ignorance is eroding my will to live, trans men deserve better and if you think we should be abused, murdered, raped, and pushed out of spaces because of our gender then you're transphobjc, have fun with that",2
2031,2031,29,Tembieneyti14,2023-03-07 23:24:27+00:00,18,56,0,0,171.0,"Many say they were raped by Amhara forces who told them they were intent on ethnically cleansing Tigray,”a doctor working at a refugee camp in Sudan told CNN. This must stop. #Justice4TigrayWomen #IWD2023 @RaoufMazou @JanezLenarcic @UNReliefChiefhttps @UNHumanRights @UN_Women https://t.co/imtiAOMslF",2
2035,2035,33,tumi_west,2023-03-07 23:09:15+00:00,54,3,4,0,2898.0,@ARG_Mara When she is sober she will be running riot claiming phori raped her... Mxm ka di eyelashes tsa di umbrella https://t.co/pabPEzQ9zs,2
2037,2037,35,athena606,2023-03-07 23:43:54+00:00,89,21,0,2,2453.0,"Harmony.. kidnapped you, put you in a cult. Let you get raped. And killed 2 people but sure Willow… Nina’s action are unforgivable #GH https://t.co/FgUrP2sBDq",2
2038,2038,36,MthrSuperiorBen,2023-03-07 22:58:46+00:00,206,23,7,0,1802.0,"@amnesty You have the right to break your silence on how you aided a genocidal mission in Ukraine by backing a russian narrative while they raped, murdered and invaded a peaceful people. 
Wash your hands. You don’t want to perpetuate the sickness in which you currently imbibe.",2
2039,2039,37,tigray_micky,2023-03-07 23:06:03+00:00,82,200,0,11,2401.0,"As we celebrate #IWD2023, mothers, sisters and daughters in Tigray have been gang-raped, brutalised &amp; denied post-rape care. We need #Justice4TigrayWomen #EritreaOutOfTigray . Take action today. @POTUS @lauraboldrini @UN_Women @EUCouncil @IntlCrimCourt @SecBlinken @UNHumanRights https://t.co/ffkfVDvthD",2
2040,2040,38,tigray_micky,2023-03-07 23:08:10+00:00,65,162,0,9,1638.0,"Violence against women is most prevalent in Tigray. A survivor reveals that 🇪🇷 &amp; 🇪🇹 &amp; Amhara militia soldiers who were HIV+, gang raped her without protection.They intended to infect her &amp;other women of Tigray. #Justice4TigrayWomen #IWD2023 @EUCouncil @UNAIDS @UN_Women @EUCouncil https://t.co/J2vUsxjgrG",2
2043,2043,41,tigray_micky,2023-03-07 23:07:53+00:00,65,170,0,13,2025.0,"Many say they were raped by Amhara forces who told them they were intent on ethnically cleansing Tigray,” a doctor working at a refugee camp in Sudan told CNN. This must stop. #Justice4TigrayWomen #IWD2023 @RaoufMazou @JanezLenarcic @UNReliefChiefhttps @UNHumanRights  @UNGeneva https://t.co/qakvoMXhMb",2
2045,2045,43,Tembieneyti14,2023-03-07 23:28:15+00:00,15,63,0,0,217.0,"Violence against women is most prevalent in Tigray.A survivor reveals that🇪🇷&amp;🇪🇹&amp; Amhara militia soldiers who were HIV+,gang raped her without protection.They intended to infect her &amp;other women of Tigray. #Justice4TigrayWomen #IWD2023 @EUCouncil @UNAIDS @UN_Women @EU_Commission https://t.co/UkIRo3mawv",2
2046,2046,44,DocAhmadMalik,2023-03-07 21:48:04+00:00,200,24,3,1,5237.0,"Big Agriculture has raped the land, monocrops have starved the soil of organic matter &amp; biodiversity, pumping the land with fertilisers, insecticides, herbicides and pesticides.

Big supermarkets exploit producers, reduce natural diversity and are monopolistic by nature.",2
2048,2048,46,lamek102,2023-03-07 23:32:50+00:00,14,52,0,0,243.0,"As we celebrate #IWD2023, mothers, sisters and daughters in Tigray have been gang-raped, brutalised &amp; denied post-rape care. We need #Justice4TigrayWomen #EritreaOutOfTigray . Take action today. @POTUS @lauraboldrini @UN_Women @EUCouncil @IntlCrimCourt @SecBlinken @UNHumanRights https://t.co/DYLtkXNJdm",2
2050,2050,48,Dave_Pittman,2023-03-07 19:40:36+00:00,80,18,6,1,7574.0,"I was molested and raped by a Southern Baptist minister. When I went to law enforcement they said, ""too late."" Though it's been 40 yrs, I would still like the possibility of pursuing justice.

Please support #TXHB206. Drop a line to TX lawmakers. ⬇️ #SOLreform #SBCtoo",2
2051,2051,49,lesbionaje,2023-03-07 20:35:10+00:00,51,8,3,2,3409.0,"Are there any studies done on whether boys experience the same harm when raped by women than when raped by men?

Like, are they equally as likely to drop out, struggle to keep a job, attempt unaliving, use drugs, have stable family and friends, etc.?

And then the same for girls.",2
2055,2055,53,Katie_Cronin,2023-03-07 21:28:24+00:00,81,35,11,3,9063.0,"Wonder if Sunak has ever sat through a modern day slavery trial. I have. Women in Corby being held in servitude and forcibly raped by ‘punters’ day-in, day-out.

On what fucking PLANET does he think that slaves are to blame for this complete mess?",1
2057,2057,55,JohnBar28691234,2023-03-07 22:17:34+00:00,51,3,1,0,359.0,@NHPUKOfficial I look forward to reading @UniOfYork report on white girls being groomed and raped by Pakistani gangs.,2
2058,2058,56,DaSkrubKing,2023-03-07 19:24:30+00:00,239,2,5,0,5873.0,i feel so fucking bad for this poor woman bro all she did is post some tiktoks and be hot and now weird freaks are talking about how she's too pretty to be raped,1
2063,2063,61,Michael_Yon,2023-03-07 18:35:39+00:00,116,43,13,5,5105.0,"""Ken makes Potemkin village videos, and then gets upset when people look behind the curtain.  It's not a threat to the ""republic"" it is a threat to his control over it.  Read Rape of the Mind and don't get raped by Ken and the fake village makers like him.""  -JBS",2
2068,2068,66,theage,2023-03-07 23:01:21+00:00,57,13,0,5,9010.0,Breaking: Network Ten has joined Lisa Wilkinson in indicating it will seek to prove former federal Liberal staffer Bruce Lehrmann raped his then-colleague Brittany Higgins as part of its defence to his defamation claim against the news outlet. https://t.co/zkMJp91LM9,2
2073,2073,71,ancientbussy,2023-03-07 23:13:05+00:00,74,8,1,0,2567.0,Getting raped for a loaf of bread isn’t a job btw,2
2074,2074,72,Nebyat_12,2023-03-07 19:35:07+00:00,9,52,0,0,207.0,"Dear: 
@WhiteHouse @POTUS @UN @antonioguterres @eu_eeas @JosepBorrellF @_AfricanUnion @AUC_MoussaFaki @UNHumanRights @volker_turk 
@UN_HRC @FVillegasARG 
Just to remind you
Over 130K raped #TigraysWomenAndGirls are left with out justice.
#Justice4Tigray https://t.co/V8q1TkNlzc",2
2077,2077,75,marinaxdove,2023-03-07 19:54:12+00:00,168,0,1,0,8569.0,I have to carry the burden of feeling like I fucked up wholly bc I couldn’t handle telling a belligerent drunk man he almost raped me,1
2079,2079,77,marinaxdove,2023-03-07 20:52:42+00:00,86,1,1,0,13355.0,"Yes I slept with someone else while we were technically together because I had been abused for a year by him, almost raped, and fucking terrified that even if I managed to leave cordially he would come after me or my new partner publicly when he found out.",1
2081,2081,79,AnneYounger14,2023-03-07 23:46:24+00:00,145,6,2,0,3545.0,"@MuellerSheWrote @LannyBrown78 I'm so sorry this happened to you! I was also raped. I was in the Army in 1975, also wearing my duty uniform. I fought him off, and escaped. I reported it and nothing ever happened to him, but I was sent on temporary duty to another state! Thank you for your service, truly!",2
2082,2082,80,marinaxdove,2023-03-07 19:50:54+00:00,172,0,1,0,8848.0,The entire time I had to hear about what a bad terrible person I was so that he would be somewhat amenable to hearing that the reason I left him for someone else is bc he almost raped me,2
2083,2083,81,dcwxcat,2023-03-07 19:46:07+00:00,58,2,7,0,2037.0,"@NightLightNews @SethDillon @DavidAFrench Far more children have been raped and abused by clergy members than by drag queens. I don’t see anyone saying ban kids from attending church.

Not to mention all of the children who have been shot in school.

But yes, drag shows are the biggest threat to children’s well-being. 🙄",2
2086,2086,84,boobsweatntears,2023-03-07 23:08:34+00:00,94,0,4,0,7012.0,"@kaivult @okStevieee @Dexerto @qtcinderella bc he said he went to the cops after the rape and the victim said he didn’t. it’s really okay to ask. i think he takes a lot of time to make and create excellent content but if a girl got raped at your party, and the first thing you do is lie. you’re not a great person.",2
2088,2088,0,whosspicyspicy,2023-03-04 05:25:11+00:00,218,66,1,2,9360.0,me remembering how i was nice when i should have said who the fuck do u think you’re talking to: https://t.co/LGmDX1jlKT,1
2089,2089,1,pplaybunny,2023-03-03 21:17:29+00:00,112,43,0,5,6897.0,I hate when ppl keep trynna talk to me while I’m irritated like bitch I’m already annoyed why THE FUCK ARE U TALKING TO ME RN???? Be fr,1
2094,2094,6,sunflwrsunset,2023-03-02 18:55:00+00:00,50,5,1,0,2412.0,u can be talking abt killing urself and they’ll still go to sleep in the middle of the conversation lmfao fuck u and ur fake concern i hope u remember ur actions when im dead in front of u 😆,0
2096,2096,8,mklsnct,2023-03-05 01:27:21+00:00,216,37,1,2,6799.0,if somebody offers me 50 thousand on the line to the nct u all units mega concert i am walking OUT i do NOT give a fuck about those men if we're talking about that much money,1
2100,2100,12,botticellibimbo,2023-03-06 22:19:27+00:00,148,8,2,0,15134.0,"as i get older and become the ages of men who traumatized me, i just wonder why the fuck were y’all talking to me i was less hot and more annoying??? what did u gain??? and then i realize",1
2106,2106,18,poetryandcocomo,2023-03-01 17:23:21+00:00,68,3,2,0,2706.0,extremist muslims are annoying as hell because what the fuck are u even talking about WHO are you helping by telling people to choose between who they are or your god likeeee be fr rn u don't care about Islam u only care about your prejudices,0
2150,2150,62,BlackSeaSiren,2023-03-01 01:45:53+00:00,53,7,3,0,1913.0,"When I say real niggas I mean gender inclusive ok

I’m not talking bout these weird ass niggas I’m talking bout niggas that REALLY LOVE WONEN THEY BODIES N THEY COOTIE CAT

“Online he said” 

Gal fuck that ma’am with u he wanna put his face n every nook cranny n crevice",0
2158,2158,70,elvxnfae,2023-03-04 17:44:30+00:00,65,0,1,0,2312.0,@Shani40974571 @PopBase the fuck are u talking about? 💀,1
2163,2163,0,heyhoneyrae,2023-03-07 14:11:53+00:00,2541,1372,9,98,158992.0,"I’m too grown to be explaining and arguing with grown ass people about what they did. You know what you did, now get the fuck out my face.",1
2164,2164,1,supertanskiii,2023-03-07 23:30:31+00:00,2873,323,94,9,99336.0,Fuck off you desperate National Front hobbit. You’ve not just lost any remaining scraps of morality and credibility but the next election too. https://t.co/Erp7IEGxOl,1
2172,2172,9,Pattihatestrump,2023-03-07 17:48:14+00:00,59,9,8,0,708.0,"No fks to give for Ashli Babbit, she shouted ""Revolution"", now she's a dead magat. She sucked up tRump's election lies, and caught a cap between the eyes. We all know what she went there to do, so if you don't like it, FUCK YOU too! 😉🌊☺️",1
2173,2173,10,NickysAngelBaby,2023-03-07 22:43:38+00:00,103,11,20,0,6424.0,"If I even remotely see one of you saying shit about Nick’s body, I will knock you the fuck out. I love his belly. It’s sexy. HE’S sexy. Eat a bag of shit if you’ve got something obnoxious to say about him, his looks, or any of the other guys and what they may look like, too. Thx!",1
2177,2177,14,SugaSweetShawty,2023-03-07 20:29:44+00:00,176,17,9,5,7976.0,@Glamazontyomi Meeting Men who are patient enough to allow the space and time to get to know you before trying to fuck. We both horny but I need to know this is a safe space before we can get physical. Let’s like eachother first. I don’t feel like that too much to ask but 🤷🏾‍♀️,1
2181,2181,18,NSFWSHO,2023-03-07 18:03:24+00:00,97,6,0,1,1721.0,"Is it too much to want Blood Riot to be so obsessed with Bakugou that he is all “you have a wife and a kid? The fuck? Says who?” 

Then magically makes them disappear and swoops in to take him prize? 

I think not. Blood Riot shall have what he wants. Period. 💅",1
2183,2183,20,Marshalofthelaw,2023-03-07 05:00:25+00:00,73,1,24,7,4117.0,"Marshal: is my name 10/10

Marshall: fuck you it's one L 0/10

Marsh: simple, but effective, 8/10

Marchill: ?/10

Marshal Of Marshal Does Stuff: too long 4/10

Marshal used to do stuff: that's just mean -10/10",2
